Cites,Authors,Title,Year,Source,Publisher,ArticleURL,CitesURL,GSRank,QueryDate,Type,DOI,ISSN,CitationURL,Volume,Issue,StartPage,EndPage,ECC,CitesPerYear,CitesPerAuthor,AuthorCount,Age
0,"AK Setiaji","SISTEM PAKAR UNTUK MENENTUKAN TIPE AUTISME PADA ANAK USIA 7-10 TAHUN MENGGUNAKAN METODE FORWARD CHAINING",,"core.ac.uk","","https://core.ac.uk/download/pdf/35378552.pdf","",339,"2019-03-27","PDF","","","",,,,,0,0.00,0,1,
0,"S Sondang, KDK Wardani, M Dewi","Sistem Pakar Diagnosa Penyakit Mata Menggunakan Metode Dempster-Shafer Berbasis Web",2013,"Jurnal Aksara Komputer …","jurnal.pcr.ac.id","https://jurnal.pcr.ac.id/index.php/jakt/article/view/468","",340,"2019-03-27","","","","",,,,,0,0.00,0,3,6
0,"T Kusumaningrum","Pembuatan Sistem Pakar Untuk Mendeteksi Kerusakan Pada Mesin Mobil Toyota Avanza Menggunakan Php Dan Mysql",2013,"","","","",341,"2019-03-27","CITATION","","","",,,,,0,0.00,0,1,6
0,"F Frieyadie, H Aryanti","Sistem Pakar Diagnosa Gangguan Kehamilan Berbasis Web dengan Menggunakan Metode Forward Chaining pada Rsia Rp Soeroso",2013,"Jurnal Pilar Nusa Mandiri","ejournal.nusamandiri.ac.id","http://ejournal.nusamandiri.ac.id/ejurnal/index.php/pilar/article/view/9","",342,"2019-03-27","","","","",,,,,0,0.00,0,2,6
0,"S PREHANTO","SISTEM PAKAR DIAGNOSIS DAN PENANGANAN PENYAKIT PADA TANAMAN PADI MENGGUNAKAN METODE DECISION TREE",2013,"","eprints.umpo.ac.id","http://eprints.umpo.ac.id/230","",343,"2019-03-27","","","","",,,,,0,0.00,0,1,6
0,"AM Puspitasari, S Suhartono…","Sistem Pakar Berbasis Web Dengan Metode Probabilitas Klasik Untuk Diagnosa Penyakit Tuberkulosis Pada Manusia Dewasa",2013,"Jurnal Masyarakat …","ejournal.undip.ac.id","https://ejournal.undip.ac.id/index.php/jmasif/article/view/8449","",344,"2019-03-27","","","","",,,,,0,0.00,0,3,6
0,"A Pujiyanta, A Pujiantoro","Sistem Pakar Penentuan Jenis Penyakit Hati Dengan Metode Inferensi Fuzzy Tsukamoto (Study Kasus Di RS PKU Muhammadiyah YOGYAKARTA)",2013,"Jurnal Informatika Ahmad Dahlan","academia.edu","http://www.academia.edu/download/34515680/Jurnal_-_Ardi_Puji_-_Penyakit_Hati_FIS_Tsukamoto.pdf","",345,"2019-03-27","PDF","","","",,,,,0,0.00,0,2,6
0,"AP Putra, AP Kurniati, A Romadhony","Sistem Pakar Dengan Menggunakan Metode Case Base Reasoning, Rule Base Reasoning dan Theorema Bayes (Studi Kasus: Deteksi Penyakit Umum)",,"academia.edu","","http://www.academia.edu/download/45525289/THETA_JURNAL_113091032_72200c92a78f5378bae4c3e95e4aeda1.pdf","",346,"2019-03-27","PDF","","","",,,,,0,0.00,0,3,
0,"NK ULFAH","PERANCANGAN SISTEM PAKAR DIAGNOSIS JENIS PENYAKIT GIGI DAN MULUT PADA MANUSIA DENGAN MENGGUNAKAN METODE DECISION TREE",2013,"","eprints.umpo.ac.id","http://eprints.umpo.ac.id/263","",347,"2019-03-27","","","","",,,,,0,0.00,0,1,6
0,"A Sahal","SISTEM PAKAR SEBAGAI ALAT BANTU ASUHAN KEPERAWATAN MENANGANI PENYAKIT DEMAM BERDARAH DENGAN ALGORITMA RETE DAN CERTAINTY …",2013,"","etd.repository.ugm.ac.id","http://etd.repository.ugm.ac.id/index.php?mod=book_detail&sub=BookDetail&act=view&typ=htmlext&buku_id=63569&obyek_id=4&unitid=1&jenis_id=","",348,"2019-03-27","","","","",,,,,0,0.00,0,1,6
0,"A KURNIASARI","SISTEM PAKAR UNTUK MENDIAGNOSA AWAL PENYAKIT TUBERKULOSIS (TB) MENGGUNAKAN METODE DEMPSTERSHAFER",2013,"","repository.uin-suska.ac.id","http://repository.uin-suska.ac.id/id/eprint/1223","",349,"2019-03-27","","","","",,,,,0,0.00,0,1,6
0,"U Dartawibawa","SISTEM PAKAR UNTUK MENDIAGNOSA PENYAKIT ANJING DENGAN MENGGUNAKAN METODE DEMPSTER-SHAFER BERBASIS ANDROID",2013,"","repository.uin-suska.ac.id","http://repository.uin-suska.ac.id/id/eprint/3194","",350,"2019-03-27","","","","",,,,,0,0.00,0,1,6
0,"A Burhan","Sistem Pakar Untuk Mengidentifikasikan Kerusakan Pada Mini Compo Dengan Metode Forward Chaining (Studi Kasus Pada PT. LG Electronics Indonesia)",2013,"","eprints.ukmc.ac.id","http://eprints.ukmc.ac.id/763/","",351,"2019-03-27","","","","",,,,,0,0.00,0,1,6
0,"H Naibaho","PEMBANGUNAN SISTEM PAKAR UNTUKMENDIAGNOSA PENYAKIT BABI BERBASIS WEB MENGGUNAKAN METODE CERTAINTY FAKTOR",2013,"","e-journal.uajy.ac.id","http://e-journal.uajy.ac.id/1418/","",352,"2019-03-27","","","","",,,,,0,0.00,0,1,6
0,"M MYSQL","PERANCANGAN APLIKASI SISTEM PAKAR UNTUK MENDIAGNOSA PENYAKIT STROKE ISKEMIK DENGAN MENGGUNAKAN BAHASA PEMOGRAMAN …",,"academia.edu","","http://www.academia.edu/download/32319347/09101152630390_Romy_Ramanda_Teknik_Informatika.pdf","",353,"2019-03-27","PDF","","","",,,,,0,0.00,0,1,
0,"V MARDIAN","PENGEMBANGAN SISTEM PAKAR DIAGNOSIS PENYAKIT MENULAR PADA ANAK DENGAN MENGGUNAKAN METODE CERTAINTY FACTOR",2013,"","repository.uin-suska.ac.id","http://repository.uin-suska.ac.id/id/eprint/1228","",354,"2019-03-27","","","","",,,,,0,0.00,0,1,6
0,"NKC Dewi, AS Honggowibowo, D Nugraheny","Sistem Pakar Penilaian Penguasaan Materi Pelajaran Berbasis Website dengan Metode Bayesian Network (Studi Kasus di SMA Angkasa YOGYAKARTA)",2013,"Compiler","ejournals.stta.ac.id","http://ejournals.stta.ac.id/index.php/compiler/article/view/37","",355,"2019-03-27","","","","",,,,,0,0.00,0,3,6
0,"RSF Sitorus","PEMBANGUNAN APLIKASI SISTEM PAKAR ANALISIS PENYAKIT GANGGUAN KEPRIBADIAN MENGGUNAKAN TEOREMA BAYES",2013,"","e-journal.uajy.ac.id","http://e-journal.uajy.ac.id/3325/","",356,"2019-03-27","","","","",,,,,0,0.00,0,1,6
0,"G Mauser","PEMBANGUNAN SISTEM PAKAR DIAGNOSA HAMA DAN PENYAKIT TANAMAN KENTANG DENGAN METODE CERTAINTY FACTOR",2013,"","e-journal.uajy.ac.id","http://e-journal.uajy.ac.id/id/eprint/4534","",357,"2019-03-27","","","","",,,,,0,0.00,0,1,6
0,"N ST Kahar","Sistem Pakar Diagnosa Jenis Perdarahan Pada Masa Kehamilan Dan Pasca Melahirkan (Studi Kasus Salah Satu Rumah Sakit Di Kota Jambi)",2013,"FIKI 2013","publikasi.dinus.ac.id","http://publikasi.dinus.ac.id/index.php/fiki2013/article/view/523","",358,"2019-03-27","","","","",,,,,0,0.00,0,1,6
0,"NLA Prabowo","Sistem Pakar untuk Mendiagnosa dan Menanggulangi Penyakit pada Ikan Lele Dumbo (Clarias Gariepinus) Menggunakan Metode Backward Chaining (Expert …",2013,"","publikasiilmiah.ums.ac.id","https://publikasiilmiah.ums.ac.id/xmlui/handle/11617/4079","",359,"2019-03-27","","","","",,,,,0,0.00,0,1,6
0,"G Govian, H Thendean","Aplikasi Sistem Pakar Untuk Memprediksi Hasil Pertandingan Sepak Bola Menggunakan Dempster-Shafer Theory (DST)",2013,"Jurnal Ilmu Komputer dan Sistem …","journal.untar.ac.id","https://journal.untar.ac.id/index.php/jiksi/article/view/3072","",360,"2019-03-27","","","","",,,,,0,0.00,0,2,6
0,"D Febriansyah, I Mulyana…","PENERAPAN METODE CERTAINTY FACTOR PADA SISTEM PAKAR IDENTIFIKASI PENYAKIT POTENSIAL IKAN AIR TAWAR (Studi kasus: Balai Penelitian dan …",2013,"Jurnal Online Mahasiswa …","jom.unpak.ac.id","http://jom.unpak.ac.id/index.php/ilkom/article/view/260","",361,"2019-03-27","","","","",,,,,0,0.00,0,3,6
0,"M NOVITA","RANCANG BANGUN SISTEM PAKAR DIAGNOSA GANGGUAN PERILAKU ABNORMAL ANAK DENGAN METODE DEMPSTER-SHAFER",2013,"","repository.uin-suska.ac.id","http://repository.uin-suska.ac.id/1239/","",362,"2019-03-27","","","","",,,,,0,0.00,0,1,6
0,"YY Welim, TW Wisjhnuadji","Pengaruh IPK dan Motivasi dalam memprediksi ketepatan waktu Kelulusan Mahasiswa dengan menggunakan Sistem Pakar Berbasis Adaptive Neuro Fuzzy",2013,"SESINDO 2013","is.its.ac.id","http://is.its.ac.id/pubs/oajis/index.php/home/detail/508/Pengaruh-IPK-dan-Motivasi-dalam-memprediksi-ketepatan-waktu-Kelulusan-Mahasiswa-dengan-menggunakan-Sistem-Pakar-Berbasis-Adaptive-Neuro-Fuzzy","",363,"2019-03-27","","","","",,,,,0,0.00,0,2,6
0,"OKI KIRNAWANTO","RANCANG BANGUN SISTEM PAKAR DIAGNOSA PENYAKIT DENGAN GEJALA DEMAM PADA MANUSIA MENGGUNAKAN PERANGKAT MOBILE DENGAN …",2013,"","eprints.umpo.ac.id","http://eprints.umpo.ac.id/254","",364,"2019-03-27","","","","",,,,,0,0.00,0,1,6
0,"PS Lalita","Aplikasi Sistem Pakar Untuk Mendiagnosa Jenis Kulit Wajah Beserta Informasi Ramuan Masker Wajah Berbahan Dasar Alami Berbasis Android",,"","","","",365,"2019-03-27","CITATION","","","",,,,,0,0.00,0,1,
0,"F FIRDAUS","SISTEM PAKAR DIAGNOSA PENYAKIT TANAMAN JERUK MENGGUNAKAN METODE FORWARD CHAINING (Studi Kasus Kementerian Pertanian, Balai Penelitian …",2013,"","eprints.umm.ac.id","http://eprints.umm.ac.id/27759/","",366,"2019-03-27","","","","",,,,,0,0.00,0,1,6
0,"LD Marsindi","SISTEM PAKAR IDENTIFIKASI HAMA DAN PENYAKIT JAHE BERBASIS WEB MENGGUNAKAN METODE FORWARD CHAINING (EXPERT SYSTEM TO IDENTFY …",2013,"","digilib.unila.ac.id","http://digilib.unila.ac.id/890/","",367,"2019-03-27","","","","",,,,,0,0.00,0,1,6
0,"N ARIKA WAHONO","DIAGNOSA PENYAKIT TIDAK MENULAR MENGGUNAKAN SISTEM PAKAR (NOT CONTAGIOUS DISEASE DIAGNOSIS USING EXPERT SYSTEM)",2013,"Jurnal Manajemen Informatika","jurnalmahasiswa.unesa.ac.id","https://jurnalmahasiswa.unesa.ac.id/index.php/jurnal-manajemen-informatika/article/viewFile/2098/5448","",368,"2019-03-27","PDF","","","",,,,,0,0.00,0,1,6
0,"AYU MEIATRI WINDINE SARI","SISTEM PAKAR UNTUK MENGANALISIS TINGKAT STRES BELAJAR PADA SISWA SMA",2013,"Jurnal Manajemen …","jurnalmahasiswa.unesa.ac.id","https://jurnalmahasiswa.unesa.ac.id/index.php/jurnal-manajemen-informatika/article/download/2086/5443","",369,"2019-03-27","PDF","","","",,,,,0,0.00,0,1,6
0,"LN Mentari","Membangun Sistem Informasi Penggajian DI Toserba Panti Rahayu Berbasis Web",,"","","","",370,"2019-03-27","CITATION","","","",,,,,0,0.00,0,1,
0,"L Pathya Sukma","Aplikasi Sistem Pakar Untuk Mendiagnosa Jenis Kulit Wajah Beserta Informasi Ramuan Masker Wajah Berbahan Dasar Alami Berbasis Android",2013,"","","","",371,"2019-03-27","CITATION","","","",,,,,0,0.00,0,1,6
0,"T PURNADI","SISTEM KONSULTASI KESEHATAN UNTUK DIAGNOSA NYERI DADA DAN OPTIMASI TAKARAN OBAT DENGAN ALGORITMA GENETIKA",2013,"","etd.repository.ugm.ac.id","http://etd.repository.ugm.ac.id/index.php?act=view&buku_id=61532&mod=penelitian_detail&sub=PenelitianDetail&typ=html","",372,"2019-03-27","","","","",,,,,0,0.00,0,1,6
0,"YB Widodo, YT Handoyo","Sistem Paker Untuk Konsultasi Studi",2013,"Majalah Ilmiah Matematika …","ejournal.gunadarma.ac.id","http://ejournal.gunadarma.ac.id/index.php/majalah-matkom/article/view/688","",373,"2019-03-27","","","","",,,,,0,0.00,0,2,6
0,"M lhsan Sarita, S Hartati","An Application of Expert System to Identify Trees Utilizing Leaf Images",,"IJCCS (Indonesian Journal of Computing and …","journal.ugm.ac.id","https://journal.ugm.ac.id/ijccs/article/view/2275","",374,"2019-03-27","","","","",,,,,0,0.00,0,2,
0,"Y Nugroho","RANCANG BANGUN APLIKASI KNOWLEDGE BASED SYSTEM BERBASIS FENG SHUI UNTUK MENENTUKAN HARGA JUAL RUMAH PADA PROPERTY …",,"core.ac.uk","","https://core.ac.uk/download/pdf/35378067.pdf","",375,"2019-03-27","PDF","","","",,,,,0,0.00,0,1,
0,"C Wiguna","IMPLEMENTASI METODE FUZZY INFERENCE SYSTEM (FIS) TSUKAMOTO UNTUK PENENTUAN PERAWATAN KULIT BERDASARKAN JENISNYA",,"eprints.dinus.ac.id","","http://eprints.dinus.ac.id/12359/1/jurnal_12287.pdf","",376,"2019-03-27","PDF","","","",,,,,0,0.00,0,1,
0,"V Vydia, N Irliana","Integrasi, Pengaruh dan Masa Depan Sistem Cerdas Dalam Sistem Pendukung Manajemen",2013,"Jurnal Transformatika","journals.usm.ac.id","http://journals.usm.ac.id/index.php/transformatika/article/view/93","",377,"2019-03-27","","","","",,,,,0,0.00,0,2,6
0,"D Yudi","Pengembangan Rule-Based Expert System untuk Mendiagnosa Kerusakan pada Sepeda Motor Suzuki",,"dosen.publikasistmikibbi.lppm.org","","http://dosen.publikasistmikibbi.lppm.org/permalink/000094.pdf","",378,"2019-03-27","PDF","","","",,,,,0,0.00,0,1,
0,"IE WIBOWO","LKP: RANCANG BANGUN SISTEM INFORMASI RAWAT JALAN PADA RUMAH SAKIT USADA WAGE",2013,"","digilib.stikom.edu","http://digilib.stikom.edu/detil.php?id=2641","",379,"2019-03-27","","","","",,,,,0,0.00,0,1,6
0,"G RAMADHAN","PSI: RANCANG BANGUN SISTEM INFORMASI PELAYANAN SERVIS MOTOR PADA CV. KARTINI MOTOR GRESIK",2013,"","digilib.stikom.edu","http://digilib.stikom.edu/detil.php?id=2629","",380,"2019-03-27","","","","",,,,,0,0.00,0,1,6
0,"J Triajianto, Y Purwananto, R Soelaiman","Implementasi Sistem Klasifikasi Fuzzy Berbasis Optimasi Koloni Semut untuk Diagnosa Penyakit Diabetes",2013,"Jurnal Teknik ITS","ejurnal.its.ac.id","http://www.ejurnal.its.ac.id/index.php/teknik/article/view/2734","",381,"2019-03-27","","","","",,,,,0,0.00,0,3,6
0,"H Amalia","Sistem Penunjang Keputusan Kesehatan untuk Hipertensi Menggunakan Algoritma C4. 5",2013,"Jurnal Pilar Nusa Mandiri","ejournal.nusamandiri.ac.id","http://ejournal.nusamandiri.ac.id/ejurnal/index.php/pilar/article/view/3","",382,"2019-03-27","","","","",,,,,0,0.00,0,1,6
0,"AF NIRMALA","PSI: RANCANG BANGUN SISTEM INFORMASI KEPEGAWAIAN PADA PT MITRA ABADI WISESA SURABAYA",2013,"","digilib.stikom.edu","http://digilib.stikom.edu/detil.php?id=2740","",383,"2019-03-27","","","","",,,,,0,0.00,0,1,6
0,"N Tangkelabi, SS Yusida","Sistem Pendukung Keputusan Pemilihan Objek Wisata Bahari Dengan Metode Analitical Hierarchy Process (AHP) di Propinsi Sulawesi Selatan",2013,"Jurnal Inspiration","jurnal.akba.ac.id","https://jurnal.akba.ac.id/index.php/inspiration/article/download/40/38","",384,"2019-03-27","PDF","","","",,,,,0,0.00,0,2,6
0,"PI Del","Sistem Pembantu Pengambilan Keputusan Pemilihan Jurusan di Politeknik Informatika Del",,"researchgate.net","","https://www.researchgate.net/profile/Rosni_Lumbantoruan/publication/260339664_Sistem_Pembantu_Pengambilan_Keputusan_Pemilihan_Jurusan/links/5b59115caca272a2d66b9b23/Sistem-Pembantu-Pengambilan-Keputusan-Pemilihan-Jurusan.pdf","",385,"2019-03-27","PDF","","","",,,,,0,0.00,0,1,
0,"SPPP KELAMIN, KPBM FORWARD","LAPORAN TUGAS AKHIR",,"","","","",386,"2019-03-27","CITATION","","","",,,,,0,0.00,0,2,
0,"RG Subehi, DN Sari, H Rachmawati","Perancangan Sistem Informasi Manajemen Parkir Dengan Pendekatan Algoritma Hill Climbing di Pusat Perbelanjaan (Studi Kasus: Mal Ska-Pekanbaru)",2013,"Semantik","publikasi.dinus.ac.id","http://publikasi.dinus.ac.id/index.php/semantik/article/view/755","",387,"2019-03-27","","","","",,,,,0,0.00,0,3,6
0,"T Hidayat","PERENCANAAN STRATEGIS SISTEM INFORMASI UNTUK MENDUKUNG STRATEGI BISNIS DAN DAYA SAING PELAYANAN JASA TEKNIS PADA BALAI …",,"jurnal.likmi.ac.id","","http://jurnal.likmi.ac.id/Jurnal/7_2008/Perencanaan_Strategis_SI_taufan_.pdf","",388,"2019-03-27","PDF","","","",,,,,0,0.00,0,1,
0,"I Mekongga, M Agustin, K Korina","Reservation System Design Inpatient Hospital Line Online",2013,"Jurnal Telematik, Vol 5, No 4 …","eprints.polsri.ac.id","http://eprints.polsri.ac.id/96/1/telematik.pdf","",389,"2019-03-27","PDF","","","",,,,,0,0.00,0,3,6
0,"KP ANJING","PERANCANGAN DAN PEMBUATAN FUZZY EXPERT SYSTEM UNTUK ANALISIS PENYAKIT",,"core.ac.uk","","https://core.ac.uk/download/pdf/19661576.pdf","",390,"2019-03-27","PDF","","","",,,,,0,0.00,0,1,
0,"A Muhammad, S Kom, M Kom, R Mariana, S Psi","PERANCANGAN DAN PEMBANGUNAN SISTEM PAKAR BERBASIS WEB UNTUK MENENTUKAN KECEMASAN PADA REMAJA",,"","","","",391,"2019-03-27","CITATION","","","",,,,,0,0.00,0,5,
0,"SS Suryono, M Si, EA Sarwoko, M Kom","MONITORING PERSEDIAAN SUKU CADANG POLA REPLACEMENT MENGGUNAKAN METODA ADAPTIVE NEURO FUZZY INFERENCE SYSTEM",2013,"","eprints.undip.ac.id","http://eprints.undip.ac.id/41212/","",392,"2019-03-27","","","","",,,,,0,0.00,0,4,6
0,"F Rakhma Indah, AAS ST, M Kom, P Barlian Henryranu","SISTEM PAKAR UNTUK REKOMENDASI PROFESI PEKERJAAN PADA BIDANG TEKNOLOGI INFORMASI BERDASARKAN KEPRIBADIAN …",,"","","","",393,"2019-03-27","CITATION","","","",,,,,0,0.00,0,4,
0,"M Puspita, Z Wafa, S Kom, M Kom, A Syafnur","APLIKASI SISTEM PAKAR BERBASIS WEB DALAM MENGANALISA SAKIT KEJIWAAN",,"","","","",394,"2019-03-27","CITATION","","","",,,,,0,0.00,0,5,
0,"SUB INDONESIA, B ACEH","RANCANG BANGUN SISTEM PAKAR MENENTUKAN PENYAKIT TANAMAN KAKAO MENGGUNAKAN METODE FORWARD CHAINING BERBASIS …",,"","","","",395,"2019-03-27","CITATION","","","",,,,,0,0.00,0,2,
0,"A Wuryandari, D Trisnawati","APLIKASI SISTEM PAKAR UNTUK DIAGNOSA PENYAKIT DIABETES MELITUS MENGGUNAKAN METODE DHEMSTER SHAFER",2013,"MAGISTRA","","","",396,"2019-03-27","CITATION","","","",,,,,0,0.00,0,2,6
0,"S Putra, AA Soebroto, I Arwani","PENGEMBANGAN APLIKASI SISTEM PAKAR UNTUK MEMPREDIKSI KELAS KEMAMPUAN LAHAN PERTANIAN",,"","","","",397,"2019-03-27","CITATION","","","",,,,,0,0.00,0,3,
0,"TSBPS SMA","SISTEM PAKAR UNTUK MENGANALISIS",,"","","","",398,"2019-03-27","CITATION","","","",,,,,0,0.00,0,1,
0,"B Yuwono, HC Rustamadji, DA Gumara","SISTEM PAKAR BERBASIS WEB UNTUK MENDIAGNOSA PENYAKIT GIGI MENGGUNAKAN METODE CERTAINTY FACTOR",2013,"Prosiding SeNAIK","jurnal.wicida.ac.id","http://jurnal.wicida.ac.id/index.php/senaik/article/view/170","",399,"2019-03-27","CITATION","","","",,,,,0,0.00,0,3,6
0,"M Syarifudin","SISTEM PAKAR BERBASIS ANDROID UNTUK MENDIAGNOSA PENYAKIT PADA AYAM BROILER",,"","","","",400,"2019-03-27","CITATION","","","",,,,,0,0.00,0,1,
0,"H Pratiwi","SISTEM PAKAR ANALISIS PENJAMINAN MUTU BERSTANDAR ISO 9004 PADA PERGURUAN TINGGI",2013,"Prosiding SeNAIK","jurnal.wicida.ac.id","http://jurnal.wicida.ac.id/index.php/senaik/article/view/140","",401,"2019-03-27","CITATION","","","",,,,,0,0.00,0,1,6
0,"L Simorangkir","Diagnosa Awal Penyakit Mata Pada Manusia Dengan Sistem Pakar Metode Forwad Chaining",2013,"Konferensi Nasional Informatika 2013","","","",402,"2019-03-27","CITATION","","","",,,,,0,0.00,0,1,6
0,"AE Wijaya","SISTEM PAKAR BERBASIS WEB UNTUK MENDIAGNOSA PENYAKIT PADA HEWAN KURBAN MENGGUNAKAN BACKWARD CHAINING",2013,"Jurnal Teknologi dan Komunikasi STMIK …","jurnalstmiksubang.ac.id","http://www.jurnalstmiksubang.ac.id/index.php/jtik/article/view/32","",403,"2019-03-27","CITATION","","","",,,,,0,0.00,0,1,6
0,"S Emma Budi","Representing Knowledge Base into Database for WAP and Web-based Expert System",2013,"","eprints.undip.ac.id","http://eprints.undip.ac.id/41698/","",404,"2019-03-27","","","","",,,,,0,0.00,0,1,6
0,"B Prasetyo, S Bukhori, W Eka","Design and Implementation Geographic Information System for Disruption Feeders Inspection in PT. PLN (Persero) Distribusi Jawa Timur Area JemberS",,"repository.unej.ac.id","","http://repository.unej.ac.id/handle/123456789/49","",405,"2019-03-27","","","","",,,,,0,0.00,0,3,
0,"SD PEN, TEMDPPP AYAM, ITP AYAM","LAPORAN TUGAS AKHIR",,"","","","",406,"2019-03-27","CITATION","","","",,,,,0,0.00,0,3,
0,"S Lukas, I Murwantara, YE Soelistio","Sistem Pakar dengan Kemampuan Belajar Sebagai Pendukung Pengenalan Penyakit Dalam",2013,"","","","",407,"2019-03-27","CITATION","","","",,,,,0,0.00,0,3,6
0,"SS Suryono, M Si, EA Sarwoko, M Kom","IMPLEMENTATION OF EXPERT SYSTEM FOR MONITORING PERFORMANCE ENGINE AND EMPLOYEES IN WEAVING UNIT USE RULE-BASED REASONING …",2013,"","eprints.undip.ac.id","http://eprints.undip.ac.id/41878/","",408,"2019-03-27","","","","",,,,,0,0.00,0,4,6
0,"AA Kuncoro","Sistem Pendukung Keputusan Penentuan Rumah/Tanah Multi Kriteria Kepada Calon Konsumen Dengan Metode Fuzzy Logic",2013,"JURNAL ILMIAH EKONOMI DAN BISNIS","jurnal.stekom.ac.id","http://jurnal.stekom.ac.id/index.php/ebisnis/article/viewFile/61/60","",409,"2019-03-27","PDF","","","",,,,,0,0.00,0,1,6
0,"YI Kurniawan","LKP: SISTEM INFORMASI PENCATATAN JADWAL PELATIHAN PADA PENGABDIAN MASYARAKAT (STIKOM SURABAYA)",2013,"","digilib.stikom.edu","http://digilib.stikom.edu/detil.php?id=2566","",410,"2019-03-27","","","","",,,,,0,0.00,0,1,6
0,"W ADITYA NUGRAHA, M LESTARI, M YASIN…","PERANCANGAN SISTEM PAKAR PENDETEKSI PENYAKIT PADA TANAMAN KOPI DENGAN LAYANAN BERBASIS LOKASI",2013,"","BINUS","","",411,"2019-03-27","CITATION","","","",,,,,0,0.00,0,4,6
0,"MLR Dalimunthe","Aplikasi Sistem Pakar Diagnosa Kerusakan Notebook Menggunakan Java Dan Netbeans Ide 7.2",2013,"","","","",412,"2019-03-27","CITATION","","","",,,,,0,0.00,0,1,6
0,"B MAFTUKAH","PSI: RANCANG BANGUN SISTEM INFORMASI ADMINISTRASI KEPEGAWAIAN PADA UD. BINTANG LAUT",2013,"","digilib.stikom.edu","http://digilib.stikom.edu/detil.php?id=2681","",413,"2019-03-27","","","","",,,,,0,0.00,0,1,6
0,"M Hakim","SISTEM PAKAR HUKUM TAJWID PADA KITAB SUCI AL-QUR'AN DENGAN METODE FORWARD CHAINING",2013,"Prosiding SeNAIK","jurnal.wicida.ac.id","http://jurnal.wicida.ac.id/index.php/senaik/article/view/120","",414,"2019-03-27","CITATION","","","",,,,,0,0.00,0,1,6
0,"MRA Simanjuntak, AM Panjaitan","Identifikasi pendekatan holistic quality system dalam industri jasa pendidikan (studi kasus: fakultas sains dan teknologi Universitas Pelita Harapan)",2013,"","portal.kopertis3.or.id","http://portal.kopertis3.or.id/handle/123456789/2233","",415,"2019-03-27","","","","",,,,,0,0.00,0,2,6
0,"R Rheinhard, F Firdha, A Aldous, RP Florensa","SISTEM PAKAR PENENTU KECERDASAN JAMAK PADA ANAK BERBASIS WEB",2013,"Teknik dan Ilmu Komputer","","","",416,"2019-03-27","CITATION","","","",,,,,0,0.00,0,4,6
0,"J SADIKIN","PSI: RANCANG BANGUN SISTEM INFORMASI ADMINSTRASI KEPEGAWAIAN PADA UD. DWI MULYA PLASTIK SIDOARJO",2013,"","digilib.stikom.edu","http://digilib.stikom.edu/detil.php?id=2588","",417,"2019-03-27","","","","",,,,,0,0.00,0,1,6
0,"S RAHMAWANTO","PSI: RANCANG BANGUN SISTEM INFORMASI KEPEGAWAIAN PADA PT. CITRA PERSADA INDONESIA SURABAYA",2013,"","digilib.stikom.edu","http://digilib.stikom.edu/detil.php?id=2630","",418,"2019-03-27","","","","",,,,,0,0.00,0,1,6
0,"HM Baun, OD Nurhayati","Implementasi Adaptive Neuro Fuzzy Inference System untuk Penentuan Status Gizi Balita",2013,"JSINBIS (Jurnal Sistem Informasi …","jsinbis.msi.undip.ac.id","http://jsinbis.msi.undip.ac.id/upload/08.hanna%20mariana.pdf","",419,"2019-03-27","PDF","","","",,,,,0,0.00,0,2,6
0,"N DIAN TUNJUNG","PREDIKSI PENYAKIT DIABETES MELLITUS DENGAN MENGGUNAKAN PENDEKATAN JARINGAN SYARAF TIRUAN",2013,"","","","",420,"2019-03-27","CITATION","","","",,,,,0,0.00,0,1,6
0,"BV SANTOSO","PSI: RANCANG BANGUN SISTEM INFORMASI ADMINISTRASI PEGAWAI PADA PT LEDOKOMBO JEMBER JAWA TIMUR",2013,"","digilib.stikom.edu","http://digilib.stikom.edu/detil.php?id=2685","",421,"2019-03-27","","","","",,,,,0,0.00,0,1,6
0,"M Muthohir","SISTEM PENDUKUNG KEPUTUSAN UNTUK MENENTUKAN RANGKING CALON PENERIMA BEASISWA MENGGUNAKAN PENDEKATAN FUZZY QUERY (STUDI …",2013,"JURNAL ILMIAH EKONOMI DAN BISNIS","jurnal.stekom.ac.id","http://jurnal.stekom.ac.id/index.php/ebisnis/article/view/62","",422,"2019-03-27","","","","",,,,,0,0.00,0,1,6
0,"A Marlyaningrum","Aplikasi Sistem Pakar Diagnosis Sistem Komputer",2013,"","Jurnal TI","","",423,"2019-03-27","CITATION","","","",,,,,0,0.00,0,1,6
0,"JY Lee","Sistem Pakar Diagnosis Penyakit Asma",2013,"","Universiti Tun Hussein Onn …","","",424,"2019-03-27","CITATION","","","",,,,,0,0.00,0,1,6
0,"ES Nugroho, H Murti","Sistem Pakar Untuk Mendiagnosa Penyakit Pada Burung Kenari Berbasis Web",2013,"","Skripsi, Universitas Stikubank …","","",425,"2019-03-27","CITATION","","","",,,,,0,0.00,0,2,6
0,"B Relita","Sri Astuti berjudul “Perancangan Sistem Pakar Tes Kepribadian Dengan Menggunakan Metode Bayes”",2013,"Binjai: STMIK KAPUTAMA Binjai Sumatra Utara","","","",426,"2019-03-27","CITATION","","","",,,,,0,0.00,0,1,6
0,"N Zolkeply","Sistem Pakar Diagnosis Penyakit Alahan",2013,"","Universiti Tun Hussein Onn …","","",427,"2019-03-27","CITATION","","","",,,,,0,0.00,0,1,6
0,"YJ Chai","Sistem Pakar Diagnosis Jenis Sakit Kepala Secara Dalam Talian",2013,"","Universiti Tun Hussein Onn …","","",428,"2019-03-27","CITATION","","","",,,,,0,0.00,0,1,6
0,"WB Jisokhi","Perancangan Sistem Pakar Menggunakan Metode Bayes Untuk Mengenal Kepribadian Dengan Metode DISC",2013,"Medan: STMIK Budi Darma Medan","","","",429,"2019-03-27","CITATION","","","",,,,,0,0.00,0,1,6
0,"SN Kamsin","Sistem Pakar Penentuan Penyakit Hamster",2013,"","Universiti Tun Hussein Onn …","","",430,"2019-03-27","CITATION","","","",,,,,0,0.00,0,1,6
0,"A Paundra, FA Do Rego, LD Xavier","Perancangan Aplikasi Sistem Pakar sebagai Alat Bantu Pembelajaran Troubleshooting Komputer pada Sekolah Menengah Kejuruan",2013,"Widya Teknika","","","",431,"2019-03-27","CITATION","","","",,,,,0,0.00,0,3,6
0,"R Mustika Brilianti","Analisa Dan Pembuatan Aplikasi Sistem Pakar Diagnosa Penyakit Pernapasan Organ Paru Khususnya TB Paru Berbasis Website Dan Android",2013,"","","","",432,"2019-03-27","CITATION","","","",,,,,0,0.00,0,1,6
0,"NA Septiani","PENGEMBANGAN SISTEM INFORMASI PENERIMAAN PEGAWAI PADA PT. ANANDA PUTRA PRATAMA TANGERANG",2013,"Seminar Nasional Ilmu Pengetahuan …","konferensi.nusamandiri.ac.id","http://konferensi.nusamandiri.ac.id/prosiding/index.php/sniptek/article/view/393","",433,"2019-03-27","","","","",,,,,0,0.00,0,1,6
0,"ASR Batang","SISTEM BERBASIS ATURAN UNTUK MENENTUKAN BENTUK STRUKTUR TOWER",,"","","","",434,"2019-03-27","CITATION","","","",,,,,0,0.00,0,1,
0,"E Elis Rohmah Wafiroh","Aplikasi Diagnosa Penyakit dalam dengan Metode Certainty Factor Berbasis Web",2013,"","digilib.uinsgd.ac.id","http://digilib.uinsgd.ac.id/281/","",435,"2019-03-27","","","","",,,,,0,0.00,0,1,6
0,"PBCP PENELUSURAN, GPM MANUSIA, O DI SUSUN","LAPORAN TUGAS AKHIR",,"","","","",436,"2019-03-27","CITATION","","","",,,,,0,0.00,0,3,
0,"J Mete, B Android","REYVAN SEPTA RAHARDJO",,"eprints.dinus.ac.id","","http://eprints.dinus.ac.id/12761/1/jurnal_12935.pdf","",437,"2019-03-27","PDF","","","",,,,,0,0.00,0,2,
0,"AK Hernawan","Pengembangan Perangkat Deteksi Dini Kerusakan Transformator Tenaga Dengan Metode Forward Chaining",2013,"","repository.upi.edu","http://repository.upi.edu/304/","",438,"2019-03-27","","","","",,,,,0,0.00,0,1,6
0,"SEKO AGUS","Rekayasa Perangkat Lunak Penentuan Keluarga Sejahtera Menurut Kriteria Badan Peranan Perempuan Dan Keluarga Berencana (BPPKB) Di Kecamatan …",2013,"Skripsi, Fakultas Ilmu Komputer","eprints.dinus.ac.id","http://eprints.dinus.ac.id/12614","",439,"2019-03-27","","","","",,,,,0,0.00,0,1,6
0,"D TUNJUNG, S KOM","PREDIKSI PENYAKIT DIABETES MELLITUS DENGAN MENGGUNAKAN PENDEKATAN JARINGAN SYARAF TIRUAN",,"academia.edu","","http://www.academia.edu/download/32156303/56.pdf","",440,"2019-03-27","PDF","","","",,,,,0,0.00,0,2,
0,"NAK Wardani","SMS GATEWAY UNTUK SISTEM PENGADUAN PELANGGARAN PROGRAM PENYIARAN PADA KPID PROVINSI JAWA TENGAH",,"eprints.dinus.ac.id","","http://eprints.dinus.ac.id/12830/1/jurnal_13034.pdf","",441,"2019-03-27","PDF","","","",,,,,0,0.00,0,1,
