Cites,Authors,Title,Year,Source,Publisher,ArticleURL,CitesURL,GSRank,QueryDate,Type,DOI,ISSN,CitationURL,Volume,Issue,StartPage,EndPage,ECC,CitesPerYear,CitesPerAuthor,AuthorCount,Age
25,"M Syahrizal","Sistem Pakar Untuk Mengidentifikasi Kerusakan Pada Mobil Toyota Dengan Best First Search Berbasis Wap",2013,"Majalah Ilmiah INTI (Informasi dan …","ejurnal.stmik-budidarma.ac.id","https://ejurnal.stmik-budidarma.ac.id/index.php/inti/article/view/99","https://scholar.google.com/scholar?cites=10732003427625441365&as_sdt=2005&sciodt=0,5&hl=en",1,"2019-03-27","","","","",,,,,25,4.17,25,1,6
24,"NA Sari","Sistem Pakar Mendiagnosa Penyakit Demam Berdarah Menggunakan Metode Certainty Factor",2013,"Pelita Informatika: Informasi dan …","ejurnal.stmik-budidarma.ac.id","https://ejurnal.stmik-budidarma.ac.id/index.php/pelita/article/view/304","https://scholar.google.com/scholar?cites=5396479129165622081&as_sdt=2005&sciodt=0,5&hl=en",2,"2019-03-27","","","","",,,,,24,4.00,24,1,6
20,"YN Istiqomah, A Fadlil","Sistem Pakar untuk mendiagnosa penyakit saluran pencernaan menggunakan metode Dempster Shafer",2013,"Jurnal Sarjana Teknik Informatika","neliti.com","https://www.neliti.com/publications/211370/sistem-pakar-untuk-mendiagnosa-penyakit-saluran-pencernaan-menggunakan-metode-de","https://scholar.google.com/scholar?cites=18393768774311548307&as_sdt=2005&sciodt=0,5&hl=en",3,"2019-03-27","","","","",,,,,20,3.33,10,2,6
21,"S Rahayu","Sistem pakar untuk mendiagnosa penyakit gagal ginjal dengan menggunakan metode bayes",2013,"Pelita Informatika: Informasi dan …","ejurnal.stmik-budidarma.ac.id","https://ejurnal.stmik-budidarma.ac.id/index.php/pelita/article/view/310","https://scholar.google.com/scholar?cites=17172514442268422216&as_sdt=2005&sciodt=0,5&hl=en",4,"2019-03-27","","","","",,,,,21,3.50,21,1,6
13,"F Nurlaela","Sistem Pakar untuk mendeteksi penyakit gigi pada manusia",2013,"Speed-Sentra Penelitian Engineering dan Edukasi","ijns.org","http://www.ijns.org/journal/index.php/speed/article/view/1230","https://scholar.google.com/scholar?cites=7042167701315658516&as_sdt=2005&sciodt=0,5&hl=en",5,"2019-03-27","","","","",,,,,13,2.17,13,1,6
12,"AS Sembiring","Sistem pakar diagnosa penyakit dan hama tanaman padi",2013,"Pelita Informatika: Informasi dan …","ejurnal.stmik-budidarma.ac.id","https://ejurnal.stmik-budidarma.ac.id/index.php/pelita/article/view/128","https://scholar.google.com/scholar?cites=7592238898345403692&as_sdt=2005&sciodt=0,5&hl=en",6,"2019-03-27","","","","",,,,,12,2.00,12,1,6
9,"E Ongko","Perancangan Sistem Pakar Diagnosa Penyakit pada Mata",2013,"Jurnal Times","stmik-time.ac.id","http://www.stmik-time.ac.id/ejournal/index.php/jurnalTIMES/article/view/5","https://scholar.google.com/scholar?cites=3714035943035566638&as_sdt=2005&sciodt=0,5&hl=en",7,"2019-03-27","","","","",,,,,9,1.50,9,1,6
11,"D Harto","Perancangan Sistem Pakar Untuk Mengidentifikasi Penyakit Pada Tanaman Semangka Dengan Menggunakan Metode Certainty Factor",2013,"J. Pelita Inform. Budi Darma","academia.edu","http://www.academia.edu/download/49224529/425.pdf","https://scholar.google.com/scholar?cites=8444167214416980169&as_sdt=2005&sciodt=0,5&hl=en",8,"2019-03-27","PDF","","","",,,,,11,1.83,11,1,6
11,"M Dahria, R Silalahi…","Sistem Pakar Metode Dampster-Shafer Untuk Menentukan Jenis Gangguan Perkembangan Pada Anak",2013,"… Trihuna Darma, Medan","prpm.trigunadharma.ac.id","https://prpm.trigunadharma.ac.id/public/fileJurnal/hplUJurnal%2012-1-2013_1%20Dahria%20new.pdf","https://scholar.google.com/scholar?cites=17598165819100991100&as_sdt=2005&sciodt=0,5&hl=en",9,"2019-03-27","PDF","","","",,,,,11,1.83,4,3,6
9,"A Pranolo, SM Widyastuti","Desain Pengembangan Sistem Pakar untuk Identifikasi Gangguan Tanaman Hutan dengan Forward Chaining dan Certainty Factor",2013,"SESINDO 2013","is.its.ac.id","http://is.its.ac.id/pubs/oajis/index.php/home/detail/509/Desain-Pengembangan-Sistem-Pakar-untuk-Identifikasi-Gangguan-Tanaman-Hutan-dengan-Forward-Chaining-dan-Certainty-Factor","https://scholar.google.com/scholar?cites=6339551150638881614&as_sdt=2005&sciodt=0,5&hl=en",10,"2019-03-27","","","","",,,,,9,1.50,5,2,6
7,"TD Nisa, R Primartha","Diagnosis penyakit gigi periodontal menggunakan sistem pakar fuzzy",2013,"Jurnal Generic","eprints.unsri.ac.id","http://eprints.unsri.ac.id/4122/","https://scholar.google.com/scholar?cites=14559831365828913978&as_sdt=2005&sciodt=0,5&hl=en",11,"2019-03-27","","","","",,,,,7,1.17,4,2,6
7,"MJ Wahyudi, A Fadlil","Sistem pakar untuk mengidentifikasi penyakit udang galah dengan metode theorema bayes",2013,"Jurnal Sarjana Teknik Informatika","neliti.com","https://www.neliti.com/publications/211050/sistem-pakar-untuk-mengidentifikasi-penyakit-udang-galah-dengan-metode-theorema","https://scholar.google.com/scholar?cites=4176424451878193708&as_sdt=2005&sciodt=0,5&hl=en",12,"2019-03-27","","","","",,,,,7,1.17,4,2,6
8,"R Retnowati, A Pujiyanta","Implementasi Case Base Reasoning pada Sistem Pakar dalam Menentukan Jenis Gangguan Kejiwaan",2013,"Jurnal Sarjana Teknik Informatika","neliti.com","https://www.neliti.com/publications/211290/implementasi-case-base-reasoning-pada-sistem-pakar-dalam-menentukan-jenis-ganggu","https://scholar.google.com/scholar?cites=5626251846976278447&as_sdt=2005&sciodt=0,5&hl=en",13,"2019-03-27","","","","",,,,,8,1.33,4,2,6
8,"P Destarianto, E Yudaningtyas, SH Pramono","Penerapan Metode Inferece Tree dan Forward Chaining dalam Sistem Pakar Diagnosis Hama dan Penyakit Kedelai Edamame berdasarkan Gejala Kerusakannya",2013,"Jurnal EECCIS","jurnaleeccis.ub.ac.id","http://jurnaleeccis.ub.ac.id/index.php/eeccis/article/view/197","https://scholar.google.com/scholar?cites=586044310295212605&as_sdt=2005&sciodt=0,5&hl=en",14,"2019-03-27","","","","",,,,,8,1.33,3,3,6
6,"M Maslim","Aplikasi Logika Fuzzy pada Sistem Pakar Pariwisata",2013,"Seminar Nasional Teknologi Informasi dan Komunikasi …","fti.uajy.ac.id","https://fti.uajy.ac.id/sentika/publikasi/makalah/2013/2013_16.pdf","https://scholar.google.com/scholar?cites=8899818791956042290&as_sdt=2005&sciodt=0,5&hl=en",15,"2019-03-27","PDF","","","",,,,,6,1.00,6,1,6
7,"ED Rikhiana, A Fadlil","Implementasi Sistem Pakar Untuk Mendiagnosa Penyakit Dalam Pada Manusia Menggunakan Metode Dempster Shafer",2013,"Jurnal Sarjana Teknik Informatika","neliti.com","https://www.neliti.com/publications/211587/implementasi-sistem-pakar-untuk-mendiagnosa-penyakit-dalam-pada-manusia-mengguna","https://scholar.google.com/scholar?cites=15390927935102751619&as_sdt=2005&sciodt=0,5&hl=en",16,"2019-03-27","","","","",,,,,7,1.17,4,2,6
5,"A Ibrahim","Pengembangan Sistem Pakar Identifikasi Hama dan Penyakit Tanaman Kelapa",2013,"Jurnal Generic","journal.portalgaruda.org","http://journal.portalgaruda.org/index.php/generic/article/view/120","https://scholar.google.com/scholar?cites=6151599003520564211&as_sdt=2005&sciodt=0,5&hl=en",17,"2019-03-27","","","","",,,,,5,0.83,5,1,6
5,"A Marlyaningrum","Aplikasi Sistem Pakar Diagnosis pada Sistem Komputer",2013,"","repository.widyatama.ac.id","https://repository.widyatama.ac.id/xmlui/handle/123456789/2198","https://scholar.google.com/scholar?cites=1612166044022300985&as_sdt=2005&sciodt=0,5&hl=en",18,"2019-03-27","","","","",,,,,5,0.83,5,1,6
6,"A Kusnadi","Perancangan Aplikasi Sistem Pakar untuk Mendiagnosa Penyakit pada Manusia",2013,"Ultimatics","ejournals.umn.ac.id","http://ejournals.umn.ac.id/index.php/TI/article/view/307","https://scholar.google.com/scholar?cites=426862208694621716&as_sdt=2005&sciodt=0,5&hl=en",19,"2019-03-27","","","","",,,,,6,1.00,6,1,6
5,"M Minarni","Rancang Bangun Aplikasi Sistem Pakar untuk Kerusakan Komputer dengan Metode Backward Chaining",2013,"Jurnal TeknoIf","ejournal.itp.ac.id","http://ejournal.itp.ac.id/index.php/tinformatika/article/download/79/76","https://scholar.google.com/scholar?cites=5180779530882383406&as_sdt=2005&sciodt=0,5&hl=en",20,"2019-03-27","PDF","","","",,,,,5,0.83,5,1,6
4,"M Nilmada","Sistem Pakar untuk mendeteksi kerusakan sepeda motor",2013,"UG Journal","ejournal.gunadarma.ac.id","http://ejournal.gunadarma.ac.id/index.php/ugjournal/article/view/859","https://scholar.google.com/scholar?cites=13707938336132109733&as_sdt=2005&sciodt=0,5&hl=en",21,"2019-03-27","","","","",,,,,4,0.67,4,1,6
15,"ITI DAN, T BARU","Sistem Informasi Manajemen",2013,"","ifanapriana09.student.ipb.ac.id","http://ifanapriana09.student.ipb.ac.id/files/2011/10/Sistem-informasi-manajemen.pdf","https://scholar.google.com/scholar?cites=5791946401405174553&as_sdt=2005&sciodt=0,5&hl=en",22,"2019-03-27","PDF","","","",,,,,15,2.50,8,2,6
4,"I Prasojo, S Kusumadewi","Diagnosis EKG dengan Sistem Pakar menggunakan K-NN",2013,"Magister Teknik Informatika Universitas …","fmipa.umri.ac.id","http://fmipa.umri.ac.id/wp-content/uploads/2016/06/Fatria-Nurchania-Diagnosis-EKG.pdf","https://scholar.google.com/scholar?cites=9252400145313169724&as_sdt=2005&sciodt=0,5&hl=en",23,"2019-03-27","PDF","","","",,,,,4,0.67,2,2,6
4,"YI Za'iim","Sistem Pakar untuk Diagnosa Penyakit Jantung Koroner Menggunakan Metode Perceptron",2013,"Skripsi, Fakultas Ilmu Komputer","eprints.dinus.ac.id","http://eprints.dinus.ac.id/12414/1/jurnal_12365.pdf","https://scholar.google.com/scholar?cites=11805733596444871015&as_sdt=2005&sciodt=0,5&hl=en",24,"2019-03-27","PDF","","","",,,,,4,0.67,4,1,6
21,"H Rohayani","Analisis sistem pendukung keputusan dalam memilih program studi menggunakan metode logika fuzzy",2013,"Jurnal Sistem Informasi","ejournal.unsri.ac.id","https://ejournal.unsri.ac.id/index.php/jsi/article/view/876","https://scholar.google.com/scholar?cites=593091739218470623&as_sdt=2005&sciodt=0,5&hl=en",25,"2019-03-27","","","","",,,,,21,3.50,21,1,6
4,"EP Wiweka","Sistem Pakar Diagnosa Infeksi Saluran Pernafasan Akut (ISPA) Menggunakan Logika Fuzzy",2013,"Jurnal Sistem dan Teknologi Informasi (JUSTIN)","jurnal.untan.ac.id","http://jurnal.untan.ac.id/index.php/justin/article/viewFile/1120/1125","https://scholar.google.com/scholar?cites=5964658632173908633&as_sdt=2005&sciodt=0,5&hl=en",26,"2019-03-27","PDF","","","",,,,,4,0.67,4,1,6
4,"E Elfani, A Pujiyanta","Sistem Pakar Mendiagnosa Penyakit Pada Ikan Konsumsi Air Tawar Berbasis Website",2013,"Jurnal Sarjana Teknik Informatika","neliti.com","https://www.neliti.com/publications/211503/sistem-pakar-mendiagnosa-penyakit-pada-ikan-konsumsi-air-tawar-berbasis-website","https://scholar.google.com/scholar?cites=3198734669613341584&as_sdt=2005&sciodt=0,5&hl=en",27,"2019-03-27","","","","",,,,,4,0.67,2,2,6
3,"R Reisa, J Jusak, P Sudarmaningtyas","Sistem Pakar Untuk Diagnosis Penyakit Mata",2013,"Jurnal JSIKA","jurnal.stikom.edu","http://jurnal.stikom.edu/index.php/jsika/article/view/190","https://scholar.google.com/scholar?cites=9818847948083679989&as_sdt=2005&sciodt=0,5&hl=en",28,"2019-03-27","","","","",,,,,3,0.50,1,3,6
3,"NA Ritonga","Sistem Pakar Mendiagnosa Penyakit Lambung Menggunakan Metode Certainty Factor",2013,"Teknik Informatika, STMIK Budi Darma Medan, Medan","academia.edu","http://www.academia.edu/download/40933120/27._Nella_Almi.pdf","https://scholar.google.com/scholar?cites=5212435132106864875&as_sdt=2005&sciodt=0,5&hl=en",29,"2019-03-27","PDF","","","",,,,,3,0.50,3,1,6
11,"J Jauhari, M bin Ibrahim","Intelligent Tutoring System sebagai Upaya Inovatif dalam Pembelajaran untuk Pembelajaran Berbantuan Komputer",2013,"Jurnal Generic","portalgaruda.org","http://portalgaruda.org/portalgaruda/journals/index.php/generic/article/view/116","https://scholar.google.com/scholar?cites=12166056852449852689&as_sdt=2005&sciodt=0,5&hl=en",30,"2019-03-27","","","","",,,,,11,1.83,6,2,6
10,"R Ganevi, BE Purnama","Sistem pendukung keputusan penilaian kinerja guru sekolah menengah pertama negeri (SMP N) 1 Pacitan",2013,"Speed-Sentra Penelitian Engineering dan Edukasi","ijns.org","http://www.ijns.org/journal/index.php/speed/article/view/1236","https://scholar.google.com/scholar?cites=550984153141433294&as_sdt=2005&sciodt=0,5&hl=en",31,"2019-03-27","","","","",,,,,10,1.67,5,2,6
3,"R Primartha, N Fathiyah","Sistem Pakar Fuzzy Untuk Diagnosis Kanker Payudara Menggunakan Metode Mamdani",2013,"GENERIC","eprints.unsri.ac.id","http://eprints.unsri.ac.id/4123/","https://scholar.google.com/scholar?cites=12935136717361373387&as_sdt=2005&sciodt=0,5&hl=en",32,"2019-03-27","","","","",,,,,3,0.50,2,2,6
3,"WR Pratama, J Jusak, P Sudarmaningtyas","Rancang Bangun Aplikasi Sistem Pakar Untuk Menentukan Penyakit Pada Tanaman Kedelai",2013,"Jurnal JSIKA","jurnal.stikom.edu","http://jurnal.stikom.edu/index.php/jsika/article/view/188","https://scholar.google.com/scholar?cites=14106494211683159658&as_sdt=2005&sciodt=0,5&hl=en",33,"2019-03-27","","","","",,,,,3,0.50,1,3,6
3,"A Rukmana","Sistem Pakar Untuk Mendiagnosis Kerusakan Sepeda Motor Non Injeksi Pada Bengkel Gemilang Jaya Motor Kabupaten Pacitan",2013,"EPUB-SISTEM PAKAR","epub.tiunsa.org","http://epub.tiunsa.org/index.php/SP/article/view/28/28","https://scholar.google.com/scholar?cites=7086724625561401444&as_sdt=2005&sciodt=0,5&hl=en",34,"2019-03-27","PDF","","","",,,,,3,0.50,3,1,6
3,"D Aryanto, A Pujiyanta","Aplikasi Sistem Pakar Penentuan Asupan Makanan Bagi Penderita Penyakit Gizi Buruk Dengan Inferensi Fuzzy",2013,"Jurnal Sarjana Teknik Informatika","neliti.com","https://www.neliti.com/publications/211313/aplikasi-sistem-pakar-penentuan-asupan-makanan-bagi-penderita-penyakit-gizi-buru","https://scholar.google.com/scholar?cites=12502950569947673646&as_sdt=2005&sciodt=0,5&hl=en",35,"2019-03-27","","","","",,,,,3,0.50,2,2,6
3,"A Rukmana, S Iriani","Analisis dan Perancangan Sistem Pakar Untuk Mendiagnosis Kerusakan Sepeda Motor Non Injeksi Pada Bengkel Gemilang Jaya Motor Kabupaten Pacitan",2013,"IJNS-Indonesian Journal on Networking and Security","ijns.org","http://www.ijns.org/journal/index.php/ijns/article/view/280","https://scholar.google.com/scholar?cites=8430246139165449744&as_sdt=2005&sciodt=0,5&hl=en",36,"2019-03-27","","","","",,,,,3,0.50,2,2,6
3,"G Tangaguling","Pembangunan Sistem Pakar Untuk Mendiagnosa Hama Penyakit Pada Tanaman Padi Berbasis Web",2013,"","e-journal.uajy.ac.id","http://e-journal.uajy.ac.id/5172/","https://scholar.google.com/scholar?cites=9142213456050319877&as_sdt=2005&sciodt=0,5&hl=en",37,"2019-03-27","","","","",,,,,3,0.50,3,1,6
3,"ZN Baiti","Aplikasi chatbot “MI3” untuk informasi jurusan teknik informatika berbasis sistem pakar menggunakan metode forward chaining",2013,"","etheses.uin-malang.ac.id","http://etheses.uin-malang.ac.id/7691/1/09650054.pdf","https://scholar.google.com/scholar?cites=6736198357636768291&as_sdt=2005&sciodt=0,5&hl=en",38,"2019-03-27","PDF","","","",,,,,3,0.50,3,1,6
4,"MY Munirah, M Rozlini","An expert system development: its application on diagnosing oyster mushroom diseases",2013,"2013 13th International Conference …","ieeexplore.ieee.org","https://ieeexplore.ieee.org/abstract/document/6703917/","https://scholar.google.com/scholar?cites=11189674311726316474&as_sdt=2005&sciodt=0,5&hl=en",39,"2019-03-27","","","","",,,,,4,0.67,2,2,6
6,"KH Pambayun, RA Setyawan, BD Setiawan","Sistem Pendukung Keputusan Seleksi Penerimaan Asisten Praktikum Menggunakan Metode Profile Matching",2013,"Universitas Brawijaya","academia.edu","http://www.academia.edu/download/33749128/2-libre.pdf","https://scholar.google.com/scholar?cites=9743577132317664662&as_sdt=2005&sciodt=0,5&hl=en",40,"2019-03-27","PDF","","","",,,,,6,1.00,2,3,6
8,"A Pranolo, S Widyastuti","Muslimah,“Desain basis data sistem pakar untuk identifikasi penyakit pada sengon (falcataria moluccana),”",2013,"Simp. Nas. Teknol. Terap","","","https://scholar.google.com/scholar?cites=15092907033670415906&as_sdt=2005&sciodt=0,5&hl=en",41,"2019-03-27","CITATION","","","",,,,,8,1.33,4,2,6
2,"M Soleh","Sistem Pakar Penentuan Selera Konsumen Terhadap Menu Kopi Dengan Metode Fuzzy Logic",2013,"","mahasiswa.dinus.ac.id","http://mahasiswa.dinus.ac.id/docs/skripsi/abstrak/12306.pdf","https://scholar.google.com/scholar?cites=5973387141954075276&as_sdt=2005&sciodt=0,5&hl=en",42,"2019-03-27","","","","",,,,,2,0.33,2,1,6
2,"D Setyowati, YI Permana","Sistem Pakar Diagnosa Penyakit Tanaman Padi Berbasis Web",2013,"Jurnal Teknologi …","technoscientia.akprind.ac.id","http://technoscientia.akprind.ac.id/full/vol6no1agus2013/32-40_ds.pdf","https://scholar.google.com/scholar?cites=7073431203363817642&as_sdt=2005&sciodt=0,5&hl=en",43,"2019-03-27","PDF","","","",,,,,2,0.33,1,2,6
2,"AE Purnama, D Destiani, A Setia","Perancangan Sistem Pakar Zakat Pertanian dan Peternakan Berbasis Web",2013,"Jurnal Algoritma","jurnal.sttgarut.ac.id","http://www.jurnal.sttgarut.ac.id/index.php/algoritma/article/view/57","https://scholar.google.com/scholar?cites=15690564492940673604&as_sdt=2005&sciodt=0,5&hl=en",44,"2019-03-27","","","","",,,,,2,0.33,1,3,6
2,"E Puspita, T Baidawi","Sistem Pakar Identifikasi Penanggulangan Hama dan Penyakit Pada Anggrek Phalaenopsis Berbasis Web",2013,"Seminar Nasional Inovasi dan Tren","researchgate.net","https://www.researchgate.net/profile/Taufik_Baidawi/publication/316736855_A2-2013-SNIT-Fullpaper-eva-sistem_pakar_anggrek_phalaenopsis/data/590fe7a8a6fdccad7b126ea9/A2-2013-SNIT-Fullpaper-eva-sistem-pakar-anggrek-phalaenopsis.pdf","https://scholar.google.com/scholar?cites=12711161920098075004&as_sdt=2005&sciodt=0,5&hl=en",45,"2019-03-27","PDF","","","",,,,,2,0.33,1,2,6
7,"PSIBP RUMAH","Pembangunan Sistem Informasi Billing Pada Rumah Sakit Umum Daerah (Rsud) Kabupaten Pacitan Berbasis Web",2013,"","bep.ejurnal.net","http://bep.ejurnal.net/index.php/nas/article/view/87","https://scholar.google.com/scholar?cites=6298168361128876850&as_sdt=2005&sciodt=0,5&hl=en",46,"2019-03-27","","","","",,,,,7,1.17,7,1,6
2,"PA BHASKARA","Perancangan Sistem Pakar Untuk Diagnosa Kerusakan Hardware Laptop Menggunakan Metode Certainty Factor",2013,"Skripsi, Fakultas Ilmu Komputer","eprints.dinus.ac.id","http://eprints.dinus.ac.id/12225","https://scholar.google.com/scholar?cites=8058398827333593431&as_sdt=2005&sciodt=0,5&hl=en",47,"2019-03-27","","","","",,,,,2,0.33,2,1,6
2,"A Yaqin, E Utami","Sistem Pakar Pemetaan Kelas Siswa LBB “abc” Menggunakan Metode Forward Chaining",2013,"Creative Information Technology Journal","citec.amikom.ac.id","http://citec.amikom.ac.id/main/index.php/citec/article/view/8","https://scholar.google.com/scholar?cites=6441912762192630642&as_sdt=2005&sciodt=0,5&hl=en",48,"2019-03-27","","","","",,,,,2,0.33,1,2,6
2,"DR Fitriana","Merancang Sistem Pakar Diagnosa Penyakit Jantung dengan Metode Forward Chaining Berbasis Web",2013,"","eprints.umpo.ac.id","http://eprints.umpo.ac.id/252","https://scholar.google.com/scholar?cites=13403232509728701686&as_sdt=2005&sciodt=0,5&hl=en",49,"2019-03-27","","","","",,,,,2,0.33,2,1,6
2,"F Susanti, S Winiarti","Sistem Pakar Penentuan Kesesuaian Lahan Pertanian untuk Pembudidayaan Tanaman Buah-buahan",2013,"Jurnal Sarjana Teknik Informatika","neliti.com","https://www.neliti.com/publications/211573/sistem-pakar-penentuan-kesesuaian-lahan-pertanian-untuk-pembudidayaan-tanaman-bu","https://scholar.google.com/scholar?cites=7809326849501479604&as_sdt=2005&sciodt=0,5&hl=en",50,"2019-03-27","","","","",,,,,2,0.33,1,2,6
2,"BD Natalina","Sistem Pakar Untuk Mendiagnosa Penyakit Alopesia Pada Manusia dengan Metode Certainty Factor",2013,"Pelita Informatika: Informasi dan …","ejurnal.stmik-budidarma.ac.id","https://ejurnal.stmik-budidarma.ac.id/index.php/pelita/article/view/285","https://scholar.google.com/scholar?cites=13356667662814394240&as_sdt=2005&sciodt=0,5&hl=en",51,"2019-03-27","","","","",,,,,2,0.33,2,1,6
2,"T Tuswanto, A Fadlil","Sistem Pakar Untuk Mendiagnosa Hama dan Penyakit Tanaman Bawang Merah Menggunakan Certainty Factor",2013,"Jurnal Sarjana Teknik Informatika","neliti.com","https://www.neliti.com/publications/211230/sistem-pakar-untuk-mendiagnosa-hama-dan-penyakit-tanaman-bawang-merah-menggunaka","https://scholar.google.com/scholar?cites=10230571330242235054&as_sdt=2005&sciodt=0,5&hl=en",52,"2019-03-27","","","","",,,,,2,0.33,1,2,6
3,"W Handoko","Sistem pendukung keputusan untuk mendiagnosa Penyakit ayam broiler dengan metode Simple additive weighting (SAW)",2013,"","eprints.ums.ac.id","http://eprints.ums.ac.id/id/eprint/26085","https://scholar.google.com/scholar?cites=5564409681587358501&as_sdt=2005&sciodt=0,5&hl=en",53,"2019-03-27","","","","",,,,,3,0.50,3,1,6
2,"M Sya'rudin","Sistem Pakar Untuk Mendiagnosa Penyakit Pada Tanaman Jamur dengan Menggunakan Metode Backward Chaining",2013,"","eprints.ums.ac.id","http://eprints.ums.ac.id/id/eprint/27346","https://scholar.google.com/scholar?cites=15450528430517172848&as_sdt=2005&sciodt=0,5&hl=en",54,"2019-03-27","","","","",,,,,2,0.33,2,1,6
3,"GR Cahyono, J Riadi","Implementasi Certainty Factor Pada Sistem Pakar Untuk Diagnosa Hama Dan Penyakit Tanaman Jagung Menggunakan Sms Gateway",2013,"Jurnal INTEKNA","ejurnal.poliban.ac.id","http://ejurnal.poliban.ac.id/index.php/intekna/article/view/126","https://scholar.google.com/scholar?cites=3585064462732946533&as_sdt=2005&sciodt=0,5&hl=en",55,"2019-03-27","","","","",,,,,3,0.50,2,2,6
5,"P Wulandari","Sistem Penunjang Keputusan Pemilihan Metode/Alat Kontrasepsi",2013,"Program Magister Keperawatan Maternitas …","pkko.fik.ui.ac.id","http://pkko.fik.ui.ac.id/files/TUGAS%20SIM%20KOE%20FIX.pdf","https://scholar.google.com/scholar?cites=15896681336531647209&as_sdt=2005&sciodt=0,5&hl=en",56,"2019-03-27","PDF","","","",,,,,5,0.83,5,1,6
2,"M Silmi, EA Sarwoko…","Sistem Pakar Berbasis Web Dan Mobile Web Untuk Mendiagnosis Penyakit Darah Pada Manusia Dengan Menggunakan Metode Inferensi Forward Chaining",2013,"Jurnal Masyarakat …","ejournal.undip.ac.id","https://ejournal.undip.ac.id/index.php/jmasif/article/view/8459","https://scholar.google.com/scholar?cites=3039090402275885729&as_sdt=2005&sciodt=0,5&hl=en",57,"2019-03-27","","","","",,,,,2,0.33,1,3,6
2,"LS Lestari","Sistem Pakar untuk Mendiagnosa Awal Tumor Otak Menggunakan Metode Bayesian Network Berbasis Web",2013,"","repository.uin-suska.ac.id","http://repository.uin-suska.ac.id/1122/","https://scholar.google.com/scholar?cites=11974475418486169225&as_sdt=2005&sciodt=0,5&hl=en",58,"2019-03-27","","","","",,,,,2,0.33,2,1,6
11,"YS Putra, MA Muslim, A Naba","Game Chicken Roll dengan Menggunakan Metode Forward Chaining",2013,"Jurnal EECCIS","jurnaleeccis.ub.ac.id","http://www.jurnaleeccis.ub.ac.id/index.php/eeccis/article/view/200","https://scholar.google.com/scholar?cites=6885010753931625591&as_sdt=2005&sciodt=0,5&hl=en",59,"2019-03-27","","","","",,,,,11,1.83,4,3,6
4,"H Arifin","Rancang Bangun Aplikasi Pengenalan Budaya Cina Berbasis Sistem Operasi Android",2013,"","eprints.mdp.ac.id","http://eprints.mdp.ac.id/784/","https://scholar.google.com/scholar?cites=7222886931915474235&as_sdt=2005&sciodt=0,5&hl=en",60,"2019-03-27","","","","",,,,,4,0.67,4,1,6
3,"I Syaputra","Sistem Pakar Untuk Mendiagnosa Pengguna Narkoba Dengan Menggunakan Metode Bayes",2013,"Pelita Informatika Budi Darma","","","https://scholar.google.com/scholar?cites=148385709842554585&as_sdt=2005&sciodt=0,5&hl=en",61,"2019-03-27","CITATION","","","",,,,,3,0.50,3,1,6
3,"S Adhinta Nicho Pratama","Sistem Pakar Untuk Mendiagnosis Hama Dan Penyakit Tanaman Padi",2013,"Speed Journal-Indonesian Jurnal on Computer …","","","https://scholar.google.com/scholar?cites=12347305696810825878&as_sdt=2005&sciodt=0,5&hl=en",62,"2019-03-27","CITATION","","","",,,,,3,0.50,3,1,6
3,"MW Pangestika, B Irawan, Y Brianorman","Sistem pakar untuk diagnosa penyakit ibu hamil berbasis mobile",2013,"e-Indonesia Initiatives (eII Forum), Institut …","","","https://scholar.google.com/scholar?cites=1865611841399450750&as_sdt=2005&sciodt=0,5&hl=en",63,"2019-03-27","CITATION","","","",,,,,3,0.50,1,3,6
3,"MS Ivo Randi, Z Wafa, RH Jhon","Perancangan Sistem Pakar Untuk Mendiagnosa Penyakit Kanker Serviks Dengan Metode Forward Chaining",2013,"Jurnal Sarjana Teknik Informatika 09101152630035","","","https://scholar.google.com/scholar?cites=11500243064333522942&as_sdt=2005&sciodt=0,5&hl=en",64,"2019-03-27","CITATION","","","",,,,,3,0.50,1,3,6
3,"M Harun","Aplikasi Sistem Pakar Diagnosa Penyakit Pada Kucing",2013,"no. September","","","https://scholar.google.com/scholar?cites=327439278106308&as_sdt=2005&sciodt=0,5&hl=en",65,"2019-03-27","CITATION","","","",,,,,3,0.50,3,1,6
1,"S Japit, W Jonathan","Sistem Pakar Pendeteksian Jenis Ular",2013,"Jurnal Ilmiah Core IT: Community Research …","ijcoreit.org","http://www.ijcoreit.org/index.php/coreit/article/view/25","https://scholar.google.com/scholar?cites=3192378183805109454&as_sdt=2005&sciodt=0,5&hl=en",66,"2019-03-27","","","","",,,,,1,0.17,1,2,6
1,"NS Setiawan, J Jusak, J Lemantara","Sistem Pakar Untuk Mendiagnosis Kecerdasan Majemuk Menggunakan Metode Fuzzy Expert System",2013,"Jurnal JSIKA","jurnal.stikom.edu","http://jurnal.stikom.edu/index.php/jsika/article/view/163","https://scholar.google.com/scholar?cites=13956720086603233984&as_sdt=2005&sciodt=0,5&hl=en",67,"2019-03-27","","","","",,,,,1,0.17,0,3,6
1,"S Nurhatika","Sistem Pakar Untuk Mendiagnosis Penyakit Tanaman Kelapa Sawit",2013,"","repository.atmaluhur.ac.id","http://repository.atmaluhur.ac.id/handle/123456789/831","https://scholar.google.com/scholar?cites=16125132096874005317&as_sdt=2005&sciodt=0,5&hl=en",68,"2019-03-27","","","","",,,,,1,0.17,1,1,6
3,"AA Nugroho","Perancangan Aplikasi Informasi Untuk Deteksi Penyakit Vertigo",2013,"Teknik Informatika, Universitas Dian …","mahasiswa.dinus.ac.id","http://mahasiswa.dinus.ac.id/docs/skripsi/jurnal/11906.pdf","https://scholar.google.com/scholar?cites=17005069052008710165&as_sdt=2005&sciodt=0,5&hl=en",69,"2019-03-27","PDF","","","",,,,,3,0.50,3,1,6
1,"V Ongkosaputra, H Agus","SISTEM PAKAR DIAGNOSA PENYAKIT ALZHEIMER SECARA DINI MENGGUNAKAN FUZZY TSUKAMOTO",2013,"Universitas Dian Nuswantoro","mahasiswa.dinus.ac.id","http://mahasiswa.dinus.ac.id/docs/skripsi/abstrak/12193.pdf","https://scholar.google.com/scholar?cites=4431423958445361689&as_sdt=2005&sciodt=0,5&hl=en",70,"2019-03-27","","","","",,,,,1,0.17,1,2,6
