Cites,Authors,Title,Year,Source,Publisher,ArticleURL,CitesURL,GSRank,QueryDate,Type,DOI,ISSN,CitationURL,Volume,Issue,StartPage,EndPage,ECC,CitesPerYear,CitesPerAuthor,AuthorCount,Age
0,"N Iswanti","PERANCANGAN APLIKASI SISTEM PAKAR MENDIAGNOSA PENYAKIT OSTEOPOROSIS MENGGUNAKAN METODE CERTAINTY FACTOR",2013,"Pelita Informatika: Informasi dan …","ejurnal.stmik-budidarma.ac.id","https://ejurnal.stmik-budidarma.ac.id/index.php/pelita/article/view/303","",238,"2019-03-27","","","","",,,,,0,0.00,0,1,6
0,"C Kesuma","PENERAPAN SISTEM PAKAR IDENTIFIKASI PENYAKIT BERBASIS ALGORITMA GENETIKA",2013,"EVOLUSI-Jurnal Sains dan Manajemen","ejournal.bsi.ac.id","http://ejournal.bsi.ac.id/ejurnal/index.php/evolusi/article/view/2265","",239,"2019-03-27","","","","",,,,,0,0.00,0,1,6
0,"D Nugroho, K Kustanto","SISTEM PAKAR UNTUK DIAGNOSIS PENYAKIT GINJAL DENGAN METODE FORWARD CHAINING",2013,"Jurnal Teknologi Informasi dan Komunikasi …","p3m.sinus.ac.id","https://p3m.sinus.ac.id/jurnal/index.php/TIKomSiN/article/view/124","",240,"2019-03-27","","","","",,,,,0,0.00,0,2,6
0,"R Indrawan","SISTEM PAKAR DIAGNOSIS AWAL KANKER USUS MENGGUNAKAN METODE CERTAINTY FACTOR",2013,"","repository.upi.edu","http://repository.upi.edu/id/eprint/284","",241,"2019-03-27","","","","",,,,,0,0.00,0,1,6
0,"T RIFAI","SISTEM PAKAR BERBASIS WEB PENENTUAN JENIS DAN NAMA BATUAN BERDASARKAN SIFAT–SIFAT FISIKNYA",2013,"","eprints.upnyk.ac.id","http://eprints.upnyk.ac.id/6221/","",242,"2019-03-27","","","","",,,,,0,0.00,0,1,6
0,"F Rahmansyah","APLIKASI SISTEM PAKAR MENDIAGNOSA PENYAKIT YANG DISEBABKAN OLEH NYAMUK BERBASIS WEB",2013,"","eprints.unisbank.ac.id","http://eprints.unisbank.ac.id/1605/","",243,"2019-03-27","","","","",,,,,0,0.00,0,1,6
0,"R Efendi, IR Widiasari","Perancangan Sistem Pakar Penyakit Paru-Paru Menggunakan Metode VCIRS",2013,"","repository.uksw.edu","http://repository.uksw.edu/handle/123456789/1687","",244,"2019-03-27","","","","",,,,,0,0.00,0,2,6
0,"SRI HANDAYANI","SISTEM PAKAR DIAGNOSA PENYAKIT KANKER PAYUDARA MANUSIA BERBASIS WEB",2013,"","eprints.unisbank.ac.id","http://eprints.unisbank.ac.id/1532/","",245,"2019-03-27","","","","",,,,,0,0.00,0,1,6
0,"R Andropurnomo, H Thendean","Sistem Pakar Untuk Memprediksi Foreign Exchange",2013,"Jurnal Ilmu Komputer dan …","journal.untar.ac.id","https://journal.untar.ac.id/index.php/jiksi/article/view/3086","",246,"2019-03-27","","","","",,,,,0,0.00,0,2,6
0,"AND Soetarmono","PERANCANGAN SISTEM PAKAR DALAM MENDIAGNOSA PENYAKIT PADA BALITA",2013,"Teknika","ejournal.ikado.ac.id","http://ejournal.ikado.ac.id/index.php/teknika/article/view/11","",247,"2019-03-27","","","","",,,,,0,0.00,0,1,6
0,"MB Noviantoro, PS Sasongko","Sistem Pakar untuk Mendeteksi Penyakit Jantung Koroner Menggunakan Fuzzy-mamdani",2013,"Jurnal Matematika","ejournal3.undip.ac.id","https://ejournal3.undip.ac.id/index.php/matematika/article/view/3754","",248,"2019-03-27","","","","",,,,,0,0.00,0,2,6
0,"M Noviantoro, PS Sasongko, K Kushartantya","SISTEM PAKAR UNTUK MENDETEKSI PENYAKIT JANTUNG KORONER MENGGUNAKAN FUZZY-MAMDANI descargar musica gratis de youtube",2013,"","eprints.undip.ac.id","http://eprints.undip.ac.id/42989/1/2_abstrak.pdf.pdf","",249,"2019-03-27","","","","",,,,,0,0.00,0,3,6
0,"T Sugiarto","Sistem Pakar Diagnosa Penyakit Paru-Paru dengan Metode Rule Based Knowledge",2013,"","eprints.umk.ac.id","http://eprints.umk.ac.id/1996/","",250,"2019-03-27","","","","",,,,,0,0.00,0,1,6
0,"L Purnami","SISTEM PAKAR BERBASIS WEB MENENTUKAN RAMUAN HERBAL PADA PENYAKIT KULIT MENGGUNAKAN CERTAINTY FACTOR",2013,"","eprints.upnyk.ac.id","http://eprints.upnyk.ac.id/10279/","",251,"2019-03-27","","","","",,,,,0,0.00,0,1,6
0,"R Setyo","SISTEM PAKAR DIAGNOSA KERUSAKAN PADA AUTOMATIC TELLER MACHINE (ATM) BERBASIS WEB",2013,"","eprints.unisbank.ac.id","http://eprints.unisbank.ac.id/1457/","",252,"2019-03-27","","","","",,,,,0,0.00,0,1,6
0,"YP YUNIYANTO","SISTEM PAKAR UNTUK MENDIAGNOSIS PENYAKIT HIPERTENSI DAN TERAPI DENGAN MENGGUNAKAN METODE FORWARD CHAINING",2013,"","UNIVERSITAS MUHAMMADIYAH …","","",253,"2019-03-27","CITATION","","","",,,,,0,0.00,0,1,6
0,"O TUNGGAL","Perancangan Aplikasi Sistem Pakar Untuk Mendiagnosa Penyakit Pada Anak Balita",2013,"","eprints.ums.ac.id","http://eprints.ums.ac.id/id/eprint/26233","",254,"2019-03-27","","","","",,,,,0,0.00,0,1,6
0,"RY Khusuharyanti","RANCANG BANGUN SISTEM PAKAR DIAGNOSA HAMA DAN PENYAKIT PADA TANAMAN PISANG BERBASIS WEB",2013,"","eprints.unisbank.ac.id","http://eprints.unisbank.ac.id/1459/","",255,"2019-03-27","","","","",,,,,0,0.00,0,1,6
0,"DW Sumayoko","Sistem Pakar Untuk Mendeteksi Kerusakan pada Mesin Centrifugal di PT. Industri Gula Nusantara",2013,"","eprints.unisbank.ac.id","http://eprints.unisbank.ac.id/1776/","",256,"2019-03-27","","","","",,,,,0,0.00,0,1,6
0,"A Setyo Pambudi","SISTEM PAKAR UNTUK MENGIDENTIFIKASI KERUSAKAN PADA AUDIO MOBIL BERBASIS WEB",2013,"","eprints.umk.ac.id","http://eprints.umk.ac.id/1312/","",257,"2019-03-27","","","","",,,,,0,0.00,0,1,6
0,"AH Muhammad","SISTEM PAKAR UNTUK MENDETEKSI KERUSAKAN SOFTWARE DAN HARDWARE PADA DEVICE ANDROID BERBASIS WEB",2013,"","eprints.upnyk.ac.id","http://eprints.upnyk.ac.id/10274/","",258,"2019-03-27","","","","",,,,,0,0.00,0,1,6
0,"S KOSASI","SISTEM PAKAR TES PSIKOMETRI KEPRIBADIAN MANUSIA MENGGUNAKAN METODE FORWARD CHAINING",,"jurnal.stmikpontianak.ac.id","","http://www.jurnal.stmikpontianak.ac.id/file/SANDY_KOSASI_-_PROCEEDINGS_SNIF_2013.pdf","",259,"2019-03-27","PDF","","","",,,,,0,0.00,0,1,
0,"MA Elhias, S Kom","APLIKASI SISTEM PAKAR UNTUK MENENTUKAN PROFIL MANUSIA BERDASARKAN KONSEP PASSION",,"riset.potensi-utama.ac.id","","http://riset.potensi-utama.ac.id/upload/penelitian/penerbitan_jurnal/APLIKASI%20SISTEM%20PAKAR%20%20UNTUK%20MENENTUKAN%20PROFIL.pdf","",260,"2019-03-27","PDF","","","",,,,,0,0.00,0,2,
0,"AA RUFIANI","PERANCANGAN SISTEM PAKAR KONSULTASI GANGGUAN KETULIAN DENGAN METODE DECISION TREE",2013,"","eprints.umpo.ac.id","http://eprints.umpo.ac.id/371/","",261,"2019-03-27","","","","",,,,,0,0.00,0,1,6
0,"T Ismail","Perancangan Dan Pembuatan Aplikasi Sistem Pakar Untuk Diagnosa Awal Gangguan Pada Trafo Arus",2013,"","repository.upi.edu","http://repository.upi.edu/308/","",262,"2019-03-27","","","","",,,,,0,0.00,0,1,6
0,"NKN KURNIAWAN","SISTEM PAKAR PENENTUAN JURUSAN DI SMA DIPONEGORO TUMPANG DENGAN METODE FORWARD",2013,"Jurnal Mahasiswa Fakultas Sains dan …","ejournal.unikama.ac.id","http://ejournal.unikama.ac.id/index.php/JFTI/article/view/125","",263,"2019-03-27","CITATION","","","",,,,,0,0.00,0,1,6
0,"E Eulis Nuraeni","Implementasi Metode Forward Chaining pada Sistem Pakar Diagnosa Penyakit THT (Telinga, Hidung, Tenggorokan)",2013,"","digilib.uinsgd.ac.id","http://digilib.uinsgd.ac.id/295/","",264,"2019-03-27","","","","",,,,,0,0.00,0,1,6
0,"D Maulina, K Kusrini, R Arief","PEMODELAN SISTEM PAKAR ANALISIS KARAKTERISTIK ANAK PRASEKOLAH DENGAN GENRE MUSIK",2013,"SEMNASTEKNOMEDIA ONLINE","ojs.amikom.ac.id","http://ojs.amikom.ac.id/index.php/semnasteknomedia/article/view/550","",265,"2019-03-27","","","","",,,,,0,0.00,0,3,6
0,"AD Nugroho","Sistem Pakar Diagnosis Komplikasi Beresiko Tinggi Selama Kehamilan Dengan Metode Forward Chaining",2013,"","eprints.umk.ac.id","http://eprints.umk.ac.id/1835/","",266,"2019-03-27","","","","",,,,,0,0.00,0,1,6
0,"AW Kusumaningrum","SISTEM PAKAR DIAGNOSA PENYAKIT KULIT PADA KUCING DENGAN METODE CERTAINTY FACTOR",,"core.ac.uk","","https://core.ac.uk/download/pdf/35378185.pdf","",267,"2019-03-27","PDF","","","",,,,,0,0.00,0,1,
0,"A Nofiani","IMPLEMENTASI SISTEM PAKAR UNTUK MENDETEKSI KERUSAKAN PERANGKAT KERAS PADA KOMPUTER",2013,"","repository.atmaluhur.ac.id","http://repository.atmaluhur.ac.id/handle/123456789/834","",268,"2019-03-27","","","","",,,,,0,0.00,0,1,6
0,"AMH Pardede, BS Ginting, S Kom…","PERANCANGAN SISTEM PAKAR DETEKSI KERUSAKAN PRINTER CANON BERBASIS WEB",2013,"Jurnal …","penelitian.kaputama.ac.id","http://penelitian.kaputama.ac.id/images/sampledata/File/Jurnal/Jurnal2013/JURNAL10.pdf","",269,"2019-03-27","PDF","","","",,,,,0,0.00,0,4,6
0,"FWF Wijaya","APLIKASI SISTEM PAKAR DIAGNOSA PENYAKIT TANAMAN TEBU MENGGUNAKAN METODE FORWARD CHAINING",2013,"Jurnal Mahasiswa Fakultas Sains dan …","ejournal.unikama.ac.id","http://ejournal.unikama.ac.id/index.php/JFTI/article/view/134/0","",270,"2019-03-27","CITATION","","","",,,,,0,0.00,0,1,6
0,"RP Triyantoro","SISTEM PAKAR PENGANGGARAN MODAL DENGAN KECERDASAN RESIKO DAN ANALISIS BISNIS PADA ASET TETAP",2013,"","repository.upi.edu","http://repository.upi.edu/2657/","",271,"2019-03-27","","","","",,,,,0,0.00,0,1,6
0,"A Ramadhan","Rancang Bangun Aplikasi Sistem Pakar Troubleshooting Sepeda Motor Honda Berbasis Android",2013,"","eprints.unisbank.ac.id","http://eprints.unisbank.ac.id/1701/","",272,"2019-03-27","","","","",,,,,0,0.00,0,1,6
0,"S Hartati","SISTEM PAKAR PENDIAGNOSA PENYAKIT KARIES PADA GIGI MENGGUNAKAN FUZZY INFERENCE SYSTEM DENGAN METODE TSUKAMOTO",2013,"","etd.repository.ugm.ac.id","http://etd.repository.ugm.ac.id/index.php?act=view&buku_id=58834&mod=penelitian_detail&sub=PenelitianDetail&typ=html","",273,"2019-03-27","","","","",,,,,0,0.00,0,1,6
0,"ME Fauzi","APLIKASI SISTEM PAKAR FUZZY SUGENO UNTUK REKOMENDASI PENGOBATAN DIABETES MELLITUS TIPE 2",2013,"","eprints.umm.ac.id","http://eprints.umm.ac.id/27805/","",274,"2019-03-27","","","","",,,,,0,0.00,0,1,6
0,"K VIKY","SISTEM PAKAR MENGGUNAKAN CERTAINTY FACTOR UNTUK DIAGNOSA STADIUM PENYAKIT KANKER SERVIKS SKRIPSI",2013,"","UPN"" Veteran"" Yogyakarta","","",275,"2019-03-27","CITATION","","","",,,,,0,0.00,0,1,6
0,"M Sumadyo","SISTEM PAKAR PEMBAGIAN WARIS (FARO'IDL) STUDI KASUS KEPAKARAN KYAI ROCHMADI",2013,"… Ilmu Komputer Sistem Embedded dan Logic …","jurnal.unismabekasi.ac.id","http://jurnal.unismabekasi.ac.id/index.php/piksel/article/download/304/234","",276,"2019-03-27","PDF","","","",,,,,0,0.00,0,1,6
0,"SHT Prasojo","APLIKASI SISTEM PAKAR BERBASIS WEB UNTUK PENDETEKSIAN KERUSAKAN MESIN FOTOCOPY CANON NP 6650 II",2013,"","eprints.upnyk.ac.id","http://eprints.upnyk.ac.id/9665/","",277,"2019-03-27","","","","",,,,,0,0.00,0,1,6
0,"BE Purnama, IU Wardati","Pembuatan Aplikasi Sistem Pakar Untuk Diagnosis Kerusakan Hardware Komputer Pada Izzati Komputer",2013,"IJNS-Indonesian Journal on Networking and …","ijns.org","http://www.ijns.org/journal/index.php/ijns/article/view/316","",278,"2019-03-27","","","","",,,,,0,0.00,0,2,6
0,"APS KOM","SISTEM PAKAR UNTUK IDENTIFIKASI PENYAKIT PADA SENGON (FALCATARIA MOLUCCANA)",2013,"","repository.ugm.ac.id","https://repository.ugm.ac.id/id/eprint/120218","",279,"2019-03-27","","","","",,,,,0,0.00,0,1,6
0,"AAJI KESUMA","SISTEM PAKAR DIAGNOSA PENYAKIT GINJAL DENGAN METODE FUZZY TSUKAMOTO",2013,"","Universitas Potensi Utama","","",280,"2019-03-27","CITATION","","","",,,,,0,0.00,0,1,6
0,"J Juliana","SISTEM PAKAR MENDIAGNOSA PENYAKIT SELAPUT RADANG OTAK DENGAN MENGGUNAKAN METODE CERTAINTY FACTOR",2013,"Pelita Informatika: Informasi dan …","ejurnal.stmik-budidarma.ac.id","https://ejurnal.stmik-budidarma.ac.id/index.php/pelita/article/view/296","",281,"2019-03-27","","","","",,,,,0,0.00,0,1,6
0,"Y Bambang","Sistem Pakar Berbasis Web Untuk Diagnosa Hama Dan Penyakit Pada Tanaman Melon",2013,"Seminar Nasional Informatika …","Teknik Informatika UPN"" Veteran"" …","","",282,"2019-03-27","CITATION","","","",,,,,0,0.00,0,1,6
0,"H Fadli","SISTEM PAKAR UNTUK MENDIAGNOSA KERUSAKAN SEPEDA MOTOR 4-TAK DENGAN METODE DEMPSTER SHAFER",2013,"","UPN"" VETERAN"" YOGYAKARTA","","",283,"2019-03-27","CITATION","","","",,,,,0,0.00,0,1,6
0,"WP Wahyuningsih","Sistem Pakar Berbasis Web Untuk Mengidentifikasi Penyakit Pada Tanaman Anggrek Dengan Metode Certainty Factor",2013,"","eprints.upnyk.ac.id","http://eprints.upnyk.ac.id/9560/","",284,"2019-03-27","","","","",,,,,0,0.00,0,1,6
0,"R Delima, YJ Yuwanto","RULE-BASED EXPERT SYSTEM FOR DETECTING AVOCADO DISEASE AND PEST (SISTEM PAKAR BERBASIS ATURAN UNTUK MENDETEKSI PENYAKIT DAN …",2013,"Proceedings of KNASTIK","labti.ukdw.ac.id","https://labti.ukdw.ac.id/ojs/index.php/proceedings/article/view/271","",285,"2019-03-27","","","","",,,,,0,0.00,0,2,6
0,"NI Permatasari","RANCANG BANGUN SISTEM PAKAR DIAGNOSIS KERUSAKAN KOMPUTER DAN PENANGANANNYA BERBASIS MOBILE WEB",,"files.novilestari.webnode.com","","http://files.novilestari.webnode.com/200000117-9f1e5a01f4/JURNAL%20RANCANG%20BANGUN%20SISTEM%20PAKAR%20DIAGNOSIS%20KERUSAKAN%20KOMPUTER%20DAN%20PENANGANANNYA%20BERBASIS%20MOBILE%20WEB.pdf","",286,"2019-03-27","PDF","","","",,,,,0,0.00,0,1,
0,"A Syukri","APLIKASI SISTEM PAKAR DIAGNOSA GANGGUAN KULIT PADA ANAK MENGGUNAKAN METODE FORWARD CHAINING",2013,"","repository.atmaluhur.ac.id","http://repository.atmaluhur.ac.id/handle/123456789/835","",287,"2019-03-27","","","","",,,,,0,0.00,0,1,6
0,"MHEKA WARDANA","SISTEM PAKAR MENDIAGNOSA PENYAKIT MATA DENGAN METODE FORWARD CHAINING",2013,"","eprints.umpo.ac.id","http://eprints.umpo.ac.id/229","",288,"2019-03-27","","","","",,,,,0,0.00,0,1,6
0,"IF SINDRIYANTI","PERANCANGAN DAN IMPLEMENTASI SISTEM PAKAR DENGAN METODE CERTAINTY FACTOR UNTUK DIAGNOSA AWAL PENYAKIT LUPUS",2013,"","eprints.umm.ac.id","http://eprints.umm.ac.id/27766/","",289,"2019-03-27","","","","",,,,,0,0.00,0,1,6
0,"S AZIZ","Sistem Pakar Diagnosa Pola Reversal Dan Continue Pada Forex Market Berbasis Web",2013,"","eprints.ums.ac.id","http://eprints.ums.ac.id/id/eprint/27283","",290,"2019-03-27","","","","",,,,,0,0.00,0,1,6
0,"RB Samodra","SISTEM PAKAR PENGOBATAN ALTERNATIF PADA PENDERITA GANGGUAN KULIT MENGGUNAKAN RAMUAN TRADISIONAL",,"core.ac.uk","","https://core.ac.uk/download/pdf/35377609.pdf","",291,"2019-03-27","PDF","","","",,,,,0,0.00,0,1,
0,"ID Reja","SISTEM PAKAR FUZZY MENDIAGNOSA PENYAKIT MATA MELALUI SMS GATEWAY",2013,"","e-journal.uajy.ac.id","http://e-journal.uajy.ac.id/id/eprint/4355","",292,"2019-03-27","","","","",,,,,0,0.00,0,1,6
0,"VAD GUNAWAN","APLIKASI SISTEM PAKAR BERBASIS PHP UNTUK MENDETEKSI PENYAKIT DIABETES MENGGUNAKAN METODE CERTAINTY FACTOR",2013,"","eprints.uns.ac.id","https://eprints.uns.ac.id/14881/","",293,"2019-03-27","","","","",,,,,0,0.00,0,1,6
0,"D Rahman, D Nugroho, W Laksito","Perancangan Aplikasi Sistem Pakar Untuk Mendiagnosa Kerusakan Kendaraan Toyota Inova Pada PT. Bengawan Abadi Motor Surakarta",2013,"Jurnal Ilmiah SINUS","p3m.sinus.ac.id","https://p3m.sinus.ac.id/jurnal/index.php/e-jurnal_SINUS/article/view/106","",294,"2019-03-27","","","","",,,,,0,0.00,0,3,6
0,"TA Yanto","PERANCANGAN SISTEM PAKAR DIAGNOSIS PENYAKIT AYAM DENGAN MENGGUNAKAN METODE FORWARD CHAINING",2013,"","repository.widyatama.ac.id","https://repository.widyatama.ac.id/xmlui/handle/123456789/3468","",295,"2019-03-27","","","","",,,,,0,0.00,0,1,6
0,"M Khasyogi","Implementasi Algoritma Entropy pada Metode Certainty Factor (CF) dalam Sistem Pakar untuk Deteksi Dini Disleksia",2013,"","repository.upi.edu","http://repository.upi.edu/6291/","",296,"2019-03-27","","","","",,,,,0,0.00,0,1,6
0,"A Aziz, TISAL PANGKALPINANG…","APLIKASI SISTEM PAKAR GANGGUAN OTOT DAN TULANG PADA ANAK BERBASIS WEB MENGGUNAKAN METODE FORWARD CHAINING",2013,"","lppm.atmaluhur.ac.id","http://lppm.atmaluhur.ac.id/wp-content/uploads/2015/12/Jurnal_0911500091_Abdul-Aziz.pdf","",297,"2019-03-27","PDF","","","",,,,,0,0.00,0,3,6
0,"N Nurhayati","SISTEM PAKAR DIOGNOSA PENYAKIT ISPA (INFEKSI SALURAN PERNAPASAN AKUT) DENGAN MENGGUNAKAN METODE CERTAINTY FACTOR",2013,"Pelita Informatika: Informasi dan …","ejurnal.stmik-budidarma.ac.id","https://ejurnal.stmik-budidarma.ac.id/index.php/pelita/article/view/306","",298,"2019-03-27","","","","",,,,,0,0.00,0,1,6
0,"MN Zain","Rancang Bangun Sistem Pakar Diagnosa Penyakit Tanaman Tomat Dengan Menggunakan Metode Forward Changing",2013,"","eprints.umpo.ac.id","http://eprints.umpo.ac.id/331","",299,"2019-03-27","","","","",,,,,0,0.00,0,1,6
0,"RT Palupi","Aplikasi Sistem Pakar Mendiagnosa Gangguan Pada Menstruasi Berbasis Android",2013,"","","","",300,"2019-03-27","CITATION","","","",,,,,0,0.00,0,1,6
0,"S Sukanto","SISTEM PAKAR PENGAMBILAN KEPUTUSAN DALAM PEMBAGIAN HARTA WARIS MENURUT HUKUM KEWARISAN ISLAM",2013,"Seminar Nasional Ilmu Pengetahuan dan …","konferensi.nusamandiri.ac.id","http://konferensi.nusamandiri.ac.id/prosiding/index.php/sniptek/article/view/395","",301,"2019-03-27","","","","",,,,,0,0.00,0,1,6
0,"S Ardhito Pratomo","Sistem Pakar untuk Deteksi Kerusakan Sepeda Motor dengan menggunakan Case Based Reasoning (CBR)",2013,"","eprints.unisbank.ac.id","http://eprints.unisbank.ac.id/1869/","",302,"2019-03-27","","","","",,,,,0,0.00,0,1,6
0,"D WAHYONO","SISTEM PAKAR DIAGNOSA INFEKSI SALURAN PERNAFASAN AKUT (ISPA) BERBASIS WEB DENGAN METODE FORWARD CHAINING",2013,"","repository.atmaluhur.ac.id","http://repository.atmaluhur.ac.id/handle/123456789/840","",303,"2019-03-27","","","","",,,,,0,0.00,0,1,6
0,"US HARTINI","PERANCANGAN DAN IMPLEMENTASI SISTEM PAKAR DETEKSI DINI GANGGUAN MASA KEHAMILAN DENGAN METODE FORWARD CHAINING",2013,"","eprints.umpo.ac.id","http://eprints.umpo.ac.id/261","",304,"2019-03-27","","","","",,,,,0,0.00,0,1,6
0,"R Noviana, W Winarti, D Indriani","APLIKASI SISTEM PAKAR UNTUK MENDIAGNOSA PENYAKIT GANGGUAN TIDUR DENGAN TURBO PROLOG 2.0",2013,"SEMNASTEKNOMEDIA …","ojs.amikom.ac.id","http://ojs.amikom.ac.id/index.php/semnasteknomedia/article/view/542","",305,"2019-03-27","","","","",,,,,0,0.00,0,3,6
0,"A Pranolo, SM Widyastuti","Desain Basis Data Sistem Pakar untuk Identifikasi Penyakit pada Sengon (Falcataria Moluccana)",2013,"","publikasiilmiah.ums.ac.id","https://publikasiilmiah.ums.ac.id/xmlui/handle/11617/4081","",306,"2019-03-27","","","","",,,,,0,0.00,0,2,6
0,"F Indriyani","APLIKASI SISTEM PAKAR UNTUK IDENTIFIKASI PENYAKIT TERNAK AYAM BROILER MENGGUNAKAN METODE CERTAINTY FACTOR",2013,"","eprints.umk.ac.id","http://eprints.umk.ac.id/1484/","",307,"2019-03-27","","","","",,,,,0,0.00,0,1,6
0,"H KURNIAWAN","APLIKASI SISTEM PAKAR UNTUK MENDIAGNOSA PENYAKIT KULIT SAPI BERBASIS WEB DENGAN MENGGUNAKAN METODE FORWARD CHAINING",2013,"","repository.atmaluhur.ac.id","http://repository.atmaluhur.ac.id/handle/123456789/851","",308,"2019-03-27","","","","",,,,,0,0.00,0,1,6
0,"R Rizal","DIAGNOSA KERUSAKAN MESIN TIPE OM366A PADA MOBIL MERCEDES-BENZ MENGGUNAKAN SISTEM PAKAR",2013,"TECHSI-Jurnal Teknik Informatika","ojs.unimal.ac.id","http://ojs.unimal.ac.id/index.php/techsi/article/view/148","",309,"2019-03-27","","","","",,,,,0,0.00,0,1,6
0,"DA Rizki","SISTEM PAKAR IDENTIFIKASI TERAPI JUS BUAH UNTUK PENYEMBUHAN PENYAKIT DALAM DENGAN MENGGUNAKAN METODE CERTAINTY …",2013,"","UPN"" Vetean"" Yogyakarta","","",310,"2019-03-27","CITATION","","","",,,,,0,0.00,0,1,6
0,"N NUHA","SISTEM PAKAR DIAGNOSA PENYAKIT TULANG (ORTOPEDI) MENGGUNAKAN PERANGKAT MOBILE DENGAN METODE BACKWARD CHAINING",2013,"","eprints.umpo.ac.id","http://eprints.umpo.ac.id/342","",311,"2019-03-27","","","","",,,,,0,0.00,0,1,6
0,"Y Risyani","Sistem Pakar untuk Optimasi Pohon Jabon (Anthocephalus Cadamba) dengan Metode Backward Channing",2013,"Jurnal Ilmiah Core IT: Community Research …","ijcoreit.org","http://ijcoreit.org/index.php/coreit/article/view/1","",312,"2019-03-27","","","","",,,,,0,0.00,0,1,6
0,"N Adennia","SISTEM PAKAR PENDETEKSIAN PENYIMPANGAN TINGKAH LAKU ANAK USIA 0 SAMPAI 3 TAHUN DENGAN METODE BAYESIAN",2013,"","eprints.umk.ac.id","http://eprints.umk.ac.id/1992/","",313,"2019-03-27","","","","",,,,,0,0.00,0,1,6
0,"A Istyo Prananto","Aplikasi Sistem Pakar Untuk Diagnosa Penyakit Tht (telinga, Hidung Dan Tenggorokan) Menggunakan Java Netbeans 7.2 Dan Xampp",2013,"","","","",314,"2019-03-27","CITATION","","","",,,,,0,0.00,0,1,6
0,"RH Prayoga","SISTEM PAKAR UNTUK MENDIAGNOSA JENIS PENYAKIT PADA AYAM MENGGUNAKAN METODE FORWARD CHAINING",2013,"EXPLORE IT!","jurnal.yudharta.ac.id","http://jurnal.yudharta.ac.id/v2/index.php/EXPLORE-IT/article/view/261","",315,"2019-03-27","","","","",,,,,0,0.00,0,1,6
0,"W Zuliati","APLIKASI SISTEM PAKAR UNTUK MENDIAGNOSA PENYAKIT PADA AYAM PETELUR MENGGUNAKAN METODE FORWARD CHAINING",2013,"","repository.atmaluhur.ac.id","http://repository.atmaluhur.ac.id/handle/123456789/812","",316,"2019-03-27","","","","",,,,,0,0.00,0,1,6
0,"F Nirwana","SISTEM PAKAR UNTUK DIAGNOSA PENYAKIT KELAINAN GENETIS PADA ANAK DENGAN METODE FORWARD CHAINING BERBASIS WEB",2013,"","repository.atmaluhur.ac.id","http://repository.atmaluhur.ac.id/handle/123456789/832","",317,"2019-03-27","","","","",,,,,0,0.00,0,1,6
0,"E Yulsilviana, H Ansari","Sistem Pakar Kerusakan Motor Kendaraan Roda Dua Jenis Yamaha Matic pada Reza Jaya Motor Samarinda",2013,"Sebatik","jurnal.wicida.ac.id","http://jurnal.wicida.ac.id/index.php/sebatik/article/download/52/43","",318,"2019-03-27","PDF","","","",,,,,0,0.00,0,2,6
0,"RP Bendriyanti, H Aspriyono","SISTEM PAKAR MENDETEKSI PENYAKIT ASMA PADA PUSKESMAS LINGKAR TIMUR BENGKULU",2013,"Jurnal Media Infotama","jurnal.unived.ac.id","https://jurnal.unived.ac.id/index.php/jmi/article/view/68","",319,"2019-03-27","","","","",,,,,0,0.00,0,2,6
0,"R Dwi Ariyani","Sistem Pakar Untuk Mendiagnosa Penyakit Kulit pada Anak Menggunakan Metode Teorema Bayes Berbasis Web",2013,"","eprints.umk.ac.id","http://eprints.umk.ac.id/1940/","",320,"2019-03-27","","","","",,,,,0,0.00,0,1,6
0,"R Apriliyani","Perancangan Sistem Pakar Troubleshooting Kerusakan Komputer Dengan Menggunakan Visual Studio 2010 Dengan Metode Forward Chaining",2013,"","eprints.ums.ac.id","http://eprints.ums.ac.id/id/eprint/27297","",321,"2019-03-27","","","","",,,,,0,0.00,0,1,6
0,"D Rahmawanti","Aplikasi Sistem Pakar Berbasis Web Untuk Mendeteksi Kerusakan Unit Excavator PC 400-7 Dengan Pelacakan Forward Chaining",2013,"Jurnal Teknologi, Universitas Dian Nuswantoro …","eprints.dinus.ac.id","http://eprints.dinus.ac.id/12677/1/jurnal_12841.pdf","",322,"2019-03-27","PDF","","","",,,,,0,0.00,0,1,6
0,"D Mahardika","APLIKASI SISTEM PAKAR UNTUK MENDIAGNOSA PENYAKIT GANGGUAN PENCERNAAN PADA ANAK BERBASIS WEB MENGGUNAKAN METODE FORWARD …",2013,"","repository.atmaluhur.ac.id","http://repository.atmaluhur.ac.id/handle/123456789/842","",323,"2019-03-27","","","","",,,,,0,0.00,0,1,6
0,"I SETIAWAN","APLIKASI SISTEM PAKAR UNTUK MENDIAGNOSIS PENYAKIT PADA SAPI DENGAN METODE FORWARD CHAINING MENGGUNAKAN PHP DAN MY SQL",2013,"","repository.atmaluhur.ac.id","http://repository.atmaluhur.ac.id/handle/123456789/824","",324,"2019-03-27","","","","",,,,,0,0.00,0,1,6
0,"M Malik, A Susdaryanto","PENERAPAN LOGIKA FUZZY PADA APLIKASI SISTEM PAKAR UNTUK MENDIAGNOSIS PENYAKIT NEUROLOGI PADA MANUSIA BERBASIS WEB",2013,"","eprints.mdp.ac.id","http://eprints.mdp.ac.id/805/","",325,"2019-03-27","","","","",,,,,0,0.00,0,2,6
0,"A Ali Rahman","Sistem Pakar Penentuan Solusi Perbaikan Kerusakan Mobil Toyota Corolla Altis Menggunakan Metode Case-Based Reasoning",2013,"","digilib.uinsgd.ac.id","http://digilib.uinsgd.ac.id/id/eprint/264","",326,"2019-03-27","","","","",,,,,0,0.00,0,1,6
0,"CK Lusi, P Honggowiyono…","PENGEMBANGAN SISTEM PAKAR UNTUK MENDIAGNOSIS GANGGUAN KESEHATAN MENTAL PESERTA DIDIK DI SMA NEGERI 2 MALANG",2013,"Tugas Akhir Jurusan …","academia.edu","http://www.academia.edu/download/32745738/artikel_fix.pdf","",327,"2019-03-27","PDF","","","",,,,,0,0.00,0,3,6
0,"FT Anggoro","SISTEM PAKAR DIAGNOSA GEJALA AWAL PENYAKIT DI PERUT DAN SISTEM PENCERNAAN BERDASARKAN BUKU Â “DOKTER DI RUMAH ANDAÂ” DENGAN …",2013,"","eprints.umm.ac.id","http://eprints.umm.ac.id/27960/","",328,"2019-03-27","","","","",,,,,0,0.00,0,1,6
0,"SA Tama","PERANCANGAN PERANGKAT LUNAK SISTEM PAKAR DIAGNOSA PENYAKIT KULIT DI KLINIK SUN-FLOWER DENGAN METODE FORWARD CHAINING …",2013,"","eprints.unisbank.ac.id","http://eprints.unisbank.ac.id/1753/","",329,"2019-03-27","","","","",,,,,0,0.00,0,1,6
0,"M Reza Adriansyah","Aplikasi Sistem Pakar Pemilihan Gadgets Berbasis Web Menggunakan Php 5.4 Dan Mysql",2013,"","","","",330,"2019-03-27","CITATION","","","",,,,,0,0.00,0,1,6
0,"GP Kusuma","SISTEM PAKAR UNTUK MENGIDENTIFIKASI PENYAKIT PADA IKAN LELE MENGGUNAKAN METODE BACKWARD CHAINING",2013,"Jurnal Media Infotama","jurnal.unived.ac.id","https://jurnal.unived.ac.id/index.php/jmi/article/view/29","",331,"2019-03-27","","","","",,,,,0,0.00,0,1,6
0,"AN Pratitis","SISTEM PAKAR DIAGNOSA PENYAKIT DAN HAMA PADA TANAMAN PEPAYA CALIFORNIA DI DUSUN KETHITANG-RAWALO",2013,"Telematika","ejournal.amikompurwokerto.ac.id","http://ejournal.amikompurwokerto.ac.id/index.php/telematika/article/view/404","",332,"2019-03-27","","","","",,,,,0,0.00,0,1,6
0,"FK Putra","Menentukan Kecenderungan Dan Karakter Seseorang Dengan Sistem Pakar Menggunakan Tekhnik Backward Chaining Menerapkan Prinsip Experiental Learning",2013,"Eksplora Informatika","ejournal.stikom-bali.ac.id","http://ejournal.stikom-bali.ac.id/index.php/0f410362/article/view/616","",333,"2019-03-27","","","","",,,,,0,0.00,0,1,6
0,"CJ Ebenhaezar","Aplikasi Sistem Pakar Berbasis Mobile Untuk Menganalisis Kerusakan Sepeda Motor 4 Tak Merk Honda Dengan Metode Forward Chaining",2013,"","eprints.ukmc.ac.id","http://eprints.ukmc.ac.id/680/","",334,"2019-03-27","","","","",,,,,0,0.00,0,1,6
0,"J Risanto","SISTEM PAKAR UNTUK MENENTUKAN ALTERNATIF KEPUTUSAN MENGGUNAKAN METODE EXPECTED PAY OFF (EP) DAN EXPECTED LOSS (EL)",,"Jurnal Pilar Sains","ejournal.unri.ac.id","https://ejournal.unri.ac.id/index.php/JPS/article/view/1519","",335,"2019-03-27","","","","",,,,,0,0.00,0,1,
0,"A PRANATA","APLIKASI SISTEM PAKAR UNTUK MENDIAGNOSA HAMA DAN PENYAKIT PADA TANAMAN STROBERI BERBASIS WEB DENGAN METODE FORWARD …",2013,"","repository.atmaluhur.ac.id","http://repository.atmaluhur.ac.id/handle/123456789/843","",336,"2019-03-27","","","","",,,,,0,0.00,0,1,6
0,"T Sitepu","Sistem Pakar Hama dan Penyakit Tanaman Disertai dengan Sig Lalat Buah pada Jeruk Manis di Kabupaten Karo",2013,"","repository.maranatha.edu","https://repository.maranatha.edu/15071/","",337,"2019-03-27","","","","",,,,,0,0.00,0,1,6
0,"K Ahmad","Aplikasi Sistem Pakar untuk Diagnosa Penyakit Hipertiroid dengan Metode Inferensi Fuzzy Mamdani",2013,"","eprints.undip.ac.id","http://eprints.undip.ac.id/39216/","",338,"2019-03-27","","","","",,,,,0,0.00,0,1,6
