Cites,Authors,Title,Year,Source,Publisher,ArticleURL,CitesURL,GSRank,QueryDate,Type,DOI,ISSN,CitationURL,Volume,Issue,StartPage,EndPage,ECC,CitesPerYear,CitesPerAuthor,AuthorCount,Age
1,"M Silmy","Sistem pakar web dan Mobile Web untuk mendiagnosis Penyakit Darah pada manusia dengan mengggunakan metode inferensi forward chaining Seoul",2013,"Journal of Informatics and technologi","","","https://scholar.google.com/scholar?cites=12807695390654528385&as_sdt=2005&sciodt=0,5&hl=en",143,"2019-03-27","CITATION","","","",,,,,1,0.17,1,1,6
1,"S Putri","Sistem Pakar berbasis web untuk diagnosa dan penanganan penyakit binatang kucing menggunakan probabilitas dan teorema bayes",2013,"Yogyakarta: UIN Sunan Kalijaga","","","https://scholar.google.com/scholar?cites=16711553460101369224&as_sdt=2005&sciodt=0,5&hl=en",144,"2019-03-27","CITATION","","","",,,,,1,0.17,1,1,6
1,"ST Rahmad Hidayat","Rancang Bangun Aaplikasi Sistem Pakar Untuk Kerusakan Komputer Dengan Metode Backward Chaining",2013,"","Institut Teknologi Padang","","https://scholar.google.com/scholar?cites=12001016773253551862&as_sdt=2005&sciodt=0,5&hl=en",145,"2019-03-27","CITATION","","","",,,,,1,0.17,1,1,6
1,"I Prasetyanigrum","Sistem pakar",2013,"Diktat Tidak Terpublikasi, Surabaya: Politeknik …","","","https://scholar.google.com/scholar?cites=15860721758422177989&as_sdt=2005&sciodt=0,5&hl=en",146,"2019-03-27","CITATION","","","",,,,,1,0.17,1,1,6
1,"K Rega Prilianti","Desain Sistem Pakar untuk Evaluasi Pertumbuhan Tanaman",2013,"","Vitro","","https://scholar.google.com/scholar?cites=12467064078610959658&as_sdt=2005&sciodt=0,5&hl=en",147,"2019-03-27","CITATION","","","",,,,,1,0.17,1,1,6
1,"D Harto","Perancangan Sistem Pakar Untuk Mengidentifikasi Penyakit Pada Tanaman Semangka Dengan Menggunakan Metode",2013,"Certainty Factor","","","https://scholar.google.com/scholar?cites=14606118978161907069&as_sdt=2005&sciodt=0,5&hl=en",148,"2019-03-27","CITATION","","","",,,,,1,0.17,1,1,6
1,"S Avianty","Sistem Pakar Pendeteksi Penyakit Degeneratif Berbasis Web",2013,"Semarang: Universitas Dian Nusantara","","","https://scholar.google.com/scholar?cites=5121524242941370375&as_sdt=2005&sciodt=0,5&hl=en",149,"2019-03-27","CITATION","","","",,,,,1,0.17,1,1,6
4,"EB Sulistiarini","Representing knowledge base into database for WAP and web-based expert system",2013,"arXiv preprint arXiv:1312.3060","arxiv.org","https://arxiv.org/abs/1312.3060","https://scholar.google.com/scholar?cites=10364575040954162201&as_sdt=2005&sciodt=0,5&hl=en",150,"2019-03-27","","","","",,,,,4,0.67,4,1,6
2,"IMD Maysanjaya, MWA Kesiman…","Pengembangan Sistem Identifikasi Jenis Kelamin Janin Pada Citra Usg",2013,"Jurnal Nasional …","ejournal.undiksha.ac.id","http://ejournal.undiksha.ac.id/index.php/janapati/article/view/9754","https://scholar.google.com/scholar?cites=7912496359740056672&as_sdt=2005&sciodt=0,5&hl=en",151,"2019-03-27","","","","",,,,,2,0.33,1,3,6
1,"N Yuliati","Perancangan Dan Implementasi Sistem Pakar Untuk Memprediksi Penyakit Apendisitis Dengan Metode Dempster-Shafer",2013,"Jurnal Manajemen Informatika","jurnalmahasiswa.unesa.ac.id","https://jurnalmahasiswa.unesa.ac.id/index.php/jurnal-manajemen-informatika/article/view/2135","https://scholar.google.com/scholar?cites=16866596642864100075&as_sdt=2005&sciodt=0,5&hl=en",152,"2019-03-27","CITATION","","","",,,,,1,0.17,1,1,6
1,"I Zulkarnaini","DIAGNOSA PENYAKIT KANKER PAYUDARA DENGAN MENGUNAKAN SISTEM FUZZY MADM (MULTI ATTRIBUTE DECISION MAKING)",2013,"","Lentera","","https://scholar.google.com/scholar?cites=10888145791465722804&as_sdt=2005&sciodt=0,5&hl=en",153,"2019-03-27","CITATION","","","",,,,,1,0.17,1,1,6
3,"NP Andayu","Perancangan Text To Speech Converter Engine Dalam Pengucapan Kata Berbahasa Arab Sehari-hari",2013,"Jurnal Sistem dan Teknologi Informasi (JUSTIN)","jurnal.untan.ac.id","http://jurnal.untan.ac.id/index.php/justin/article/download/3199/3170","https://scholar.google.com/scholar?cites=13968937704829523321&as_sdt=2005&sciodt=0,5&hl=en",154,"2019-03-27","PDF","","","",,,,,3,0.50,3,1,6
1,"S Supyani, B Widada, WLY Saptomo","Aplikasi Diagnosa Kerusakan Mesin Sepeda Motor Bebek 4 TAK Dengan Metode Forward Chaining",2013,"Jurnal Teknologi Informasi …","p3m.sinus.ac.id","https://p3m.sinus.ac.id/jurnal/index.php/TIKomSiN/article/view/78","https://scholar.google.com/scholar?cites=7828394523862809210&as_sdt=2005&sciodt=0,5&hl=en",155,"2019-03-27","","","","",,,,,1,0.17,0,3,6
2,"A Pranolo, SM Widyastuti","Azhari,“",2013,"… Sistem Pakar Untuk Identifikasi Gangguan Tanaman …","","","https://scholar.google.com/scholar?cites=14549384985691819239&as_sdt=2005&sciodt=0,5&hl=en",156,"2019-03-27","CITATION","","","",,,,,2,0.33,1,2,6
1,"A Amelia, M Sarwoko, TA Riza","Perancangan Sistem Deteksi Jenis Kendaraan Bermotor Berbasis Mikrokontroler (Studi Kasus: Jalur Transjakarta)",2013,"jurnal Teknologi","ejournal.akprind.ac.id","https://ejournal.akprind.ac.id/index.php/jurtek/article/view/992","https://scholar.google.com/scholar?cites=6179644484415068307&as_sdt=2005&sciodt=0,5&hl=en",157,"2019-03-27","","","","",,,,,1,0.17,0,3,6
1,"M Rahmayu","Pendeteksian Diagnosa Penyakit Kandungan Pada Ibu Hamil Dengan Menggunakan Metode Forward Chaining",2013,"Jurnal Techno Nusa Mandiri","ejournal.nusamandiri.ac.id","http://ejournal.nusamandiri.ac.id/ejurnal/index.php/techno/article/view/117","https://scholar.google.com/scholar?cites=8367029865316538942&as_sdt=2005&sciodt=0,5&hl=en",158,"2019-03-27","","","","",,,,,1,0.17,1,1,6
2,"L Perdana, D Nugroho","Kustanto,“",2013,"Sistem Pakar untuk Diagnosis Penyakit Ginjal dengan …","","","https://scholar.google.com/scholar?cites=4333194738406745734&as_sdt=2005&sciodt=0,5&hl=en",159,"2019-03-27","CITATION","","","",,,,,2,0.33,1,2,6
1,"RK Khaula","Evaluasi Sistem Informasi Kesehatan Ditinjau Dari kualitas Data di Unit Rekam Medis Asri Medical Center Universitas Muhammadiyah Yogyakarta (AMC UMY)",2013,"","eprints.ums.ac.id","http://eprints.ums.ac.id/id/eprint/26128","https://scholar.google.com/scholar?cites=15141792906576835142&as_sdt=2005&sciodt=0,5&hl=en",160,"2019-03-27","","","","",,,,,1,0.17,1,1,6
2,"P Wahyu","Menur dkk",2013,"Sistem Pakar Untuk Diagnosa Penyakit Ibu Hamil …","","","https://scholar.google.com/scholar?cites=14865300558473208867&as_sdt=2005&sciodt=0,5&hl=en",161,"2019-03-27","CITATION","","","",,,,,2,0.33,2,1,6
1,"MB Saputra","Sistem Informasi Keluhan Pelanggan Berbasis Web Pada PDAM Tirta Musi Palembang",2013,"JURNAL MAHASISWA MI D3","eprints.binadarma.ac.id","http://eprints.binadarma.ac.id/87/1/SISTEM%20INFORMASI%20KELUHAN%20PELANGGAN%20BERBASIS%20WEB%20PADA%20PDAM%20TIRTA%20MUSI%20PALEMBANG.pdf","https://scholar.google.com/scholar?cites=2988940882358420797&as_sdt=2005&sciodt=0,5&hl=en",162,"2019-03-27","PDF","","","",,,,,1,0.17,1,1,6
1,"I Juliani, TA Putri","Penentuan Bidang Pekerjaan Berdasarkan Emergenetics Dengan Menggunakan Metode Case Based Reasoning Dan Algoritma Nearest Neighbour",2013,"","eprints.mdp.ac.id","http://eprints.mdp.ac.id/788/","https://scholar.google.com/scholar?cites=7009189654062064138&as_sdt=2005&sciodt=0,5&hl=en",163,"2019-03-27","","","","",,,,,1,0.17,1,2,6
1,"BH Purnomo","MODEL PENUNJANG KEPUTUSAN INVESTASI BAGI PENGEMBANGAN AGROINDUSTRI PERIKANAN",2013,"Jurnal Ilmiah Inovasi","publikasi.polije.ac.id","https://publikasi.polije.ac.id/index.php/jii/article/view/98","https://scholar.google.com/scholar?cites=3424874304331530472&as_sdt=2005&sciodt=0,5&hl=en",164,"2019-03-27","","","","",,,,,1,0.17,1,1,6
2,"S Priyono, M Bettiza","Aplikasi Diagnosa Faktor Risiko Diabetes Mellitus Tipe 2 dengan Logika Fuzzy",2013,"Universitas Maritim Raja Ali Haji, Riau","jurnal.umrah.ac.id","http://jurnal.umrah.ac.id/wp-content/uploads/2013/08/Sapta-Priyono.pdf","https://scholar.google.com/scholar?cites=10944517148501791892&as_sdt=2005&sciodt=0,5&hl=en",165,"2019-03-27","PDF","","","",,,,,2,0.33,1,2,6
5,"Y Yuniati","Pengembangan Perangkat Lunak Pembelajaran Bahasa Isyarat Bagi Penderita Tunarungu Wicara",2013,"Jurnal Generic","portalgaruda.org","http://portalgaruda.org/portalgaruda/journals/index.php/generic/article/view/127","https://scholar.google.com/scholar?cites=635352141059278080&as_sdt=2005&sciodt=0,5&hl=en",166,"2019-03-27","","","","",,,,,5,0.83,5,1,6
1,"PP Nurhasanah","Aplikasi Ramuan Obat Tradisional untuk Mengatasi Aneka Penyakit Berbasis Mobile Android",2013,"","eprints.ums.ac.id","http://eprints.ums.ac.id/id/eprint/26137","https://scholar.google.com/scholar?cites=1336681558282186245&as_sdt=2005&sciodt=0,5&hl=en",167,"2019-03-27","","","","",,,,,1,0.17,1,1,6
2,"D Purnamasari, J Henharta, YP Sasmita, F Ihsani…","Get Easy Using Weka",2013,"","repository.gunadarma.ac.id","http://repository.gunadarma.ac.id/1668/1/07_Buku%20WEKA_Lintang.pdf","https://scholar.google.com/scholar?cites=472107046009990383&as_sdt=2005&sciodt=0,5&hl=en",168,"2019-03-27","PDF","","","",,,,,2,0.33,0,5,6
2,"Y Hendriana","Program Bantu Identifikasi Penyakit THT",2013,"","publikasiilmiah.ums.ac.id","https://publikasiilmiah.ums.ac.id/xmlui/handle/11617/4075","https://scholar.google.com/scholar?cites=2987966109242909091&as_sdt=2005&sciodt=0,5&hl=en",169,"2019-03-27","","","","",,,,,2,0.33,2,1,6
2,"AM Mona, MH Adiguna","Studi Perbandingan Metode Fuzzy dan Certainty Factor dalam mendiagnosa penyakit Skizofrenia",2013,"","eprints.mdp.ac.id","http://eprints.mdp.ac.id/958/","https://scholar.google.com/scholar?cites=16200067755197234802&as_sdt=2005&sciodt=0,5&hl=en",170,"2019-03-27","","","","",,,,,2,0.33,1,2,6
11,"DF Murad, N Kusniawati","Aplikasi Intelligence Website untuk Penunjang Laporan PAUD pada Himpaudi Kota Tangerang",2013,"CCIT Journal","ejournal.raharja.ac.id","http://ejournal.raharja.ac.id/index.php/ccit/article/view/203","https://scholar.google.com/scholar?cites=17407623595580372209&as_sdt=2005&sciodt=0,5&hl=en",171,"2019-03-27","","","","",,,,,11,1.83,6,2,6
8,"Z Azmi, M Dahria","Decision Tree Berbasis Algoritma Untuk Pengambilan Keputusan",2013,"Jurnal Ilmiah SAINTIKOM","demo.pohonkeputusan.com","http://demo.pohonkeputusan.com/files/DECISION%20TREE%20BERBASIS%20ALGORITMA%20UNTUK%20PENGAMBILAN%20KEPUTUSAN.pdf","https://scholar.google.com/scholar?cites=13886224365249370760&as_sdt=2005&sciodt=0,5&hl=en",172,"2019-03-27","PDF","","","",,,,,8,1.33,4,2,6
1,"D Kaparang, S Eko","Penentuan Alih Fungsi Lahan Marginal Menjadi Lahan Pangan Berbasis Algoritma K-Means di Wilayah Kabupaten Boyolali",2013,"de CARTESIAN","ejournal.unsrat.ac.id","https://ejournal.unsrat.ac.id/index.php/decartesian/article/view/3217","https://scholar.google.com/scholar?cites=15111784212455731248&as_sdt=2005&sciodt=0,5&hl=en",173,"2019-03-27","","","","",,,,,1,0.17,1,2,6
1,"GB Ismoyo, S Guslendra, M Kom, S Armonitha","ANALISA DAN PERANCANGAN APLIKASI SISTEM PENDUKUNG KEPUTUSAN DENGAN METODE AHP (ANALYTIC HIERARCHY PROCESS) DALAM …",2013,"","academia.edu","http://www.academia.edu/download/36326579/Jurnal_Gatot_Broto_Ismoyo_11101152630022.pdf","https://scholar.google.com/scholar?cites=4345089481161693148&as_sdt=2005&sciodt=0,5&hl=en",174,"2019-03-27","PDF","","","",,,,,1,0.17,0,4,6
1,"H Dharma","Aplikasi Penentuan Prioritas Kriterria Pemilihan Rumah Kost Berbasis Analytical Hierarchy Process (AHP)",2013,"EXPERT","jurnal.ubl.ac.id","http://jurnal.ubl.ac.id/index.php/expert/article/view/485","https://scholar.google.com/scholar?cites=445367712201945315&as_sdt=2005&sciodt=0,5&hl=en",175,"2019-03-27","","","","",,,,,1,0.17,1,1,6
1,"B Lianto, ED Rinawiyanti","Rantai Nilai Inovasi Terpadu: Sebuah model konseptual dan hipotesa awal",2013,"Proceedings 7th National …","repository.ubaya.ac.id","http://repository.ubaya.ac.id/id/eprint/9203","https://scholar.google.com/scholar?cites=16198019636577546480&as_sdt=2005&sciodt=0,5&hl=en",176,"2019-03-27","","","","",,,,,1,0.17,1,2,6
1,"DB Alamsyah","Aplikasi Manajemen Risiko Pada Industri Kecil Nata De Coco (Studi Kasus Di Ud. Citra Mandiri Margo Mulyo Muktisari-Jember)",2013,"","repository.unej.ac.id","http://repository.unej.ac.id/handle/123456789/12349","https://scholar.google.com/scholar?cites=8385211215177639576&as_sdt=2005&sciodt=0,5&hl=en",177,"2019-03-27","","","","",,,,,1,0.17,1,1,6
2,"MP Eisenring","Abu Batubara Sebuah Konsep Inovatif Bagi Produksi Bata Abu Abu Untuk Memperoleh Kekuatan Tinggi Dan Aman Terhadap Lingkungan (a Literatur Study)",2013,"Mektrik","neliti.com","https://www.neliti.com/publications/154961/abu-batubara-sebuah-konsep-inovatif-bagi-produksi-bata-abu-abu-untuk-memperoleh","https://scholar.google.com/scholar?cites=16112404259132659334&as_sdt=2005&sciodt=0,5&hl=en",178,"2019-03-27","","","","",,,,,2,0.33,2,1,6
1,"A Baswara, A Nursikuwagus","Implementasi Fuzzy Mamdani untuk Seleksi Siswa Baru",2013,"Sekol. Tinggi Sains dan Teknol …","academia.edu","http://www.academia.edu/download/38352784/Jurnal.pdf","https://scholar.google.com/scholar?cites=11343558357213802288&as_sdt=2005&sciodt=0,5&hl=en",179,"2019-03-27","PDF","","","",,,,,1,0.17,1,2,6
6,"MFQ Azizi","Perbandingan antara Metode Backpropagation dengan Metode Learning Vector Quantization (LVQ) pada Pengenalan Citra Barcode",2013,"","lib.unnes.ac.id","http://lib.unnes.ac.id/19106/","https://scholar.google.com/scholar?cites=9701231422711846371&as_sdt=2005&sciodt=0,5&hl=en",180,"2019-03-27","","","","",,,,,6,1.00,6,1,6
0,"F ERIZAL","APLIKASI SISTEM PAKAR UNTUK DIAGNOSA AWAL PENYAKIT SISTEM PERNAFASAN BERBASIS WEB",2013,"","repository.uin-suska.ac.id","http://repository.uin-suska.ac.id/3167/","",181,"2019-03-27","","","","",,,,,0,0.00,0,1,6
0,"ISNL Made","SISTEM PAKAR MENDIAGNOSIS KERUSAKAN PADA MOBIL PEUGEOT 206",2013,"SISTEM PAKAR MENDIAGNOSIS …","digilib.esaunggul.ac.id","http://digilib.esaunggul.ac.id/bookmark/204/Pakar","",182,"2019-03-27","","","","",,,,,0,0.00,0,1,6
0,"AP Handoko","Sistem Pakar (Expert System) Troubleshooting Komputer",2013,"Jurnal Ilmiah SINUS","p3m.sinus.ac.id","https://p3m.sinus.ac.id/jurnal/index.php/e-jurnal_SINUS/article/view/114","",183,"2019-03-27","","","","",,,,,0,0.00,0,1,6
0,"M Nunita Sari","SISTEM PAKAR PENDIAGNOSA PENYAKIT KANDUNGAN BERBASIS WEB",2013,"","eprints.unisbank.ac.id","http://eprints.unisbank.ac.id/1421/","",184,"2019-03-27","","","","",,,,,0,0.00,0,1,6
0,"MM Ir I Joko Dewanto","SISTEM PAKAR PENGENALAN GERAKAN PADA SENI BELA DIRI TAEKWONDO",2013,"SISTEM PAKAR PENGENALAN …","digilib.esaunggul.ac.id","http://digilib.esaunggul.ac.id/UEU-Undergraduate-2007-81-098/1275","",185,"2019-03-27","","","","",,,,,0,0.00,0,1,6
0,"R Pamungkas","SISTEM PAKAR DIAGNOSA DINI GANGGUAN PADA SISTEM REPRODUKSI PRIA",,"eprints.dinus.ac.id","","http://eprints.dinus.ac.id/12515/1/jurnal_12554.pdf","",186,"2019-03-27","PDF","","","",,,,,0,0.00,0,1,
0,"BS Putra","PERANCANGA SISTEM PAKAR PENDETEKSI GANGGUAN KEHAMILAN",2013,"Teknika","ejournal.ikado.ac.id","http://ejournal.ikado.ac.id/index.php/teknika/article/view/12","",187,"2019-03-27","","","","",,,,,0,0.00,0,1,6
0,"MD SEPTYAWAN","SISTEM PAKAR PENYAKIT PADA ITIK BERBASIS WEB",2013,"","eprints.unisbank.ac.id","http://eprints.unisbank.ac.id/1748/","",188,"2019-03-27","","","","",,,,,0,0.00,0,1,6
0,"EFI RAHMAYANI","SISTEM PAKAR MENDIAGNOSA PENYAKIT DIARE MENGGUNAKAN METODE TEOREMA BAYES",2013,"","Universitas Potensi Utama","","",189,"2019-03-27","CITATION","","","",,,,,0,0.00,0,1,6
0,"A Pradika Saputra","SISTEM PAKAR PENDIAGNOSA PENYAKIT SYARAF PUSAT",2013,"","eprints.umk.ac.id","http://eprints.umk.ac.id/1845/","",190,"2019-03-27","","","","",,,,,0,0.00,0,1,6
0,"MS Permono","Sistem Pakar Trobleshoting Laptop Berbasis Web",2013,"","eprints.ums.ac.id","http://eprints.ums.ac.id/id/eprint/26485","",191,"2019-03-27","","","","",,,,,0,0.00,0,1,6
0,"MRS Assadad","SISTEM PAKAR DIAGNOSA PENYAKIT TANAMAN JERUK",2013,"","eprints.upnyk.ac.id","http://eprints.upnyk.ac.id/6177/","",192,"2019-03-27","","","","",,,,,0,0.00,0,1,6
0,"NP ASTUTI","SISTEM PAKAR UNTUK MENDETEKSI KERUSAKAN PADA KOMPUTER TABLET",2013,"","eprints.unisbank.ac.id","http://eprints.unisbank.ac.id/1793/","",193,"2019-03-27","","","","",,,,,0,0.00,0,1,6
0,"I BUCHORI","SISTEM PAKAR PENDIAGNOSA KEKURANGAN VITAMIN PADA MANUSIA BERBASIS WEB",2013,"","eprints.unisbank.ac.id","http://eprints.unisbank.ac.id/1476/","",194,"2019-03-27","","","","",,,,,0,0.00,0,1,6
0,"S Fransiska","Sistem Pakar Untuk Mendiagnosa Penyakit Epilepsi",2013,"","eprints.ukmc.ac.id","http://eprints.ukmc.ac.id/701/","",195,"2019-03-27","","","","",,,,,0,0.00,0,1,6
0,"P NINDYA","SISTEM PAKAR UNTUK MENDIAGNOSA GANGGUAN PERKEMBANGAN PADA ANAK BERBASIS WEB",2013,"","UPN"" Veteran"" Yogyakarta","","",196,"2019-03-27","CITATION","","","",,,,,0,0.00,0,1,6
0,"F Prasetyo","SISTEM PAKAR BERBASIS WEB UNTUK MENGETAHUI PENYAKIT PADA IKAN LELE",2013,"","eprints.upnyk.ac.id","http://eprints.upnyk.ac.id/10267/","",197,"2019-03-27","","","","",,,,,0,0.00,0,1,6
0,"RP Indra Mustika, H Chris Timotius K","APLIKASI PERENCANAAN PERHITUNGAN INSTALASI LISTRIK PENERANGAN MENGGUNAKAN SISTEM PAKAR",2013,"electrans","jurnal.upi.edu","http://jurnal.upi.edu/electrans/view/2148/APLIKASI%20%20PERENCANAAN%20PERHITUNGAN%20INSTALASI%20LISTRIK%20PENERANGAN%20MENGGUNAKAN%20SISTEM%20PAKAR","",198,"2019-03-27","","","","",,,,,0,0.00,0,2,6
0,"S NIRMALASARI","SISTEM PAKAR MENDIAGNOSA KERUSAKAN KOMPUTER",2013,"","eprints.umpo.ac.id","http://eprints.umpo.ac.id/553","",199,"2019-03-27","","","","",,,,,0,0.00,0,1,6
0,"P FAJRININGDIAH","SISTEM PAKAR MENDETEKSI PENYAKIT MATA PADA MANUSIA",2013,"","eprints.umpo.ac.id","http://eprints.umpo.ac.id/255","",200,"2019-03-27","","","","",,,,,0,0.00,0,1,6
0,"EY Rahmawati","SISTEM PAKAR BERBASIS WEB UNTUK MENDIAGNOSA KERUSAKAN MOBIL",2013,"","eprints.upnyk.ac.id","http://eprints.upnyk.ac.id/10308/","",201,"2019-03-27","","","","",,,,,0,0.00,0,1,6
0,"AE MIGUNANI","SISTEM PAKAR PENENTU PASAL TINDAK PIDANA KORUPSI BERBASIS WEB",2013,"","UPN"" Vetean"" Yogyakarta","","",202,"2019-03-27","CITATION","","","",,,,,0,0.00,0,1,6
0,"C Fitriati","SISTEM PAKAR PENDIAGNOSA PENYAKIT TULANG PADA ANAK BERBASIS WEB",2013,"","eprints.unisbank.ac.id","http://eprints.unisbank.ac.id/1479/","",203,"2019-03-27","","","","",,,,,0,0.00,0,1,6
0,"AT MULIA","SISTEM PAKAR BERBASIS WEB PENENTUAN JENIS PLANKTONIC FORAMINIFERA",2013,"","eprints.upnyk.ac.id","http://eprints.upnyk.ac.id/9708/","",204,"2019-03-27","","","","",,,,,0,0.00,0,1,6
0,"M Syahputra","Sistem Pakar Deteksi Kerusakan Pada Jaringan LAN Berbasis WEB",2013,"","Universitas Potensi Utama","","",205,"2019-03-27","CITATION","","","",,,,,0,0.00,0,1,6
0,"KR WITARI, IGK GANDHIADI…","SISTEM PAKAR PENDIAGNOSA PENYAKIT MENULAR PADA ANJING",2013,"E-Jurnal …","researchgate.net","https://www.researchgate.net/profile/I_Putu_Eka_N_Kencana2/publication/319060176_SISTEM_PAKAR_PENDIAGNOSA_PENYAKIT_MENULAR_PADA_ANJING/links/5992340a0f7e9b433f414ef4/SISTEM-PAKAR-PENDIAGNOSA-PENYAKIT-MENULAR-PADA-ANJING.pdf","",206,"2019-03-27","PDF","","","",,,,,0,0.00,0,3,6
0,"R Maulany","Pendekatan Metode Certainty Factor dalam Perancangan Sistem Pakar Kerusakan Komputer",2013,"Jurnal Teknologi Informasi dan Komunikasi","jurnal.unai.edu","http://jurnal.unai.edu/index.php/teika/article/view/150","",207,"2019-03-27","","","","",,,,,0,0.00,0,1,6
0,"GSM Rahayu, S Surjono…","Sistem Pakar Batik Yogyakarta Berbasis Web",2013,"Jurnal Nasional Teknik …","ejnteti.jteti.ugm.ac.id","http://ejnteti.jteti.ugm.ac.id/index.php/JNTETI/article/view/98","",208,"2019-03-27","","","","",,,,,0,0.00,0,3,6
0,"O SARI","SISTEM PAKAR DIAGNOSA DAN PENANGGULANGANNYA PENYAKIT TANAMAN KARET",2013,"","repository.atmaluhur.ac.id","http://repository.atmaluhur.ac.id/handle/123456789/853","",209,"2019-03-27","","","","",,,,,0,0.00,0,1,6
0,"AC Saputra","PROTOTIPE SISTEM PAKAR DENGAN METODE VARIABLE CENTERED INTELLIGENT RULE SYSTEM UNTUK MENDIAGNOSA PENYAKIT PADA ANJING",2013,"","etd.repository.ugm.ac.id","http://etd.repository.ugm.ac.id/index.php?mod=penelitian_detail&sub=PenelitianDetail&act=view&typ=html&buku_id=59273","",210,"2019-03-27","","","","",,,,,0,0.00,0,1,6
0,"FF Kurniawan","Aplikasi Sistem Pakar Deteksi Kerusakan Pada Televisi Berwarna Polytron LED Berbasis Web",2013,"","eprints.unisbank.ac.id","http://eprints.unisbank.ac.id/1686/","",211,"2019-03-27","","","","",,,,,0,0.00,0,1,6
0,"P Candra","SISTEM PAKAR UNTUK MENENTUKAN KUALITAS LIMBAH PABRIK TEKSTIL BERBASIS WEB",2013,"","eprints.unisbank.ac.id","http://eprints.unisbank.ac.id/1472/","",212,"2019-03-27","","","","",,,,,0,0.00,0,1,6
0,"D SETIYANI","SISTEM PAKAR DIAGNOSA VIRUS KOMPUTER BERBASIS WEB",2013,"","eprints.unisbank.ac.id","http://eprints.unisbank.ac.id/1795/","",213,"2019-03-27","","","","",,,,,0,0.00,0,1,6
0,"A Muhammad Rif'an Suqid","SISTEM PAKAR DIAGNOSA PENYAKIT TANAMAN JERUK BERBASIS ANDROID",2013,"","UPN"" Veteran"" Yogyakarta","","",214,"2019-03-27","CITATION","","","",,,,,0,0.00,0,1,6
0,"M Setiawan","SISTEM PAKAR UNTUK MENDIAGNOSA PENYAKIT PENCERNAAN MANUSIA DENGAN TEOREMA BAYES",2013,"","eprints.unisbank.ac.id","http://eprints.unisbank.ac.id/1469/","",215,"2019-03-27","","","","",,,,,0,0.00,0,1,6
0,"Z ARIFIN","SISTEM PAKAR UNTUK MENDIAGNOSA KERUSAKAN PADA LAPTOP ACER BERBASIS WEB",2013,"","eprints.unisbank.ac.id","http://eprints.unisbank.ac.id/1427/","",216,"2019-03-27","","","","",,,,,0,0.00,0,1,6
0,"E Gunawan","APLIKASI SISTEM PAKAR DIAGNOSIS DAN PENGENDALIAN PENYAKIT TANAMAN PADI",2013,"","repository.atmaluhur.ac.id","http://repository.atmaluhur.ac.id/handle/123456789/836","",217,"2019-03-27","","","","",,,,,0,0.00,0,1,6
0,"A Anshori","Rancang Bangun Sistem Pakar untuk Mendiagnosa Penyakit Tanaman Cabai dengan Metode Forward Chaining",2013,"","digilib.unila.ac.id","http://digilib.unila.ac.id/14/","",218,"2019-03-27","","","","",,,,,0,0.00,0,1,6
0,"YDI Wardhani","Aplikasi Sistem Pakar Diagnosa Gangguan Sistem Pencernaan Menggunakan Expertise2go",2013,"","","","",219,"2019-03-27","CITATION","","","",,,,,0,0.00,0,1,6
0,"S THENDEAN","Pembuatan Sistem Pakar Untuk Diagnosa Penyakit Kucing Berbasis Web",2013,"","repository.ubaya.ac.id","http://repository.ubaya.ac.id/id/eprint/14299","",220,"2019-03-27","","","","",,,,,0,0.00,0,1,6
0,"P Pratiwi","SISTEM PAKAR UNTUK DIAGNOSA PENYAKIT PADA HEWAN TERNAK KAMBING BERBASIS MOBILE",2013,"","eprints.upnyk.ac.id","http://eprints.upnyk.ac.id/10266/","",221,"2019-03-27","","","","",,,,,0,0.00,0,1,6
0,"MK RAMBUT, YY PUTRA","SISTEM PAKAR UNTUK MENDIAGNOSA PENYAKIT YANG DAPAT",,"repository.amikom.ac.id","","http://repository.amikom.ac.id/files/Publikasi_07.12.2487.pdf","",222,"2019-03-27","PDF","","","",,,,,0,0.00,0,2,
0,"T FEBYANTO","SISTEM PAKAR UNTUK MENDETEKSI KERUSAKAN PADA MOTOR TOSSA BERBASIS WEB",2013,"","eprints.unisbank.ac.id","http://eprints.unisbank.ac.id/1473/","",223,"2019-03-27","","","","",,,,,0,0.00,0,1,6
0,"G Virginia, J Purwadi, TM Kurniasih","IMPLEMENTASI SISTEM PAKAR PADA PEMILIHAN VARIETAS PADI",2013,"Proceedings of KNASTIK","vlabti.ukdw.ac.id","https://vlabti.ukdw.ac.id/ojs/index.php/proceedings/article/view/174","",224,"2019-03-27","","","","",,,,,0,0.00,0,3,6
0,"I YULIANDRINI","PERANCANGAN SISTEM PAKAR UNTUK MENDIAGNOSA SECARA DINI PENYAKIT PADA ANAK BERBASIS WEB",2013,"","eprints.unisbank.ac.id","http://eprints.unisbank.ac.id/1407/","",225,"2019-03-27","","","","",,,,,0,0.00,0,1,6
0,"MPMD MAYA","PERANCANGAN SISTEM PAKAR UNDANG-UNDANG ITE DALAM",,"eprints.dinus.ac.id","","http://eprints.dinus.ac.id/11932/1/jurnal_11650.pdf","",226,"2019-03-27","PDF","","","",,,,,0,0.00,0,1,
0,"R Wijayanti, S Winiarti","Sistem Pakar Mendiagnosa Penyakit pada Buah-buahan Pascapanen",2013,"Jurnal Sarjana Teknik Informatika","neliti.com","https://www.neliti.com/publications/211218/sistem-pakar-mendiagnosa-penyakit-pada-buah-buahan-pascapanen","",227,"2019-03-27","","","","",,,,,0,0.00,0,2,6
0,"A Priliatama","SISTEM PAKAR PENYAKIT DALAM DAN TERAPI PEMIJATAN ACUPRESSURE KAKI BERBASIS WEB",2013,"","eprints.upnyk.ac.id","http://eprints.upnyk.ac.id/9823/","",228,"2019-03-27","","","","",,,,,0,0.00,0,1,6
0,"T Sugiono","Sistem Pakar untuk Mendiagnosa Penyakit Gigi dengan Metode Decision Tree",2013,"","eprints.umk.ac.id","http://eprints.umk.ac.id/1936/","",229,"2019-03-27","","","","",,,,,0,0.00,0,1,6
0,"WR Setiarini","Aplikasi Sistem Pakar Untuk Mendiagnosa Penyakit Paru-paru Dengan Menggunakan Tools Expertise2go",2013,"","","","",230,"2019-03-27","CITATION","","","",,,,,0,0.00,0,1,6
0,"A Efiyanti","Sistem Pakar Pendektesi Penyakit Kanker Menggunakan Metode Demster Shafer",2013,"","publikasiilmiah.ums.ac.id","https://publikasiilmiah.ums.ac.id/xmlui/handle/11617/4101","",231,"2019-03-27","","","","",,,,,0,0.00,0,1,6
0,"I Gunawan","APLIKASI SISTEM PAKAR DIAGNOSA GANGGUAN KEJIWAAN",2013,"","repository.atmaluhur.ac.id","http://repository.atmaluhur.ac.id/handle/123456789/815","",232,"2019-03-27","","","","",,,,,0,0.00,0,1,6
0,"R Muhriyana, Y Burhanuddin…","Aplikasi Rencana Pemotongan Plat Menggunakan Sistem Pakar",2013,"Jurnal Ilmiah Teknik …","journal.eng.unila.ac.id","http://journal.eng.unila.ac.id/index.php/fema/article/view/47","",233,"2019-03-27","","","","",,,,,0,0.00,0,3,6
0,"D Anggraeni","Sistem pakar diagnosa kerusakan pada printer dengan menggunakan metode Certainty Factor Pararel",2013,"","digilib.uinsgd.ac.id","http://digilib.uinsgd.ac.id/6177/","",234,"2019-03-27","","","","",,,,,0,0.00,0,1,6
0,"NASP Witanto","SISTEM PAKAR BERBASIS WEB UNTUK MENDIAGNOSA PENYAKIT PADA HEWAN HAMSTER",2013,"","eprints.upnyk.ac.id","http://eprints.upnyk.ac.id/6179/","",235,"2019-03-27","","","","",,,,,0,0.00,0,1,6
0,"M Yazdi, GF Handono","Sistem Pakar Fuzzy Penentuan Kualitas Kakao",2013,"Jurnal Nasional Pendidikan Teknik …","ejournal.undiksha.ac.id","http://ejournal.undiksha.ac.id/index.php/janapati/article/view/9798","",236,"2019-03-27","","","","",,,,,0,0.00,0,2,6
0,"V Khoiriah","SISTEM PAKAR MENGGUNAKAN CERTAINTY FACTOR UNTUK DIAGNOSA STADIUM PENYAKIT KANKER SERVIKS",2013,"","eprints.upnyk.ac.id","http://eprints.upnyk.ac.id/9753/","",237,"2019-03-27","","","","",,,,,0,0.00,0,1,6
