Cites,Authors,Title,Year,Source,Publisher,ArticleURL,CitesURL,GSRank,QueryDate,Type,DOI,ISSN,CitationURL,Volume,Issue,StartPage,EndPage,ECC,CitesPerYear,CitesPerAuthor,AuthorCount,Age
1,"SL Munajati, R Anadra, A Aprianto","Penentuan Sentra Peta di Wilayah Jakarta dengan Menggunakan Sistem Informasi Geografis",2010,"MAJALAH ILMIAH GLOBE","jurnal.big.go.id","http://jurnal.big.go.id/index.php/GL/article/view/118","https://scholar.google.com/scholar?cites=7553392604468287362&as_sdt=2005&sciodt=0,5&hl=en",439,"2019-03-23","","","","",,,,,1,0.11,0,3,9
1,"N Rina","Evaluasi Efektifitas Sistem Informasi Akuntansi Pendapatan Pada PT. PLN (Persero) Wilayah Sumatera Utara Cabang Medan",2010,"","repository.usu.ac.id","http://repository.usu.ac.id/handle/123456789/18556","https://scholar.google.com/scholar?cites=16254756592319550124&as_sdt=2005&sciodt=0,5&hl=en",440,"2019-03-23","","","","",,,,,1,0.11,1,1,9
2,"F Hartono","Analisis dan Perancangan Sistem Informasi Akuntansi Persediaan Terkomputerisasi di Toko Slamet Yogyakarta",2010,"","e-journal.uajy.ac.id","http://e-journal.uajy.ac.id/3084/","https://scholar.google.com/scholar?cites=4462655517498133450&as_sdt=2005&sciodt=0,5&hl=en",441,"2019-03-23","","","","",,,,,2,0.22,2,1,9
2,"BFP Setyawan, T Pitana, D Priyanta","… Laut di Daerah Shore Line Selat Madura dengan Menggunakan Data Automatic Identification System (AIS) dan Sistem Informasi Geografis (SIG).[serial …",2010,"","Tugas Akhir, Jurusan Teknik Sistem …","","https://scholar.google.com/scholar?cites=10280576962013366772&as_sdt=2005&sciodt=0,5&hl=en",442,"2019-03-23","CITATION","","","",,,,,2,0.22,1,3,9
1,"L Aufan","Pemanfaatan Framework Codeigniter dalam Pengembangan Sistem Informasi Pendataan Laporan Kerja Praktek Mahasiswa Program Studi Teknik Informatika …",2010,"JUITA: Jurnal Informatika","jurnalnasional.ump.ac.id","http://jurnalnasional.ump.ac.id/index.php/JUITA/article/view/413/409","https://scholar.google.com/scholar?cites=11702031319103136059&as_sdt=2005&sciodt=0,5&hl=en",443,"2019-03-23","PDF","","","",,,,,1,0.11,1,1,9
1,"R Wijaya","Evaluasi Sistem Informasi Akuntansi Fungsi Penggajian Dalam Rangka Meningkatkan Kualitas Pelayanan Pada Rumah Sakit Islam Malang",2010,"","eprints.umm.ac.id","http://eprints.umm.ac.id/525/1/Evaluasi_Sistem_Informasi_Akuntansi_Fungsi_Penggajian_Dalam_Rangka_Meningkatkan_Kualitas_Pelayanan_Pada_Rumah_Sakit_Islam_Malang.pdf","https://scholar.google.com/scholar?cites=5440929437903951788&as_sdt=2005&sciodt=0,5&hl=en",444,"2019-03-23","","","","",,,,,1,0.11,1,1,9
2,"M Dewi","Applying a respecification of the Delone and Mclean's model to measure the success of Accounting Information System in Sragen",2010,"","eprints.uns.ac.id","https://eprints.uns.ac.id/6256/","https://scholar.google.com/scholar?cites=7286777118523232080&as_sdt=2005&sciodt=0,5&hl=en",445,"2019-03-23","","","","",,,,,2,0.22,2,1,9
1,"I Indarto, F Usman","Desain Fitur dan Implementasi Sistem Informasi Daerah Irigasi (Studi Kasus: Daerah Irigasi Sampean Baru)",2010,"Media Teknik Sipil","media.sipil.ft.uns.ac.id","http://media.sipil.ft.uns.ac.id/index.php/mts/article/download/89/85","https://scholar.google.com/scholar?cites=13705669403133965983&as_sdt=2005&sciodt=0,5&hl=en",446,"2019-03-23","PDF","","","",,,,,1,0.11,1,2,9
1,"HN Andriati","Peranan Sistem Informasi Dalam Menciptakan Keunggulan Daya Saing Melalui Transmigrasi Teknologi",2010,"Jurnal Akuntansi Maranatha","journal.maranatha.edu","https://journal.maranatha.edu/index.php/jam/article/view/269","https://scholar.google.com/scholar?cites=18378826674894784510&as_sdt=2005&sciodt=0,5&hl=en",447,"2019-03-23","","","","",,,,,1,0.11,1,1,9
1,"E Herlina","Evaluasi Kebijakan Sistem Informasi Manajemen Pengujian Kendaraan Bermotor (SIM PKB) Di Kota Cimahi",2010,"","repository.unikom.ac.id","https://repository.unikom.ac.id/id/eprint/7419","https://scholar.google.com/scholar?cites=11493751180467116346&as_sdt=2005&sciodt=0,5&hl=en",448,"2019-03-23","","","","",,,,,1,0.11,1,1,9
1,"M Arifin, RC Pratama","Perancangan Sistem Informasi Prediksi Pemesanan Stok Alat-alat Musik Pada CV Graha Music & Lighting",2010,"Jurnal Fakultas Hukum UII","neliti.com","https://www.neliti.com/publications/88467/perancangan-sistem-informasi-prediksi-pemesanan-stok-alat-alat-musik-pada-cv-gra","https://scholar.google.com/scholar?cites=9186169197032500907&as_sdt=2005&sciodt=0,5&hl=en",449,"2019-03-23","","","","",,,,,1,0.11,1,2,9
1,"S Nugroho","Sistem informasi peringatan dini dan peramalan penderita demam berdarah di Surakarta",2010,"","eprints.uns.ac.id","https://eprints.uns.ac.id/5343/","https://scholar.google.com/scholar?cites=237485224429165449&as_sdt=2005&sciodt=0,5&hl=en",450,"2019-03-23","","","","",,,,,1,0.11,1,1,9
1,"B Rizaldi, DD Bhakti","Sistem Informasi Berbasis Web Tentang Ujian Online Pada Smpn 16 Cirebon",2010,"JURNAL ICT","stmik-ikmi-cirebon.net","http://stmik-ikmi-cirebon.net/e-journal/index.php/JICT/article/view/15","https://scholar.google.com/scholar?cites=15792494442315191596&as_sdt=2005&sciodt=0,5&hl=en",451,"2019-03-23","","","","",,,,,1,0.11,1,2,9
2,"A Tia","Tinjauan Atas Pengembangan Sistem Informasi Akutansi Persediaan Barang Dagang Pada Misyelle Group Bandung",2010,"","elib.unikom.ac.id","http://elib.unikom.ac.id/download.php?id=76664","https://scholar.google.com/scholar?cites=8616093546048818175&as_sdt=2005&sciodt=0,5&hl=en",452,"2019-03-23","CITATION","","","",,,,,2,0.22,2,1,9
1,"Z Mubarok","Sistem informasi spasial potensi perikanan Kabupaten Cirebon berbasis Web",2010,"","repository.uinjkt.ac.id","http://repository.uinjkt.ac.id/dspace/handle/123456789/21270","https://scholar.google.com/scholar?cites=2971597518712263290&as_sdt=2005&sciodt=0,5&hl=en",453,"2019-03-23","","","","",,,,,1,0.11,1,1,9
3,"R Noveandini, MS Wulandari","Pemanfaatan Media Pembelajaran Secara Online (E-learning) Bagi Wanita Karir Dalam Upaya Meningkatkan Efektivitas Dan Fleksibilitas Pemantauan …",2010,"Jurnal Fakultas …","files.novilestari.webnode.com","http://files.novilestari.webnode.com/200000152-9484d95882/PEMANFAATAN%20MEDIA%20PEMBELAJARAN%20SECARA%20ONLINE%20(E-LEARNING)%20BAGI%20WANITA%20KARIR%20DALAM%20UPAYA%20MENINGKATKAN%20EFEKTIVITAS%20DAN%20FLEKSIBILITAS%20PEMANTAUAN%20KEGIATAN%20BELAJAR%20ANAK%20SISWAI%20SEKOLAH%20DASAR.pdf","https://scholar.google.com/scholar?cites=3169096534922664081&as_sdt=2005&sciodt=0,5&hl=en",454,"2019-03-23","PDF","","","",,,,,3,0.33,2,2,9
1,"RW Hidayat","Sistem Informasi Manajemen Berbasis Client Server di CV. Defourdelta",2010,"","elib.unikom.ac.id","http://elib.unikom.ac.id/download.php?id=85124","https://scholar.google.com/scholar?cites=18377896974709424092&as_sdt=2005&sciodt=0,5&hl=en",455,"2019-03-23","PDF","","","",,,,,1,0.11,1,1,9
1,"S Sitorus","Sistem Informasi Berbasis Web Pada Sekolah SMA Islam Azizi Menggunakan Php Dan MySql",2010,"","repository.usu.ac.id","http://repository.usu.ac.id/handle/123456789/20023","https://scholar.google.com/scholar?cites=11462659303095387636&as_sdt=2005&sciodt=0,5&hl=en",456,"2019-03-23","","","","",,,,,1,0.11,1,1,9
1,"CA Fathia","Sistem Informasi Rekam Medis Sebagai Upaya Untuk Meningkatkan Pelayanan Di Puskesmas Rancaekek",2010,"","elib.unikom.ac.id","http://elib.unikom.ac.id/files/disk1/691/jbptunikompp-gdl-cyfaagniaf-34504-10-unikom_c-l.pdf","https://scholar.google.com/scholar?cites=3918286019117062205&as_sdt=2005&sciodt=0,5&hl=en",457,"2019-03-23","PDF","","","",,,,,1,0.11,1,1,9
2,"VE Nurwijayanti","Analisis Dan Perancangan Sistem Informasi Penjualan Pada Body And Soul Clothing Di Ambarukmo Plaza Yogyakarta",2010,"Naskah Publikasi, Jurusan Informasi Amikom …","","","https://scholar.google.com/scholar?cites=926556905610576567&as_sdt=2005&sciodt=0,5&hl=en",458,"2019-03-23","CITATION","","","",,,,,2,0.22,2,1,9
2,"M Tompira","Perancangan Sistem Informasi Manajemen Gereja (Studi Kasus di Gereja Kristen Indonesia Salatiga)",2010,"","Fakultas Teknologi Informasi …","","https://scholar.google.com/scholar?cites=10160617036018461198&as_sdt=2005&sciodt=0,5&hl=en",459,"2019-03-23","CITATION","","","",,,,,2,0.22,2,1,9
2,"DJP Tinggi","Pedoman Praktik Baik Sistem Informasi",2010,"KP Nasional, Sistem Penjaminan Mutu Perguruan …","","","https://scholar.google.com/scholar?cites=15043243341268443815&as_sdt=2005&sciodt=0,5&hl=en",460,"2019-03-23","CITATION","","","",,,,,2,0.22,2,1,9
2,"K Graviardhi","Sistem Informasi Fitness Center Hotel Ciputra Semarang",2010,"… Seminar Nasional Aplikasi Teknologi Informasi (SNATI …","","","https://scholar.google.com/scholar?cites=4368222495712799251&as_sdt=2005&sciodt=0,5&hl=en",461,"2019-03-23","CITATION","","","",,,,,2,0.22,2,1,9
1,"HA Ali, S Endah, S Edi, RA Ridla","Desain dan Implementasi Jejaring Sensor Nirkabel Inframerah untuk Sistem Informasi Parkir Gedung Bertingkat",2010,"Emitter","repo.pens.ac.id","http://repo.pens.ac.id/197/","https://scholar.google.com/scholar?cites=5450118598190076971&as_sdt=2005&sciodt=0,5&hl=en",462,"2019-03-23","","","","",,,,,1,0.11,0,4,9
2,"G Lusiana","Perancangan dan implementasi sistem informasi akademik berbasis web dengan teknologi model view controller dan ajax (studi kasus: fakultas teknologi …",2010,"Salatiga: Perpustakaan Universitas Kristen Satya …","","","https://scholar.google.com/scholar?cites=12095211197035820920&as_sdt=2005&sciodt=0,5&hl=en",463,"2019-03-23","CITATION","","","",,,,,2,0.22,2,1,9
2,"FA Pardede, S Warnars","Pemanfaatan Teknologi Sistem Informasi Geografis Untuk Menunjang Pembangunan Daerah, Indonesia: Fakultas Teknologi Informasi",2010,"Universitas Budi Luhur","","","https://scholar.google.com/scholar?cites=7965631941872668963&as_sdt=2005&sciodt=0,5&hl=en",464,"2019-03-23","CITATION","","","",,,,,2,0.22,1,2,9
2,"J Tambotoh","Penerapan Kajian Kelayakan Finansial untuk Meningkatkan Tingkat Kematangan Manajemen Investasi Sistem Informasi/Teknologi Informasi Studi Kasus …",2010,"","Tesis","","https://scholar.google.com/scholar?cites=8605316872093850741&as_sdt=2005&sciodt=0,5&hl=en",465,"2019-03-23","CITATION","","","",,,,,2,0.22,2,1,9
2,"A Rahmawati","Pengaruh Sistem Informasi Akuntansi terhadap Kualitas Informasi Laporan Keuangan Daerah",2010,"","Skripsi Fakultas Ekonomi …","","https://scholar.google.com/scholar?cites=268737333830922312&as_sdt=2005&sciodt=0,5&hl=en",466,"2019-03-23","CITATION","","","",,,,,2,0.22,2,1,9
2,"M Arifin, A Rudyanto","Perancangan Sistem Informasi Penjadwalan Produksi Paving Block Pada CV. Eko Joyo. Seminar Nasional Aplikasi Teknologi Informasi 2010 (SNATI …",2010,"","Yogyakarta","","https://scholar.google.com/scholar?cites=2060655290604185516&as_sdt=2005&sciodt=0,5&hl=en",467,"2019-03-23","CITATION","","","",,,,,2,0.22,1,2,9
2,"HB Wibowo","Rancang Bangun Sistem Monitoring Perkuliahan dengan Metode Pembelajaran Student Centered Learning (SCL) di Jurusan Sistem Informasi ITS",2010,"","Surabaya: Institut Teknologi Sepuluh …","","https://scholar.google.com/scholar?cites=12644808623943219973&as_sdt=2005&sciodt=0,5&hl=en",468,"2019-03-23","CITATION","","","",,,,,2,0.22,2,1,9
1,"IB Raharjo","Sistem informasi tagihan listrik PLN menggunakan sms gateway dengan php dan mysql",2010,"","eprints.uns.ac.id","https://eprints.uns.ac.id/10756/","https://scholar.google.com/scholar?cites=12550896172773254149&as_sdt=2005&sciodt=0,5&hl=en",469,"2019-03-23","","","","",,,,,1,0.11,1,1,9
1,"AS Nur, P Okkie","Investigasi dan Analisa Coverage Area Pemancar CDMA di Daerah Surabaya dengan Sistem Informasi Geografis (SIG)",2010,"Emitter","repo.pens.ac.id","http://repo.pens.ac.id/id/eprint/203","https://scholar.google.com/scholar?cites=2094198533346735113&as_sdt=2005&sciodt=0,5&hl=en",470,"2019-03-23","","","","",,,,,1,0.11,1,2,9
3,"C Salubongga","PEMBANGUNAN APLIKASI BERBASIS WEB UNTUK EVALUASI KINERJA DOSEN PADA PROSES BELAJAR DAN MENGAJAR DI UNIVERSITAS ATMA JAYA …",2010,"","e-journal.uajy.ac.id","http://e-journal.uajy.ac.id/3364/","https://scholar.google.com/scholar?cites=18327553709420357134&as_sdt=2005&sciodt=0,5&hl=en",471,"2019-03-23","","","","",,,,,3,0.33,3,1,9
1,"S Nur","Analisis dan perancangan sistem informasi manajemen penyewaan mobil pada Avis Indonesia",2010,"","repository.uinjkt.ac.id","http://repository.uinjkt.ac.id/dspace/handle/123456789/4945","https://scholar.google.com/scholar?cites=11487577093566336716&as_sdt=2005&sciodt=0,5&hl=en",472,"2019-03-23","","","","",,,,,1,0.11,1,1,9
1,"I Kurniawan","Sistem Informasi Geografis Berbasis Web Sebagai Penentu Shortest Path Dengan Menggunakan Algoritma Dijkstra",2010,"Skripsi. Universitas Sumatera Utara","academia.edu","http://www.academia.edu/download/34234243/djistra.pdf","https://scholar.google.com/scholar?cites=2935739908707260708&as_sdt=2005&sciodt=0,5&hl=en",473,"2019-03-23","PDF","","","",,,,,1,0.11,1,1,9
1,"AD Anggraeni","EVALUASI SISTEM INFORMASI MANAJEMEN KESEHATAN IBU DAN ANAK (SIM KIA) DI PUSKESMAS WILAYAH KERJA DINAS KESEHATAN KOTA SEMARANG …",2010,"","eprints.undip.ac.id","http://eprints.undip.ac.id/38341/","https://scholar.google.com/scholar?cites=15524846887231304827&as_sdt=2005&sciodt=0,5&hl=en",474,"2019-03-23","","","","",,,,,1,0.11,1,1,9
1,"FD Astuti","Sistem Informasi Pembayaran Siswa Berbasis Framework Cake PHP Studi Kasus pada Sekolah Dasar Hang Tuah 10 Siduarjo",2010,"","core.ac.uk","https://core.ac.uk/download/pdf/12217365.pdf","https://scholar.google.com/scholar?cites=6010352837383496418&as_sdt=2005&sciodt=0,5&hl=en",475,"2019-03-23","PDF","","","",,,,,1,0.11,1,1,9
12,"D Suparto, WS Sigit, W Setiady","Business intelligence: konsep dan metode",2010,"Jurnal CommIT","eprints2.binus.ac.id","http://eprints2.binus.ac.id/25618/1/9%20business%20intellegence.konsep%20dan%20metode.pdf","https://scholar.google.com/scholar?cites=12924786038644465334&as_sdt=2005&sciodt=0,5&hl=en",476,"2019-03-23","PDF","","","",,,,,12,1.33,4,3,9
1,"A Yani","PENGEMBANGAN MODEL SISTEM INFORMASI GEOGRAFIS (SIG) UNTUK PENGELOLAAN PENDIDIKAN DALAM ERA OTONOMI DAERAH (Studi Pengembangan …",2010,"penelitian-pendidikan","jurnal.upi.edu","http://jurnal.upi.edu/penelitian-pendidikan/view/1799/PENGEMBANGAN%20MODEL%20SISTEM%20INFORMASI%20GEOGRAFIS%20(SIG)%20UNTUK%20PENGELOLAAN%20PENDIDIKAN%20DALAM%20ERA%20OTONOMI%20DAERAH%20(Studi%20Pengembangan%20di%20Kabupaten%20Sukabumi)","https://scholar.google.com/scholar?cites=5223162174889938733&as_sdt=2005&sciodt=0,5&hl=en",477,"2019-03-23","","","","",,,,,1,0.11,1,1,9
1,"E Maria","Analisis Kelayakan Proyek Pengembangan Sistem Informasi Manajemen Menggunakan Metode Cost and Benefits Analysis (Studi Kasus: Sebuah Distributor di …",2010,"","repository.uksw.edu","http://repository.uksw.edu/handle/123456789/51","https://scholar.google.com/scholar?cites=10417854650055729302&as_sdt=2005&sciodt=0,5&hl=en",478,"2019-03-23","","","","",,,,,1,0.11,1,1,9
2,"I Mangatur","Sistem Informasi Geografi dan Penerapannya dalam Bidang HPT",2010,"Universitas Padjadjaran, Jatinangor","","","https://scholar.google.com/scholar?cites=4926313736042267957&as_sdt=2005&sciodt=0,5&hl=en",479,"2019-03-23","CITATION","","","",,,,,2,0.22,2,1,9
2,"I Calculus","Pemanfaatan Sistem Informasi Pada Perseroan Terbatas Pertamina Unit Pemasaran VII Makassar",2010,"Universitas Hasanuddin: Makassar","","","https://scholar.google.com/scholar?cites=2882081359540527832&as_sdt=2005&sciodt=0,5&hl=en",480,"2019-03-23","CITATION","","","",,,,,2,0.22,2,1,9
2,"D Pramana","Sistem Informasi Karya Akademik Mahasiswa Berbasis Web",2010,"Laporan Tugas Akhir pada Jurusan Manajemen …","","","https://scholar.google.com/scholar?cites=16078241193986050231&as_sdt=2005&sciodt=0,5&hl=en",481,"2019-03-23","CITATION","","","",,,,,2,0.22,2,1,9
2,"I Dinata","Tugas Akhir Sistem Informasi Geografis Perguruan Tinggi Swasta Kota Padang Berbasis Web",2010,"","ITP","","https://scholar.google.com/scholar?cites=10212494415293690543&as_sdt=2005&sciodt=0,5&hl=en",482,"2019-03-23","CITATION","","","",,,,,2,0.22,2,1,9
2,"PA Lestari","Faktor-faktor yang mempengaruhi kinerja Sistem Informasi Akuntansi pada Lembaga Perkreditan Desa di Kota Denpasar",2010,"Jurnal Ipteks New Media","","","https://scholar.google.com/scholar?cites=16286989532470996312&as_sdt=2005&sciodt=0,5&hl=en",483,"2019-03-23","CITATION","","","",,,,,2,0.22,2,1,9
2,"GGS Bagja","Membangun Sistem Informasi Kesehatan Puskesmas Cibaregbeg",2010,"","Univ. Komp. Indonesia","","https://scholar.google.com/scholar?cites=12174265889345047439&as_sdt=2005&sciodt=0,5&hl=en",484,"2019-03-23","CITATION","","","",,,,,2,0.22,2,1,9
2,"M Zulkarnain","Analisis Sistem Informasi Akuntansi Penjualan pada PT. Mutifa-Industri Farmasi Medan",2010,"","Skripsi Fakultas Ekonomi …","","https://scholar.google.com/scholar?cites=2210254969080828903&as_sdt=2005&sciodt=0,5&hl=en",485,"2019-03-23","CITATION","","","",,,,,2,0.22,2,1,9
2,"R Fahmi","Pengaruh Kuntabilitas, Independensi, dan Pengalaman Auditor Terhadapa Kualitas Audit pada Klien yang Menerapkan Sistem Informasi Berbasis …",2010,"Universitas Negeri Islam Syarif Hidayatullah. Skripsi …","","","https://scholar.google.com/scholar?cites=8571275278776031669&as_sdt=2005&sciodt=0,5&hl=en",486,"2019-03-23","CITATION","","","",,,,,2,0.22,2,1,9
2,"MA Violetta","Pengembangan Sistem Informasi Akademik SMA Kolombo Sleman",2010,"Naskah publikasi STIMIK AMIKOM Yogyakarta","","","https://scholar.google.com/scholar?cites=13033366516839729796&as_sdt=2005&sciodt=0,5&hl=en",487,"2019-03-23","CITATION","","","",,,,,2,0.22,2,1,9
2,"AA Nugroho","Sistem Informasi Pemesanan Penggunaan Lapangan Futsal Berbasis Web",2010,"Universitas Diponegoro: Semarang","","","https://scholar.google.com/scholar?cites=2028263379309420124&as_sdt=2005&sciodt=0,5&hl=en",488,"2019-03-23","CITATION","","","",,,,,2,0.22,2,1,9
2,"B Eko","Sistem Informasi Geografis dengan ArcView SIG",2010,"Yogyakarta: Penerbit Andi","","","https://scholar.google.com/scholar?cites=11561293259618314207&as_sdt=2005&sciodt=0,5&hl=en",489,"2019-03-23","CITATION","","","",,,,,2,0.22,2,1,9
2,"Y Candra, C Hermawan","Studi analisis kebutuhan dan pemetaan hutan kota di Kota Bekasi berbasis sistem informasi geografis",2010,"","Tugas Akhir, Program Studi …","","https://scholar.google.com/scholar?cites=7780013934972831978&as_sdt=2005&sciodt=0,5&hl=en",490,"2019-03-23","CITATION","","","",,,,,2,0.22,1,2,9
2,"RP Stanley","Perancangan dan pembuatan sistem informasi administrasi dan perhitungan hpp berbasis web untuk cabang dan pusat ud duta mulia.(Skripsi No …",2010,"Unpublished undergraduate thesis, Universitas Kristen …","","","https://scholar.google.com/scholar?cites=1104407422842208204&as_sdt=2005&sciodt=0,5&hl=en",491,"2019-03-23","CITATION","","","",,,,,2,0.22,2,1,9
2,"R Medyanto","Audit Sistem Informasi dengan menggunakan COBIT (Control Objective for Information and Related Technology)",2010,"","Skripsi SI Universitas Bina …","","https://scholar.google.com/scholar?cites=1792044288466236896&as_sdt=2005&sciodt=0,5&hl=en",492,"2019-03-23","CITATION","","","",,,,,2,0.22,2,1,9
2,"A Birtha, M Soemantri, F Abdian","Aplikasi Sistem Informasi Persediaan Barang pada Perusahaan Export Hasil Laut Berbasis Web",2010,"Transmisi","","","https://scholar.google.com/scholar?cites=3326001676576266536&as_sdt=2005&sciodt=0,5&hl=en",493,"2019-03-23","CITATION","","","",,,,,2,0.22,1,3,9
2,"AS Anggoro","Pemanfaatan Teknologi Pengindraan Jauh dan Sistem Informasi Geografis untuk Pendugaan Potensi Peresapan Air Das Wedi di Kabupaten Klaten …",2010,"","Tesis","","https://scholar.google.com/scholar?cites=7325634896661914418&as_sdt=2005&sciodt=0,5&hl=en",494,"2019-03-23","CITATION","","","",,,,,2,0.22,2,1,9
2,"D Palupirini","Konsep Dasar Sistem Informasi",2010,"Universitas Sriwijaya, Palembang","","","https://scholar.google.com/scholar?cites=5499736783216013429&as_sdt=2005&sciodt=0,5&hl=en",495,"2019-03-23","CITATION","","","",,,,,2,0.22,2,1,9
2,"P Rangsang, KP Adhitia","Pemanfaatan Teknologi SMS Gateway dan Metode Forward Chaining Pada Sistem Informasi Bimbingan dan Konseling (Studi Kasus SMAK ST Thomas …",2010,"","SNASTI","","https://scholar.google.com/scholar?cites=18063911258249473132&as_sdt=2005&sciodt=0,5&hl=en",496,"2019-03-23","CITATION","","","",,,,,2,0.22,1,2,9
2,"E Prashta","Sistem Informasi Geografis: Konsep-konsep dasar",2010,"","Bandung, Informatika","","https://scholar.google.com/scholar?cites=2398013751294851385&as_sdt=2005&sciodt=0,5&hl=en",497,"2019-03-23","CITATION","","","",,,,,2,0.22,2,1,9
2,"Z Manurung","Analisis Penerapan Sistem Informasi Akuntansi Penjualan pada PT. Mutifa Industri",2010,"","Skripsi UMM","","https://scholar.google.com/scholar?cites=15989390364540898822&as_sdt=2005&sciodt=0,5&hl=en",498,"2019-03-23","CITATION","","","",,,,,2,0.22,2,1,9
2,"M Subair","Perancangan Sistem Informasi Presensi Berbasis Sidik Jari Kehadiran Mahasiswa STMIK AMIKOM",2010,"Yogyakarta: STMIK AMIKOM","","","https://scholar.google.com/scholar?cites=12802208985172730159&as_sdt=2005&sciodt=0,5&hl=en",499,"2019-03-23","CITATION","","","",,,,,2,0.22,2,1,9
2,"SIG Tim, PT Geomatik-Konsultan","Modul pelatihan sistem informasi geografis ArcGIS",2010,"Makassar: PT Geomatik Konsultan","","","https://scholar.google.com/scholar?cites=2397366126249876802&as_sdt=2005&sciodt=0,5&hl=en",500,"2019-03-23","CITATION","","","",,,,,2,0.22,1,2,9
2,"F Kemal","Sistem Informasi Simpan Pinjam Di Koperasi Karyawan Pusat Perencanaan dan Pengembangan Perumka “DINAMIKO” PT",2010,"Kereta Api Indonesia (Persero), Bandung","","","https://scholar.google.com/scholar?cites=7617603870545118300&as_sdt=2005&sciodt=0,5&hl=en",501,"2019-03-23","CITATION","","","",,,,,2,0.22,2,1,9
2,"T Arifin, SN Amri","Integrasi sistem informasi geografis dan analytic hierarchy process dalam penentuan zonasi pengembangan kawasan pesisir Teluk Bungus",2010,"J. Segara","","","https://scholar.google.com/scholar?cites=6631936565814466197&as_sdt=2005&sciodt=0,5&hl=en",502,"2019-03-23","CITATION","","","",,,,,2,0.22,1,2,9
2,"B Windhya","Aplikasi inventaris kantor pada seketariat daerah provinsi Kalimantan Selatan, program studi sistem informasi",2010,"Sekolah Tinggi Manajemen Informatika dan Komputer …","","","https://scholar.google.com/scholar?cites=13425177009514986804&as_sdt=2005&sciodt=0,5&hl=en",503,"2019-03-23","CITATION","","","",,,,,2,0.22,2,1,9
2,"Y Sugiarti","Metodologi Penelitian di Bidang Sistem Informasi dan Komputer",2010,"Buku Ajar Dikmenti Banten","","","https://scholar.google.com/scholar?cites=16857753398436340171&as_sdt=2005&sciodt=0,5&hl=en",504,"2019-03-23","CITATION","","","",,,,,2,0.22,2,1,9
2,"GH Bodnar, WS Hopwood","Sistem Informasi Akuntansi. Edisi 10",2010,"","Yogyakarta: Penerbit Andi","","https://scholar.google.com/scholar?cites=2463688740956655877&as_sdt=2005&sciodt=0,5&hl=en",505,"2019-03-23","CITATION","","","",,,,,2,0.22,1,2,9
2,"N Susanti","Buku Panduan Skripsi Sistem Informasi",2010,"Fakultas Teknik, Universitas Muria Kudus, Kudus","","","https://scholar.google.com/scholar?cites=9735914769485579788&as_sdt=2005&sciodt=0,5&hl=en",506,"2019-03-23","CITATION","","","",,,,,2,0.22,2,1,9
2,"DL Saputri","Knowledge Management Bagi Sistem Informasi Perpustakaan Universitas Gadjah Mada",2010,"Jakarta: Binus University","","","https://scholar.google.com/scholar?cites=15876186713782024891&as_sdt=2005&sciodt=0,5&hl=en",507,"2019-03-23","CITATION","","","",,,,,2,0.22,2,1,9
2,"D Sugandi, NT Sugito","Urgensi Sistem Informasi Geografis (SIG) untuk Mendukung Data Geospasial",2010,"Jurusan Pendidikan Geografi. Universitas Pendidikan …","","","https://scholar.google.com/scholar?cites=8586273511875916489&as_sdt=2005&sciodt=0,5&hl=en",508,"2019-03-23","CITATION","","","",,,,,2,0.22,1,2,9
2,"A Kurniadi","PSIK X (Analisa dan Perancangan Sistem Informasi). Semarang",2010,"","Tidak dipublikasikan","","https://scholar.google.com/scholar?cites=18296184675321653484&as_sdt=2005&sciodt=0,5&hl=en",509,"2019-03-23","CITATION","","","",,,,,2,0.22,2,1,9
2,"E Nugraha","Penerapan Sistem Informasi Akuntansi Persediaan dalam Menunjang Efektivitas Pengendalian Persediaan Barang Dagang CV",2010,"Techo, skripsi, Universitas Siliwangi","","","https://scholar.google.com/scholar?cites=17135445282293291249&as_sdt=2005&sciodt=0,5&hl=en",510,"2019-03-23","CITATION","","","",,,,,2,0.22,2,1,9
2,"HH Risnandar","Analisis Sistem Informasi Akuntansi Pemberian Kredit Kepemilikan Rumah pada PT. Bank Tabungan Negara (Persero) Kantor Cabang Bekasi",2010,"","Skripsi Ekonomi. Program Sarjana …","","https://scholar.google.com/scholar?cites=7231592139038976488&as_sdt=2005&sciodt=0,5&hl=en",511,"2019-03-23","CITATION","","","",,,,,2,0.22,2,1,9
2,"FE Said","Analisis Sistem Informasi Diagram Alir Data (DFD)/Data Flow Diagram",2010,"","","","https://scholar.google.com/scholar?cites=6542036539836430774&as_sdt=2005&sciodt=0,5&hl=en",512,"2019-03-23","CITATION","","","",,,,,2,0.22,2,1,9
2,"A Akhmadi","Upaya Peningkatan Efektifitas Pengelolaan Barang Persediaan di Gresik Setting Computer melalui Desain Sistem Informasi Manajemen Persediaan",2010,"Skipsi Sarjana Universitas Telkom. Bandung","","","https://scholar.google.com/scholar?cites=18217440775034069060&as_sdt=2005&sciodt=0,5&hl=en",513,"2019-03-23","CITATION","","","",,,,,2,0.22,2,1,9
2,"D Mahyuzir Tavri","Analisa Sistem Informasi",2010,"","Jakarta: PT. Elex Media …","","https://scholar.google.com/scholar?cites=9469710901475834014&as_sdt=2005&sciodt=0,5&hl=en",514,"2019-03-23","CITATION","","","",,,,,2,0.22,2,1,9
2,"M Soleh","Perancangan Sistem Informasi Pengajuan Kenaikan Pangkat dan Jabatan Dosen PNS dan Kenaikan Gaji Berkala di SBM (Sekolah Bisnis dan …",2010,"Skripsi. UNIKOM","","","https://scholar.google.com/scholar?cites=13037153566950995469&as_sdt=2005&sciodt=0,5&hl=en",515,"2019-03-23","CITATION","","","",,,,,2,0.22,2,1,9
2,"NH Agustiani","Pengaruh Sistem Informasi Akademik Terpadu (SIKADU) terhadap Kinerja Individual Dengan Kemudahan Pengguna Sebagai Variabel Moderating",2010,"","Tesis Universitas Negeri Semarang","","https://scholar.google.com/scholar?cites=748011175337889996&as_sdt=2005&sciodt=0,5&hl=en",516,"2019-03-23","CITATION","","","",,,,,2,0.22,2,1,9
