Cites,Authors,Title,Year,Source,Publisher,ArticleURL,CitesURL,GSRank,QueryDate,Type,DOI,ISSN,CitationURL,Volume,Issue,StartPage,EndPage,ECC,CitesPerYear,CitesPerAuthor,AuthorCount,Age
0,"W Rahmalina","FAKTOR YANG MEMPENGARUHI PROMOSI DAN INFORMASI WISATA PULAU CINTA",2019,"RABIT (Jurnal Teknologi dan Sistem Informasi …","jurnal.univrab.ac.id","http://jurnal.univrab.ac.id/index.php/rabit/article/view/557","",702,"2019-03-25","","","","",,,,,0,0.00,0,1,1
0,"FD Noviandha, IF Astuti…","Sistem Pendukung Keputusan Untuk Penentuan Kategori Uang Kulliah Tunggal Dengan Metode Multifactor Evaluation Process (Studi Kasus: Universitas …",2019,"… : Jurnal Ilmiah Ilmu …","e-journals.unmul.ac.id","http://e-journals.unmul.ac.id/index.php/JIM/article/view/1552","",703,"2019-03-25","","","","",,,,,0,0.00,0,3,1
0,"K Karfindo, LM Putra","Transparansi Kegiatan Monitoring Pelaksanaan Bimbingan Skripsi dengan Sistem AT-MOGI",2019,"Techno. Com","publikasi.dinus.ac.id","http://publikasi.dinus.ac.id/index.php/technoc/article/view/1989","",704,"2019-03-25","","","","",,,,,0,0.00,0,2,1
0,"S Suprihatin","Evaluasi implementasi bimbingan teknologi informasi dan komunikasi (BTIK) dalam kurikulum 2013 di SMA",2019,"Wiyata Dharma: Jurnal Penelitian dan Evaluasi …","jurnal.ustjogja.ac.id","http://jurnal.ustjogja.ac.id/index.php/wd/article/view/3361","",705,"2019-03-25","","","","",,,,,0,0.00,0,1,1
0,"S Bahri, S Suhada, JM Hudin","Teknologi Global Positioning Sistem (GPS) Untuk Pelaporan Dan Penjemputan Sampah Berbasis Android",2019,"CESS (Journal of Computer …","jurnal.unimed.ac.id","https://jurnal.unimed.ac.id/2012/index.php/cess/article/view/11358","",706,"2019-03-25","","","","",,,,,0,0.00,0,3,1
0,"O Elisa","Audit Kinerja Tata Kelola Teknologi Informasi Menggunakan Metode Framework COBIT 5 Dan Technology Acceptance Model (TAM)(Studi Kasus: Poltekkes Tanjung …",2019,"Seminar Nasional Teknologi Komputer & Sains …","prosiding.seminar-id.com","https://www.prosiding.seminar-id.com/index.php/sainteks/article/view/232","",707,"2019-03-25","","","","",,,,,0,0.00,0,1,1
0,"P Pahrizal, A Sonita, D Deslianti","PELATIHAN KETERAMPILAN DASAR KOMPUTER DAN TEKNOLOGI INFORMASI BAGI PERANGKAT DESA DI KECAMATAN AIR BESI, KABUPATEN BENGKULU …",2019,"Proceeding of The URECOL","repository.urecol.org","http://repository.urecol.org/index.php/proceeding/article/view/490","",708,"2019-03-25","","","","",,,,,0,0.00,0,3,1
0,"SAPA Indraswarawati, IPDS Putra…","EFFECT OF TOP MANAGEMENT SUPPORT, SYSTEM QUALITY, AND INFORMATION QUALITY ON SATISFACTION ACCOUNTING INFORMATION SYSTEM USERS …",2019,"Widya Akuntansi dan …","ejournal.unhi.ac.id","https://ejournal.unhi.ac.id/index.php/widyaakuntansi/article/view/251","",709,"2019-03-25","","","","",,,,,0,0.00,0,3,1
0,"Y Sirait","APLIKASI INFORMASI GEOGRAFIS LOKASI FASILITAS SOSIAL BERDASARKAN RADIUS BERBASIS ANDROID (Studi Kasus: Kota Malang, Jawa Timur)",2019,"","eprints.itn.ac.id","http://eprints.itn.ac.id/1441/","",710,"2019-03-25","","","","",,,,,0,0.00,0,1,1
0,"FP Siswanto, I Hamidah","PERKEMBANGAN INFORMASI GEOSPASIAL TEMATIK TEMA TRANSPORTASI SETELAH PENETAPAN KEBIJAKAN SATU PETA Studi Kasus Tematik Kementerian …",2019,"Seminar Nasional Geomatika","semnas.big.go.id","http://semnas.big.go.id/index.php/SN/article/view/935","",711,"2019-03-25","","","","",,,,,0,0.00,0,2,1
0,"H Fengky, H Sabijono, M Kalalo","EVALUASI PENERAPAN SISTEM PENGENDALIAN INTERNAL PENERIMAAN KAS PADA HOTEL YUTA MANADO",2019,"Jurnal EMBA: Jurnal Riset …","ejournal.unsrat.ac.id","https://ejournal.unsrat.ac.id/index.php/emba/article/view/23218","",712,"2019-03-25","","","","",,,,,0,0.00,0,3,1
0,"A Stevanus, R Pratiwi","PENGARUH PERSEPSI KEMUDAHAN PEMBAYARAN DAN KUALITAS INFORMASI TERHADAP KEPUTUSAN PEMBELIAN SECARA ONLINE DI TOKOPEDIA",,"eprints.mdp.ac.id","","http://eprints.mdp.ac.id/2550/","",713,"2019-03-25","","","","",,,,,0,0.00,0,2,
0,"R Liza","RANCANG BANGUN SISTEM E-SPORT CYBERCAFE FINDER MENGGUNAKAN METODE LBS (LOCATION BASED SERVICE) BERBASIS ANDROID",2019,"JURNAL TEKNOLOGI INFORMASI","jurnal.una.ac.id","http://jurnal.una.ac.id/index.php/jurti/article/view/431","",714,"2019-03-25","","","","",,,,,0,0.00,0,1,1
0,"F Adikara, H Gunawan, S Sandfreni","Pemodelan Hasil Elisitasi Kebutuhan Sistem Penjualan Online Menggunakan Metode Knowledge Acquisition in Automated Specification",,"Jurnal Edukasi dan Penelitian …","jurnal.untan.ac.id","http://jurnal.untan.ac.id/index.php/jepin/article/view/28016","",715,"2019-03-25","","","","",,,,,0,0.00,0,3,
0,"R Santriono, R Roestam","ANALISIS DAN PERANCANGAN SISTEM PENDUKUNG KEPUTUSAN PEMILIHAN PAKET INTERNET OPERATOR TELEKOMUNIKASI DENGAN METODE …",2019,"… Manajemen Sistem Informasi","ejournal.stikom-db.ac.id","http://ejournal.stikom-db.ac.id/index.php/manajemensisteminformasi/article/download/597/422","",716,"2019-03-25","PDF","","","",,,,,0,0.00,0,2,1
0,"T Hidayat, S Sukisno","RANCANG BANGUN SISTEM PENERIMAAN MAHASISWA BARU ONLINE DENGAN MODEL SDLC METODE PROTOTIPE DI UNIVERSITAS ISLAM SYEKH-YUSUF",2019,"JURNAL PENELITIAN DAN KARYA …","ejournal.unis.ac.id","http://ejournal.unis.ac.id/index.php/pelita/article/view/49","",717,"2019-03-25","","","","",,,,,0,0.00,0,2,1
0,"J Prasetiana","DATABASE DISASTERS RECOVERY PLAN: SISTEM RECOVERY DATABASE MENGGUNAKAN ETL (EXTRACTION TRANSFORMATION LOADING)",2019,"Journal of Information System …","journal.stmikjayakarta.ac.id","http://journal.stmikjayakarta.ac.id/index.php/jisicom/article/view/66","",718,"2019-03-25","","","","",,,,,0,0.00,0,1,1
0,"MF Adriansyah","PERANCANGAN MODEL REMINDER SYSTEM UNTUK PEMBAYARAN PENYEWAAN KAMAR INDEKOS (Studi Kasus: Indekos Chicaritos Vini Vidi Vici, Bandung)",2019,"","repository.unpas.ac.id","http://repository.unpas.ac.id/40394/","",719,"2019-03-25","","","","",,,,,0,0.00,0,1,1
0,"MI Haq, S Suyanto, U Udiyanto","PEMANFAATAN INFORMASI GEOSPASIAL DALAM MENDUKUNG KINERJA DAN PELAYANAN PDAM Studi Kasus di PDAM Kota Probolinggo dan PDAM Kab …",2019,"Seminar Nasional Geomatika","semnas.big.go.id","http://semnas.big.go.id/index.php/SN/article/view/1020","",720,"2019-03-25","","","","",,,,,0,0.00,0,3,1
0,"A Masnur, MK Anam","CBC IMPLEMENTASI LOGIKA FUZZY DENGAN INFERENSI TSUKAMOTO PADA DETEKSI KEGAGALAN SISTEM TRANSFER CAKE BREAKER CONVEYOR (CBC)",2019,"… (Jurnal Teknologi dan Sistem Informasi …","jurnal.univrab.ac.id","http://jurnal.univrab.ac.id/index.php/rabit/article/view/596","",721,"2019-03-25","","","","",,,,,0,0.00,0,2,1
0,"D Ariadi, T Tashid","Prototipe Sistem Pengukur Ketinggian Permukaan Sampah Pada Tempat Pembuangan Sementara Menggunakan Arduino Dan Web Gis",2019,"JOISIE (Journal Of Information …","ejournal.pelitaindonesia.ac.id","http://www.ejournal.pelitaindonesia.ac.id/ojs32/index.php/JOISIE/article/view/243","",722,"2019-03-25","","","","",,,,,0,0.00,0,2,1
0,"L Indo","PERANCANGAN APLIKASI PERHITUNGAN SISTEM PERSAMAAN LINEAR MENGGUNAKAN METODE GAUSS JORDAN BERBASIS ANDROID",2019,"MASITIKA","journal.widyadharma.ac.id","http://journal.widyadharma.ac.id/index.php/masitika/article/view/660","",723,"2019-03-25","","","","",,,,,0,0.00,0,1,1
0,"TH Rasyid, T Siswanto","Inventory Container Information System at PT. Sarana Bandar Nasional",2019,"Intelmatics","trijurnal.lemlit.trisakti.ac.id","http://www.trijurnal.lemlit.trisakti.ac.id/index.php/intelmatics/article/view/3919","",724,"2019-03-25","","","","",,,,,0,0.00,0,2,1
0,"A Widarma, H Kumala","Sistem Pendukung Keputusan Dalam Menentukan Pengguna Listrik Subsidi Dan Nonsubsidi Menggunakan Metode Fuzzy Mamdani (Studi Kasus: PT. PLN Tanjung …",2019,"JURNAL TEKNOLOGI INFORMASI","jurnal.una.ac.id","http://www.jurnal.una.ac.id/index.php/jurti/article/view/432","",725,"2019-03-25","","","","",,,,,0,0.00,0,2,1
0,"R Hidayad, S Fauziati…","Perancangan Knowledge Management System di Direktorat Jenderal Bea dan Cukai Kementerian Keuangan",2019,"… Teknologi Komputer & …","prosiding.seminar-id.com","https://www.prosiding.seminar-id.com/index.php/sainteks/article/view/237","",726,"2019-03-25","","","","",,,,,0,0.00,0,3,1
0,"GD Harta, IP Julianto…","ANALISIS PENERAPAN SISTEM PEMBAYARAN SPP MELALUI APLIKASI PEMBAYARAN SPP TERKOMPUTERISASI PADA SMA NEGERI 4 SINGARAJA",2019,"JIMAT (Jurnal Ilmiah …","ejournal.undiksha.ac.id","https://ejournal.undiksha.ac.id/index.php/S1ak/article/view/16910","",727,"2019-03-25","","","","",,,,,0,0.00,0,3,1
0,"D Satria, S Yana","THE DESIGN Of STUDENT ATTENDANCE-BASED RFID DEVICES (Radio Frequency Identification) With INTEGRATED SCHEDULING SYSTEM In COLLEGE",2019,"Proceeding International Conference …","jurnal.abulyatama.ac.id","http://jurnal.abulyatama.ac.id/mea2016/article/view/173","",728,"2019-03-25","","","","",,,,,0,0.00,0,2,1
0,"E Indra, AL Sitanggang, MH Loi","RANCANG BANGUN APLIKASI SISTEM UJIAN SARINGAN MASUK SMA BERBASIS ANDROID (Studi Kasus SMA Amir Hamzah Medan)",2019,"Jurnal Sistem Informasi dan …","jurnal.unprimdn.ac.id","http://jurnal.unprimdn.ac.id/index.php/JUSIKOM/article/view/439","",729,"2019-03-25","","","","",,,,,0,0.00,0,3,1
0,"T Hariguna, B Berlilana","Pengukuran Perilaku Publik Terhadap Layanan E-Government Menggunakan Expectation Confirmation Model dan Kualitas System Informasi",2019,"Telematika","ejournal.amikompurwokerto.ac.id","http://ejournal.amikompurwokerto.ac.id/index.php/telematika/article/view/781","",730,"2019-03-25","","","","",,,,,0,0.00,0,2,1
0,"PA Sasmito, RPS Ilhamsyah","SISTEM PENDUKUNG KEPUTUSAN PENERIMA BEASISWA DENGAN MENERAPKAN METODE SIMPLE ADDITIVE WEIGHTING (SAW)",,"Coding Jurnal Komputer dan Aplikasi","jurnal.untan.ac.id","http://jurnal.untan.ac.id/index.php/jcskommipa/article/view/30832","",731,"2019-03-25","","","","",,,,,0,0.00,0,2,
0,"ERS Moningkey, VR Palilingan…","Library Information System in PTIK UNIMA Manado",2019,"5th UPI International …","atlantis-press.com","https://www.atlantis-press.com/proceedings/ictvet-18/55913988","",732,"2019-03-25","","","","",,,,,0,0.00,0,3,1
0,"T Mirani, E Sinduningrum…","Rancang Bangun Sistem Pengenalan Citra untuk Tingkat Kematangan Buah Pepaya California Berdasarkan Warna Berbasis",2019,"Prosiding Seminar …","journal.uhamka.ac.id","https://journal.uhamka.ac.id/index.php/teknoka/article/view/2896","",733,"2019-03-25","","","","",,,,,0,0.00,0,3,1
0,"T Hasanah, HJS Sitio","Sistem Pendukung Keputusan Pemilihan Jurusan Pada Yayasan Muhammad Nasir dengan Menggunakan Metode MOORA",2019,"JOURNAL OF INFORMATICS AND …","ojs.uma.ac.id","http://www.ojs.uma.ac.id/index.php/jite/article/view/2161","",734,"2019-03-25","","","","",,,,,0,0.00,0,2,1
0,"W Wahyudi, SDW Prajanti, M Kurniawan…","PENGEMBANGAN SOFTWARE UNTUK SISTEM VALIDASI KATEGORI JURNAL INTERNASIONAL TERINDEKS SCOPUS DAN JURNAL NASIONAL …",2019,"… : Jurnal Sains dan …","journal.unnes.ac.id","https://journal.unnes.ac.id/nju/index.php/sainteknol/article/view/17566","",735,"2019-03-25","","","","",,,,,0,0.00,0,4,1
0,"E Elisawati","SISTEM INVENTORY SUKU CADANG SEPEDA MOTOR UNTUK MENGHITUNG ESTIMASI STOK MENGGUNAKAN METODE ECONOMIC ORDER QUANTITY …",2019,"INFORMATIKA","ejournal.stmikdumai.ac.id","http://ejournal.stmikdumai.ac.id/index.php/path/article/view/118","",736,"2019-03-25","","","","",,,,,0,0.00,0,1,1
0,"AP Natasuwarna","Rancangan Sistem E-Procurement pada Usaha Hutan Tanaman Industri dengan Metode Enterprise Architecture",2019,"Techno. Com","publikasi.dinus.ac.id","http://publikasi.dinus.ac.id/index.php/technoc/article/view/2080","",737,"2019-03-25","","","","",,,,,0,0.00,0,1,1
0,"P Rahmawanti","PENERAPAN SISTEM PENGENDALIAN INTERN ATAS PERSEDIAAN BARANG PADA PT. MICA JAYA PRATAMA SOLO",2019,"Prosiding Seminar Nasional Akuntansi …","sngbr.polinema.ac.id","http://sngbr.polinema.ac.id/index.php/snamk/article/view/211","",738,"2019-03-25","","","","",,,,,0,0.00,0,1,1
0,"RCS Haryono","ANALISIS DAN PENILAIAN TEKNOLOGI INFORMASI PADA PROSES TATA KELOLA DENGAN COBIT 5 PADA DOMAIN EDM STUDI KASUS UNIVERSITAS …",2019,"","ejournal.almaata.ac.id","http://ejournal.almaata.ac.id/index.php/IJUBI/article/view/876","",739,"2019-03-25","","","","",,,,,0,0.00,0,1,1
0,"HD Ramandita, E Utami, ET Lutfi","Sistem Pengukuran Kinerja Manajemen Untuk Mengevaluasi Tujuan Perusahaan Menggunakan Model Balanced Scorecard Dan Gamification",2019,"Creative Information …","citec.amikom.ac.id","http://citec.amikom.ac.id/main/index.php/citec/article/view/120","",740,"2019-03-25","","","","",,,,,0,0.00,0,3,1
0,"AR Utary, M Azis","Penerapan sistem material requirements planning terhadap efisiensi biaya persediaan bahan baku",2019,"Jurnal Ilmu Manajemen Mulawarman …","journal.feb.unmul.ac.id","http://journal.feb.unmul.ac.id/index.php/JIMM/article/view/1168","",741,"2019-03-25","","","","",,,,,0,0.00,0,2,1
0,"E Mulyana, F Abdurahim…","Analisis dan Perancangan Arsitektur Sistem Aplikasi Layanan Informasi Lokasi Berbasis IoT",2019,"… Teknik Elektro UIN …","senter.ee.uinsgd.ac.id","https://senter.ee.uinsgd.ac.id/repositori/index.php/prosiding/article/view/senter2018p27","",742,"2019-03-25","","","","",,,,,0,0.00,0,3,1
0,"I Mahendra, F Fadhilah, I Khairina","Sistem Pakar Berbasis Web Menggunakan Metode Forward Chaining Untuk Mendiagnosa Penyakit Pulpa Dan Periapikal",2019,"… DAN SISTEM INFORMASI","jurnal.mdp.ac.id","http://jurnal.mdp.ac.id/index.php/jatisi/article/view/138","",743,"2019-03-25","","","","",,,,,0,0.00,0,3,1
0,"MF Fathony","Medical Information System Development at Klinik Pratama Kalimasadha Tengaran",2019,"","eprints.ums.ac.id","http://eprints.ums.ac.id/id/eprint/71303","",744,"2019-03-25","","","","",,,,,0,0.00,0,1,1
0,"Y Setiawati, E Elfizar","SISTEM PENDUKUNG KEPUTUSAN SPASIAL PEMILIHAN SEKOLAH MENENGAH KEJURUAN TEKNIK KOMPUTER DAN JARINGAN MENGGUNAKAN …",,"wahyu sari yeni","","","",745,"2019-03-25","CITATION","","","",,,,,0,0.00,0,2,
0,"B Kusnadi","SISTEM PENDUKUNG KEPUTUSAN PEMILIHAN ATLET RENANG TINGKAT NASIONAL MENGGUNAKAN METODE SIMPLE ADDTIVE WEIGHTING (SAW)",2019,"","eprints.mercubuana-yogya.ac.id","http://eprints.mercubuana-yogya.ac.id/4374/","",746,"2019-03-25","","","","",,,,,0,0.00,0,1,1
0,"MA Ramzy","Pengembangan Sistem Pakar Diagnosa Penyakit Kambing Menggunakan Metode Forward Chaining Berbasis Android",2019,"Setrum: Sistem Kendali-Tenaga-Elektronika …","jurnal.untirta.ac.id","http://jurnal.untirta.ac.id/index.php/jis/article/view/3810","",747,"2019-03-25","","","","",,,,,0,0.00,0,1,1
0,"H Magdalena, R Rani","Desain Sistem Pendukung Keputusan Seleksi Calon Guru Sekolah Alam Berbasis Islam",2019,"CogITo Smart Journal","cogito.unklab.ac.id","http://cogito.unklab.ac.id/index.php/cogito/article/view/125","",748,"2019-03-25","","","","",,,,,0,0.00,0,2,1
0,"HT Frianto, M Zarlis","PERANCANGAN SISTEM PENGAMBILAN PUTUSAN PENGADILAN HUKUM DENGAN METODOLOGI ARTIFICIAL INTELLIGENT SEBAGAI PEMBELAJARAN …",,"osf.io","","https://osf.io/evt3r/download/?format=pdf","",749,"2019-03-25","PDF","","","",,,,,0,0.00,0,2,
0,"MDL Siahaan","MENGUKUR TINGKAT KEPERCAYAAN SISTEM ZAKAT ONLINE MENGGUNAKAN TECHNOLOGY ACCEPTANCE MODEL (TAM) DI KALANGAN MASYARAKAT …",2019,"Jurnal Abdi Ilmu","jurnal.pancabudi.ac.id","http://jurnal.pancabudi.ac.id/index.php/abdiilmu/article/view/401","",750,"2019-03-25","","","","",,,,,0,0.00,0,1,1
0,"PKMK CIPTA","PROPOSAL PROGRAM KREATIVITAS MAHASISWA SISTEM PENDUKUNG KEPUTUSAN DALAM MEREKOMENDASIKAN UNIT AFDELING TERBAIK DI …",,"osf.io","","https://osf.io/er29c/download/?format=pdf","",751,"2019-03-25","PDF","","","",,,,,0,0.00,0,1,
0,"D Zakiniyati","Sistem Pendukung Keputusan Untuk Penentuan Penerima Beasiswa Menggunakan Metode Weighted Product Di Fakultas Komunikasi Dan Informatika UMS",2019,"","eprints.ums.ac.id","http://eprints.ums.ac.id/id/eprint/70347","",752,"2019-03-25","","","","",,,,,0,0.00,0,1,1
0,"IP Sari, R Wahyu","SISTEM PRODUKSI KELAPA SAWIT DAN KARET DENGAN MEMBANDINGKAN HASIL PRODUKSI MENGGUNAKAN SIMULASI (STUDI KASUS: KABUPATEN …",2019,"… (Jurnal Teknologi dan Sistem Informasi …","jurnal.univrab.ac.id","http://jurnal.univrab.ac.id/index.php/rabit/article/view/509","",753,"2019-03-25","","","","",,,,,0,0.00,0,2,1
0,"RS Iswara","SISTEM PENDUKUNG KEPUTUSAN UNTUK MENENTUKAN ANGGOTA PASUKAN KHUSUS PRAMUKA MENGGUNAKAN METODE AHP dan TOPSIS",2019,"","eprints.itn.ac.id","http://eprints.itn.ac.id/903/","",754,"2019-03-25","","","","",,,,,0,0.00,0,1,1
0,"L Liyanti, AR Hakim","PERANCANGAN PENERAPAN TANDA TANGAN DIGITAL SEBAGAI PENGEMBANGAN SISTEM PELAYANAN PENTASHIHAN AL QURAN DIGITAL",2019,"SISTEMASI","sistemasi.ftik.unisi.ac.id","http://sistemasi.ftik.unisi.ac.id/index.php/stmsi/article/view/415","",755,"2019-03-25","","","","",,,,,0,0.00,0,2,1
0,"RJ Saputra, T Arianto…","Pemanfaatan Aplikasi Informasi Warkah (I-Wak) Untuk Sistem Pengarsipan Warkah (Studi di Kantor Pertanahan Kabupaten Banyuasin Provinsi Sumatera Selatan)",2019,"Jurnal Tunas Agraria","jurnaltunasagraria.stpn.ac.id","http://www.jurnaltunasagraria.stpn.ac.id/index.php/JTA/article/view/22","",756,"2019-03-25","","","","",,,,,0,0.00,0,3,1
0,"SA Wibawa","PENENTUAN TINGKAT RESIKO DAERAH RAWAN BANJIR DI LAMONGAN SEBAGAI SISTEM KESIAPSIAGAAN, MENGGUNAKAN METODE FUZZY TSUKAMOTO",2019,"","eprints.umg.ac.id","http://eprints.umg.ac.id/805/","",757,"2019-03-25","","","","",,,,,0,0.00,0,1,1
0,"I Gunawan, A Afrina…","SISTEM PENDUKUNG KEPUTUSAN PEMILIHAN KARYAWAN TERBAIK PADA LAMOIST LAYERS BATAM",2019,"JR: JURNAL RESPONSIVE …","ojs.stt-ibnusina.ac.id","https://ojs.stt-ibnusina.ac.id/index.php/JR/article/view/153","",758,"2019-03-25","","","","",,,,,0,0.00,0,3,1
0,"TH Kusuma, M Fathur, I Oktavia, Y Yulistia","Sistem Pendukung Keputusan Rekrutmen Karyawan Pada PT. Oze Mitra NusantaraRegion Palembang Menggunakan Metode Simple Additive Weighting (SAW)",,"eprints.mdp.ac.id","","http://eprints.mdp.ac.id/2669/","",759,"2019-03-25","","","","",,,,,0,0.00,0,4,
0,"VF Lesawengan, F Jansen…","MINIMALISASI KESALAHAN SURVEY TOPOGRAFI DALAM PEMETAAN DIGITAL DENGAN KOORDINAT GLOBAL MENGGUNAKAN AUTOCAD LAND DESKTOP …",2019,"JURNAL SIPIL …","ejournal.unsrat.ac.id","https://ejournal.unsrat.ac.id/index.php/jss/article/view/21409","",760,"2019-03-25","","","","",,,,,0,0.00,0,3,1
0,"IP Julianto, INP Yasa","The Analysis of Technology Acceptance Model (TAM) on The Use of Accounting Information System",2019,"International Conference on Tourism …","atlantis-press.com","https://www.atlantis-press.com/proceedings/teams-18/55911655","",761,"2019-03-25","","","","",,,,,0,0.00,0,2,1
0,"S Wiguna","PEMBANGUNAN PERANGKAT LUNAK PENGELOLAAN HASIL BELAJAR SISWA BERBASIS WEB MENGGUNAKAN PENDEKATAN WORK SYSTEM FRAMEWORK …",2019,"","repository.unpas.ac.id","http://repository.unpas.ac.id/id/eprint/40455","",762,"2019-03-25","","","","",,,,,0,0.00,0,1,1
0,"F Firmandi, A Sofiyan, A Saputra…","PERANCANGAN APLIKASI SISTEM PENUNJANG KEPUTUSAN MENENTUKAN LOKASI PASAR UNTUK PEDAGANG PADA KANTOR PELAYANAN PASAR KOTA …",2019,"…","ejournal.stmikdumai.ac.id","http://ejournal.stmikdumai.ac.id/index.php/path/article/view/126","",763,"2019-03-25","","","","",,,,,0,0.00,0,4,1
0,"RT Pinzon, L Priskila","Sistem Pengingat Klinis untuk Perbaikan Kepatuhan Peresepan Berdasarkan Formularium dan Formularium Nasional di RS Bethesda Yogyakarta",2019,"The Journal of …","jha.mutupelayanankesehatan.net","http://jha.mutupelayanankesehatan.net/index.php/JHA/article/download/16/7","",764,"2019-03-25","PDF","","","",,,,,0,0.00,0,2,1
0,"A Afrina","SISTEM PENUNJANG KEPUTUSAN PENILAIAN KINERJA PEGAWAI DENGAN METODE SMART PADA RUMAH TAHANAN KELAS IIA BATAM",2019,"JR: JURNAL RESPONSIVE Teknik Informatika","ojs.stt-ibnusina.ac.id","https://ojs.stt-ibnusina.ac.id/index.php/JR/article/view/160","",765,"2019-03-25","","","","",,,,,0,0.00,0,1,1
0,"D Prianto, F Fauziah…","Sistem Pakar Diagnosa Penyakit dan Hama pada Tanaman Lada dengan Metode Forward Chaining Berbasis Android",2019,"Ensiklopedia of …","jurnal.ensiklopediaku.org","http://jurnal.ensiklopediaku.org/ojs-2.4.8-3/index.php/ensiklopedia/article/view/60","",766,"2019-03-25","","","","",,,,,0,0.00,0,3,1
0,"H Haryono, B Budiyono, I Istyarini, W Wardi…","SISTEM PENJAMINAN MUTU PENDIDIKAN DALAM MENINGKATKAN MUTU PENDIDIKAN SEKOLAH DASAR DI KECAMATAN GAJAH MUNGKUR KOTA …",2019,"Jurnal …","journal.unnes.ac.id","https://journal.unnes.ac.id/sju/index.php/panjar/article/view/28463","",767,"2019-03-25","","","","",,,,,0,0.00,0,5,1
0,"BH Sugiharto, U Rumefi","Analisis Implementasi dan Pemodelan REA (Resource, Event, Agent) Sistem Akuntansi Pada UMKM Di Kabupaten Pasuruan",2019,"JAE (JURNAL AKUNTANSI DAN …","ojs.unpkediri.ac.id","http://ojs.unpkediri.ac.id/index.php/akuntansi/article/view/12759","",768,"2019-03-25","","","","",,,,,0,0.00,0,2,1
0,"TH Nasution, IS Siregar, F Fahmi","Design of Portable Fingerprint System Prototype for Student Presence Integrated with Academic Information System at the Universitas Sumatera Utara",2019,"Simetrikal Journal of Engineering …","jocai.usu.ac.id","https://jocai.usu.ac.id/index.php/jet/article/view/688","",769,"2019-03-25","","","","",,,,,0,0.00,0,3,1
0,"S Sutedi, M Agarina","DESIGN OF DATA COLLECTION SYSTEM OF LECTURER'S RESEARCH AT INSTITUTE INFORMATICS AND BUSINESS DARMAJAYA LAMPUNG",2019,"IJISCS (International Journal Of …","ojs.stmikpringsewu.ac.id","http://www.ojs.stmikpringsewu.ac.id/index.php/ijiscs/article/view/709","",770,"2019-03-25","","","","",,,,,0,0.00,0,2,1
0,"M Utami, Y Apridiansyah","Implementasi Algoritma Sequential Searching Pada Sistem Pelayanan Puskesmas Menggunakan Bootstrap (Studi Kasus Puskesmas Kampung Bali Bengkulu)",2019,"Journal Scientific and Applied of …","jurnal.umb.ac.id","http://www.jurnal.umb.ac.id/index.php/JSAI/article/view/166","",771,"2019-03-25","","","","",,,,,0,0.00,0,2,1
0,"SA Arnomo","MENGUKUR MUTU INTERACTION QUALITY SYSTEM E-TICKET",2019,"KLIK-KUMPULAN JURNAL ILMU KOMPUTER","klik.ulm.ac.id","http://klik.ulm.ac.id/index.php/klik/article/view/171","",772,"2019-03-25","","","","",,,,,0,0.00,0,1,1
0,"B Jannah, AY Ridwan…","Designing the Measurement of System Green Manufacturing Using SCOR Model in The Leather Tanning Industry",2019,"… Sistem dan Industri)","jrsi.sie.telkomuniversity.ac.id","http://jrsi.sie.telkomuniversity.ac.id/index.php/JRSI/article/view/301","",773,"2019-03-25","","","","",,,,,0,0.00,0,3,1
0,"I Irwandi","Sistem Pendukung Keputusan Pemilihan Gedung Pernikahan Dengan Metode Simple Additive Weighting (Saw)",2019,"Naskah Publikasi Prodi Sistem Informasi","eprints.mercubuana-yogya.ac.id","http://eprints.mercubuana-yogya.ac.id/4962/","",774,"2019-03-25","","","","",,,,,0,0.00,0,1,1
0,"AF Nauval","Sistem dropshipping dalam online shop menurut hukum Islam dan undang-undang informasi dan transaksi",,"repository.uinjkt.ac.id","","http://repository.uinjkt.ac.id/dspace/handle/123456789/44218","",775,"2019-03-25","","","","",,,,,0,0.00,0,1,
1,"R Ramadiani, A Rahmah","Sistem pendukung keputusan pemilihan tenaga kesehatan teladan menggunakan metode Multi-Attribute Utility Theory",2019,"… Ilmiah Teknologi Sistem Informasi","journal.unipdu.ac.id","http://journal.unipdu.ac.id/index.php/register/article/download/1273/822","https://scholar.google.com/scholar?cites=10276226748751111140&as_sdt=2005&sciodt=0,5&hl=en",776,"2019-03-25","PDF","","","",,,,,1,1.00,1,2,1
0,"G Jati","Sistem pendukung keputusan pengangkatan staf pengajar pesantren terpadu dengan menggunakan Algoritma Weighted Product: Studi Kasus Pondok Pesantren Al …",2019,"","digilib.uinsgd.ac.id","http://digilib.uinsgd.ac.id/18050/","",777,"2019-03-25","","","","",,,,,0,0.00,0,1,1
0,"RE Wismanu, M Nuh, N Widodo…","Model Inovasi Pemerintah Daerah Bidang Pelayanan Perizinan dalam Mewujudkan Smart City (Studi Pendekatan Sistem Dinamik Pada Pemerintah Kabupaten …",2019,"Jurnal Ilmiah Administrasi …","ejournalfia.ub.ac.id","https://ejournalfia.ub.ac.id/index.php/jiap/article/view/850","",778,"2019-03-25","","","","",,,,,0,0.00,0,4,1
0,"S Ananda","PENERAPAN METODE TOPSIS DALAM SISTEM PENDUKUNG KEPUTUSAN SELEKSI CALON GURU TETAP YAYASAN MUHAMMADIYAH DI PDM BANTUL",2019,"","eprints.akakom.ac.id","http://eprints.akakom.ac.id/8254/","",779,"2019-03-25","","","","",,,,,0,0.00,0,1,1
0,"AN Sa'adah","Analisis Sistem Pengendalian Interen Terhadap Efektivitas Prosedur Pemberian Kredit Pada Koperasi Simpan Pinjam Bina Arta Kabupaten Sleman Yogyakarta",2019,"","eprints.mercubuana-yogya.ac.id","http://eprints.mercubuana-yogya.ac.id/4840/","",780,"2019-03-25","","","","",,,,,0,0.00,0,1,1
0,"R Prathivi","ANALISA SISTEM QR CODE UNTUK IDENTIFIKASI BUKU PERPUSTAKAAN",2019,"Jurnal Pengembangan Rekayasa dan Teknologi","journals.usm.ac.id","http://journals.usm.ac.id/index.php/jprt/article/view/1225","",781,"2019-03-25","","","","",,,,,0,0.00,0,1,1
0,"Y Delwon","PERANCANGAN SISTEM PENDUKUNG KEPUTUSAN UNTUK PENILAIAN KINERJA KARYAWAN PADA CU PANCUR DANGERI MENGGUNAKAN METODE …",2019,"MASITIKA","journal.widyadharma.ac.id","http://journal.widyadharma.ac.id/index.php/masitika/article/view/668","",782,"2019-03-25","","","","",,,,,0,0.00,0,1,1
0,"E Indrioko","Strategi Penerapan Teknologi Informasi dan Komunikasi di Madrasah",2019,"Jurnal Al-Mutaaliyah: Jurnal Pendidikan Guru …","ejournal.kopertais4.or.id","http://ejournal.kopertais4.or.id/sasambo/index.php/mutaaliyah/article/view/3333","",783,"2019-03-25","","","","",,,,,0,0.00,0,1,1
0,"A Ramadani, TRR Sihombing","Sistem Pendukung Keputusan Pemilihan Asuransi Jiwa Pada PT Bhinneka Life Indonesia Pematangsiantar Dengan Menggunakan Metode Moora",2019,"JOURNAL OF INFORMATICS AND …","ojs.uma.ac.id","http://www.ojs.uma.ac.id/index.php/jite/article/view/2160","",784,"2019-03-25","","","","",,,,,0,0.00,0,2,1
0,"YDF Barus, F Fatayat","SISTEM PENDUKUNG KEPUTUSAN MENENTUKAN JURUSAN SISWA SMA MENGGUNAKAN METODE SIMPEL MULTI ATTRIBUTE RATING …",,"wahyu sari yeni","","","",785,"2019-03-25","CITATION","","","",,,,,0,0.00,0,2,
