Cites,Authors,Title,Year,Source,Publisher,ArticleURL,CitesURL,GSRank,QueryDate,Type,DOI,ISSN,CitationURL,Volume,Issue,StartPage,EndPage,ECC,CitesPerYear,CitesPerAuthor,AuthorCount,Age
0,"AAJ Permana, YR Alkautsar","Sistem Pendukung Keputusan Penentuan Supplier Suku Cadang Mobil Pabrikan Eropa Dalam Konteks Interaksi Manusia Komputer",2016,"Jurnal Nasional Pendidikan …","ejournal.undiksha.ac.id","http://ejournal.undiksha.ac.id/index.php/janapati/article/download/9921/6297","",1,"2019-11-13","PDF","","","",,,,,0,0.00,0,2,3
2,"W Firdaus","RANCANG BANGUN MADING ONLINE BERBASIS WEB (Studi Kasus: Program Studi Sistem Informasi Fakultas Sains dan Teknologi Universitas Islam Negeri Sultan …",2016,"","repository.uin-suska.ac.id","http://repository.uin-suska.ac.id/3080/","https://scholar.google.com/scholar?cites=18030842183960945207&as_sdt=2005&sciodt=0,5&hl=en",2,"2019-11-13","","","","",,,,,2,0.67,2,1,3
5,"T Lestariningsih","Analisis Sitem Informasi Dalam Perspektif Human Computer Interaction",2016,"Jurnal AKSI (Akuntansi dan Sistem Informasi)","journal.pnm.ac.id","http://journal.pnm.ac.id/index.php/aksi/article/view/98","https://scholar.google.com/scholar?cites=17202445482268572626&as_sdt=2005&sciodt=0,5&hl=en",3,"2019-11-13","","","","",,,,,5,1.67,5,1,3
2,"R Andrian, D Sakethi, M Chairuddin","Pengembangan Sistem Informasi Penelitian dan Pengabdian Dosen Jurusan Ilmu Komputer Menggunakan Metode Rational Unified Process (RUP)",2016,"Jurnal Komputasi","jurnal.fmipa.unila.ac.id","http://jurnal.fmipa.unila.ac.id/komputasi/article/view/1090","https://scholar.google.com/scholar?cites=10563738156676370294&as_sdt=2005&sciodt=0,5&hl=en",4,"2019-11-13","","","","",,,,,2,0.67,1,3,3
0,"D Abdullah","Pertemuan X: Diktat Kuliah Interaksi Manusia & Komputer (IMK)-Teknik Evaluasi",2016,"","repository.unimal.ac.id","http://repository.unimal.ac.id/1111/1/10-teknik-evaluasi.pdf","",5,"2019-11-13","PDF","","","",,,,,0,0.00,0,1,3
0,"U Dewi Widianti","Kerangka Kerja Dan Paradigma Interaksi",2016,"","repository.unikom.ac.id","https://repository.unikom.ac.id/49098/1/Kerangka%20Kerja%20dan%20Paradigma%20Interaksi.pdf","",6,"2019-11-13","","","","",,,,,0,0.00,0,1,3
2,"E Paulus, M Suryani, R Farabi…","EVALUASI APLIKASI SEMI-IMMERSIVE VIRTUAL REALITY PADA BIDANG PENDIDIKAN MENURUT ASPEK HEURISTIK DAN PEMBELAJARAN",2016,"JIKO (Jurnal …","ejournal.akakom.ac.id","https://ejournal.akakom.ac.id/index.php/jiko/article/view/32","https://scholar.google.com/scholar?cites=17748467443430509632&as_sdt=2005&sciodt=0,5&hl=en",7,"2019-11-13","","","","",,,,,2,0.67,1,4,3
0,"ML Adzani","Analisis dan perancangan UI/UX pada prototype aplikasi mobile E-Commerce Gramedia. com",2016,"","kc.umn.ac.id","http://kc.umn.ac.id/1268/2/BAB%20I.pdf","",8,"2019-11-13","","","","",,,,,0,0.00,0,1,3
5,"A Yasin, MZ Yumarlin","Evaluasi Web UJB menggunakan Golden Rules Of User Interface Design Theo Mandel",2016,"SEMNASTEKNOMEDIA ONLINE","ojs.amikom.ac.id","http://ojs.amikom.ac.id/index.php/semnasteknomedia/article/view/1160","https://scholar.google.com/scholar?cites=4677970737013784228&as_sdt=2005&sciodt=0,5&hl=en",9,"2019-11-13","","","","",,,,,5,1.67,3,2,3
4,"T Oktaviana, LY Syah…","Analisis Aplikasi Gojek dengan Menggunakan Metode Usability",2016,"… Teknologi Informasi dan …","eprints.binadarma.ac.id","http://eprints.binadarma.ac.id/3238/","https://scholar.google.com/scholar?cites=15439747899288644273&as_sdt=2005&sciodt=0,5&hl=en",10,"2019-11-13","","","","",,,,,4,1.33,1,3,3
2,"MIP Nasution, SD Andriana","Aplikasi Pembelajaran Berbasis Mobile Untuk Tuna Aksara",2016,"MATICS","103.17.76.13","http://103.17.76.13/index.php/saintek/article/view/3475","https://scholar.google.com/scholar?cites=17433210222089282124&as_sdt=2005&sciodt=0,5&hl=en",11,"2019-11-13","","","","",,,,,2,0.67,1,2,3
0,"RJ Iskandar","PERANCANGAN APLIKASI PEMBELAJARAN NOTASI DAN TANGGA NADA DENGAN PARTITUR BERBASIS ANDROID",2016,"INTEKSIS","journal.widyadharma.ac.id","http://journal.widyadharma.ac.id/index.php/inteksis/article/view/126","",12,"2019-11-13","","","","",,,,,0,0.00,0,1,3
0,"D Pratiwi","Peer Review: Mengenal Interaksi Manusia dan Komputer",2016,"","repository.gunadarma.ac.id","http://repository.gunadarma.ac.id/id/eprint/1849","",13,"2019-11-13","CITATION","","","",,,,,0,0.00,0,1,3
0,"TRY ARIWIBOWO","Perancangan User Interface Web Menggunakan CI dan SVG",2016,"","repository.unpas.ac.id","http://repository.unpas.ac.id/id/eprint/13484","",14,"2019-11-13","","","","",,,,,0,0.00,0,1,3
1,"TH Manurung","PERANCANGAN APLIKASI PEMBELAJARAN LOGIKA DAN ALGORITMA DENGAN MENGGUNAKAN METODE COMPUTER BASED INSTRUCTION",2016,"JURIKOM (Jurnal Riset Komputer)","ejurnal.stmik-budidarma.ac.id","https://ejurnal.stmik-budidarma.ac.id/index.php/jurikom/article/view/56","https://scholar.google.com/scholar?cites=14854948070949314222&as_sdt=2005&sciodt=0,5&hl=en",15,"2019-11-13","","","","",,,,,1,0.33,1,1,3
9,"R Firmansyah","Evaluasi Heuristik Pada Desain Interface Aplikasi My Indihome",2016,"Seminar Nasional Ilmu Pengetahuan …","konferensi.nusamandiri.ac.id","http://konferensi.nusamandiri.ac.id/prosiding/index.php/sniptek/article/view/19","https://scholar.google.com/scholar?cites=15596425305214735611&as_sdt=2005&sciodt=0,5&hl=en",16,"2019-11-13","","","","",,,,,9,3.00,9,1,3
0,"M Ichwan, IA Dewi, DB Utami","Desain dan Implementasi Kabin Cerdas Sebagai Alat Ukur Kesehatan Bagi Penyandang Disabilitas Tuna Netra dan Lanjut Usia",2016,"ReTII","journal.itny.ac.id","https://journal.itny.ac.id/index.php/ReTII/article/view/481","",17,"2019-11-13","","","","",,,,,0,0.00,0,3,3
2,"A Suharso, M Muhaimin","Media Belajar Kerangka Manusia 3D Berbasis Magicbook Augmented Reality (AR)(Studi Kasus SMPN 1 Kota Baru)",2016,"Syntax: Jurnal Informatika","journal.unsika.ac.id","https://journal.unsika.ac.id/index.php/syntax/article/download/697/599","https://scholar.google.com/scholar?cites=10377237649355239990&as_sdt=2005&sciodt=0,5&hl=en",18,"2019-11-13","PDF","","","",,,,,2,0.67,1,2,3
3,"APW Wibowo","Implementasi Teknik Computer Vision Dengan Metode Colored Markers Trajectory Secara Real Time",2016,"Jurnal Teknik Informatika","","","https://scholar.google.com/scholar?cites=7056633565647743604&as_sdt=2005&sciodt=0,5&hl=en",19,"2019-11-13","CITATION","","","",,,,,3,1.00,3,1,3
1,"V Vydia, N Hidayati","ALTERNATIF MEDIA PEMBELAJARAN DENGAN LEARNING MANAGEMENT SYSTEM MOODLE PADA FAKULTAS TEKNOLOGI INFORMASI DAN KOMUNIKASI …",2016,"Jurnal Transformatika","journals.usm.ac.id","http://journals.usm.ac.id/index.php/transformatika/article/view/322","https://scholar.google.com/scholar?cites=5413809581778357434&as_sdt=2005&sciodt=0,5&hl=en",20,"2019-11-13","","","","",,,,,1,0.33,1,2,3
7,"A Triansah, D Cahyadi, IF Astuti","Membangun Aplikasi Web Dan Mobile Android Untuk Media Pencarian Kost Menggunakan Phonegap Dan Google Maps Api",2016,"… : Jurnal Ilmiah Ilmu …","e-journals.unmul.ac.id","http://e-journals.unmul.ac.id/index.php/JIM/article/view/21","https://scholar.google.com/scholar?cites=17854010107442082886&as_sdt=2005&sciodt=0,5&hl=en",21,"2019-11-13","","","","",,,,,7,2.33,2,3,3
7,"R Layona, B Yulianto","Aplikasi pencarian informasi dan lokasi tempat makan pada perangkat mobile berbasis android",2016,"Jurnal Nasional Teknologi dan Sistem …","teknosi.fti.unand.ac.id","https://teknosi.fti.unand.ac.id/index.php/teknosi/article/view/30","https://scholar.google.com/scholar?cites=14511106811329082258&as_sdt=2005&sciodt=0,5&hl=en",22,"2019-11-13","","","","",,,,,7,2.33,4,2,3
0,"I Yusti","Sistem Informasi Manajemen Surat Berbasis Php dan Mysql di Institut Seni Indonesia Padangpanjang",2016,"Jurnal Sains dan Teknologi: Jurnal Keilmuan dan …","ojs.sttind.ac.id","http://ojs.sttind.ac.id/sttind_ojs/index.php/Sain/article/view/53","",23,"2019-11-13","","","","",,,,,0,0.00,0,1,3
0,"E Kristiani","AN ANALYSIS AND DESIGN OF THE THERAPIE COMPANY PROFILE WEBSITE USING USER EXPERIENCE METHOD (UX)",2016,"Teknik dan Ilmu Komputer","ejournal.ukrida.ac.id","http://ejournal.ukrida.ac.id/ojs/index.php/TIK/article/view/1090","",24,"2019-11-13","CITATION","","","",,,,,0,0.00,0,1,3
8,"E Rusnandi, H Sujadi, EFN Fauzyah","Implementasi Augmented Reality (AR) pada Pengembangan Media Pembelajaran Pemodelan Bangun Ruang 3D untuk Siswa Sekolah Dasar",2016,"INFOTECH journal","jurnal.unma.ac.id","https://www.jurnal.unma.ac.id/index.php/infotech/article/view/40","https://scholar.google.com/scholar?cites=12549752826844732104&as_sdt=2005&sciodt=0,5&hl=en",25,"2019-11-13","","","","",,,,,8,2.67,3,3,3
2,"MAM Baihaqy, A Rosidi, SA Syahdan","Analisis Usability Aplikasi E-Learning Di Fakultas Teknik dan Ilmu Komputer Unsiq Wonosobo",2016,"Jurnal Penelitian dan …","ojs.unsiq.ac.id","https://ojs.unsiq.ac.id/index.php/ppkm/article/view/353","https://scholar.google.com/scholar?cites=12339568993385967791&as_sdt=2005&sciodt=0,5&hl=en",26,"2019-11-13","","","","",,,,,2,0.67,1,3,3
0,"R Munthe, PI Santosa, R Ferdiana","IMPLEMENTASI PERCEPTUAL USER INTERFACE PADA VIRTUAL MUSIC INSTRUMENT",2016,"SEMNASTEKNOMEDIA …","ojs.amikom.ac.id","https://www.ojs.amikom.ac.id/index.php/semnasteknomedia/article/view/1272","",27,"2019-11-13","","","","",,,,,0,0.00,0,3,3
8,"AA Ali, EE Pramana, SS Tjandra","Evaluasi Heuristik Pada Web Based Learning Untuk Meningkatkan Aspek Usability Sistem",2016,"Insand Comtech: Information …","ejournal.unira.ac.id","http://ejournal.unira.ac.id/index.php/insand_comtech/article/view/102","https://scholar.google.com/scholar?cites=15305281121849710093&as_sdt=2005&sciodt=0,5&hl=en",28,"2019-11-13","","","","",,,,,8,2.67,3,3,3
0,"S MUJAHIDIN","Pengembangan Sistem 3D Gaze Tracking berbasis Eye Tribe Tracker untuk Meningkatkan Akurasi Perpotongan Pandangan 3D pada Ruang Nyata",2016,"","etd.repository.ugm.ac.id","http://etd.repository.ugm.ac.id/index.php?act=view&buku_id=106317&mod=penelitian_detail&sub=PenelitianDetail&typ=html","",29,"2019-11-13","","","","",,,,,0,0.00,0,1,3
0,"NK Tachjar","Analisis User Friendly Antar Muka Menu Automated Teller Machine (ATM) Dengan Menggunakan Metode TAM",2016,"","repository.perbanas.id","http://repository.perbanas.id/xmlui/handle/123456789/1662","",30,"2019-11-13","","","","",,,,,0,0.00,0,1,3
0,"T Darmanto","PERANCANGAN PROTOTIPE PEMBUKA PINTU DAN PENCATAT KEHADIRAN MENGGUNAKAN MIKROKONTROLER DAN TEKNOLOGI RFID",2016,"INTEKSIS","journal.widyadharma.ac.id","http://journal.widyadharma.ac.id/index.php/inteksis/article/view/124","",31,"2019-11-13","","","","",,,,,0,0.00,0,1,3
0,"AD Suriyanto","PENGGELOLAAN KOTAK REVIEW/ULASAN PADA SISTEM PENJUALAN PADA TOKO ONLINE",2016,"Jurnal Komunikasi","ejournal.bsi.ac.id","http://ejournal.bsi.ac.id/ejurnal/index.php/jkom/article/view/1494","",32,"2019-11-13","","","","",,,,,0,0.00,0,1,3
0,"GA Sandi","SISTEM INFORMASI BERBASIS WEBSITE PADA CV. PIXEL DIGITAL PRINTING SURABAYA",2016,"","repository.nscpolteksby.ac.id","http://repository.nscpolteksby.ac.id/92/","",33,"2019-11-13","","","","",,,,,0,0.00,0,1,3
0,"A Susanto, A Noertjahyana, A Setiawan","Aplikasi Pengelola Keuangan Pribadi Berbasis Android",2016,"Jurnal Infra","publication.petra.ac.id","http://publication.petra.ac.id/index.php/teknik-informatika/article/view/4539","",34,"2019-11-13","","","","",,,,,0,0.00,0,3,3
0,"F DwikaAinunIlmi","Perancangan Kendali Keyboard Virtual Hemocs Pada Perangkat Berbasis Ios Dengan Teknik Free Movement",2016,"","repository.ub.ac.id","http://repository.ub.ac.id/id/eprint/147233","",35,"2019-11-13","","","","",,,,,0,0.00,0,1,3
0,"AO Putra","LKP: Sistem Informasi Berbasis Web Pada TX Travel Sriwijaya",2016,"","repository.dinamika.ac.id","http://repository.dinamika.ac.id/id/eprint/1953/","",36,"2019-11-13","","","","",,,,,0,0.00,0,1,3
0,"Y Lahagu, N Sitompul","PERANCANGAN APLIKASI PEMBELAJARAN TEKNOLOGI INFORMASI KOMUNIAKSI (TIK) DENGAN MENGGUNAKAN METODE COMPUTER BASED …",2016,"Jurnal Ilmiah INFOTEK","ejurnal.amikstiekomsu.ac.id","https://ejurnal.amikstiekomsu.ac.id/index.php/infotek/article/view/92","",37,"2019-11-13","","","","",,,,,0,0.00,0,2,3
0,"M Fuad","LKP: Rancang Bangun Aplikasi Jasa Pengiriman Berbasis Web Pada Rush Kurir Surabaya",2016,"","repository.dinamika.ac.id","http://repository.dinamika.ac.id/id/eprint/1912/","",38,"2019-11-13","","","","",,,,,0,0.00,0,1,3
0,"S Samudi","Penerapan Fuzzy Inference System untuk Keberhasilan Penggunaan Animasi Interaktif Tingkat Sekolah Dasar",2016,"Jurnal Techno Nusa Mandiri","ejournal.nusamandiri.ac.id","http://ejournal.nusamandiri.ac.id/index.php/techno/article/view/213","",39,"2019-11-13","","","","",,,,,0,0.00,0,1,3
0,"NATS Kurniawan, IPW Buana…","Rancang Bangun Game “Who Wants To Be A Brillianaire” Berbasis Android",2016,"Jurnal Ilmiah Merpati …","ocs.unud.ac.id","https://ocs.unud.ac.id/index.php/merpati/article/view/17887","",40,"2019-11-13","","","","",,,,,0,0.00,0,3,3
0,"FAS Efendi, R Purwaningsih…","Media Perancangan Sistem Informasi Akademis Universitas Diponegoro Berbasis Android Menggunakan Metode User Centered Design",2016,"Industrial Engineering …","ejournal3.undip.ac.id","https://ejournal3.undip.ac.id/index.php/ieoj/article/view/11899","",41,"2019-11-13","","","","",,,,,0,0.00,0,3,3
0,"C SATYA CHANDRA","PEMBUATAN MEDIA PEMBELAJARAN MENGENAL LAMBANG-LAMBANG BUDDHIS UNTUK KELAS 1 SD TAMAN MUDA IBU PAWIYATAN TAMANSISWA …",2016,"","eprints.uad.ac.id","http://eprints.uad.ac.id/9962/1/KP_11018185_JUDUL.pdf","",42,"2019-11-13","PDF","","","",,,,,0,0.00,0,1,3
0,"I HUDIYA","Information Retrieval Pencarian Judul Buku Berbahasa Indonesia di Universitas Muhammadiyah Gresik dengan Menggunakan Single Linkage Hierarchical Method",2016,"","eprints.umg.ac.id","http://eprints.umg.ac.id/2003/","",43,"2019-11-13","","","","",,,,,0,0.00,0,1,3
0,"A Muqtadir, B Pramono, IP Ningrum","PENGENDALI FUNGSI POINTER BERBASIS HAND GESTURE MENGGUNAKAN ALGORITMA CONVEX HULL",2016,"semanTIK","ojs.uho.ac.id","http://ojs.uho.ac.id/index.php/semantik/article/viewFile/735/485","",44,"2019-11-13","PDF","","","",,,,,0,0.00,0,3,3
1,"BD Bernadhi, S Saptadi","Perancangan Integrasi Sistem Informasi Akademik Dengan E-learning (Studi Kasus: Program Studi Xyz)",2016,"J@ ti Undip: Jurnal Teknik Industri","ejournal.undip.ac.id","https://ejournal.undip.ac.id/index.php/jgti/article/view/12945","https://scholar.google.com/scholar?cites=4428307687478397972&as_sdt=2005&sciodt=0,5&hl=en",45,"2019-11-13","","","","",,,,,1,0.33,1,2,3
0,"U Rosyidah","USER INTERFACE DALAM DESAIN MODEL PENAKSIR RESPON EMOSI",2016,"Techno. Com","publikasi.dinus.ac.id","http://publikasi.dinus.ac.id/index.php/technoc/article/view/1236","",46,"2019-11-13","","","","",,,,,0,0.00,0,1,3
5,"I Wijaya, R Sefriani","Interactive Multimedia CD Design Chemistry Lesson In Concept Training Material and amendment For Class X Vocational High School (SMK)",2016,"JOURNAL OF DYNAMICS …","ejournal.kopertis10.or.id","http://ejournal.kopertis10.or.id/index.php/dynamics/article/view/934","https://scholar.google.com/scholar?cites=8038279222000691024&as_sdt=2005&sciodt=0,5&hl=en",47,"2019-11-13","","","","",,,,,5,1.67,3,2,3
0,"L Supardi, M Mudjiran, S Marsidin","Kontribusi Konsep Diri dan Kebutuhan Berafilasi terhadap Interaksi Sosial Siswa Sekolah Menengah Pertama",2016,"JPPI (Jurnal Penelitian …","jurnal.iicet.org","http://jurnal.iicet.org/index.php/jppi/article/view/138","",48,"2019-11-13","","","","",,,,,0,0.00,0,3,3
0,"VM Rumata","The Opportunities and Challenges of the Big Data Implementation in Social Science Research: a Literature Review-Peluang Dan Tantangan Big Data Dalam …",,"Jurnal Penelitian Komunikasi dan Opini Publik","academia.edu","http://www.academia.edu/download/53930479/Jurnal_Vol_20_No_2_-_Cetak_Lepas_5.pdf","",49,"2019-11-13","PDF","","","",,,,,0,0.00,0,1,
0,"H Oktavianto","Perancangan Aplikasi Permainan Strategi Battle Ship Menggunakan VB. NET",2016,"INTEKSIS","journal.widyadharma.ac.id","http://journal.widyadharma.ac.id/index.php/inteksis/article/view/100","",50,"2019-11-13","","","","",,,,,0,0.00,0,1,3
0,"DP Viko","Penerapan teknik simulasi untuk analisa data prediksi waktu pada halte bus",2016,"","kc.umn.ac.id","http://kc.umn.ac.id/id/eprint/1277","",51,"2019-11-13","","","","",,,,,0,0.00,0,1,3
0,"H Hartini","EFEKTIVITAS LABORATORIUM KOMPUTER DALAM PENINGKATAN KOMPETENSI SISWA DI MADRASAH ALIYAH NEGERI KABUPATEN TANA TORAJA",2016,"JURNAL KEPENDIDIKAN MEDIA: TEKNOLOGI …","jurnal.unismuh.ac.id","https://jurnal.unismuh.ac.id/index.php/media/article/view/2637","",52,"2019-11-13","","","","",,,,,0,0.00,0,1,3
1,"Y Yulmaini","Penggunaan Metode Fuzzy Inference System (Fis) Mamdani Dalam Pemilihan Peminatan Mahasiswa Untuk Tugas Akhir",,"Jurnal Informatika Darmajaya","neliti.com","https://www.neliti.com/publications/101327/penggunaan-metode-fuzzy-inference-system-fis-mamdani-dalam-pemilihan-peminatan-m","https://scholar.google.com/scholar?cites=10567388954733157783&as_sdt=2005&sciodt=0,5&hl=en",53,"2019-11-13","","","","",,,,,1,0.00,1,1,
0,"D Arifianto, TD Susanto","Layanan Tanya Jawab E-Government Tingkat Kecamatan Berbasis Short Message Service",2016,"JUSTINDO (Jurnal Sistem dan …","jurnal.unmuhjember.ac.id","http://jurnal.unmuhjember.ac.id/index.php/JUSTINDO/article/view/238","",54,"2019-11-13","","","","",,,,,0,0.00,0,2,3
0,"AC Wibowo, D Alexandra…","WEB BASED BIOLOGY INSTRUCTIONAL SOFTWARE ON BIOTIC AND ABIOTIC NATURAL SYMPTOMS FOR GRADE 7",2016,"Teknik dan Ilmu …","ejournal.ukrida.ac.id","http://ejournal.ukrida.ac.id/ojs/index.php/TIK/article/view/1100","",55,"2019-11-13","CITATION","","","",,,,,0,0.00,0,3,3
0,"FR Tijan, AT Rianto, N Afina…","GAME"" FIX OUR ENVIRONMENT"" APPLICATIONS DESIGN BASED ON ANDROID",2016,"Teknik dan Ilmu …","ejournal.ukrida.ac.id","http://ejournal.ukrida.ac.id/ojs/index.php/TIK/article/view/1152","",56,"2019-11-13","CITATION","","","",,,,,0,0.00,0,4,3
0,"R Heni, M Marjohan, A Alizamar","Kontribusi Self Esteem dan Self Control terhadap Kecanduan Game Online",2016,"JPPI (Jurnal Penelitian Pendidikan …","jurnal.iicet.org","http://jurnal.iicet.org/index.php/jppi/article/view/144/159","",57,"2019-11-13","","","","",,,,,0,0.00,0,3,3
1,"H Oktafitriani, G Hermana, MF Perdana…","WEB BASED INTERACTIVE MULTIMEDIA APPLICATIONS IN THE RESTURANT"" TEA ADDICT""",2016,"Teknik dan Ilmu …","ejournal.ukrida.ac.id","http://ejournal.ukrida.ac.id/ojs/index.php/TIK/article/view/1138","https://scholar.google.com/scholar?cites=16646868177654990426&as_sdt=2005&sciodt=0,5&hl=en",58,"2019-11-13","CITATION","","","",,,,,1,0.33,0,4,3
0,"FA RAMA","IMPLEMENTASI SISTEM INFORMASI PERPUSTAKAAN DIGITAL BERBASIS WEB (STUDI KASUS: PT JAWAPOS KORAN)",,"","","","",59,"2019-11-13","CITATION","","","",,,,,0,0.00,0,1,
0,"RF Ramadhan","TUGAS AKHIR IMK ANALISIS BLOOPER PADA WEBSITE BADAN PUSAT STATISTIK",,"academia.edu","","http://www.academia.edu/download/43925053/12.7353_Riza_F_Ramadhan_TUGAS_AKHIR_IMK.pdf","",60,"2019-11-13","PDF","","","",,,,,0,0.00,0,1,
1,"R Dawood","Embedding HCI in Computer Science Education: A Preliminary Attempt",2016,"Proceedings of the 2nd International Conference in …","dl.acm.org","https://dl.acm.org/citation.cfm?id=2898465","https://scholar.google.com/scholar?cites=16289371561629567451&as_sdt=2005&sciodt=0,5&hl=en",61,"2019-11-13","","","","",,,,,1,0.33,1,1,3
0,"PA Christianto, EB Susanto…","PENGUATAN CITRA PEKALONGAN SEBAGAI KOTA BATIK MELALUI PEMBANGUNAN PUSAT INFORMASI UMKM BATIK BERBASIS MOBILE YANG MAMPU …",2016,"JURNAL LITBANG …","jurnal.pekalongankota.go.id","https://jurnal.pekalongankota.go.id/index.php/litbang/article/view/1","",62,"2019-11-13","","","","",,,,,0,0.00,0,3,3
0,"K Mitra","ANALISIS WEBSITE SEKOLAH KRISTA MITRA DENGAN METODE PIECES",,"mahasiswa.dinus.ac.id","","http://mahasiswa.dinus.ac.id/docs/skripsi/jurnal/19017.pdf","",63,"2019-11-13","PDF","","","",,,,,0,0.00,0,1,
0,"O Yuliani, J Prasojo","Abdurachman, Lukmanul H., Herri G.,(2014), Penerapan Pusat Listrik Tenaga Surya (PLTS) sebagai Sumber Energi Pompa Sirkulasi Air Tambak Ikan Air …",2016,"ReTII","journal.itny.ac.id","https://journal.itny.ac.id/index.php/ReTII/article/view/435","",64,"2019-11-13","HTML","","","",,,,,0,0.00,0,2,3
1,"D Lasut, S Haryanto","Perancangan Aplikasi Pengenalan Tempat Wisata di Jawa Barat Berbasis Multimedia",2016,"Jurnal Sisfokom (Sistem Informasi dan …","jurnal.atmaluhur.ac.id","http://jurnal.atmaluhur.ac.id/index.php/sisfokom/article/view/25","https://scholar.google.com/scholar?cites=235841749754455773&as_sdt=2005&sciodt=0,5&hl=en",65,"2019-11-13","","","","",,,,,1,0.33,1,2,3
8,"MZ Yumarlin","Evaluasi Penggunaan Website Universitas Janabadra Dengan Menggunakan Metode Usability Testing",2016,"Informasi Interaktif","e-journal.janabadra.ac.id","http://www.e-journal.janabadra.ac.id/index.php/informasiinteraktif/article/view/345","https://scholar.google.com/scholar?cites=17541095728760532469&as_sdt=2005&sciodt=0,5&hl=en",66,"2019-11-13","","","","",,,,,8,2.67,8,1,3
0,"M Mustakim, HE Saputra…","MEMBANGUN WEB ENGINEERING PUZZLE RESEARCH DATA MINING MENGGUNAKAN MODEL NAVIGATIONAL DEVELOPMENT TECHNIQUE",2016,"… Ilmiah Rekayasa dan …","ejournal.uin-suska.ac.id","http://ejournal.uin-suska.ac.id/index.php/RMSI/article/view/1685","",67,"2019-11-13","","","","",,,,,0,0.00,0,3,3
0,"ST Ade Bastian, M Kom","SISTEM PAKAR PENYAKIT MATA DENGAN WML DAN PHP PADA PERANGKAT MOBILE",,"academia.edu","","http://www.academia.edu/download/42916849/SISTEM_PAKAR_PENYAKIT_MATA_DENGAN_WML_DAN_PHP_PADA_PERANGKAT_MOBILE.pdf","",68,"2019-11-13","PDF","","","",,,,,0,0.00,0,2,
12,"D Rosadi, FO Andriawan","Aplikasi sistem informasi pencarian tempat kos di kota bandung berbasis android",2016,"Jurnal Computech & Bisnis","jurnal.stmik-mi.ac.id","http://www.jurnal.stmik-mi.ac.id/index.php/jcb/article/view/145","https://scholar.google.com/scholar?cites=291870394023183846&as_sdt=2005&sciodt=0,5&hl=en",69,"2019-11-13","","","","",,,,,12,4.00,6,2,3
0,"A Siswanto, GW Sasmito…","Aplikasi Pengolahan Gaji Karyawan Pada Karlita International Hotel",2016,"Jurnal Informatika …","ejournal.poltektegal.ac.id","http://ejournal.poltektegal.ac.id/index.php/informatika/article/viewFile/332/326","",70,"2019-11-13","PDF","","","",,,,,0,0.00,0,3,3
4,"CR Pasalli, V Poekoel, X Najoan","Sistem Pakar Diagnosa Penyakit Anak Menggunakan Metode Forward Chaining Berbasis Mobile",2016,"Jurnal Teknik Informatika","ejournal.unsrat.ac.id","https://ejournal.unsrat.ac.id/index.php/informatika/article/view/12828","https://scholar.google.com/scholar?cites=15673332893156332659&as_sdt=2005&sciodt=0,5&hl=en",71,"2019-11-13","","","","",,,,,4,1.33,1,3,3
0,"D Susanti, E Rusnandi","Simulasi Aplikatif Pembuatan Pupuk Organik Cair dan Kompos Pada BPLH Majalengka",2016,"INFOTECH journal","jurnal.unma.ac.id","https://www.jurnal.unma.ac.id/index.php/infotech/article/view/28","",72,"2019-11-13","","","","",,,,,0,0.00,0,2,3
0,"F Fransisca, YR Isak","Perancangan Aplikasi Alat Bantu Ajar Tebak Gambar Dengan Visual Studio 2010 Pada Sekolah Dasar Perguruan Buddhi",2016,"Jurnal Sisfokom (Sistem Informasi dan …","jurnal.atmaluhur.ac.id","http://jurnal.atmaluhur.ac.id/index.php/sisfokom/article/view/27","",73,"2019-11-13","","","","",,,,,0,0.00,0,2,3
0,"NTS Saptadi, RB Wongardi","PERANCANGAN APLIKASI PEMBELAJARAN AKSARA UNTUK MENINGKATKAN KEMAMPUAN MASYARAKAT BUTA AKSARA",2016,"SEMNASTEKNOMEDIA ONLINE","ojs.amikom.ac.id","https://www.ojs.amikom.ac.id/index.php/semnasteknomedia/article/view/1312","",74,"2019-11-13","","","","",,,,,0,0.00,0,2,3
2,"TR Widodo, A Setiawan, S Rostianingsih","Pembuatan Aplikasi Pembelajaran “Ikatan Kimia” dengan Memanfaatkan Augmented Reality",2016,"Jurnal Infra","publication.petra.ac.id","http://publication.petra.ac.id/index.php/teknik-informatika/article/view/4517","https://scholar.google.com/scholar?cites=13737808471220953262&as_sdt=2005&sciodt=0,5&hl=en",75,"2019-11-13","","","","",,,,,2,0.67,1,3,3
0,"KT Martono","RANCANG BANGUN MEDIA PENGENALAN RAMBU-RAMBULALULINTAS DENGANMEMANFAATKAN TEKNOLOGIAUGMENTED REALITY",,"ejournal.uksw.edu","","https://ejournal.uksw.edu/aiti/article/view/1262","",76,"2019-11-13","","","","",,,,,0,0.00,0,1,
0,"B Budiman","Rancang Bangun Apliaksi Sistem Absensi Pegawai Koperasi Saluyu Kabupaten Majalengka",2016,"INFOTECH journal","jurnal.unma.ac.id","https://www.jurnal.unma.ac.id/index.php/infotech/article/view/27","",77,"2019-11-13","","","","",,,,,0,0.00,0,1,3
3,"PM Herlambang, L Aryoseto","Potensi Virtual Reality Berbasis Smartphone sebagai Media Belajar Mahasiswa Kedokteran",2016,"Cermin Dunia Kedokteran","cdkjournal.com","http://www.cdkjournal.com/index.php/CDK/article/view/67","https://scholar.google.com/scholar?cites=3006764319782809983&as_sdt=2005&sciodt=0,5&hl=en",78,"2019-11-13","","","","",,,,,3,1.00,2,2,3
4,"PI Hidayati","OPTIMALISASI PENGEMBANGAN BLENDED LEARNING BERBASIS MOODLE UNTUK MATAKULIAH MIKROBIOLOGI OPTIMIZATION DEVELOPMENT BASED …",2016,"Jurnal Inspirasi Pendidikan","ejournal.unikama.ac.id","http://ejournal.unikama.ac.id/index.php/jrnspirasi/article/view/1328","https://scholar.google.com/scholar?cites=13703470352979399491&as_sdt=2005&sciodt=0,5&hl=en",79,"2019-11-13","","","","",,,,,4,1.33,4,1,3
7,"E Kuntarto, R Asyhar","Pengembangan Model Pembelajaran Blended Learning Pada Aspek Learning Design Dengan Platform Media Sosial Online Sebagai Pendukung Perkuliahan …",2016,"Repository Unja","repository.unja.ac.id","http://repository.unja.ac.id/id/eprint/626","https://scholar.google.com/scholar?cites=7099956124951322031&as_sdt=2005&sciodt=0,5&hl=en",80,"2019-11-13","","","","",,,,,7,2.33,4,2,3
2,"M Pangkey, V Poekoel, O Lantang","Sistem Pakar Pendeteksi Kerusakan Handphone Berbasis Android",2016,"Jurnal Teknik Informatika","ejournal.unsrat.ac.id","https://ejournal.unsrat.ac.id/index.php/informatika/article/view/12825","https://scholar.google.com/scholar?cites=9740442504025345303&as_sdt=2005&sciodt=0,5&hl=en",81,"2019-11-13","","","","",,,,,2,0.67,1,3,3
