Cites,Authors,Title,Year,Source,Publisher,ArticleURL,CitesURL,GSRank,QueryDate,Type,DOI,ISSN,CitationURL,Volume,Issue,StartPage,EndPage,ECC,CitesPerYear,CitesPerAuthor,AuthorCount,Age
0,"IN Fajri, SA Syahdan","SISTEM PENDUKUNG KEPUTUSAN PEMBERIAN KREDIT USAHA MIKRO PADA BANK MANDIRI GOMBONG",2015,"Jurnal Teknologi Informasi Respati","jti.respati.ac.id","http://jti.respati.ac.id/index.php/jurnaljti/article/view/128","",646,"2019-07-09","","","","",,,,,0,0.00,0,2,4
0,"I Wahyu Istiono","PENERAPAN METODE WEIGHT PRODUCT DALAM SISTEM PENDUKUNG KEPUTUSAN KELAYAKAN TKI KE LUAR NEGERI",2015,"","eprints.sinus.ac.id","https://eprints.sinus.ac.id/407/","",647,"2019-07-09","","","","",,,,,0,0.00,0,1,4
0,"AA NADHIF","Sistem Pendukung Keputusan Untuk Seleksi Pegawai Baru Pada Pr. Janur Kuning Menggunakan Metode Topsis Berbasis Web",2015,"","eprints.umk.ac.id","http://eprints.umk.ac.id/4219/","",648,"2019-07-09","","","","",,,,,0,0.00,0,1,4
0,"W Setyaningsih","Sistem Pendukung Keputusan dalam Penentuan Bundling Penjualan Barang dengan Metode Apriori",,"neliti.com","","https://www.neliti.com/publications/185007/sistem-pendukung-keputusan-dalam-penentuan-bundling-penjualan-barang-dengan-meto","",649,"2019-07-09","","","","",,,,,0,0.00,0,1,
0,"M Xurniawati","Sistem Pendukung Keputusan Pemilihan Siswa Calon Lomba Keterampilan Siswa Pada Smk Tamansiswa Kudus",2015,"","eprints.umk.ac.id","http://eprints.umk.ac.id/5288/","",650,"2019-07-09","","","","",,,,,0,0.00,0,1,4
0,"NS PUTRA, DPAS Kom","SISTEM PENDUKUNG KEPUTUSAN MENENTUKAN PERKEBUNAN BUAH KAKAO TERHADAP HASIL PRODUKSI DI DINAS KEHUTANAN DAN …",2015,"JOSINFO: Jurnal Online Sistem …","ejournal.stikom-bali.ac.id","http://www.ejournal.stikom-bali.ac.id/index.php/josinfo/article/view/652","",651,"2019-07-09","","","","",,,,,0,0.00,0,2,4
0,"GA Prabowo, B Noranita","SISTEM PENDUKUNG KEPUTUSAN PENENTUAN PEMINATAN PESERTA DIDIK MENGGUNAKAN METODE WEIGHTED PRODUCT BERBASIS WEB",2015,"","eprints.undip.ac.id","http://eprints.undip.ac.id/59392/","",652,"2019-07-09","","","","",,,,,0,0.00,0,2,4
0,"IGY Kharisma","Sistem Pendukung Keputusan Menentukan Jurusan Pada SMA Negeri 1 Baturiti Dengan Menggunakan Metode MFEP (Multifactor Evalaution Process)",2015,"JOSINFO: Jurnal Online Sistem …","ejournal.stikom-bali.ac.id","http://www.ejournal.stikom-bali.ac.id/index.php/josinfo/article/view/81","",653,"2019-07-09","","","","",,,,,0,0.00,0,1,4
0,"R Faslah","sistem pendukung keputusan penyeleksian beasiswa menggunakan metode weighted product pada bagian akademik politeknik negeri Banjarmasin",2015,"POLHASAINS","ejournal.polihasnur.ac.id","http://ejournal.polihasnur.ac.id/index.php/phssains/article/view/230","",654,"2019-07-09","","","","",,,,,0,0.00,0,1,4
0,"W Partana, IMA Suyadnya, W Setiawan","SISTEM PENDUKUNG KEPUTUSAN PENILAIAN SERTIFIKASI GURU POLA PLPG DENGAN METODE PROMETHEE BERBASIS WEB",2015,"Jurnal SPEKTRUM","ojs.unud.ac.id","https://ojs.unud.ac.id/index.php/spektrum/article/view/20005","",655,"2019-07-09","","","","",,,,,0,0.00,0,3,4
0,"AR Sanjaya, S Hanief…","SISTEM PENDUKUNG KEPUTUSAN PEMILIHAN TIPE SEPEDA GUNUNG MENGGUNAKAN METODE SAW (SIMPLE ADDITIVE WEIGHTING)",2015,"… : Jurnal Online Sistem …","ejournal.stikom-bali.ac.id","http://ejournal.stikom-bali.ac.id/index.php/josikom/article/view/57","",656,"2019-07-09","","","","",,,,,0,0.00,0,3,4
0,"BA Minartiningtyas, AS Kusuma","Sistem Pendukung Keputusan Penentuan Penerima Bantuan Keluarga Kurang Mampu Menggunakan Metode Ahp Dan Topsis",2015,"S@ CIES","ejournal.stiki-indonesia.ac.id","https://ejournal.stiki-indonesia.ac.id/index.php/sacies/article/view/56","",657,"2019-07-09","","","","",,,,,0,0.00,0,2,4
0,"S Adi Wibowo, Y Agus Pranoto","APLIKASI SISTEM PENDUKUNG KEPUTUSAN SEBAGAI FILTER PENERIMA BEASISWA MENGGUNAKAN MODEL ANALYTICAL HIERARCHY PROCESS",2015,"INDUSTRI INOVATIF","eprints.itn.ac.id","http://eprints.itn.ac.id/3391/","",658,"2019-07-09","","","","",,,,,0,0.00,0,2,4
0,"IR SYAHPUTRI","Sistem Pendukung Keputusan Analisis Pola Pembelian Produk Dengan Metode Algoritma Apriori",2015,"","Universitas Potensi Utama","","",659,"2019-07-09","CITATION","","","",,,,,0,0.00,0,1,4
0,"IM Nur","SISTEM PENDUKUNG KEPUTUSAN PEMILIHAN LAPTOP MENGGUNAKAN METODE SAW (SIMPLE ADDITIVE WEIGHTING) PADA CV ANAVISIA …",,"mahasiswa.dinus.ac.id","","http://mahasiswa.dinus.ac.id/docs/skripsi/jurnal/14864.pdf","",660,"2019-07-09","PDF","","","",,,,,0,0.00,0,1,
0,"DG Pratama","SISTEM PENDUKUNG KEPUTUSAN PEMILIHAN SPARE PART PADA BENGKEL PRATAMA MOTOR DENGAN METODE WEIGHTED PRODUCT",,"mahasiswa.dinus.ac.id","","http://mahasiswa.dinus.ac.id/docs/skripsi/jurnal/16468.pdf","",661,"2019-07-09","PDF","","","",,,,,0,0.00,0,1,
0,"A Aridho","Aplikasi sistem pendukung keputusan diagnosa penyakit setelah melahirkan dengan metode forward chaining dan logika fuzzy",2015,"","digilib.uinsgd.ac.id","http://digilib.uinsgd.ac.id/id/eprint/19701","",662,"2019-07-09","","","","",,,,,0,0.00,0,1,4
0,"P Parjono, WW Winarno, ET Luthfi","SISTEM PENDUKUNG KEPUTUSAN MENENTUKAN KELAYAKAN REKONSTRUKSI RUMAH MISKIN (Studi Kasus: Kabupaten Klaten)",2015,"Jurnal Teknologi Informasi …","jti.respati.ac.id","http://jti.respati.ac.id/index.php/jurnaljti/article/view/129","",663,"2019-07-09","","","","",,,,,0,0.00,0,3,4
0,"S Marliyanti, S Perdana, S Mawlan","Sistem Pendukung Keputusan Untuk Menentukan Tata Letak Cabang Pabrik Pada PTPN VII Cintamanis",,"eprints.mdp.ac.id","","http://eprints.mdp.ac.id/1462/","",664,"2019-07-09","","","","",,,,,0,0.00,0,3,
0,"DRP ANGGRAINI","SISTEM PENDUKUNG KEPUTUSAN PENENTUAN LOKASI PEMBANGUNAN CABANG BARU USAHA KULINER MENGGUNAKAN METODE TOPSIS",2015,"","eprints.umm.ac.id","http://eprints.umm.ac.id/22449/","",665,"2019-07-09","","","","",,,,,0,0.00,0,1,4
0,"GA Candra, R Rawansyah…","Sistem Pendukung Keputusan Pemilihan Mahasiswa Berprestasi dengan Metode Fuzzy Multi-attribute Decision Making Saw",2015,"Jurnal Informatika …","jip.polinema.ac.id","http://jip.polinema.ac.id/ojs3/index.php/jip/article/view/108","",666,"2019-07-09","","","","",,,,,0,0.00,0,3,4
0,"A Kusumaningrum","PERANCANGAN SISTEM PENDUKUNG KEPUTUSAN KESESUAIAN LOKASI TERNAK RUMINANSIA DITINJAU DARI ASPEK SOSIAL EKONOMI",,"stta.ac.id","","http://stta.ac.id/data_lp3m/10.Mei2015_Anggraini.pdf","",667,"2019-07-09","PDF","","","",,,,,0,0.00,0,1,
0,"A Riyanto","Penerapan sistem pendukung keputusan dengan metode (Topsis) penilaian kinerja karyawan (Studi kasus: Dharma Wanita persatuan Kementrian Pekerjaan Umum) …",2015,"","eprints.unpam.ac.id","http://eprints.unpam.ac.id/835/","",668,"2019-07-09","","","","",,,,,0,0.00,0,1,4
0,"M Marlindawati, S Muhammad Sobri","Implementasi Sistem Pendukung Keputusan untuk Menentukan Penerima Dana Bantuan (Studi Kasus Kabupaten Banyuasin)",,"BE"" TRIK","eprints.binadarma.ac.id","http://eprints.binadarma.ac.id/2583/","",669,"2019-07-09","","","","",,,,,0,0.00,0,2,
0,"R PAHLAWAN","Sistem Pendukung Keputusan Seleksi Pegawai Kecamatan baru di Kecamatan Medan Timur Dengan Menggunakan Metode Analytical Hierarchy …",2015,"","Universitas Potensi Utama","","",670,"2019-07-09","CITATION","","","",,,,,0,0.00,0,1,4
0,"PTBPRLG PERCUT","SISTEM PENDUKUNG KEPUTUSAN PEMBERIAN PINJAMAN TERHADAP NASABAH DENGAN METODE SIMPLE ADDITIVE WEIGHTING (SAW) STUDI …",,"researchgate.net","","https://www.researchgate.net/profile/Tonni_Limbong2/publication/305443418_SISTEM_PENDUKUNG_KEPUTUSAN_PEMBERIAN_PINJAMAN_TERHADAP_NASABAH_DENGAN_METODE_SIMPLE_ADDITIVE_WEIGHTING_SAW_STUDI_KASUS_PT_BPR_LAKSANA_GUNA_PERCUT/links/578f51bf08ae9754b7ecea6a/SISTEM-PENDUKUNG-KEPUTUSAN-PEMBERIAN-PINJAMAN-TERHADAP-NASABAH-DENGAN-METODE-SIMPLE-ADDITIVE-WEIGHTING-SAW-STUDI-KASUS-PT-BPR-LAKSANA-GUNA-PERCUT.pdf","",671,"2019-07-09","PDF","","","",,,,,0,0.00,0,1,
0,"MB Faizin","SISTEM PENDUKUNG KEPUTUSAN PREDIKSI HARGA SEPEDA MOTOR BEKAS MENGGUNAKAN METODE FUZZY TSUKAMOTO BERBASIS WEB MOBILE",,"academia.edu","","http://www.academia.edu/download/38629412/JURNAL_SKRIPSI1.pdf","",672,"2019-07-09","PDF","","","",,,,,0,0.00,0,1,
0,"NUR KHOLIQ","SISTEM PENDUKUNG KEPUTUSAN DALAM PEMILIHAN MOTOR BEBEK DENGAN MENGGUNAKAN METODE SIMPLE ADDITIVE WEIGHTING (SAW)",,"simki.unpkediri.ac.id","","http://simki.unpkediri.ac.id/mahasiswa/file_artikel/2015/10.1.03.03.0148.pdf","",673,"2019-07-09","PDF","","","",,,,,0,0.00,0,1,
0,"D Firmawan, ST Fatah Yasin","Sistem Pendukung Keputusan Dalam Penentuan Guru Teladan Berdasarkan Kinerjanya Menggunakan Metode Weighted Product Berbasis Web",2015,"","eprints.ums.ac.id","http://eprints.ums.ac.id/id/eprint/39616","",674,"2019-07-09","","","","",,,,,0,0.00,0,2,4
0,"IGAG PUTRI","“Sistem Pendukung Keputusan Penentuan Lokasi Pembangunan Tempat Usaha Bengkel Sepeda Motor Dengan Menggunakan Metode SAW (Simple …",2015,"","UNIVERSITAS POTENSI UTAMA","","",675,"2019-07-09","CITATION","","","",,,,,0,0.00,0,1,4
0,"MAB Santosa","IPLEMENTASI FUZZY SUGENO DAN FORWARD CHAINING PADA SISTEM PENDUKUNG KEPUTUSAN PENGATURAN NUTRISI DAN MAKANAN ATLET",2015,"","repository.upi.edu","http://repository.upi.edu/id/eprint/20612","",676,"2019-07-09","","","","",,,,,0,0.00,0,1,4
0,"DR Prehanto, WS Pramono","SISTEM PENDUKUNG KEPUTUSAN MENENTUKAN LOKASI SPBU BERBASIS WEB (STUDI KASUS: SPBU 54.61126 JL. RAYA BENJENG-GRESIK)",2015,"Jurnal Manajemen …","jurnalmahasiswa.unesa.ac.id","https://jurnalmahasiswa.unesa.ac.id/index.php/jurnal-manajemen-informatika/article/view/12579","",677,"2019-07-09","","","","",,,,,0,0.00,0,2,4
0,"YA Wibowo","SISTEM PENDUKUNG KEPUTUSAN REKRUTMEN PEGAWAI DENGAN MENGGUNAKAN METODE SAW (SIMPLE ADDITIVE WEIGHTING)",,"mahasiswa.dinus.ac.id","","http://mahasiswa.dinus.ac.id/docs/skripsi/jurnal/15148.pdf","",678,"2019-07-09","PDF","","","",,,,,0,0.00,0,1,
0,"AH Siambaton","Sistem Pendukung Keputusan Pemilihan Gitar Berbasis Android Menggunakan Metode Weighted Sum Model",2015,"","repository.usu.ac.id","http://repository.usu.ac.id/handle/123456789/61930","",679,"2019-07-09","","","","",,,,,0,0.00,0,1,4
0,"DA Wulandari, NS Simin","Rancang Bangun Aplikasi Sistem Pendukung Keputusan dalam Rangka Meningkatkan Kinerja Pelayanan Pelanggan Listrik",2015,"STUDIA INFORMATIKA: JURNAL …","journal.uinjkt.ac.id","http://journal.uinjkt.ac.id/index.php/sisteminformasi/article/view/2175","",680,"2019-07-09","","","","",,,,,0,0.00,0,2,4
0,"A Fikri, S Sumiati…","Sistem Pendukung Keputusan Penerimaan Karyawan PT. Sigma Mitra Sejatimenggunakan Metode Fuzzy Mamdani",2015,"… Seminar Nasional Riset …","e-jurnal.lppmunsera.org","http://e-jurnal.lppmunsera.org/index.php/senasset/article/view/745","",681,"2019-07-09","","","","",,,,,0,0.00,0,3,4
0,"B SETYAJI","SISTEM PENDUKUNG KEPUTUSAN PENENTUAN KELAYAKAN TENAGA KERJA MENGGUNAKAN METODE NAIVE BAYES CLASSIFICATION",,"eprints.dinus.ac.id","","http://eprints.dinus.ac.id/16562/1/jurnal_15548.pdf","",682,"2019-07-09","PDF","","","",,,,,0,0.00,0,1,
0,"H HANDAYANI","Sistem Pendukung Keputusan Untuk Menentukan Tingkat Kedisiplinan Dan Sanksi Pelanggaran Siswa Di SMA N 1 Jatinom",2015,"","eprints.ums.ac.id","http://eprints.ums.ac.id/id/eprint/39914","",683,"2019-07-09","","","","",,,,,0,0.00,0,1,4
0,"RA Susanto","APLIKASI SISTEM PENDUKUNG KEPUTUSAN PENERIMAAN CALON PENGURUS OSIS BARU DENGAN METODE COMPOSITE PERFORMANCE INDEX (CPI) DI …",2015,"","eprints.amikompurwokerto.ac.id","http://eprints.amikompurwokerto.ac.id:8083/246/","",684,"2019-07-09","","","","",,,,,0,0.00,0,1,4
0,"MH Rohman, R Yunitarini","Sistem Pendukung Keputusan Penerimaan Mahasiswa Baru Menggunakan Metode Logika Fuzzy Model Sugeno",2015,"Rekayasa","infestasi.trunojoyo.ac.id","http://infestasi.trunojoyo.ac.id/rekayasa/article/view/5352","",685,"2019-07-09","","","","",,,,,0,0.00,0,2,4
0,"A Wijaya","Sistem Pendukung Keputusan Pemilihan Rumah Menggunakan Metode Analytic Hierarchy Process (AHP) Dan Brown Gibson",2015,"","repository.upi.edu","http://repository.upi.edu/17824/","",686,"2019-07-09","","","","",,,,,0,0.00,0,1,4
0,"AD Khafindin, A Kardianawati","SISTEM PENDUKUNG KEPUTUSAN PEMBELIAN KREDIT SEPEDA MOTOR MENGGUNAKAN FUZZY SYSTEM PADA DEALER YAMAHA",2015,"Techno. Com","publikasi.dinus.ac.id","http://publikasi.dinus.ac.id/index.php/technoc/article/view/882","",687,"2019-07-09","","","","",,,,,0,0.00,0,2,4
0,"HA Yudha, B Yuwono, FR Kodong","SISTEM PENDUKUNG KEPUTUSAN MENGGUNAKAN METODE PROMETHEE (STUDI KASUS: STASIUN PENGISIAN BAHAN BAKAR UMUM)",2015,"Telematika","jurnal.upnyk.ac.id","http://www.jurnal.upnyk.ac.id/index.php/telematika/article/view/444","",688,"2019-07-09","","","","",,,,,0,0.00,0,3,4
0,"B Sabella, O Soesanto, A Farmadi","SISTEM PENDUKUNG KEPUTUSAN PENENTUAN GIZI HARIAN ATLET SEPAKBOLA DENGAN METODE LINEAR PROGRAMMING (Studi KasusPada Martapura FC …",2015,"PHASTI","ejournal.polihasnur.ac.id","http://ejournal.polihasnur.ac.id/index.php/pha/article/view/177","",689,"2019-07-09","","","","",,,,,0,0.00,0,3,4
0,"KA Sutrisna, IKRY Negara…","SISTEM PENDUKUNG KEPUTUSAN PENENTUAN PENYAKIT MALARIA BERBASIS WINDOWS PHONE DENGAN METODE NAÏVE BAYES DAN CERTAINTY …",2015,"… : Jurnal Online Sistem …","ejournal.stikom-bali.ac.id","http://www.ejournal.stikom-bali.ac.id/index.php/josikom/article/view/124","",690,"2019-07-09","","","","",,,,,0,0.00,0,3,4
0,"Y Yunita, N Indrawati","Rancang Bangun Sistem Pendukung Keputusan Penerimaan Beasiswa Menggunakan Meotde Naive Bayes Classiffier",2015,"Prosiding Seminar Nasional ReTII","journal.sttnas.ac.id","https://journal.sttnas.ac.id/index.php/ReTII/article/view/65/0","",691,"2019-07-09","","","","",,,,,0,0.00,0,2,4
0,"J ATIKA","SISTEM PENDUKUNG KEPUTUSAN LOKASI PROMOSI PENERIMAAN MAHASISWA BARU MENGGUNAKAN METODE TOPSIS STUDI KASUS UNIV …",2015,"","Universitas Potensi Utama","","",692,"2019-07-09","CITATION","","","",,,,,0,0.00,0,1,4
0,"M Sulhan, D Tikasari","Sistem Pendukung Keputusan Kepuasan Mahasiswa terhadap Layanan Konseling di Universitas Kanjuruhan Malang Menggunakan Metode Servqual",,"Bimasakti","neliti.com","https://www.neliti.com/publications/183034/sistem-pendukung-keputusan-kepuasan-mahasiswa-terhadap-layanan-konseling-di-univ","",693,"2019-07-09","","","","",,,,,0,0.00,0,2,
0,"D PRANOTO","Pembuatan Sistem Pendukung Keputusan Pemilihan Tempat Kuliner dengan Metode Analytical Network Process Pada Website Portal Kuliner",2015,"","repository.ubaya.ac.id","http://repository.ubaya.ac.id/id/eprint/24115","",694,"2019-07-09","","","","",,,,,0,0.00,0,1,4
0,"Z SYIFA'UZ","MEMBANGUN SISTEM PENDUKUNG KEPUTUSAN PEMILIHAN JURUSAN BAGI CALON SISWA/I BARU DI SMKN 1 KEBONSARI KABUPATEN MADIUN DENGAN …",2015,"","eprints.umpo.ac.id","http://eprints.umpo.ac.id/1596/","",695,"2019-07-09","","","","",,,,,0,0.00,0,1,4
0,"RH Raharjo","SISTEM PENDUKUNG KEPUTUSAN PENENTUAN LAHAN TEBU TERBAIK MILIK PABRIK GULA KREBET BARU II MALANG",,"academia.edu","","http://www.academia.edu/download/38809346/jurnal_ryan.pdf","",696,"2019-07-09","PDF","","","",,,,,0,0.00,0,1,
0,"M Ama","SISTEM PENDUKUNG KEPUTUSAN UNTUK MENENTUKAN TIM UTAMA PEMAIN FUTSAL MENGGUNAKAN METODE ANALYTIC HIERRARCHY PROCESS (AHP)",2015,"","eprints.akakom.ac.id","http://eprints.akakom.ac.id/15/","",697,"2019-07-09","","","","",,,,,0,0.00,0,1,4
0,"G Saylendra","SISTEM PENDUKUNG KEPUTUSAN UNTUK PEMBELIAN RUMAH DENGAN MENGGUNAKAN METODE ANALITIC HIERARCHY PROCESS (AHP) PT SUMBER …",2015,"","eprints.akakom.ac.id","http://eprints.akakom.ac.id/340/","",698,"2019-07-09","","","","",,,,,0,0.00,0,1,4
0,"B Damanik","SISTEM PENDUKUNG KEPUTUSAN TERAPI PENDERITA DIABETES MELITUS TYPE 2 DENGAN METODE FUZZYTSUKAMOTO",2015,"JURNAL PENDIDIKAN TEKNOLOGI DAN …","jurnal.unimed.ac.id","https://jurnal.unimed.ac.id/2012/index.php/mbt/article/view/4639","",699,"2019-07-09","","","","",,,,,0,0.00,0,1,4
0,"M FERDIYANTO","Sistem Pendukung Keputusan Untuk Penilaian Preferensi Atribut Produk Kripik Jagung Menggunakan Fuzzy Analytical Hierarchy Process (Fuzzy AHP)",2015,"","etd.repository.ugm.ac.id","http://etd.repository.ugm.ac.id/index.php?act=view&buku_id=81864&mod=penelitian_detail&sub=PenelitianDetail&typ=html","",700,"2019-07-09","","","","",,,,,0,0.00,0,1,4
0,"S Saifulloh, N Asnawi","Analisis Keakuratan Metode Ahp Dan Metode Saw Terhadap Sistem Pendukung Keputusan Penerimaan Beasiswa",2015,"Data Manajemen dan Teknologi Informasi …","ojs.amikom.ac.id","http://ojs.amikom.ac.id/index.php/dasi/article/view/255","",701,"2019-07-09","","","","",,,,,0,0.00,0,2,4
0,"DYA YUSMITA","SISTEM PENDUKUNG KEPUTUSAN PENYELEKSIAN CALON ATLIT TOLAK PELURU MENGGUNAKAN METODE MFEP PADA SEKOLAH TINGGI …",2015,"","Universitas Potensi Utama","","",702,"2019-07-09","CITATION","","","",,,,,0,0.00,0,1,4
0,"E SYAHPUTRA","SISTEM PENDUKUNG KEPUTUSAN MENENTUKAN KARYAWAN TERBAIK DENGAN METODE SAW (SIMPLE ADDITIVE WEIGHTING) STUDI KASUS PT. BINTANG …",2015,"","repository.potensi-utama.ac.id","http://repository.potensi-utama.ac.id/jspui/handle/123456789/794","",703,"2019-07-09","","","","",,,,,0,0.00,0,1,4
0,"S HAPIS","SISTEM PENDUKUNG KEPUTUSAN MENENTUKAN KUALITAS BALING–BALING UNTUK KAPAL LAUT PADA CV. SKBL DIESEL DENGAN …",2015,"","Universitas potensi utama","","",704,"2019-07-09","CITATION","","","",,,,,0,0.00,0,1,4
0,"AR Irawan","SISTEM PENDUKUNG KEPUTUSAN PENENTUAN BANTUAN PROGAM SIMPANAN KELUARGA SEJAHTERA (PSKS) MENGGUNAKAN METODE SIMPLE …",2015,"","eprints.umk.ac.id","http://eprints.umk.ac.id/5604/","",705,"2019-07-09","","","","",,,,,0,0.00,0,1,4
0,"ZM Palilingan, AD Wowor, R Somya","Perancangan Sistem Pengaduan Online dan Sistem Pendukung Keputusan Terhadap Prioritas Perbaikan Jalan Dengan Menggunakan Logika Fuzzy MADM …",,"pdfs.semanticscholar.org","","https://pdfs.semanticscholar.org/6a7d/d959320f29fe5f812b67900f20b1aa08fb17.pdf","",706,"2019-07-09","","","","",,,,,0,0.00,0,3,
0,"MR WAYAHDI","SISTEM PENDUKUNG KEPUTUSAN MENENTUKAN TUNJANGAN PEGAWAI PADA PT. PERTAMINA EP MENGGUNAKAN METODE FUZZY …",2015,"","UNIVERSITAS POTENSI UTAMA","","",707,"2019-07-09","CITATION","","","",,,,,0,0.00,0,1,4
0,"W RUSDIANINGSIH","SISTEM PENDUKUNG KEPUTUSAN PENENTUAN MAHASISWA TERBAIK PADA SEKOLAH TINGGI TEKNOLOGI SINAR HUSNI MENGGUNAKAN …",2015,"","Universitas potensi utama","","",708,"2019-07-09","CITATION","","","",,,,,0,0.00,0,1,4
0,"FA Montolalu, S Rahayu…","Rancangan Sistem Pendukung Keputusan Proses Penyidikan Tindak Pidana Menggunakan Metode Analytical Hierarchy Process (Ahp)",2015,"Seminar Nasional …","jurnal.upnyk.ac.id","http://jurnal.upnyk.ac.id/index.php/semnasif/article/view/867","",709,"2019-07-09","","","","",,,,,0,0.00,0,3,4
0,"J Trisusilo, ST Eko Riswanto","SISTEM PENDUKUNG KEPUTUSAN PEMILIHAN OBYEK WISATA DI DAERAH ISTIMEWA YOGYAKARTA MENGGUNAKAN LOGIKA FUZZY TAHANI",,"jurnal.stmikelrahma.ac.id","","http://jurnal.stmikelrahma.ac.id/assets/file/Joko%20Trisusilo--stmikelrahma.pdf","",710,"2019-07-09","PDF","","","",,,,,0,0.00,0,2,
0,"S WULANDARI","PENERAPAN METODE PROFIL MATCHING DALAM SISTEM PENDUKUNG KEPUTUSAN SELEKSI CALON KEPALA LINGKUNGAN (STUDI KASUS …",2015,"","UNIVERSITAS POTENSI UTAMA","","",711,"2019-07-09","CITATION","","","",,,,,0,0.00,0,1,4
0,"BH Arminsyah","SISTEM PENDUKUNG KEPUTUSAN PEMILIHAN PEMAIN PADA KLUB SEPAK BOLA DI PS GPA SUKANDA DENGAN METODE SMART (Simple Multi Attribute …",2015,"","eprints.akakom.ac.id","http://eprints.akakom.ac.id/1969/","",712,"2019-07-09","","","","",,,,,0,0.00,0,1,4
0,"R Widyastuti, F Sukya…","Sistem Pendukung Keputusan untuk Menentukan Jabatan bagi Peserta Pendidikan dan Pelatihan Kepemimpinan",2015,"Jurnal Informatika dan …","ojs.poltek-kediri.ac.id","http://ojs.poltek-kediri.ac.id/index.php/JIM/article/view/24","",713,"2019-07-09","","","","",,,,,0,0.00,0,3,4
0,"Z NASUTION","SISTEM PENDUKUNG KEPUTUSAN PEMILIHAN BANK DIKOTA MEDAN DENGAN METODE SIMPLE MULTI ATTRIBUTE RAITING TECHNIQUE",2015,"","Universitas potensi utama","","",714,"2019-07-09","CITATION","","","",,,,,0,0.00,0,1,4
0,"R Ulil Albab","Sistem Pendukung Keputusan Pemilihan Otobus Pada Biro Perjalanan Harmony Tour",2015,"","eprints.umk.ac.id","http://eprints.umk.ac.id/5333/","",715,"2019-07-09","","","","",,,,,0,0.00,0,1,4
0,"MR Yudianto","SISTEM PENDUKUNG KEPUTUSAN PENENTUAN ROMBONGAN BELAJAR BERAGAM DAN PROPORSIONAL MENGGUNAKAN METODE WEIGHTED PRODUCT",2015,"","repository.upi.edu","http://repository.upi.edu/id/eprint/19861","",716,"2019-07-09","","","","",,,,,0,0.00,0,1,4
0,"WS Johan Rhemawan, S Ajib Susanto","SISTEM PENDUKUNG KEPUTUSAN PENGEMBANGAN PROTOTYPE SEBAGAI PERTIMBANGAN PUTUSAN PERKARA PIDANA PENGADILAN NEGERI …",,"eprints.dinus.ac.id","","http://eprints.dinus.ac.id/15311/1/jurnal_15353.pdf","",717,"2019-07-09","PDF","","","",,,,,0,0.00,0,2,
0,"M Hakim","Sistem Pendukung Keputusan Untuk Menentukan Bantuan Program Keluarga Harapan (Pkh) Pada Kelurahan Serangan Kecamatan Bonang Kabupaten Demak",2015,"","eprints.umk.ac.id","http://eprints.umk.ac.id/5615/","",718,"2019-07-09","","","","",,,,,0,0.00,0,1,4
0,"F Mauluddin","IMPLEMENTASI METODE PROMETHEE PADA SISTEM PENDUKUNG KEPUTUSAN PENENTUAN KELAYAKAN USULAN KENAIKAN PANGKAT DAN JABATAN …",2015,"","repository.upi.edu","http://repository.upi.edu/id/eprint/20080","",719,"2019-07-09","","","","",,,,,0,0.00,0,1,4
0,"EKO PRAYOGI","Sistem Pendukung Keputusan Penentuan Jumlah Produksi Pupuk Menggunakan Metode Simple Additive Weighting (SAW) Pada PT. Sentana Adidaya …",2015,"","Universitas potensi utama","","",720,"2019-07-09","CITATION","","","",,,,,0,0.00,0,1,4
0,"M Urrahman","Sistem Pendukung Keputusan Menentukan Karyawan Terbaik Menggunakan Metode Weighted Product Pada Pt Grita Artha Kreamindo (Skripsi T. Informatika S1 …",2015,"","eprints.unpam.ac.id","http://eprints.unpam.ac.id/794/","",721,"2019-07-09","","","","",,,,,0,0.00,0,1,4
0,"S FUAD","… PROCESS (AHP) DAN SIMPLE ADDITIVE WEIGHTING (SAW) PADA PENGEMBANGAN SISTEM PENDUKUNG KEPUTUSAN PEMILIHAN GURU BERPRESTASI …",2015,"","etd.repository.ugm.ac.id","http://etd.repository.ugm.ac.id/index.php?mod=book_detail&sub=BookDetail&act=view&typ=htmlext&buku_id=85222&obyek_id=4&unitid=&jenis_id=","",722,"2019-07-09","","","","",,,,,0,0.00,0,1,4
0,"RW Putra","Sistem pendukung keputusan untuk menentukan traveling salesman problem pada bagian delivery perusahaan ekspedisi menggunakan genetik algoritma",2015,"","kc.umn.ac.id","http://kc.umn.ac.id/1769/2/BAB%20I.pdf","",723,"2019-07-09","","","","",,,,,0,0.00,0,1,4
0,"AT Handayani","SISTEM PENDUKUNG KEPUTUSAN PEREKRUTAN KARYAWAN PRODUKSI MENGGUNAKAN METODE SIMPLE ADDITVE WEIGHTING (SAW) PADA CV …",,"eprints.dinus.ac.id","","http://eprints.dinus.ac.id/16687/1/jurnal_15711.pdf","",724,"2019-07-09","PDF","","","",,,,,0,0.00,0,1,
0,"Y RIMBAWANA","SISTEM PENDUKUNG KEPUTUSAN PEMILIHAN SISWA BERPRESTASI DENGAN METODE PROFILE MATCHING DI SMA NEGERI 1 GROBOGAN",2015,"","eprints.unisbank.ac.id","http://eprints.unisbank.ac.id/3062/","",725,"2019-07-09","","","","",,,,,0,0.00,0,1,4
0,"TF Prasetyo, C Kusumah","SISTEM PENDUKUNG KEPUTUSAN MAHASISWA BERPRESTASI MENGGUNAKAN METODE ANALYTICAL HIERARCHY PROCESS (AHP)",2015,"J-ENSITEC","jurnal.unma.ac.id","https://www.jurnal.unma.ac.id/index.php/JE/article/view/51","",726,"2019-07-09","","","","",,,,,0,0.00,0,2,4
0,"MA Ni'am","Sistem Pendukung Keputusan Seleksi Penerimaan Guru Di Smk Roudlotul Mubtadiin Balekambang Nalumsari Jepara Dengan Metode Ahp (Analitycal Hierarchy …",2015,"","eprints.umk.ac.id","http://eprints.umk.ac.id/5345/","",727,"2019-07-09","","","","",,,,,0,0.00,0,1,4
0,"F Adi Swastika","SISTEM PENDUKUNG KEPUTUSAN PEMILIHAN KARYAWAN BERPRESTASI DAN PEMBERIAN BONUS MENGGUNAKAN METODE PROMETHEE (Studi Kasus Di …",2015,"","eprints.upnyk.ac.id","http://eprints.upnyk.ac.id/5941/","",728,"2019-07-09","","","","",,,,,0,0.00,0,1,4
0,"W Hakim, T Turmudi","Sistem Pendukung Keputusan Metode Sugeno dalam Menentukan Tingkat Kepribadian Siswa Berdasarkan Pendidikan",2015,"CAUCHY","ejournal.uin-malang.ac.id","http://ejournal.uin-malang.ac.id/index.php/Math/article/view/3174","",729,"2019-07-09","","","","",,,,,0,0.00,0,2,4
0,"D Nafisah","Sistem Pendukung Keputusan Menentukan Penerima Bantuan Iuran Bpjs Kesehatan Dengan Metode Simple Additive Weighting Di Kabupaten Kudus",2015,"","eprints.umk.ac.id","http://eprints.umk.ac.id/5611/","",730,"2019-07-09","","","","",,,,,0,0.00,0,1,4
0,"E Gea","SISTEM PENDUKUNG KEPUTUSAN PEMILIHAN RUMAH SAKIT SEBAGAI REKANAN BISNIS MENGGUNAKAN METODE WEIGHTING PRODUCT …",2015,"","Universitas Potensi Utama","","",731,"2019-07-09","CITATION","","","",,,,,0,0.00,0,1,4
0,"F Fahmi","Sistem Pendukung Keputusan Pemilihan Kayu Untuk Pembuatan Gitar Menggunakan Metode Simple Additive Weighting Berbasis Web",2015,"","eprints.umk.ac.id","http://eprints.umk.ac.id/4435/","",732,"2019-07-09","","","","",,,,,0,0.00,0,1,4
0,"E Lestari","Sistem pendukung keputusan pemilihan guru berprestasi menggunakan menggunakan metode Simple Additive Weighting (SAW)(Studi kasus SMPN 1 Sukajaya",2015,"","eprints.unpam.ac.id","http://eprints.unpam.ac.id/839/","",733,"2019-07-09","","","","",,,,,0,0.00,0,1,4
0,"M Kumajas","SISTEM PENDUKUNG KEPUTUSAN KENAIKAN JABATAN FUNGSIONAL GURU MENGGUNAKAN METODE NAIVE BAYES STUDI KASUS DINAS PENDIDIKAN …",2015,"","repository.wicida.ac.id","http://repository.wicida.ac.id/302/","",734,"2019-07-09","","","","",,,,,0,0.00,0,1,4
0,"R Nugraha","SISTEM PENDUKUNG KEPUTUSAN PEMILIHAN SEPATU BOLA SESUAI DENGAN KARAKTERISTIK PEMAIN MENGGUNAKAN METODE SMARTER DAN ORESTE",2015,"","repository.upi.edu","http://repository.upi.edu/id/eprint/18720","",735,"2019-07-09","","","","",,,,,0,0.00,0,1,4
0,"WK PANJAITAN","SISTEM PENDUKUNG KEPUTUSAN SELEKSI REKRUTMEN TENAGA PENGAJAR PADA SMA SWASTA METHODIST 7 MEDAN DENGAN MENGGUNAKAN …",2015,"","repository.potensi-utama.ac.id","http://repository.potensi-utama.ac.id/jspui/handle/123456789/662","",736,"2019-07-09","","","","",,,,,0,0.00,0,1,4
0,"RMASTTA Nusantara","Sistem Pendukung Keputusan Perijinan Hak Guna Usaha Air Menggunakan Metode Simple Additive Weighting (SAW)",2015,"IJNS-Indonesian Jornal on Networking and …","ejurnal.net","http://ejurnal.net/portal/index.php/ijns/article/view/1367","",737,"2019-07-09","","","","",,,,,0,0.00,0,1,4
