Cites,Authors,Title,Year,Source,Publisher,ArticleURL,CitesURL,GSRank,QueryDate,Type,DOI,ISSN,CitationURL,Volume,Issue,StartPage,EndPage,ECC,CitesPerYear,CitesPerAuthor,AuthorCount,Age
3,"A Nugroho","Pengembangan Model Pembelajaran Jarak Jauh Berbasis Web",2012,"Jurnal Transformatika","journals.usm.ac.id","http://journals.usm.ac.id/index.php/transformatika/article/view/60","https://scholar.google.com/scholar?cites=9493822752182311062&as_sdt=2005&sciodt=0,5&hl=en",1,"2019-07-15","","","","",,,,,3,0.43,3,1,7
2,"M Yusriannur","Aplikasi E-Voting Berbasis Web Untuk Menunjang Pemilihan Presiden Mahasiswa Pada Universitas Dian Nuswantoro Semarang",2012,"Jurnal Sistem Informasi Universitas Dian …","eprints.dinus.ac.id","http://eprints.dinus.ac.id/12843/1/jurnal_13047.pdf","https://scholar.google.com/scholar?cites=12475161941164257428&as_sdt=2005&sciodt=0,5&hl=en",2,"2019-07-15","PDF","","","",,,,,2,0.29,2,1,7
6,"E Prihastono","Pengukuran kepuasan konsumen pada kualitas pelayanan customer service berbasis web",2012,"Jurnal Ilmiah Dinamika Teknik","unisbank.ac.id","https://www.unisbank.ac.id/ojs/index.php/ft1/article/view/1140","https://scholar.google.com/scholar?cites=14129622871350388903&as_sdt=2005&sciodt=0,5&hl=en",3,"2019-07-15","","","","",,,,,6,0.86,6,1,7
2,"G Abdullah, K Kastaman, SG Arnan","Aplikasi Pengelolaan Kas Masuk dan Kas Keluar Berbasis Web pada Perusahaan xyz",2012,"Jurnal Teknologi Informasi","","","https://scholar.google.com/scholar?cites=7198201512149336942&as_sdt=2005&sciodt=0,5&hl=en",4,"2019-07-15","CITATION","","","",,,,,2,0.29,1,3,7
3,"AR Yudiantika, BS Hantono","Perancangan Antarmuka Layanan Informasi Wisata dan Kuliner di DIY Berbasis Web dan Mobile Web",2012,"Semin. Nas. Sci. Eng. Technol","researchgate.net","https://www.researchgate.net/profile/Aditya_Yudiantika/publication/258033488_Perancangan_Antarmuka_Layanan_Informasi_Wisata_dan_Kuliner_di_DIY_Berbasis_Web_dan_Mobile_Web/links/02e7e526b2d1d7d78c000000/Perancangan-Antarmuka-Layanan-Informasi-Wisata-dan-Kuliner-di-DIY-Berbasis-Web-dan-Mobile-Web.pdf","https://scholar.google.com/scholar?cites=17198439057208362806&as_sdt=2005&sciodt=0,5&hl=en",5,"2019-07-15","PDF","","","",,,,,3,0.43,2,2,7
1,"I Pandiangan, N Rohman","Rekayasa Perangkat Lunak Sistem Manajemen Konten Menggunakan Framework Codeigniter",2012,"Jurnal Computech & Bisnis","jurnal.stmik-mi.ac.id","http://jurnal.stmik-mi.ac.id/index.php/jcb/article/view/89","https://scholar.google.com/scholar?cites=10309068597159933834&as_sdt=2005&sciodt=0,5&hl=en",6,"2019-07-15","","","","",,,,,1,0.14,1,2,7
1,"T Suratno","Sistem Pemasaran E-commerce Produk Pertanian Berbasis Web Content Manajemen System",2012,"Sosio Ekon. Bisnis","online-journal.unja.ac.id","https://online-journal.unja.ac.id/jseb/article/view/2758","https://scholar.google.com/scholar?cites=591009231099422312&as_sdt=2005&sciodt=0,5&hl=en",7,"2019-07-15","","","","",,,,,1,0.14,1,1,7
1,"A Setiyawan, D Retnoningsih…","Sistem Informasi Tugas Akhir Berbasis Web Universitas Sahid Surakarta",2012,"Jurnal Gaung …","jurnal.usahidsolo.ac.id","http://jurnal.usahidsolo.ac.id/index.php/GI/article/view/138","https://scholar.google.com/scholar?cites=2616455979347222097&as_sdt=2005&sciodt=0,5&hl=en",8,"2019-07-15","","","","",,,,,1,0.14,0,3,7
1,"KK Dinata","Perekayasaan Web Magister Teknik Informatika Pada Universitas Bina Darma",2012,"Jurnal Teknologi dan Informatika (TEKNOMATIKA)","","","https://scholar.google.com/scholar?cites=11900665577972113547&as_sdt=2005&sciodt=0,5&hl=en",9,"2019-07-15","CITATION","","","",,,,,1,0.14,1,1,7
1,"U Ependi","Sistem Informasi Pemetaan Data Penduduk Miskin Di Kabupaten Ogan Komering Ulu Sumatera Selatan",2012,"Digital Information & Systems Conference","eprints.binadarma.ac.id","http://eprints.binadarma.ac.id/2241/","https://scholar.google.com/scholar?cites=4771395123874399733&as_sdt=2005&sciodt=0,5&hl=en",10,"2019-07-15","","","","",,,,,1,0.14,1,1,7
2,"A Susanto, H Yahya","Rancang Bangun Aplikasi Penjadwalan Praktikum Di Laboratorium Komputer Universitas Dian Nuswantoro Dengan Pendekatan Algoritma Genetika",2012,"Jurnal Dian","eprints.dinus.ac.id","http://eprints.dinus.ac.id/16451/1/Penjadwalan_dengan_algo_genetika_ajib_hasan-new.pdf","https://scholar.google.com/scholar?cites=15093930336230371658&as_sdt=2005&sciodt=0,5&hl=en",11,"2019-07-15","PDF","","","",,,,,2,0.29,1,2,7
1,"V Septiawan, A Muzakir, M Nasir","Penerapan Teknologi Responsive Web Design Untuk Pengembangan Sistem Pelayanan Mahasiswa Pada Perpustakaan Universitas Bina Darma",2012,"","Online]. Tersedia: digilib. binadarma …","","https://scholar.google.com/scholar?cites=12316994098201140402&as_sdt=2005&sciodt=0,5&hl=en",12,"2019-07-15","CITATION","","","",,,,,1,0.14,0,3,7
1,"A Arofat, M Shoffa, N Bahtiar, R Saputra","Seminar Nasional Ilmu Komputer Universitas Diponegoro",2012,"Rekayasa Web, Teknologi Informasi dan …","","","https://scholar.google.com/scholar?cites=8252709360179798635&as_sdt=2005&sciodt=0,5&hl=en",13,"2019-07-15","CITATION","","","",,,,,1,0.14,0,4,7
0,"DH Wahid","Pengembangan Jejaring Sosial Alumni Berbasis Web",2012,"SKRIPSI Jurusan Teknik Elektro-Fakultas Teknik …","karya-ilmiah.um.ac.id","http://karya-ilmiah.um.ac.id/index.php/TE/article/view/17546","",14,"2019-07-15","","","","",,,,,0,0.00,0,1,7
0,"AA BAJUADJI","SISTEM INFORMASI BERBASIS WEB UNTUK MONITORING PENCAPAIAN KOMPETENSI MAHASISWA PADA KURIKULUM BERBASIS KOMPETENSI",2012,"","etd.repository.ugm.ac.id","http://etd.repository.ugm.ac.id/index.php?mod=penelitian_detail&sub=PenelitianDetail&act=view&typ=html&buku_id=54732","",15,"2019-07-15","","","","",,,,,0,0.00,0,1,7
0,"R Rahmat, M Akbar, M Akbar…","Rancang Bangun Sistem Infrastructur Gedung Universitas Bina Darma Berbasis Web",2012,"… MAHASISWA TI S1","eprints.binadarma.ac.id","http://eprints.binadarma.ac.id/133/1/jurnal%20Rahmat,%20M.%20Akbar%20,%20Kurniawan.pdf","",16,"2019-07-15","PDF","","","",,,,,0,0.00,0,4,7
0,"ADIY SUKAMDANI","“Pemanfaatan Metode View Dalam Pembangunan Web E-commerce Dengan Menggunakan Framework CodeIgniter”(Studi Kasus Toys Online Shop)",2012,"","repository.unpas.ac.id","http://repository.unpas.ac.id/29925/","",17,"2019-07-15","","","","",,,,,0,0.00,0,1,7
0,"M Safitri","Perancangan prototipe aplikasi berbasis web untuk promosi dan pemasaran toko buku online (studi kasus di pt. penerbit ipb press)",2012,"","repository.sb.ipb.ac.id","http://repository.sb.ipb.ac.id/id/eprint/1464","",18,"2019-07-15","","","","",,,,,0,0.00,0,1,7
0,"H ASKAR, ST Rizal, M MM…","PERPUSTAKAAN ELEKTRONIK RUMAH SAKIT UMUM DR MOHAMMAD HOESIN PALEMBANG BERBASIS WEB",2012,"… MAHASISWA TI S1","eprints.binadarma.ac.id","http://eprints.binadarma.ac.id/113/1/skripsi%20HADI%20ASKAR.pdf","",19,"2019-07-15","PDF","","","",,,,,0,0.00,0,4,7
0,"A Budi Christian, R Sanjaya","Pemanfaatan Portal Web"" Indonesian Wayang Network"" untuk Eksistensi Kesenian Wayang Kulit",2012,"","repository.unika.ac.id","http://repository.unika.ac.id/26/","",20,"2019-07-15","","","","",,,,,0,0.00,0,2,7
0,"L Robertus","Development Of Web-Based E-Learning With Pedagogy Concept",2012,"proceedings intl conf information system business …","eprints.undip.ac.id","http://eprints.undip.ac.id/36073/","",21,"2019-07-15","","","","",,,,,0,0.00,0,1,7
0,"M Irfan, N Lukman","SCHEDULING LECTURESOFTWARE USING WEB-BASED FRAMEWORK CODEIGNITER (A CASE STUDY: FACULTY OF SCIENCE AND TECHNOLOGY UIN …",2012,"JURNAL ISTEK","journal.uinsgd.ac.id","http://journal.uinsgd.ac.id/index.php/istek/article/view/304","",22,"2019-07-15","","","","",,,,,0,0.00,0,2,7
0,"K Kusumaningtyas, S Patmanthara…","Pengembangan E-module Berbasis Web Sebagai Media Pembelajaran Interaktif untuk Standar Kompetensi Memahami Fungsi dan Proses Kerja Berbagai …",2012,"… Jurusan Teknik Elektro …","academia.edu","http://www.academia.edu/download/32479027/Artikel_Ilmiah.pdf","",23,"2019-07-15","PDF","","","",,,,,0,0.00,0,3,7
0,"AN Safriandono","Aplikasi Web-learning Berbasis Sistem Pakar Diagnosis Kejadian Hipotermia pada Bayi Baru Lahir",2012,"Tatal","neliti.com","https://www.neliti.com/publications/221653/aplikasi-web-learning-berbasis-sistem-pakar-diagnosis-kejadian-hipotermia-pada-b","",24,"2019-07-15","","","","",,,,,0,0.00,0,1,7
0,"F Febriyani","RANCANG BANGUN SISTEM PENELUSURAN ALUMNI ONLINE MENGGUNAKAN METODE BERORIENTASI OBJEK",2012,"Jurnal Ilmu Komputer","FAKULTAS ILMU KOMPUTER …","","",25,"2019-07-15","CITATION","","","",,,,,0,0.00,0,1,7
0,"FI Setiawan, AR Adiningsih, W Widayat…","Pengembangan Sistem Informasi Manajemen Rekrutmen Asisten Laboratorium",2012,"Jurnal Fakultas Hukum …","neliti.com","https://www.neliti.com/publications/112856/pengembangan-sistem-informasi-manajemen-rekrutmen-asisten-laboratorium","",26,"2019-07-15","","","","",,,,,0,0.00,0,4,7
0,"PP Sari, A Tjahyanto","ANALISIS DAN DESAIN PENGEMBANGAN SISTEM INFORMASI UNTUK AKSES E-JOURNAL DI BADAN LITBANG KEMKOMINFO",,"mmt.its.ac.id","","http://mmt.its.ac.id/download/SEMNAS/SEMNAS%20XIV/MTI/30.%20Prosiding%20Putri%20Pradnyawidya%20Sari-OK-PRINT.pdf","",27,"2019-07-15","PDF","","","",,,,,0,0.00,0,2,
0,"D Destiniar, D Irwansyah, F Tomhart…","ANALISIS WEBSITE BADAN TEKNOLOGI NUKLIR NASIONAL (BATAN) BANDUNG",2012,"… MAHASISWA TI S1","eprints.binadarma.ac.id","http://eprints.binadarma.ac.id/185/1/BAB%20I%20ANALISIS%20WEBSITE%20BADAN%20TEKNOLOGI%20NUKLIR%20NASIONAL%20(BATAN)%20BANDUNG.pdf","",28,"2019-07-15","","","","",,,,,0,0.00,0,4,7
0,"U Ependi","SISTEM INFORMASI ONLINE PADA PROGRAM STUDI TEKNIK INFORMATIKA UNIVERSITAS BINA DARMA",,"blog.binadarma.ac.id","","http://blog.binadarma.ac.id/usman/wp-content/uploads/2010/07/Usman-Ependi-Journal-Sistem-Informasi.pdf","",29,"2019-07-15","PDF","","","",,,,,0,0.00,0,1,
0,"F Syakti, T Archives","SISTEM INFORMASI DATA TERPADU DI WILAYAH PENGADILAN TINGGI AGAMA PALEMBANG–SUMATERA SELATAN",2012,"","..:: Firamon Syakti","","",30,"2019-07-15","CITATION","","","",,,,,0,0.00,0,2,7
0,"J Herdiansyah","STUDI IMPLEMENTASI APLIKASI VIDEO ON DEMAND PADA SISTEM E-LEARNING SMA NEGERI 10 PALEMBANG",2012,"JURNAL MAHASISWA TI S1","eprints.binadarma.ac.id","http://eprints.binadarma.ac.id/407/1/jurnal%20STUDI%20IMPLEMENTASI%20APLIKASI%20VIDEO%20ON%20DEMAND%20PADA%20SISTEM%20E-LEARNING%20SMA%20NEGERI%2010%20PALEMBANG.doc","",31,"2019-07-15","DOC","","","",,,,,0,0.00,0,1,7
0,"MUB Darma, DUB Darma","RANCANG BANGUN E-COMMERCE PADA CV. ARLING JAYA KOMPUTER MENGGUNAKAN TEKNOLOGI RICH INTERNET APPLICATION (RIA)",,"blog.binadarma.ac.id","","http://blog.binadarma.ac.id/widyanto/wp-content/uploads/jurnal-Syaipul-081412861.doc","",32,"2019-07-15","DOC","","","",,,,,0,0.00,0,2,
0,"N Novitasari, L Atika, S Suyanto","RANCANG BANGUN E-LEARNING PADA SMK TAKWA BELITANG",2012,"JURNAL MAHASISWA TI …","eprints.binadarma.ac.id","http://eprints.binadarma.ac.id/109/1/jurnal%20Novitasari,%20Linda%20Atika,%20Suyanto.rtf","",33,"2019-07-15","RTF","","","",,,,,0,0.00,0,3,7
0,"S Widyastuti, M Afriyudi, M Afriyudi…","PERANGKAT LUNAK PENCARIAN ALAMAT DIKOTA PALEMBANG BERBASIS WAP PALEMBANG",2012,"… MAHASISWA TI S1","eprints.binadarma.ac.id","http://eprints.binadarma.ac.id/117/1/jurnal%20Greace%20Widyastuti,%20S.Kom.,%20Afriyudi,%20M.kom.,%20Usman%20Ependi,%20M.Kom.pdf","",34,"2019-07-15","PDF","","","",,,,,0,0.00,0,4,7
0,"S Emigawaty, M Kom, S Emigawaty…","RANCANG BANGUN WEBSITE HMI CABANG PAELMBANG MENGGUNAKAN PHP DAN MYSQL",2012,"… MAHASISWA TI S1","eprints.binadarma.ac.id","http://eprints.binadarma.ac.id/362/1/jurnal%20RANCANG%20BANGUN%20WEBSITE%20HMI%20CABANG%20PAELMBANG%20MENGGUNAKAN%20PHP%20DAN%20MYSQL.doc","",35,"2019-07-15","DOC","","","",,,,,0,0.00,0,4,7
0,"S Harmoko, S Harmoko","WEB SERVICE SEBAGAI PENGHUBUNG ANTAR APLIKASI KOPUTER DENGAN BAHASA PEMROGRAMAN YANG BERBEDA STUDI KASUS …",2012,"JURNAL MAHASISWA TI S1","eprints.binadarma.ac.id","http://eprints.binadarma.ac.id/325/1/jurnal%20WEB%20SERVICE%20SEBAGAI%20PENGHUBUNG%20ANTAR%20APLIKASI%20KOPUTER%20DENGAN%20BAHASA%20PEMROGRAMAN%20YANG%20BERBEDA%20STUDI%20KASUS%20%20PERANCANGAN%20SISTEM%20KRS%20PADA%20EL%20RAHMA%20EDUCATION%20CENTRE%20PALEMBANG.pdf","",36,"2019-07-15","PDF","","","",,,,,0,0.00,0,2,7
0,"S Suwarto","IMPLEMENTASI PENDEKATAN SEMANTIK OBJEK MODEL PADA RANCANGAN SISTEM BASIS DATA KINERJA KARYAWAN (STUDI KASUS PT BUMI INDO …",2012,"PROPOSAL-MAHASISWA TI S1","eprints.binadarma.ac.id","http://eprints.binadarma.ac.id/272/1/proposal%20IMPLEMENTASI%20PENDEKATAN%20SEMANTIK%20OBJEK%20MODEL%20PADA%20RANCANGAN%20SISTEM%20BASIS%20DATA%20KINERJA%20KARYAWAN%20(STUDI%20KASUS%20PT%20BUMI%20INDO%20SRIWIJAYA).pdf","",37,"2019-07-15","PDF","","","",,,,,0,0.00,0,1,7
0,"Z Husna, AH Mirza, AY Ranius","PERANGKAT LUNAK PENGOLAHAN REALISASI PROYEK PADA PT PERAGA LAMBANG SEJAHTERA PALEMBANG",2012,"JURNAL MAHASISWA TI …","eprints.binadarma.ac.id","http://eprints.binadarma.ac.id/125/1/jurnal%20Zuryati.pdf","",38,"2019-07-15","PDF","","","",,,,,0,0.00,0,3,7
0,"IK Wardono","Pengembangan sistem pendukung keputusan dalam pemilihan fakultas perkuliahan berbaiss mobile web",2012,"","repository.uinjkt.ac.id","http://repository.uinjkt.ac.id/dspace/bitstream/123456789/492/1/IDAM%20KUSUMO%20WARDONO-FST.PDF","",39,"2019-07-15","PDF","","","",,,,,0,0.00,0,1,7
0,"Y Evi","PERANCANGAN DAN IMPLEMENTASI SISTEM INFORMASI PERALATAN DENGAN PENERAPAN KONSEP THREE TIER (Studi Kasus: Gardu Induk Prabumulih …",2012,"","eprints.binadarma.ac.id","http://eprints.binadarma.ac.id/3555/","",40,"2019-07-15","","","","",,,,,0,0.00,0,1,7
0,"BU Fahnun, B Hardiansyah","Informasi Keanekaragaman Batik Pulau Jawa Berbasis Android",2012,"Seminar Nasional Teknologi …","103.193.19.206","http://103.193.19.206/index.php/SNTIKI/article/download/2887/1798","",41,"2019-07-15","PDF","","","",,,,,0,0.00,0,2,7
3,"Y Hanggara","Analisis Sistem Informasi Pengelolaan Data Alumni Sekolah Berbasis CodeIgniter PHP Framework",2012,"Tugas Akhir Skripsi","eprints.uny.ac.id","https://eprints.uny.ac.id/21656/1/Yoga%20Hanggara%2008520241004.pdf","https://scholar.google.com/scholar?cites=3063812442131893473&as_sdt=2005&sciodt=0,5&hl=en",42,"2019-07-15","PDF","","","",,,,,3,0.43,3,1,7
2,"T Wahyono, S Subanar","Rancang Bangun Sistem “Permadi”: Peringatan Dini Serangan Hama Tanaman Padi Berbasis Data Historis Klimatologi",2012,"Jurnal Sistem Komputer","eprints.undip.ac.id","http://eprints.undip.ac.id/40511/1/19_jurnal_siskom-vol2-num1.pdf","https://scholar.google.com/scholar?cites=7651463465756887711&as_sdt=2005&sciodt=0,5&hl=en",43,"2019-07-15","PDF","","","",,,,,2,0.29,1,2,7
0,"E Erika","Kompetensi menelusur informasi melalui mesin pencari"" Google""",2012,"AL-MAKTABAH","journal.uinjkt.ac.id","http://journal.uinjkt.ac.id/index.php/al-maktabah/article/view/1595","",44,"2019-07-15","","","","",,,,,0,0.00,0,1,7
0,"L Prananingrum, BU Fahnun","Aplikasi Mobile Doa dan Dzikir Berbasis Android 2.2",2012,"Seminar Nasional Teknologi …","103.193.19.206","http://103.193.19.206/index.php/SNTIKI/article/viewFile/2867/1778","",45,"2019-07-15","PDF","","","",,,,,0,0.00,0,2,7
0,"D Setiyadi, A Nurdin","Data Mining Potensi Akademik Siswa Berbasis Online",2012,"Sisfotenika","sisfotenika.stmikpontianak.ac.id","http://sisfotenika.stmikpontianak.ac.id/index.php/ST/article/view/61","",46,"2019-07-15","","","","",,,,,0,0.00,0,2,7
1,"R Satria, R Saputra, HA Wibawa","Sistem Peringatan Dini Meluapnya Air Sungai Menggunakan SMS Gateway dan Mikrokontroler ATMega8535",2012,"… UNDIP 2012 (Rekayasa Web …","eprints.undip.ac.id","http://eprints.undip.ac.id/36642/","https://scholar.google.com/scholar?cites=17277367799084873461&as_sdt=2005&sciodt=0,5&hl=en",47,"2019-07-15","","","","",,,,,1,0.14,0,3,7
