Cites,Authors,Title,Year,Source,Publisher,ArticleURL,CitesURL,GSRank,QueryDate,Type,DOI,ISSN,CitationURL,Volume,Issue,StartPage,EndPage,ECC,CitesPerYear,CitesPerAuthor,AuthorCount,Age
0,"S Suwarno, A Harjoko","Penentuan Klas Sidik Jari Berdasarkan Arah Kemiringan Ridge",,"IJCCS (Indonesian Journal of Computing and …","journal.ugm.ac.id","https://journal.ugm.ac.id/ijccs/article/view/5208","",255,"2019-03-27","","","","",,,,,0,0.00,0,2,
0,"H Harisno, F JINGGA","Pembangunan Sistem Knowledge Repository Manajemen Penyuluhan Pertanian dalam Rangka Mendukung Revitalisasi Penyuluhan Pertanian: Helpdesk …",2011,"Jurnal ComTech","eprints2.binus.ac.id","http://eprints2.binus.ac.id/25633/1/ComTech%20Vo.2%20No.1%20Juni%202011.pdf","",256,"2019-03-27","PDF","","","",,,,,0,0.00,0,2,8
0,"T Maftukhah","Studi Banding Metode Modifikasi Vektor Kueri Fuzzy dan Fungsi Basis Radial Fuzzy Untuk Perolehan Citra",2011,"INKOM Journal","jurnal.informatika.lipi.go.id","http://jurnal.informatika.lipi.go.id/index.php/inkom/article/view/88","",257,"2019-03-27","","","","",,,,,0,0.00,0,1,8
0,"A Andi","PENGENDALI ROBOT BERGERAK BERBASIS PERILAKU MENGGUNAKAN PARTICLE SWARM FUZZY CONTROLLER",2011,"Telematika","","","",258,"2019-03-27","CITATION","","","",,,,,0,0.00,0,1,8
0,"AYUKA HAQQUE","PERANCANGAN BUKU PENUNJANG PENDIDIKAN ANAK DI PT. JEPE PRESS MEDIA UTAMA (JP BOOKS) SURABAYA, JAWA TIMUR",2011,"","digilib.stikom.edu","http://digilib.stikom.edu/detil.php?id=2153","",259,"2019-03-27","","","","",,,,,0,0.00,0,1,8
0,"D WAHYUDI","SISTEM PENDUKUNG KEPUTUSAN DALAM PROMOSI JABATAN PADA PT. PLN (PERSERO) UNIT BISNIS DISTRIBUSI JAWA TIMUR AREA PELAYANAN …",2011,"","digilib.stikom.edu","http://digilib.stikom.edu/detil.php?id=1889","",260,"2019-03-27","","","","",,,,,0,0.00,0,1,8
0,"R Maulana","Capture Image dengan Penanda Jari",,"Capture Image dengan Penanda Jari","repo.pens.ac.id","http://repo.pens.ac.id/1175/","",261,"2019-03-27","","","","",,,,,0,0.00,0,1,
0,"RT Wahyuningrum","Kombinasi KPCA dan Euclidean Distance untuk Pengenalan Citra Wajah",2011,"Rekayasa","infestasi.trunojoyo.ac.id","http://infestasi.trunojoyo.ac.id/rekayasa/article/view/2343","",262,"2019-03-27","","","","",,,,,0,0.00,0,1,8
0,"RI MARIAN","RANCANG BANGUN SISTEM INFORMASI PERSEDIAAN DAN PENJUALAN PADA “CV. PUSTAKA PROGRESSIF”",2011,"","digilib.stikom.edu","http://digilib.stikom.edu/detil.php?id=1927","",263,"2019-03-27","","","","",,,,,0,0.00,0,1,8
0,"AFP SARI","PROYEK AKHIR: PROSES PELAKSANAAN REKRUTMEN DAN SELEKSI SUMBER DAYA MANUSIA PADA PT UNTUNG BERSAMA SEJAHTERA",2011,"","digilib.stikom.edu","http://digilib.stikom.edu/detil.php?id=2276","",264,"2019-03-27","","","","",,,,,0,0.00,0,1,8
0,"I Suprayogi","APLIKASI ALGORITMA FUZZY INTEGER TRANSPORTATION PROBLEM UNTUK OPTIMASI DISTRIBUSI AIR MINUM PDAM",,"mmt.its.ac.id","","http://mmt.its.ac.id/download/SEMNAS/SEMNAS%20XIII/MTL/10.%20Prosiding%20Imam-OK-PRINT.pdf","",265,"2019-03-27","PDF","","","",,,,,0,0.00,0,1,
0,"N WIDYASARI","PERANCANGAN PERSONNEL INFORMATION SYSTEM PADA PERUSAHAAN REAL ESTATE BHAKTI PERTIWI GRESIK",2011,"","digilib.stikom.edu","http://digilib.stikom.edu/detil.php?id=2195","",266,"2019-03-27","","","","",,,,,0,0.00,0,1,8
0,"C Anam, KS Firdausi","KOMPARASI KUALITAS CITRA HASIL REKONSTRUKSI METODE ALGEBRAIC RECONSTRUCTION TECHNIQUE (ART) ADITIF DAN MULTIPLIKATIF (MART) PADA …",2011,"BERKALA FISIKA","ejournal.undip.ac.id","https://ejournal.undip.ac.id/index.php/berkala_fisika/article/view/4973","",267,"2019-03-27","","","","",,,,,0,0.00,0,2,8
0,"H Nasution, E Rowendra, S Sumeru…","PERFORMANSI SISTEM PENDINGIN KENDARAAN DENGAN MENGGUNAKAN HFC-134a DAN HC-134a",2011,"Prosiding Industrial …","jurnal.polban.ac.id","https://jurnal.polban.ac.id/index.php/proceeding/article/view/356","",268,"2019-03-27","","","","",,,,,0,0.00,0,4,8
0,"R Arifana, R Tanamal","Perancangan Business Plan dan Fitur Web Berduka. com",2011,"","dspace.uc.ac.id","https://dspace.uc.ac.id/handle/123456789/151","",269,"2019-03-27","","","","",,,,,0,0.00,0,2,8
0,"BV Santoso","LKP: RANCANG BANGUN SISTEM INFORMASI PERMOHONAN CUTI PEGAWAI PADA PT SURABAYA AGUNG INDUSTRI PULP DAN KERTAS",2011,"","digilib.stikom.edu","http://digilib.stikom.edu/detil.php?id=1781","",270,"2019-03-27","CITATION","","","",,,,,0,0.00,0,1,8
0,"Y SADEWA, J PRAKARSA","LKP: RANCANG BANGUN SISTEM INFORMASI PERMOHONAN CUTI PEGAWAI PADA PT ANGKASA PURA I (PERSERO) BANDAR UDARA …",2011,"","digilib.stikom.edu","http://digilib.stikom.edu/detil.php?id=1706","",271,"2019-03-27","CITATION","","","",,,,,0,0.00,0,2,8
0,"MRSSN Ayub","Pendekatan Rangkaian RC Untuk Pembelajaran Sistem Pernafasan Bagi Mahasiswa Ilmu Kesehatan",2011,"","repository.uksw.edu","http://repository.uksw.edu/handle/123456789/5935","",272,"2019-03-27","","","","",,,,,0,0.00,0,1,8
0,"A Haryono","LKP: RANCANG BANGUN SISTEM INFORMASI KEPEGAWAIAN PT INTIDRAGON SURYATAMA",2011,"","digilib.stikom.edu","http://digilib.stikom.edu/detil.php?id=1985","",273,"2019-03-27","","","","",,,,,0,0.00,0,1,8
0,"M IRFANSYAH","PENGUKURAN KINERJA K-NEAREST NEIGHBORS DAN SELF ORGANIZING MAPS MENGGUNAKAN FAST FOURIER TRANSFORM UNTUK …",,"","","","",274,"2019-03-27","CITATION","","","",,,,,0,0.00,0,1,
0,"VM Santi","Penerapan Partial Least Square Regression (PLSR) Pada Pemodelan Kalibrasi Senyawa Aktif Kurkumin",2011,"Prosiding SNaPP: Sains, Teknologi","proceeding.unisba.ac.id","http://proceeding.unisba.ac.id/index.php/sains_teknologi/article/view/762","",275,"2019-03-27","CITATION","","","",,,,,0,0.00,0,1,8
0,"SA WIJANARKO","SISTEM CAI UNTUK PENGAJARAN FISIKA DASAR (VEKTOR DAN APLIKASINYA)",2011,"","digilib.stikom.edu","http://digilib.stikom.edu/detil.php?id=2079","",276,"2019-03-27","","","","",,,,,0,0.00,0,1,8
0,"D Elianus","LKP: SISTEM INFORMASI KOPERASI PADA DPU PENGAIRAN PROPINSI JAWA TIMUR SURABAYA",2011,"","digilib.stikom.edu","http://digilib.stikom.edu/detil.php?id=1947","",277,"2019-03-27","","","","",,,,,0,0.00,0,1,8
0,"SR Wijaya, NA Fitrandy","LKP: RANCANG BANGUN SISTEM INFORMASI PENGHITUNGAN BIAYA PROYEK PADA PT WORLD ENGINEERING",2011,"","digilib.stikom.edu","http://digilib.stikom.edu/detil.php?id=2022","",278,"2019-03-27","","","","",,,,,0,0.00,0,2,8
0,"KC HERTANTI, N PANE","LKP: SISTEM INFORMASI KEPEGAWAIAN DINAS PENGAIRAN KABUPATEN PURWOREJO",2011,"","digilib.stikom.edu","http://digilib.stikom.edu/detil.php?id=1481","",279,"2019-03-27","","","","",,,,,0,0.00,0,2,8
0,"N SUMARIGA","PSI: RANCANG BANGUN SISTEM INFORMASI KEPEGAWAIAN PADA RUMAH SAKIT NAHDLATUL ULAMA TUBAN",2011,"","digilib.stikom.edu","http://digilib.stikom.edu/detil.php?id=1529","",280,"2019-03-27","","","","",,,,,0,0.00,0,1,8
0,"H WIBISONO","RANCANG BANGUN SISTEM INFORMASI PENGELOLAAN PERSONIL PADA PT. XYZ",2011,"","digilib.stikom.edu","http://digilib.stikom.edu/detil.php?id=1564","",281,"2019-03-27","","","","",,,,,0,0.00,0,1,8
0,"SM HASANAH","ANALISA DAN PERANCANGAN SISTEM INFORMASI PENYALURAN TENAGA KERJA DI PT. XYZ",2011,"","digilib.stikom.edu","http://digilib.stikom.edu/detil.php?id=1787","",282,"2019-03-27","","","","",,,,,0,0.00,0,1,8
0,"Y SADEWA","PSI: RANCANG BANGUN SISTEM INFORMASI ADMINISTRASI PEGAWAI PT. ANGKASA PURA I BANDARA INTERNASIONAL JUANDA SURABAYA",2011,"","digilib.stikom.edu","http://digilib.stikom.edu/detil.php?id=2236","",283,"2019-03-27","","","","",,,,,0,0.00,0,1,8
0,"HDWI PRASETYO","PSI: RANCANG BANGUN SISTEM E-LEARNING (STUDI KASUS MATA KULIAH STRUCTURE QUERY LANGUAGE DI STIKOM SURABAYA)",2011,"","digilib.stikom.edu","http://digilib.stikom.edu/detil.php?id=2233","",284,"2019-03-27","","","","",,,,,0,0.00,0,1,8
0,"A HARYONO","RANCANG BANGUN SISTEM REKRUITMEN KARYAWAN PADA PT. INTI DRAGON SURYATAMA",2011,"","digilib.stikom.edu","http://digilib.stikom.edu/detil.php?id=1479","",285,"2019-03-27","","","","",,,,,0,0.00,0,1,8
0,"F SASMITA","RANCANG BANGUN SISTEM PENJADWALAN PELATIHAN SUMBER DAYA MANUSIA DENGAN MENGGUNAKAN METODE ALGORITMA GENETIKA",2011,"","digilib.stikom.edu","http://digilib.stikom.edu/detil.php?id=1638","",286,"2019-03-27","","","","",,,,,0,0.00,0,1,8
0,"Z PRIHATNA","RANCANG BANGUN PROTOTYPE PENENTUAN PEMAIN UTAMA PADA SEPAK BOLA DENGAN METODE TERM FREQUENCY-INVERS DOCUMENT …",2011,"","digilib.stikom.edu","http://digilib.stikom.edu/detil.php?id=2123","",287,"2019-03-27","","","","",,,,,0,0.00,0,1,8
0,"I ADHAM","PERANCANGAN DAN PEMBUATAN PERANGKAT LUNAK PENGOLAH SUARA BERBAHASA INDONESIA",2011,"","digilib.stikom.edu","http://digilib.stikom.edu/detil.php?id=2194","",288,"2019-03-27","","","","",,,,,0,0.00,0,1,8
0,"IWA ARIAWAN","RANCANG BANGUN SISTEM INFORMASI HUMAN RESOURCES DEPARTEMENT PADA HOTEL SHERATON LAGUNA",2011,"","digilib.stikom.edu","http://digilib.stikom.edu/detil.php?id=1804","",289,"2019-03-27","","","","",,,,,0,0.00,0,1,8
0,"BK HADIWIDJOYO","PSI: RANCANG BANGUN SISTEM INFORMASI REKRUTMEN KARYAWAN DAN PENGGAJIAN PADA PT. TIMBANGAN NKH SURABAYA",2011,"","digilib.stikom.edu","http://digilib.stikom.edu/detil.php?id=1701","",290,"2019-03-27","","","","",,,,,0,0.00,0,1,8
0,"BP Putra","RANCANG BANGUN SISTEM INFORMASI SUMBER DAYA MANUSIA PADA PT. MITRA BALI INDAH",2011,"","digilib.stikom.edu","http://digilib.stikom.edu/detil.php?id=2059","",291,"2019-03-27","","","","",,,,,0,0.00,0,1,8
0,"AD YANER, F AINI","LKP: RANCANG BANGUN SISTEM INFORMASI ARUS KAS PADA UKM GANESA PACET MOJOKERTO",2011,"","digilib.stikom.edu","http://digilib.stikom.edu/detil.php?id=2101","",292,"2019-03-27","","","","",,,,,0,0.00,0,2,8
0,"I KARINASARI","PSI: RANCANG BANGUN SISTEM INFORMASI ADMINISTRASI KEPEGAWAIAN PADA PT. WIDYA CIPTA TEHNIK",2011,"","digilib.stikom.edu","http://digilib.stikom.edu/detil.php?id=1620","",293,"2019-03-27","HTML","","","",,,,,0,0.00,0,1,8
0,"I CAHYONO","PERANCANGAN SISTEM INFORMASI SUMBER DAYA MANUSIA DI PT. INDONESIA MULTI COLOUR PRINTING",2011,"","digilib.stikom.edu","http://digilib.stikom.edu/detil.php?id=2210","",294,"2019-03-27","","","","",,,,,0,0.00,0,1,8
0,"Y Suryono, I Afrianto","PEMANFAATAN METODE SELF ORGANIZING MAP PADA OPTIMASI MASALAH TRAVELLING SALESMAN PROBLEM",2011,"Jurnal Computech & Bisnis","jurnal.stmik-mi.ac.id","http://jurnal.stmik-mi.ac.id/index.php/jcb/article/view/72","",295,"2019-03-27","","","","",,,,,0,0.00,0,2,8
0,"S SEPTIA","PSI: RANCANG BANGUN SISTEM INFORMASI ADMINISTRASI KEPEGAWAIAN PADA BAGIAN PUSAT STATISTIK KOTA SURABAYA",2011,"","digilib.stikom.edu","http://digilib.stikom.edu/detil.php?id=1531","",296,"2019-03-27","HTML","","","",,,,,0,0.00,0,1,8
0,"AP CHANDRA","PSI: RANCANG BANGUN SISTEM INFORMASI ADMINISTRASI PERSONALIA PADA PT. ANGKASA PURA I BANDARA INTERNASIONAL JUANDA",2011,"","digilib.stikom.edu","http://digilib.stikom.edu/detil.php?id=2234","",297,"2019-03-27","","","","",,,,,0,0.00,0,1,8
0,"Y Rafsyam, J Jonifan","KLASIFIKASI CITRA USG MENGGUNAKAN METODE EUCLIDEAN DISTANCE UNTUK ESTIMASI UKURAN KISTA OVARIUM",2011,"Konferensi Nasional Sistem …","repository.gunadarma.ac.id","http://repository.gunadarma.ac.id/843/","",298,"2019-03-27","","","","",,,,,0,0.00,0,2,8
0,"S Sri, H Sri","DETEKSI KEMIRINGAN ALUR POLA SIDIK JARI DENGAN HAMMING NET SEBAGAI DASAR KLASIFIKASI",2011,"Telematika","","","",299,"2019-03-27","CITATION","","","",,,,,0,0.00,0,2,8
0,"PBS SUARA, AA NUGRAHA","RANCANG-BANGUN RESTU'S AN ENGINE FOR SYNTHETIC THESPIAN UNITS (RESTU): SUBSISTEM PENENTUAN POSISI",,"researchgate.net","","https://www.researchgate.net/profile/Ary_Prihatmanto/publication/304585680_Rancang-bangun_RESTU's_an_Engine_for_Synthetic_Thespian_Units_RESTU_Subsistem_penentuan_posisi_pengguna_berdasarkan_sinyal_suara_SpeaCal/links/577480e708aeb9427e24242c.pdf","",300,"2019-03-27","PDF","","","",,,,,0,0.00,0,2,
0,"A Kurniasari, SM Susilowati…","Sistem E-learning Untuk Aplikasi ON Line Dan Offline Pada Bank Mandiri",2011,"Konferensi Nasional …","repository.gunadarma.ac.id","http://repository.gunadarma.ac.id/1059/","",301,"2019-03-27","","","","",,,,,0,0.00,0,3,8
0,"YKP TJUMOKO, H SUHARTONO","LKP: RANCANG BANGUN SISTEM INFORMASI KEUANGAN SEKOLAH (STUDI KASUS: SD SANTO YUSUP TROPODO)",2011,"","digilib.stikom.edu","http://digilib.stikom.edu/detil.php?id=2105","",302,"2019-03-27","","","","",,,,,0,0.00,0,2,8
0,"R Peni, R Nana, S Setiawardhana","PLAYLIST CHOICE WITH FACE EXPRESSION RECOGNIZE USING NEURAL NETWORK BACKPROPAGATION",2011,"EEPIS Final Project","repo.pens.ac.id","http://repo.pens.ac.id/976/","",303,"2019-03-27","","","","",,,,,0,0.00,0,3,8
0,"EVA YULIANA","RANCANG BANGUN SISTEM INFORMASI PEREKRUTAN DAN PENILAIAN KINERJA (STUDI KASUS: PT. KADE TRANS BANDARA SURABAYA)",2011,"","digilib.stikom.edu","http://digilib.stikom.edu/detil.php?id=2217","",304,"2019-03-27","","","","",,,,,0,0.00,0,1,8
0,"DG WIBISONO","PSI: RANCANG BANGUN SISTEM INFORMASI PENILAIAN KINERJA KARYAWAN (STUDI KASUS: PT. TELKOM DIVRE V SURABAYA)",2011,"","digilib.stikom.edu","http://digilib.stikom.edu/detil.php?id=2237","",305,"2019-03-27","","","","",,,,,0,0.00,0,1,8
0,"H Prasetya, T Djatna","DESIGNING OF INTELLIGENT SYSTEM USING FUZZY INFERENCE SYSTEM THE DETERMINATION OF THE GREEN AGROINDUSTRY",2011,"Journal of Agroindustrial Technology","jagb.journal.ipb.ac.id","http://jagb.journal.ipb.ac.id/index.php/jurnaltin/article/view/4793","",306,"2019-03-27","","","","",,,,,0,0.00,0,2,8
0,"Z Zulaikah, W Wahyudi, T Andromeda","APLIKASI TEKNIK KENDALI FUZZY PADA PENGENDALIAN LEVEL CAIRAN",2011,"","eprints.undip.ac.id","http://eprints.undip.ac.id/25547/","",307,"2019-03-27","","","","",,,,,0,0.00,0,3,8
0,"RR FIRDAUSY, RTRI SUTRISNO","LKP: RANCANG BANGUN APLIKASI PENILAIAN KARYA PEGAWAI PADA DIVISI PERSONALIA DAN UMUM PT ANGKASA PURA I (PERSERO) CABANG BANDAR …",2011,"","digilib.stikom.edu","http://digilib.stikom.edu/detil.php?id=2095","",308,"2019-03-27","","","","",,,,,0,0.00,0,2,8
0,"J ADHITYAWAN","RANCANG BANGUN SISTEM PENILAIAN KINERJA PENGAJAR DI SMU MUHAMMADIYAH 2 SURABAYA",2011,"","digilib.stikom.edu","http://digilib.stikom.edu/detil.php?id=1456","",309,"2019-03-27","HTML","","","",,,,,0,0.00,0,1,8
0,"E Nazrul, A Khoerul, DM Ananda, MGS Beta","KONTROL GERAKAN BUKA TUTUP PINTU UNTUK AKSES SISTEM KEAMANAN MENGGUNAKAN POLA IRIS MATA MANUSIA",2011,"Telematika","","","",310,"2019-03-27","CITATION","","","",,,,,0,0.00,0,4,8
1,"M Agus","Roadmap Implementasi Knowledge Management",2011,"Seminar Nasional Informatika 2009 (semnasIF …","UPN"" Veteran"" Yogyakarta","","https://scholar.google.com/scholar?cites=17236119812525605844&as_sdt=2005&sciodt=0,5&hl=en",311,"2019-03-27","CITATION","","","",,,,,1,0.13,1,1,8
2,"L Sutiarso, A Suyantohadi, D Kastono, AP Nugroho","Aplikasi Sistem Monitoring Pertumbuhan Tanaman Berbasis Web Menggunakan Machine Vision",2011,"Agritech","journal.ugm.ac.id","https://journal.ugm.ac.id/agritech/article/view/9644","https://scholar.google.com/scholar?cites=789151082843157488&as_sdt=2005&sciodt=0,5&hl=en",312,"2019-03-27","","","","",,,,,2,0.25,1,4,8
0,"S Andayani, JPMF UNY","Penggalian Informasi Potensial dari Basis Data di Perguruan Tinggi",,"staff.uny.ac.id","","http://staff.uny.ac.id/sites/default/files/Penggalian%20informasi%20potensial.pdf","",313,"2019-03-27","PDF","","","",,,,,0,0.00,0,2,
0,"A Darsono, E Triawati","Implementasi Media Sms Berbasis Atmega8535 Untuk Memberi Makan Ikan Secara Otomatis",2011,"Konferensi Nasional Sitem …","repository.gunadarma.ac.id","http://repository.gunadarma.ac.id/382/1/implementasi%20media%20sms%20berbasis%20ATMega8535%20untuk%20memberi%20makan%20ikan%20secara%20otomatis_UG.pdf","",314,"2019-03-27","PDF","","","",,,,,0,0.00,0,2,8
0,"HA Parhusip, Y Martono","Kadar Steviosida Maksimum pada Waktu dan Massa yang Minimum",2011,"","repository.uksw.edu","http://repository.uksw.edu/handle/123456789/209","",315,"2019-03-27","","","","",,,,,0,0.00,0,2,8
3,"MI Sari","Desain Segmentasi dan Pengenalan Karakter pada Plat Nomor Kendaraan",2011,"Konferensi Nasional ICT-M Politeknik …","journals.telkomuniversity.ac.id","http://journals.telkomuniversity.ac.id/knip/article/view/556","https://scholar.google.com/scholar?cites=2531058786699932331&as_sdt=2005&sciodt=0,5&hl=en",316,"2019-03-27","","","","",,,,,3,0.38,3,1,8
1,"A Harjoko, R Damayanti","Identification Method for 15 Names of Commercial Wood With Image of Texture Pore as an Input",2011,"Proceedings of International …","icid.sunankalijaga.org","http://icid.sunankalijaga.org/downloads/proceeding/Cluster%202%20Artificial%20Intelligence%20and%20Image%20Processing/C2_129-133%20Identification%20Method%20for%2015%20Names%20of%20Commercial%20Wood%20With%20Image%20of%20Texture%20Pore%20as%20an%20Input.pdf","https://scholar.google.com/scholar?cites=12962080875155152473&as_sdt=2005&sciodt=0,5&hl=en",317,"2019-03-27","PDF","","","",,,,,1,0.13,1,2,8
0,"AYFD YUDHISTIRA, Y SUPRIANTO","LKP: RANCANG BANGUN SISTEM PENDUKUNG KEPUTUSAN PENILAIAN KINERJA KARYAWAN PADA PT. PELABUHAN INDONESIA II (PERSERO) …",2011,"","digilib.stikom.edu","http://digilib.stikom.edu/detil.php?id=2039","",318,"2019-03-27","HTML","","","",,,,,0,0.00,0,2,8
1,"H Amir","Deteksi Bahasa Untuk Dokumen Teks Berbahasa Indonesia",2011,"Telematika","","","https://scholar.google.com/scholar?cites=6463971191472046919&as_sdt=2005&sciodt=0,5&hl=en",319,"2019-03-27","CITATION","","","",,,,,1,0.13,1,1,8
0,"S Arifin, AS Aisjah, J Al Hakim","Interpolasi Lagrange Dan Newton Untuk Peningkatan Jangkauan Ramalan Pada Prediktor Cuaca Maritim Berdasarkan Logika Fuzzy Studi Kasus: Di Perairan …",2011,"","researchgate.net","https://www.researchgate.net/profile/Aulia_Aisjah/publication/263011515_Seminar_Nasional_Teori_dan_Aplikasi_Teknologi_Kelautan_15_Desember_2011_X_-1_INTERPOLASI_LAGRANGE_DAN_NEWTON_UNTUK_PENINGKATAN_JANGKAUAN_RAMALAN_PADA_PREDIKTOR_CUACA_MARITIM_BERDASARKAN_LOGIKA_FUZZY_S/links/0f31753991ed3f2c74000000.pdf","",320,"2019-03-27","PDF","","","",,,,,0,0.00,0,3,8
0,"I Permana","IDENTIFIKASI PEMBICARA INDEPENDENT TEXT PADA DATA CLOSE-SET DENGAN MENGGUNAKAN MEL FREQUENCY CEPSTRAL COEFFICIENTS",2011,"","repository.uin-suska.ac.id","http://repository.uin-suska.ac.id/id/eprint/653","",321,"2019-03-27","","","","",,,,,0,0.00,0,1,8
0,"S Sunaryo, B Setiyono, RR Isnanto","ENKRIPSI DATA HASIL ANALISIS KOMPONEN UTAMA (PCA) ATAS CITRA IRIS MATA MENGGUNAKAN ALGORITMA MD5",2011,"","eprints.undip.ac.id","http://eprints.undip.ac.id/25345/","",322,"2019-03-27","","","","",,,,,0,0.00,0,3,8
9,"SD Budiwati, J Haryatno…","Japanese character (kana) pattern recognition application using neural network",2011,"Proceedings of the 2011 …","ieeexplore.ieee.org","https://ieeexplore.ieee.org/abstract/document/6021648/","https://scholar.google.com/scholar?cites=295033098240894851&as_sdt=2005&sciodt=0,5&hl=en",323,"2019-03-27","","","","",,,,,9,1.13,3,3,8
1,"EC Pangestiningsih","PERANCANGAN APLIKASI PENDETEKSI AREA PARKIR MOBIL",2011,"Universitas Dian Nuswantoro …","mahasiswa.dinus.ac.id","http://mahasiswa.dinus.ac.id/docs/skripsi/jurnal/12738.pdf","https://scholar.google.com/scholar?cites=5518213375684970934&as_sdt=2005&sciodt=0,5&hl=en",324,"2019-03-27","PDF","","","",,,,,1,0.13,1,1,8
7,"BR Malatista, E Sediyono","Model Pembelajaran Matematika untuk Siswa Kelas IV SDLB Penyandang Tunarungu dan Wicara dengan Metode Komtal Berbantuan Komputer",2011,"Jurnal Teknik Informatika dan Sistem …","neliti.com","https://www.neliti.com/publications/219382/model-pembelajaran-matematika-untuk-siswa-kelas-iv-sdlb-penyandang-tunarungu-dan","https://scholar.google.com/scholar?cites=5312349395416716141&as_sdt=2005&sciodt=0,5&hl=en",325,"2019-03-27","","","","",,,,,7,0.88,4,2,8
2,"E Fitriyadi, I Santoso, I Setiawan","Aplikasi Kontrol PID untuk Pengontrolan Suhu Model Sistem Hipertermia Berbasis Sensor Thermopile Mlx90247",2011,"","eprints.undip.ac.id","http://eprints.undip.ac.id/32036/","https://scholar.google.com/scholar?cites=5847118884624254093&as_sdt=2005&sciodt=0,5&hl=en",326,"2019-03-27","","","","",,,,,2,0.25,1,3,8
0,"PMPI AIR","LAPORAN AKHIR PENELITIAN FUNDAMENTAL",2011,"","","","",327,"2019-03-27","CITATION","","","",,,,,0,0.00,0,1,8
1,"M Rivai, T Mujiono","PENINGKATAN TARAF IDENTIFIKASI JENIS GAS DI UDARA TERBUKA MENGGUNAKAN TRANSFORMASI FOURIER DAN PRINCIPAL COMPONENT ANALYSIS",2011,"Jurnal Ilmiah Kursor","kursorjournal.org","http://kursorjournal.org/index.php/kursor/article/view/5","https://scholar.google.com/scholar?cites=15197488324265952826&as_sdt=2005&sciodt=0,5&hl=en",328,"2019-03-27","","","","",,,,,1,0.13,1,2,8
0,"P Danoedoro","MEMBANGUN SISTEM KLASIFIKASI PENGGUNAAN LAHAN MULTIGUNA BERBASIS PENGINDERAAN JAUH DAN SISTEM INFORMASI GEOGRAFIS …",,"researchgate.net","","https://www.researchgate.net/profile/Projo_Danoedoro/publication/302588075_MEMBANGUN_SISTEM_KLASIFIKASI_PENGGUNAAN_LAHAN_MULTIGUNA_BERBASIS_PENGINDERAAN_JAUH_DAN_SISTEM_INFORMASI_GEOGRAFIS_UNTUK_PENGELOLAAN_LINGKUNGAN/links/5731b83708ae6cca19a2f217.pdf","",329,"2019-03-27","PDF","","","",,,,,0,0.00,0,1,
0,"DEJ Weisling","PEMBANGUNAN APLIKASI PENGENALAN CITRA AKSARA JAWA MENGGUNAKAN METODE BACKPROPAGATION DENGANWAVELET SEBAGAI PEMROSESAN …",2011,"","e-journal.uajy.ac.id","http://e-journal.uajy.ac.id/1386/","",330,"2019-03-27","","","","",,,,,0,0.00,0,1,8
2,"HK Pratama","Analisis pernbandingan pengenalan tanda tangan dengan menggunakan metode perceptron dan backpropagation",2011,"","repository.uinjkt.ac.id","http://repository.uinjkt.ac.id/dspace/handle/123456789/4817","https://scholar.google.com/scholar?cites=14150785696393323724&as_sdt=2005&sciodt=0,5&hl=en",331,"2019-03-27","","","","",,,,,2,0.25,2,1,8
1,"SB Perdana","Aplikasi Algoritma Artificial Immune System (AIS) Pada Penjadwalan Job Shop Dalam Pembuatan Spring Bed (Studi Kasus Pt. Cahaya Kawi Ultra Polyintraco)",2011,"","repository.unej.ac.id","http://repository.unej.ac.id/handle/123456789/10167","https://scholar.google.com/scholar?cites=3522487082683359742&as_sdt=2005&sciodt=0,5&hl=en",332,"2019-03-27","","","","",,,,,1,0.13,1,1,8
0,"IW Budiastra, S Sutrisno, U Ahmad…","Penentuan Pola Peningkatan Kekerasan Kulit Buah Manggis Selama Penyimpanan Dingin dengan Metode NIR Spectroscopy",2011,"Jurnal Keteknikan …","neliti.com","https://www.neliti.com/publications/21741/penentuan-pola-peningkatan-kekerasan-kulit-buah-manggis-selama-penyimpanan-dingi","",333,"2019-03-27","","","","",,,,,0,0.00,0,4,8
1,"A Hamzah","Text document information retrieval based on concepts",2011,"Jurnal Teknologi","ejournal.akprind.ac.id","https://ejournal.akprind.ac.id/index.php/jurtek/article/view/866","https://scholar.google.com/scholar?cites=14879094421899679823&as_sdt=2005&sciodt=0,5&hl=en",334,"2019-03-27","","","","",,,,,1,0.13,1,1,8
0,"HA Sofiyuddin, SK Saptomo, BI Setiawan","EVALUASI ALGORITMA FAZI SEDERHANA SEBAGAI METODE KENDALI PINTU SORONG (EVALUATION OF SIMPLE FUZZY ALGORITHM AS SLUICE GATE …",2011,"Jurnal Irigasi–Vol","academia.edu","http://www.academia.edu/download/38585258/ART2011_SAT.pdf","",335,"2019-03-27","PDF","","","",,,,,0,0.00,0,3,8
0,"TD Madyanto, I Santoso, I Setiawan","Pengontrolan Suhu Menggunakan Metode FUZZY-PID pada Model Sistem Hipertermia",2011,"","eprints.undip.ac.id","http://eprints.undip.ac.id/26502/","",336,"2019-03-27","","","","",,,,,0,0.00,0,3,8
9,"FT Puri","Analisis algoritma eigenface (pengenalan wajah) pada aplikasi kehadiran pengajaran dosen",2011,"","repository.uinjkt.ac.id","http://repository.uinjkt.ac.id/dspace/bitstream/123456789/1674/1/FIKA%20TIARA%20PURI-FST.PDF","https://scholar.google.com/scholar?cites=1046763445866344464&as_sdt=2005&sciodt=0,5&hl=en",337,"2019-03-27","PDF","","","",,,,,9,1.13,9,1,8
24,"AA Kusuma, RR Isnanto, I Santoso","Pengenalan Iris Mata Menggunakan Pencirian Matriks Ko-Okurensi Aras Keabuan",2011,"","eprints.undip.ac.id","http://eprints.undip.ac.id/25366/","https://scholar.google.com/scholar?cites=4748674991645736078&as_sdt=2005&sciodt=0,5&hl=en",338,"2019-03-27","","","","",,,,,24,3.00,8,3,8
11,"TD Prihartono, RR Isnanto, I Santoso","Identifikasi Iris Mata Menggunakan Alihragam Wavelet Haar",2011,"","eprints.undip.ac.id","http://eprints.undip.ac.id/32065/","https://scholar.google.com/scholar?cites=10062061060517111490&as_sdt=2005&sciodt=0,5&hl=en",339,"2019-03-27","","","","",,,,,11,1.38,4,3,8
1,"ICJ Kusuma, T Andromeda, D Darjat","Perancangan Simulator Pengendalian Posisi Turret Pada Mobil Pemadam Kebakaran",2011,"","eprints.undip.ac.id","http://eprints.undip.ac.id/25273/","https://scholar.google.com/scholar?cites=10668810116061854644&as_sdt=2005&sciodt=0,5&hl=en",340,"2019-03-27","","","","",,,,,1,0.13,0,3,8
2,"E Sujatmiko, RR Isnanto, E Handoko","Pemilihan Algoritma Optimal untuk Kompresi Data Citra Iris Mata Manusia",2011,"","eprints.undip.ac.id","http://eprints.undip.ac.id/25329/","https://scholar.google.com/scholar?cites=5052934062329748133&as_sdt=2005&sciodt=0,5&hl=en",341,"2019-03-27","","","","",,,,,2,0.25,1,3,8
0,"S Nurmaini, R Passarella","Pedoman Penulisan Tugas Akhir Jurusan Sistem Komputer",2011,"","eprints.unsri.ac.id","http://eprints.unsri.ac.id/3253/1/PEDOMAN_PENULISAN_TUGAS_AKHIR.pdf","",342,"2019-03-27","PDF","","","",,,,,0,0.00,0,2,8
0,"S Susilo","RANCANG BANGUN SISTEM PENGENALAN POLA SIDIK JARI MENGGUNAKAN METODE MINUTIAE",2011,"Jurnal Pendidikan Fisika Indonesia","journal.unnes.ac.id","http://journal.unnes.ac.id/nju/index.php/JPFI/article/view/1069","",343,"2019-03-27","","","","",,,,,0,0.00,0,1,8
0,"K Dimas Achmad Akbar, A Fernando…","Verifikasi Citra Wajah Menggunakan Metode Discrete Cosine Transform Untuk Aplikasi Login",2011,"","repo.pens.ac.id","http://repo.pens.ac.id/1437/","",344,"2019-03-27","","","","",,,,,0,0.00,0,3,8
1,"DY Tadeus, B Setiyono, I Setiawan","Simulasi Kendali Daya Reaktor Nuklir dengan Teknik Kontrol Optimal",2011,"","eprints.undip.ac.id","http://eprints.undip.ac.id/32003/","https://scholar.google.com/scholar?cites=10264438461974745676&as_sdt=2005&sciodt=0,5&hl=en",345,"2019-03-27","","","","",,,,,1,0.13,0,3,8
0,"D Wulandari","PERAMALAN RATA-RATA TEMPERATUR UDARA HARIAN KOTA PEKANBARU MENGGUNAKAN MODEL ARIMA (0, 1, 1)",2011,"","repository.uin-suska.ac.id","http://repository.uin-suska.ac.id/448/","",346,"2019-03-27","","","","",,,,,0,0.00,0,1,8
