Cites,Authors,Title,Year,Source,Publisher,ArticleURL,CitesURL,GSRank,QueryDate,Type,DOI,ISSN,CitationURL,Volume,Issue,StartPage,EndPage,ECC,CitesPerYear,CitesPerAuthor,AuthorCount,Age
3,"R Dewi, M Ichwan, MI Gandalisha","Komparasi Framework MVC (Codeignitier, dan CakePHP) Pada Aplikasi Berbasis Web (Studi Kasus: Sistem Informasi Perwalian Di Jurusan Institut …",2011,"Jurnal Informatika","","","https://scholar.google.com/scholar?cites=7905542108726012199&as_sdt=2005&sciodt=0,5&hl=en",428,"2019-03-24","CITATION","","","",,,,,3,0.38,1,3,8
3,"A Wijanyati","Sistem Informasi Akuntansi Pendekatan Pengembangan Pada UKM",2011,"","Surakarta: Universitas Islam Batik …","","https://scholar.google.com/scholar?cites=12695288215685532805&as_sdt=2005&sciodt=0,5&hl=en",429,"2019-03-24","CITATION","","","",,,,,3,0.38,3,1,8
3,"W Churchman","Sistem Informasi Akuntansi",2011,"Terjemahan Krismiaji). Jakarta: Salemba Empat","","","https://scholar.google.com/scholar?cites=17930658242192734262&as_sdt=2005&sciodt=0,5&hl=en",430,"2019-03-24","CITATION","","","",,,,,3,0.38,3,1,8
3,"D Puspita","Efektivitas Penerapan Sistem Informasi Administrasi Kependudukan di Dinas Kependudukan dan Catatan Sipil Surabaya",2011,"Jurnal Pendidikan Administrasi Perkantoran unesa","","","https://scholar.google.com/scholar?cites=1637948698272097710&as_sdt=2005&sciodt=0,5&hl=en",431,"2019-03-24","CITATION","","","",,,,,3,0.38,3,1,8
3,"I Ridwan","Sistem Informasi",2011,"","","","https://scholar.google.com/scholar?cites=14073175336041387921&as_sdt=2005&sciodt=0,5&hl=en",432,"2019-03-24","CITATION","","","",,,,,3,0.38,3,1,8
3,"MN Sadewo","Pemodelan Hidrologi dengan Penginderaan Jauh dan Sistem Informasi Geografis untuk Penyusunan SDSS Penanggulangan Banjir. Skripsi",2011,"Skripsi. Fakultas Geografi","","","https://scholar.google.com/scholar?cites=13624278016480519175&as_sdt=2005&sciodt=0,5&hl=en",433,"2019-03-24","CITATION","","","",,,,,3,0.38,3,1,8
3,"TA Kusumastuti, B Susilo, YY Suranindyah…","… Tanaman Hijauan Pakan untuk Peningkatan Nilai Ekonomi Total Ternak Ruminansia Menggunakan Model Sistem Informasi Geografis dan Sosial …",2011,"Laporan Akhir Penelitian …","","","https://scholar.google.com/scholar?cites=2509213842101216232&as_sdt=2005&sciodt=0,5&hl=en",434,"2019-03-24","CITATION","","","",,,,,3,0.38,1,4,8
3,"A Kridalaksana","Aplikasi Sistem Informasi Geografis (SIG) Untuk Menentukan Lokasi Hutan Kota dan Contoh Pra Desain Hutan Kota Di Kecamatan Banyuwangi …",2011,"","Skripsi. Bogor: Departemen …","","https://scholar.google.com/scholar?cites=13834845995237979487&as_sdt=2005&sciodt=0,5&hl=en",435,"2019-03-24","CITATION","","","",,,,,3,0.38,3,1,8
3,"AD Setiawati Lilis","Sistem Informasi Akuntansi, Perancangan, Prosedur dan Penerapan",2011,"","Edisi","","https://scholar.google.com/scholar?cites=14715386334706294539&as_sdt=2005&sciodt=0,5&hl=en",436,"2019-03-24","CITATION","","","",,,,,3,0.38,3,1,8
3,"KB Seminar","Bahan Kuliah Manajemen Sistem Informasi",2011,"","IPB","","https://scholar.google.com/scholar?cites=18011703743706921526&as_sdt=2005&sciodt=0,5&hl=en",437,"2019-03-24","CITATION","","","",,,,,3,0.38,3,1,8
2,"U Lestari","Sistem Pakar untuk Mengidentifikasi Jenis-Jenis Kayu",2011,"JUITA: Jurnal Informatika","jurnalnasional.ump.ac.id","https://jurnalnasional.ump.ac.id/index.php/JUITA/article/view/440","https://scholar.google.com/scholar?cites=10942835959404468699&as_sdt=2005&sciodt=0,5&hl=en",438,"2019-03-24","","","","",,,,,2,0.25,2,1,8
3,"KR Siregar","Kajian Mengenai Penerimaan Teknologi dan Informasi Menggunakan Technology Accaptance Model (TAM)",2011,"Rekayasa","kompetensi.trunojoyo.ac.id","http://kompetensi.trunojoyo.ac.id/rekayasa/article/view/2322","https://scholar.google.com/scholar?cites=3198686546439423646&as_sdt=2005&sciodt=0,5&hl=en",439,"2019-03-24","","","","",,,,,3,0.38,3,1,8
6,"ND Retnowati","Analisis CSF, SWOT dan TOWS Studi Kasus: PT Intan Pariwara Klaten",2011,"Jurnal Buana Informatika","ojs.uajy.ac.id","http://ojs.uajy.ac.id/index.php/jbi/article/view/306","https://scholar.google.com/scholar?cites=15349775461632401758&as_sdt=2005&sciodt=0,5&hl=en",440,"2019-03-24","","","","",,,,,6,0.75,6,1,8
68,"E Harinurdin","Perilaku Kepatuhan Wajib Pajak Badan",2011,"Bisnis & Birokrasi Journal","journal.ui.ac.id","http://journal.ui.ac.id/index.php/jbb/article/download/610/595","https://scholar.google.com/scholar?cites=9676140411083249617&as_sdt=2005&sciodt=0,5&hl=en",441,"2019-03-24","PDF","","","",,,,,68,8.50,68,1,8
2,"MA Mikrajab, S Rahanto, HH Solikhah","Hubungan dimensi ketanggapan waktu tunggu pasien, kejelasan informasi, dan kerahasiaan informasi pelayanan kesehatan dengan karakteristik anggota rumah …",2011,"Buletin Penelitian Sistem …","neliti.com","https://www.neliti.com/publications/21270/hubungan-dimensi-ketanggapan-waktu-tunggu-pasien-kejelasan-informasi-dan-kerahas","https://scholar.google.com/scholar?cites=18116964793899358803&as_sdt=2005&sciodt=0,5&hl=en",442,"2019-03-24","","","","",,,,,2,0.25,1,3,8
8,"R Rosnelly, R Pulungan","Membandingkan Analisa Traffic antara WireShark dan NMap",2011,"","repository.ugm.ac.id","https://repository.ugm.ac.id/id/eprint/35127","https://scholar.google.com/scholar?cites=5521716284822099842&as_sdt=2005&sciodt=0,5&hl=en",443,"2019-03-24","","","","",,,,,8,1.00,4,2,8
3,"ND Annavi","Pengaruh Kode Tindakan Medis Operatif dan Non Medis Operatif pada Diagnosis Appendicitis, Fraktur Ekstremitas, Katarak Terhadap Besaran Biaya …",2011,"Skripsi, Fakultas Ilmu Kesehatan, Universitas …","core.ac.uk","https://core.ac.uk/download/pdf/148589635.pdf","https://scholar.google.com/scholar?cites=9656081572361534916&as_sdt=2005&sciodt=0,5&hl=en",444,"2019-03-24","PDF","","","",,,,,3,0.38,3,1,8
4,"M Wyzer, Y Durachman, V Arifin","Aplikasi penjualan produk alat musik berbasis web (studi kasus pt. duta karya musikindo jakarta)",2011,"… : JURNAL SISTEM INFORMASI","journal.uinjkt.ac.id","http://journal.uinjkt.ac.id/index.php/sisteminformasi/article/view/3017","https://scholar.google.com/scholar?cites=13091360793443674506&as_sdt=2005&sciodt=0,5&hl=en",445,"2019-03-24","","","","",,,,,4,0.50,1,3,8
2,"JSIR Sakit","Kementrian Kesehatan RI",2011,"Direktorat Jendral Bina Upaya Kesehatan","","","https://scholar.google.com/scholar?cites=12163400386870000787&as_sdt=2005&sciodt=0,5&hl=en",446,"2019-03-24","CITATION","","","",,,,,2,0.25,2,1,8
2,"L Sutiarso, A Suyantohadi, D Kastono, AP Nugroho","Aplikasi Sistem Monitoring Pertumbuhan Tanaman Berbasis Web Menggunakan Machine Vision",2011,"Agritech","journal.ugm.ac.id","https://journal.ugm.ac.id/agritech/article/view/9644","https://scholar.google.com/scholar?cites=789151082843157488&as_sdt=2005&sciodt=0,5&hl=en",447,"2019-03-24","","","","",,,,,2,0.25,1,4,8
2,"MSSIP Riyanto","dengan Php dan MySql",2011,"Penerbit Gava Media, Yogyakarta","","","https://scholar.google.com/scholar?cites=6347707002401997283&as_sdt=2005&sciodt=0,5&hl=en",448,"2019-03-24","CITATION","","","",,,,,2,0.25,2,1,8
2,"D Wahyuningsih","Implementasi Model EOQ Pada Pembangunan Sistem Penunjang Keputusan Pengendalian Persediaan Bahan Baku di Percetakan Majesty Malang",2011,"JURNAL TEKNOLOGI INFORMASI: Teori …","ejurnal.stimata.ac.id","http://ejurnal.stimata.ac.id/index.php/TI/article/view/133","https://scholar.google.com/scholar?cites=18037766862325191771&as_sdt=2005&sciodt=0,5&hl=en",449,"2019-03-24","","","","",,,,,2,0.25,2,1,8
12,"A Ibrahim","Perancangan Sistem Pemesanan Tiket Pesawat Berbasis Web",2011,"Jurnal sistem informasi (JSI)","","","https://scholar.google.com/scholar?cites=8373629391311924642&as_sdt=2005&sciodt=0,5&hl=en",450,"2019-03-24","CITATION","","","",,,,,12,1.50,12,1,8
2,"W Sugeng, K Mustofa","Real-Time System Pada Jaringan Komputer",2011,"Jurnal Informatika","repository.ugm.ac.id","https://repository.ugm.ac.id/33032/","https://scholar.google.com/scholar?cites=4498036459845983330&as_sdt=2005&sciodt=0,5&hl=en",451,"2019-03-24","","","","",,,,,2,0.25,1,2,8
5,"R Sari, T Listyorini","Game Edukasi Logika Matematika",2011,"Sains dan Teknologi","eprints.umk.ac.id","http://eprints.umk.ac.id/122/","https://scholar.google.com/scholar?cites=1319231127384224790&as_sdt=2005&sciodt=0,5&hl=en",452,"2019-03-24","","","","",,,,,5,0.63,3,2,8
6,"E Hariyanti, I Werdiningsih, K Surendro","Model Pengembangan Dashboard untuk Monitoring dan Evaluasi Kinerja Perguruan Tinggi",2011,"JUTI: Jurnal Ilmiah Teknologi …","juti.if.its.ac.id","http://juti.if.its.ac.id/index.php/juti/article/view/63","https://scholar.google.com/scholar?cites=9763287259216786082&as_sdt=2005&sciodt=0,5&hl=en",453,"2019-03-24","","","","",,,,,6,0.75,2,3,8
2,"A Kustiawan, AB Prasetijo, A Fatchur Rochim","Perancangan Sistem Konsultasi Akademik Online Teknik Elektro Universitas Diponegoro",2011,"","eprints.undip.ac.id","http://eprints.undip.ac.id/25735/","https://scholar.google.com/scholar?cites=12844893385600278253&as_sdt=2005&sciodt=0,5&hl=en",454,"2019-03-24","","","","",,,,,2,0.25,1,3,8
4,"LN Qomariah","Pengaruh Pola Asih dan Asuh Gizi Terhadap Tumbuh Kembang Anak Balita Usia 6-24 Bulan di Wilayah Kerja Puskesmas Jelbuk Kabupaten Jember",2011,"","repository.unej.ac.id","http://repository.unej.ac.id/handle/123456789/13806","https://scholar.google.com/scholar?cites=13942644326286850474&as_sdt=2005&sciodt=0,5&hl=en",455,"2019-03-24","","","","",,,,,4,0.50,4,1,8
17,"T Wijayanti, I Azhari","Pengembangan Customer Relationship Management Berbasis Web pada Griya Muslim Flora",2011,"Jurnal Sistem Informasi Indonesia","","","https://scholar.google.com/scholar?cites=8267753888667649495&as_sdt=2005&sciodt=0,5&hl=en",456,"2019-03-24","CITATION","","","",,,,,17,2.13,9,2,8
2,"D Suciati","Rancang Bangun Sistem Pakar untuk Mendiagnosa Gangguan Kepribadian dan Terapi Pengobatannya dengan Menggunakan Metode Backward Chaining",2011,"","digilib.stikom.edu","http://digilib.stikom.edu/detil.php?id=1460","https://scholar.google.com/scholar?cites=6048511491605364373&as_sdt=2005&sciodt=0,5&hl=en",457,"2019-03-24","","","","",,,,,2,0.25,2,1,8
2,"V Mariani, S Permatasari","Evaluasi Sistem Akuntansi Penjualan Kredit, Piutang dan Penerimaan Kas Pada PT. Insan Media Pratama",2011,"ComTech: Computer, Mathematics …","journal.binus.ac.id","http://journal.binus.ac.id/index.php/comtech/article/view/2753","https://scholar.google.com/scholar?cites=14474107932498793216&as_sdt=2005&sciodt=0,5&hl=en",458,"2019-03-24","","","","",,,,,2,0.25,1,2,8
2,"I Mashuri","Implementasi Literasi Informasi di Sekolah",2011,"Pustakaloka","jurnal.iainponorogo.ac.id","http://jurnal.iainponorogo.ac.id/index.php/pustakaloka/article/view/635","https://scholar.google.com/scholar?cites=6516701534277715663&as_sdt=2005&sciodt=0,5&hl=en",459,"2019-03-24","","","","",,,,,2,0.25,2,1,8
9,"JE Lekatompessy","Peran Sistem Pengendalian Manajemen Dalam Meningkatkan Kinerja Perusahaan: Analisis Kontinjensi Dan Resource-Based View",2011,"","eprints.undip.ac.id","http://eprints.undip.ac.id/40889/","https://scholar.google.com/scholar?cites=10153250581788253615&as_sdt=2005&sciodt=0,5&hl=en",460,"2019-03-24","","","","",,,,,9,1.13,9,1,8
2,"C Adytya","Sistem pendukung Pengambilan Keputusan Pemilihan Sekolah Bebas Narkoba dengan Menggunakan Metode SMARTER dan ORESTE",2011,"Universitas Pembangunan Nasional, Surabaya","eprints.upnjatim.ac.id","http://eprints.upnjatim.ac.id/1917/1/file1.pdf","https://scholar.google.com/scholar?cites=6225848912800991291&as_sdt=2005&sciodt=0,5&hl=en",461,"2019-03-24","PDF","","","",,,,,2,0.25,2,1,8
2,"HP Theorema","Sistem Pendukung Keputusan Pemilihan Mobil Menggunakan Metode Simple Multi Attribute Rating Technique (Smart)",2011,"","repository.usu.ac.id","http://repository.usu.ac.id/handle/123456789/27321","https://scholar.google.com/scholar?cites=11406885158526230190&as_sdt=2005&sciodt=0,5&hl=en",462,"2019-03-24","","","","",,,,,2,0.25,2,1,8
5,"T Suratno, T Prahasto…","Web Usage Mining, Pattern Discovery dan Log File",2011,"Jurnal Sistem Informasi …","jsinbis.msi.undip.ac.id","http://jsinbis.msi.undip.ac.id/upload/07.trisuratno.pdf","https://scholar.google.com/scholar?cites=14467414242849140589&as_sdt=2005&sciodt=0,5&hl=en",463,"2019-03-24","PDF","","","",,,,,5,0.63,2,3,8
2,"A Rahman","Sistem pemroses lembar jawab komputer berbasis XML",2011,"","researchgate.net","https://www.researchgate.net/profile/Arif_Rahman28/publication/304220385_Sistem_Pemroses_Lembar_Jawab_Komputer_Berbasis_XML/links/5769f56508ae1a43d23a3b88/Sistem-Pemroses-Lembar-Jawab-Komputer-Berbasis-XML.pdf","https://scholar.google.com/scholar?cites=13006883244049535676&as_sdt=2005&sciodt=0,5&hl=en",464,"2019-03-24","PDF","","","",,,,,2,0.25,2,1,8
2,"H Indriyawati, MS Suprayogi","PENGEMBANGAN RADIO ONLINE SEBAGAI PEMANFAATAN TEKNOLOGI INFORMASI DAN KOMUNIKASI UNTUK PENGEMBANGAN POTENSI MAHASISWA …",2011,"Jurnal Transformatika","journals.usm.ac.id","http://journals.usm.ac.id/index.php/transformatika/article/view/56","https://scholar.google.com/scholar?cites=17258840051579233734&as_sdt=2005&sciodt=0,5&hl=en",465,"2019-03-24","","","","",,,,,2,0.25,1,2,8
2,"N Adhiatma, D Suprajitno, A Affandi","Implementasi E-Learning Dengan Integrasi Video Conference Berbasis Web Dalam Sistem Manajemen Pembelajaran",2011,"Implementasi E-Learning …","researchgate.net","https://www.researchgate.net/profile/Achmad_Affandi/publication/268241878_IMPLEMENTASI_E-LEARNING_DENGAN_INTEGRASI_VIDEO_CONFERENCE_BERBASIS_WEB_DALAM_SISTEM_MANAJEMEN_PEMBELAJARAN/links/55488e970cf2e2031b3883ed.pdf","https://scholar.google.com/scholar?cites=18258793778154410573&as_sdt=2005&sciodt=0,5&hl=en",466,"2019-03-24","PDF","","","",,,,,2,0.25,1,3,8
3,"PYT Catur, W Karis","Model Penggunaan Teknologi Informasi Dan Kinerja Pegawai Kelurahan Menuju Terwujudnya E-Government",2011,"Semantik","publikasi.dinus.ac.id","http://publikasi.dinus.ac.id/index.php/semantik/article/view/147","https://scholar.google.com/scholar?cites=8314129536406824850&as_sdt=2005&sciodt=0,5&hl=en",467,"2019-03-24","","","","",,,,,3,0.38,2,2,8
2,"AH Rachman","Penerapan Sistem Akuntansi Penjualan Kredit pada PT. Karya Lancar Mandiri Dinamika Kendari",2011,"","academia.edu","http://www.academia.edu/download/37957712/penerapan-sistem-akuntansi-penjualan-kredit.docx","https://scholar.google.com/scholar?cites=578719523968571991&as_sdt=2005&sciodt=0,5&hl=en",468,"2019-03-24","DOC","","","",,,,,2,0.25,2,1,8
2,"FS Putra","Sistem Pendukung Keputusan Pemilihan Perguruan Tinggi Swasta Di Surabaya Dengan Menggunakan Metode Analytical Hierarchy Process (Ahp)",2011,"Skripsi, Universiatas Pembangunan Nasional Veteran …","core.ac.uk","https://core.ac.uk/download/pdf/12217415.pdf","https://scholar.google.com/scholar?cites=13678417019503493328&as_sdt=2005&sciodt=0,5&hl=en",469,"2019-03-24","PDF","","","",,,,,2,0.25,2,1,8
2,"J Jamila, S Hartati","Sistem Pendukung Keputusan Pemilihan Subkontrak Menggunakan Metode Entropy dan TOPSIS",2011,"IJCCS (Indonesian Journal of Computing and …","journal.ugm.ac.id","https://journal.ugm.ac.id/ijccs/article/view/2013","https://scholar.google.com/scholar?cites=7486525161481149443&as_sdt=2005&sciodt=0,5&hl=en",470,"2019-03-24","","","","",,,,,2,0.25,1,2,8
2,"LN Zulita, I Kanedi","Sistem Administrasi Pelayanan Pada Dinas Kependudukan Dan Pencatatan Sipil Kota Bengkulu",2011,"Jurnal Media Infotama","jurnal.unived.ac.id","https://jurnal.unived.ac.id/index.php/jmi/article/view/45","https://scholar.google.com/scholar?cites=16895028303972070153&as_sdt=2005&sciodt=0,5&hl=en",471,"2019-03-24","","","","",,,,,2,0.25,1,2,8
2,"A Firmansyah","Implementasi Services Oriented Architecture (SOA) Dalam Sistem Transaksi Perbankan di Perguruan Tinggi Studi Kasus: Universitas Padjadjaran",2011,"Konferensi Nasional ICT-M Politeknik …","journals.telkomuniversity.ac.id","http://journals.telkomuniversity.ac.id/knip/article/download/535/395","https://scholar.google.com/scholar?cites=15073978215002958458&as_sdt=2005&sciodt=0,5&hl=en",472,"2019-03-24","PDF","","","",,,,,2,0.25,2,1,8
2,"N Listiana, TJW PRABOWO","Likuiditas Pasar Saham dan Asimetri Informasi di Seputar Pengumuman Laba Triwulan",2011,"","eprints.undip.ac.id","http://eprints.undip.ac.id/29596/","https://scholar.google.com/scholar?cites=3171480780392303634&as_sdt=2005&sciodt=0,5&hl=en",473,"2019-03-24","","","","",,,,,2,0.25,1,2,8
2,"OP Waluyo","Implementasi Broadcast TV pada Local Area Network Berbasis Sistem Operasi Ubuntu 10.10",2011,"","digilib.uns.ac.id","https://digilib.uns.ac.id/dokumen/detail/20746/Implementasi-Broadcast-Tv-Pada-Local-Area-Network-Berbasis-Sistem-Operasi-Ubuntu-1010","https://scholar.google.com/scholar?cites=10334417656721434498&as_sdt=2005&sciodt=0,5&hl=en",474,"2019-03-24","","","","",,,,,2,0.25,2,1,8
2,"R Sanjoyo","Sistem Informasi Manajemen dan Fungsi SIM",2011,"Yogyakarta: D3 Rekam Medis FMIPA Universitas …","","","https://scholar.google.com/scholar?cites=14352818970663535610&as_sdt=2005&sciodt=0,5&hl=en",475,"2019-03-24","CITATION","","","",,,,,2,0.25,2,1,8
2,"WH Delone, ER McLean, WS Indonesia, H Umar…","Azhar, Susanto.(2004). Sistem Informasi Manajemen. Bandung: Linggajaya. Alter, Steven.(2002). Information System the Pondation of Business. Pearson …",,"Information Systems","","","https://scholar.google.com/scholar?cites=2254840426525638518&as_sdt=2005&sciodt=0,5&hl=en",476,"2019-03-24","CITATION","","","",,,,,2,0.00,0,5,
2,"A Wibowo","Pembangunan Sistem Layanan Berbasis Lokasi Pencarian UMKM Terdekat Berbasis Android",2011,"","e-journal.uajy.ac.id","http://e-journal.uajy.ac.id/1414/","https://scholar.google.com/scholar?cites=15416249665676280486&as_sdt=2005&sciodt=0,5&hl=en",477,"2019-03-24","","","","",,,,,2,0.25,2,1,8
5,"SK Yefta, AYE Muljadi","Pengukuran Tingkat Implementasi Green Computing Pada Departemen Network dan Departement Facilities Management PT XL Axiata, Tbk. Cabang Bandung",2011,"Jurnal Sistem Informasi","majour.maranatha.edu","http://majour.maranatha.edu/index.php/jurnal-sistem-informasi/article/download/p.%20101-111/pdf#page=81","https://scholar.google.com/scholar?cites=2970227195670120700&as_sdt=2005&sciodt=0,5&hl=en",478,"2019-03-24","PDF","","","",,,,,5,0.63,3,2,8
2,"RD Agustin","Strategi Implementasi Sistem Informasi Terintegrasi UNPAS (SITU) Menyiasati Keberagaman Sistem Lama Yang Dirasakan Telah Mapan Di Setiap …",2011,"","Konferensi Teknologi Informasi dan …","","https://scholar.google.com/scholar?cites=15880216527988160766&as_sdt=2005&sciodt=0,5&hl=en",479,"2019-03-24","CITATION","","","",,,,,2,0.25,2,1,8
2,"M Hasyim","Prediksi Keberlanjutan Penggunaan Sistem Informasi Akuntansi: Pendekatan Model TAM",2011,"","Masagena","","https://scholar.google.com/scholar?cites=13881580958924383314&as_sdt=2005&sciodt=0,5&hl=en",480,"2019-03-24","CITATION","","","",,,,,2,0.25,2,1,8
2,"M Suyatno, P Mustafid, S Aris","Rancang Bangun Sistem Pendukung Keputusan untuk Pemilihan Gagasan dengan Metode Analytical Hierarchy Process (AHP)",2011,"","eprints.undip.ac.id","http://eprints.undip.ac.id/29577/","https://scholar.google.com/scholar?cites=10350119017059520602&as_sdt=2005&sciodt=0,5&hl=en",481,"2019-03-24","","","","",,,,,2,0.25,1,3,8
2,"MMD Purnamawati","Pembangunan Aplikasi Sistem Pakar untuk Diagnosa Penyakit pada Tanaman Cabai Merah",2011,"","e-journal.uajy.ac.id","http://e-journal.uajy.ac.id/id/eprint/2139","https://scholar.google.com/scholar?cites=5301830852879426433&as_sdt=2005&sciodt=0,5&hl=en",482,"2019-03-24","","","","",,,,,2,0.25,2,1,8
1,"B Setiawan, KI Satoto, A Fatchurrochim","SISTEM INFORMASI AKUNTANSI UNTUK UKM",2011,"","eprints.undip.ac.id","http://eprints.undip.ac.id/25349/","https://scholar.google.com/scholar?cites=2972327605550732407&as_sdt=2005&sciodt=0,5&hl=en",483,"2019-03-24","","","","",,,,,1,0.13,0,3,8
15,"Y Dicky, R Martusa","Penerapan Activity Based Costing (Abc) System Dalam Penghitungan Profitabilitas Produk",2011,"Jurnal Akuntansi","","","https://scholar.google.com/scholar?cites=7375286521004536735&as_sdt=2005&sciodt=0,5&hl=en",484,"2019-03-24","CITATION","","","",,,,,15,1.88,8,2,8
2,"AS Anggara","Analisis Daerah Rawan Longsor Dengan Menggunakan Sistem Informasi Geografis Pada Cagar Alam Pegunungan Cycloop Distrik Sentani Kabupaten …",2011,"","Universitas Negeri Papua","","https://scholar.google.com/scholar?cites=6969073602466469862&as_sdt=2005&sciodt=0,5&hl=en",485,"2019-03-24","CITATION","","","",,,,,2,0.25,2,1,8
2,"M Rifkhan, E Darwiyanto, T Informatika, FT Informatika…","Perencanaan Strategi Sistem Informasi/Teknologi Informasi Menggunakan Kerangka The Open Group Architecture Framework (TOGAF) Achitecture …",2011,"vol","","","https://scholar.google.com/scholar?cites=7454742704217158253&as_sdt=2005&sciodt=0,5&hl=en",486,"2019-03-24","CITATION","","","",,,,,2,0.25,0,5,8
4,"IN Suwardika","Analisis Kinerja Organisasi Sektor Publik Menggunakan Balanced Scorecard (Studi Pada Badan Pendidikan Dan Pelatihan Provinsi Jawa Timur)",2011,"","Universitas Brawijaya","","https://scholar.google.com/scholar?cites=17724293170271798413&as_sdt=2005&sciodt=0,5&hl=en",487,"2019-03-24","CITATION","","","",,,,,4,0.50,4,1,8
3,"P Data","Data dan Informasi",2011,"","Jakarta: Kementerian Kesehatan RI","","https://scholar.google.com/scholar?cites=10996303919086401570&as_sdt=2005&sciodt=0,5&hl=en",488,"2019-03-24","CITATION","","","",,,,,3,0.38,3,1,8
8,"B Sulistyo","Penginderaan Jauh Digital: Terapannya dalam Pemodelan Erosi Berbasis Raster",2011,"","repository.unib.ac.id","http://repository.unib.ac.id/89/","https://scholar.google.com/scholar?cites=12647075220451013364&as_sdt=2005&sciodt=0,5&hl=en",489,"2019-03-24","","","","",,,,,8,1.00,8,1,8
7,"QO Aulia","Prototype dan Implementasi Metodologi Pembelajaran iLearning Pada Matakuliah Sistem Basis Data",2011,"Jurusan Sistem Informasi, Skripsi, Tangerang: Raharja","","","https://scholar.google.com/scholar?cites=408553955230501250&as_sdt=2005&sciodt=0,5&hl=en",490,"2019-03-24","CITATION","","","",,,,,7,0.88,7,1,8
31,"I Riadi","Optimalisasi Keamanan Jaringan Menggunakan Pemfilteran Aplikasi Berbasis Mikrotik",2011,"Jurnal JUSI","academia.edu","http://www.academia.edu/download/35610590/08-JUSI-Vol-1-No-1-_Optimalisasi-Keamanan-Jaringan-Menggunakan-Pemfilteran-Aplikasi-Berbasis-Mikrotik.pdf","https://scholar.google.com/scholar?cites=2575360711136190405&as_sdt=2005&sciodt=0,5&hl=en",491,"2019-03-24","PDF","","","",,,,,31,3.88,31,1,8
5,"H Henderi, U Raharjda, QO Aulia, M Hendri","Dashboarding Information Systems For The Education Sector: Aplication and Methodologies",2011,"CCIT Journal","ejournal.raharja.ac.id","http://ejournal.raharja.ac.id/index.php/ccit/article/view/209","https://scholar.google.com/scholar?cites=10169279536282202399&as_sdt=2005&sciodt=0,5&hl=en",492,"2019-03-24","","","","",,,,,5,0.63,1,4,8
1,"Y Yuniarthe","Analisis Kinerja Sistem Informasi dengan Metode Balanced Scorecard pada perusahaan outsourcer sistem informasi",2011,"Semantik","publikasi.dinus.ac.id","http://publikasi.dinus.ac.id/index.php/semantik/article/view/114","https://scholar.google.com/scholar?cites=12627639561075012658&as_sdt=2005&sciodt=0,5&hl=en",493,"2019-03-24","","","","",,,,,1,0.13,1,1,8
1,"A Fitriani","Membangun Sistem Informasi Database Penjualan Pada Anna Catering",2011,"","repository.amikom.ac.id","http://repository.amikom.ac.id/files/publikasi_05.12.1284.pdf","https://scholar.google.com/scholar?cites=6064958833544784041&as_sdt=2005&sciodt=0,5&hl=en",494,"2019-03-24","PDF","","","",,,,,1,0.13,1,1,8
3,"S Wahyuni","SISTEM PENDUKUNG KEPUTUSAN PENERIMA RASKIN MENGGUNAKAN METODE TOPSIS (TECHNIQUE FOR ORDER PREFERENCE BY SIMILARITY TO IDEAL …",2011,"","repository.uin-suska.ac.id","http://repository.uin-suska.ac.id/639/","https://scholar.google.com/scholar?cites=15550632292143496878&as_sdt=2005&sciodt=0,5&hl=en",495,"2019-03-24","","","","",,,,,3,0.38,3,1,8
1,"LA Wibisono","Sistem Informasi Kejuaraan Karate Solo Cup Berbasis Web",2011,"","eprints.ums.ac.id","http://eprints.ums.ac.id/16195/4/BAB_I.pdf","https://scholar.google.com/scholar?cites=17541993175951770837&as_sdt=2005&sciodt=0,5&hl=en",496,"2019-03-24","","","","",,,,,1,0.13,1,1,8
1,"L Christian, DM Azzahra","Sistem Informasi Akuntansi Pembelian Material pada Perusahaan Kontraktor",2011,"Seminar Nasional Aplikasi Teknologi …","academia.edu","http://www.academia.edu/download/54214608/2170-2192-1-PB.pdf","https://scholar.google.com/scholar?cites=14241286687136765215&as_sdt=2005&sciodt=0,5&hl=en",497,"2019-03-24","PDF","","","",,,,,1,0.13,1,2,8
1,"F Rohman","Faktor-Faktor yang Mempengaruhi Kinerja Sistem Informasi Akuntansi pada BRI di Eks Karesidenan Pekalongan",2011,"","lib.unnes.ac.id","http://lib.unnes.ac.id/13344/","https://scholar.google.com/scholar?cites=2362811495906331717&as_sdt=2005&sciodt=0,5&hl=en",498,"2019-03-24","","","","",,,,,1,0.13,1,1,8
2,"IP Asri","Sistem Informasi Internet Service Provider Primanet Sragen Berbasis WEB",2011,"","eprints.ums.ac.id","http://eprints.ums.ac.id/id/eprint/16205","https://scholar.google.com/scholar?cites=3291647963037425508&as_sdt=2005&sciodt=0,5&hl=en",499,"2019-03-24","","","","",,,,,2,0.25,2,1,8
1,"A Buchari","Analisis efektifitas sistem informasi dan kinerja pengguna pada sistem informasi dan manajemen pertanahan nasional (simtanas) di kantor pertanahan",2011,"","repository.sb.ipb.ac.id","http://repository.sb.ipb.ac.id/id/eprint/1506","https://scholar.google.com/scholar?cites=16268491378964843307&as_sdt=2005&sciodt=0,5&hl=en",500,"2019-03-24","","","","",,,,,1,0.13,1,1,8
4,"K Ghozali, MF Artwodini","Pembuatan Portofolio Aplikasi Mendatang Pada Perusahaan Jasa Konstruksi",2011,"Institut Teknologi Sepuluh Nopember","si.its.ac.id","http://si.its.ac.id/data/sisfo_data/files/4_vol4no1.pdf","https://scholar.google.com/scholar?cites=497562974162285383&as_sdt=2005&sciodt=0,5&hl=en",501,"2019-03-24","PDF","","","",,,,,4,0.50,2,2,8
