Cites,Authors,Title,Year,Source,Publisher,ArticleURL,CitesURL,GSRank,QueryDate,Type,DOI,ISSN,CitationURL,Volume,Issue,StartPage,EndPage,ECC,CitesPerYear,CitesPerAuthor,AuthorCount,Age
2,"R Maarial","Efektifitas Sistem Informasi Akuntansi Penjualan dan Penerimaan Kas pada PT Surya Wenang Indah Manado",2011,"","Skripsi","","https://scholar.google.com/scholar?cites=15196190622659858698&as_sdt=2005&sciodt=0,5&hl=en",733,"2019-03-24","CITATION","","","",,,,,2,0.25,2,1,8
2,"N Apriani","Perancangan sistem informasi geografis pencarian rute terpendek fasilitas umum dengan algoritma A*(studi kasus: kota pecan baru)",2011,"","Skripsi Medan: Universitas …","","https://scholar.google.com/scholar?cites=334048197182475453&as_sdt=2005&sciodt=0,5&hl=en",734,"2019-03-24","CITATION","","","",,,,,2,0.25,2,1,8
2,"HI Pohan","Membuat Sistem Informasi Penjualan Berbasis Web dengan PHP dan MySQL",2011,"Gava Media, Yogyakarta","","","https://scholar.google.com/scholar?cites=14503725522424675779&as_sdt=2005&sciodt=0,5&hl=en",735,"2019-03-24","CITATION","","","",,,,,2,0.25,2,1,8
2,"L Setiawati, A Diana","Sistem Informasi Akuntansi (Perancangan, Proses, dan Penerapan)",2011,"","Yogyakarta: Penerbit ANDI …","","https://scholar.google.com/scholar?cites=12829850465201761097&as_sdt=2005&sciodt=0,5&hl=en",736,"2019-03-24","CITATION","","","",,,,,2,0.25,1,2,8
2,"MSI Mardi","Analisis & Desain Sistem Informasi: Pendekatan Terstruktur Teori dan Praktek Aplikasi Bisnis",2011,"","CV. Andi Offset. Yogyakarta","","https://scholar.google.com/scholar?cites=9106178175367064099&as_sdt=2005&sciodt=0,5&hl=en",737,"2019-03-24","CITATION","","","",,,,,2,0.25,2,1,8
2,"L Ane","Pengaruh Sistem Informasi Akuntansi Dalam Menunjang Aktivitas Pengendalian Internal Pemberian Kredit (Studi Empiris Pada Bank Umum Di Medan)",2011,"Jurnal Telaah Akuntansi","","","https://scholar.google.com/scholar?cites=2279688710530505975&as_sdt=2005&sciodt=0,5&hl=en",738,"2019-03-24","CITATION","","","",,,,,2,0.25,2,1,8
2,"KS Yulhendri","Pengembangan Tata Kelola TI untuk Pengelolaan Sistem Informasi Terintegrasi di Perguruan Tinggi melalui penentuan Kebijakan, Aturan, Pedoman, dan …",2011,"Pengembangan Tata Kelola TI","","","https://scholar.google.com/scholar?cites=9887365566135434254&as_sdt=2005&sciodt=0,5&hl=en",739,"2019-03-24","CITATION","","","",,,,,2,0.25,2,1,8
2,"NY Rochsianto","Pengembangan Sistem Informasi Alumni Berbasis Web Menggunakan PHP dan MySQL di SMA Negeri 2 Nganjuk",2011,"Skripsi. Teknik UNY","","","https://scholar.google.com/scholar?cites=3723037733392970903&as_sdt=2005&sciodt=0,5&hl=en",740,"2019-03-24","CITATION","","","",,,,,2,0.25,2,1,8
2,"T Masyur","Sistem Informasi",2011,"Gava Media","","","https://scholar.google.com/scholar?cites=17742590794692693148&as_sdt=2005&sciodt=0,5&hl=en",741,"2019-03-24","CITATION","","","",,,,,2,0.25,2,1,8
2,"DA Santoso, A Haryono","Rancang Bangun Sistem Informasi Perencanaan dan Pengendalian Bahan Baku Pada Industri Pakaian",2011,"Jurnal Techno Science","","","https://scholar.google.com/scholar?cites=4065398149377731108&as_sdt=2005&sciodt=0,5&hl=en",742,"2019-03-24","CITATION","","","",,,,,2,0.25,1,2,8
2,"B Gunawan","Pemanfaatan sistem Informasi Geografis untuk potensi sumber daya lahan pertanian di Kabupaten Kudus",2011,"Jurnal sains dan teknologi UMK","","","https://scholar.google.com/scholar?cites=10373703851566442796&as_sdt=2005&sciodt=0,5&hl=en",743,"2019-03-24","CITATION","","","",,,,,2,0.25,2,1,8
2,"Y Lestari","Pembagunan Sistem Informasi Inventaris Pada Sekolah Menengah Pertama Negeri 2 Karangpandan Berbasis Web",2011,"Tugas Akhir Program Studi Teknik Informatika …","","","https://scholar.google.com/scholar?cites=4211024714997762045&as_sdt=2005&sciodt=0,5&hl=en",744,"2019-03-24","CITATION","","","",,,,,2,0.25,2,1,8
2,"NNM Hutabarat","Analisis dan Perancangan Sistem Informasi Akuntansi atas Siklus Pendapatan dan Siklus Pengeluaran pada Isya Collection",2011,"Skripsi Program S1 Fakultas Ekonomika dan Bisnis …","","","https://scholar.google.com/scholar?cites=17941607171124823485&as_sdt=2005&sciodt=0,5&hl=en",745,"2019-03-24","CITATION","","","",,,,,2,0.25,2,1,8
2,"B Surono","Analisis dan Perancangan Sistem Informasi Administrasi Sekolah pada SMA Tugu Nasional”",2011,"","","","https://scholar.google.com/scholar?cites=12281429450121679597&as_sdt=2005&sciodt=0,5&hl=en",746,"2019-03-24","CITATION","","","",,,,,2,0.25,2,1,8
2,"F Benny","Sistem Informasi Keputusan Perencanaan Karir Dan Pemilihan Karyawan Berprestasi Pada CV",2011,"SAS Bandung","","","https://scholar.google.com/scholar?cites=2829868029923498207&as_sdt=2005&sciodt=0,5&hl=en",747,"2019-03-24","CITATION","","","",,,,,2,0.25,2,1,8
2,"EA Yudianto","Aplikasi Sistem Informasi Geografis untuk Mendeteksi Potensi Bencana Tanah Longsor dan Banjir Bandang",2011,"","GEA","","https://scholar.google.com/scholar?cites=5464105948050497320&as_sdt=2005&sciodt=0,5&hl=en",748,"2019-03-24","CITATION","","","",,,,,2,0.25,2,1,8
2,"N Andriana","Sistem Informasi Penjualan Damar Mata Kucing Berbasis Web pada Perusahaan Damar Nona",2011,"","","","https://scholar.google.com/scholar?cites=10609774384142946196&as_sdt=2005&sciodt=0,5&hl=en",749,"2019-03-24","CITATION","","","",,,,,2,0.25,2,1,8
2,"Y Wiharto","Sistem Informasi Akademik Berbasis Sms",2011,"","Gateway","","https://scholar.google.com/scholar?cites=997508546316217194&as_sdt=2005&sciodt=0,5&hl=en",750,"2019-03-24","CITATION","","","",,,,,2,0.25,2,1,8
2,"W Dariyati","Analisis Dan Perancangan Sistem Informasi Keuangan Pada SMK Negeri 1 Girisubo Gunung Kidul Yogyakarta",2011,"Yogyakarta: STMIK AMIKOM Yogyakarta","","","https://scholar.google.com/scholar?cites=12056293539564416974&as_sdt=2005&sciodt=0,5&hl=en",751,"2019-03-24","CITATION","","","",,,,,2,0.25,2,1,8
2,"F Habibie","Analisis Data Iklim dan Aplikasi Sistem Informasi Geografi untuk pengembangan tanaman jagung di Kabupaten Buton Sulawesi Tenggara",2011,"Skripsi. Fakultas Pertanian Universitas Haluoleo …","","","https://scholar.google.com/scholar?cites=15757029742027825281&as_sdt=2005&sciodt=0,5&hl=en",752,"2019-03-24","CITATION","","","",,,,,2,0.25,2,1,8
2,"K Hadi","Optimalisasi Penerapan Sistem Informasi Manajemen dalam Peningkatan Layanan Pendidikan di SMA Semesta Kota Semarang",2011,"Walisongo Repository","","","https://scholar.google.com/scholar?cites=2576368159764279220&as_sdt=2005&sciodt=0,5&hl=en",753,"2019-03-24","CITATION","","","",,,,,2,0.25,2,1,8
2,"A Diana, L Setiawati","Sistem informasi akuntansi erancangan proses dan penerapan",2011,"","Edisi Pertama. Andi. Yogyakarta","","https://scholar.google.com/scholar?cites=8707111229490538506&as_sdt=2005&sciodt=0,5&hl=en",754,"2019-03-24","CITATION","","","",,,,,2,0.25,1,2,8
3,"A Yudono","Sistem Informasi Pertanahan dan Aspek Operasional Pengelolaan Lahan Perkotaan",2011,"Universitas Brawijaya. Malang","","","https://scholar.google.com/scholar?cites=11448790546198679698&as_sdt=2005&sciodt=0,5&hl=en",755,"2019-03-24","CITATION","","","",,,,,3,0.38,3,1,8
3,"D Setiawan","Analisis dan Perancangan Sistem Informasi Rumah Sakit Rawat-Inap di Puskesmas Grabag I Kabupaten Magelang",2011,"","Magelang","","https://scholar.google.com/scholar?cites=3355597358999547917&as_sdt=2005&sciodt=0,5&hl=en",756,"2019-03-24","CITATION","","","",,,,,3,0.38,3,1,8
2,"E Rustiyanto","Sistem Informasi Manajemen, Edisi Revisi",2011,"","Gosyen Publising, Yogyakarta","","https://scholar.google.com/scholar?cites=4674393090493134229&as_sdt=2005&sciodt=0,5&hl=en",757,"2019-03-24","CITATION","","","",,,,,2,0.25,2,1,8
2,"DJBU Kesehatan","Petunjuk Teknis Sistem Informasi Rumah Sakit Revisi II",2011,"Jakarta: Kementrian Kesehatan RI","","","https://scholar.google.com/scholar?cites=11014314167181869374&as_sdt=2005&sciodt=0,5&hl=en",758,"2019-03-24","CITATION","","","",,,,,2,0.25,2,1,8
2,"EI Wiama","Analisis dan Perancangan Sistem Informasi Aset Pada Balai Latihan Pendidikan Teknik Yogyakarta",2011,"","STMIK Amikom Yogyakarta","","https://scholar.google.com/scholar?cites=13420080999299571890&as_sdt=2005&sciodt=0,5&hl=en",759,"2019-03-24","CITATION","","","",,,,,2,0.25,2,1,8
3,"W Yudi","Sistem Informasi Akademik berbasis SMS Gateway",2011,"Jurnal Teknomatika","","","https://scholar.google.com/scholar?cites=1963614388553465927&as_sdt=2005&sciodt=0,5&hl=en",760,"2019-03-24","CITATION","","","",,,,,3,0.38,3,1,8
2,"F Bahtiar","Sistem Informasi Penyewaan Rental Mobil pada Windu Rent Car",2011,"","Yogyakarta: Sekolah Tinggi …","","https://scholar.google.com/scholar?cites=4056737399992806769&as_sdt=2005&sciodt=0,5&hl=en",761,"2019-03-24","CITATION","","","",,,,,2,0.25,2,1,8
2,"M Gabby","Tingkat efektivitas sistem informasi Remote Trading menggunakan metode UTAUT pada PT Ciptadana Securities",2011,"Universitas Bina Nusantara: Unpublished Master …","","","https://scholar.google.com/scholar?cites=3699161701707899266&as_sdt=2005&sciodt=0,5&hl=en",762,"2019-03-24","CITATION","","","",,,,,2,0.25,2,1,8
2,"KBW Adinata","Penilaian Efektivitas Sistem Informasi Akuntansi pada Perusahaan Daerah Air Minum di Kabupaten Badung",2011,"","Skripsi Sarjana Akuntansi Fakultas …","","https://scholar.google.com/scholar?cites=9691999294322497814&as_sdt=2005&sciodt=0,5&hl=en",763,"2019-03-24","CITATION","","","",,,,,2,0.25,2,1,8
2,"E Haryanto","Sistem Informasi Budidaya Ayam Broiler Berbasis Web pada Peternakan Edi",2011,"","","","https://scholar.google.com/scholar?cites=6546736980476005188&as_sdt=2005&sciodt=0,5&hl=en",764,"2019-03-24","CITATION","","","",,,,,2,0.25,2,1,8
1,"M Alamsyah, SJ Putra, ZB Fananie","Rancang Bangun Sistem Informasi Administrasi Pembukaan dan Penutupan Rekening TabunganKu (Studi Kasus: Bank Muamalat Cabang Puri Indah Jakarta Barat)",2011,"… SISTEM INFORMASI","journal.uinjkt.ac.id","http://journal.uinjkt.ac.id/index.php/sisteminformasi/article/view/134","https://scholar.google.com/scholar?cites=2198677160026322435&as_sdt=2005&sciodt=0,5&hl=en",765,"2019-03-24","","","","",,,,,1,0.13,0,3,8
1,"E Syafutra","Sistem Informasi Optimasi Pencampuran Pakan Pada Broiler Menggunakan Metode Algoritma Genetika (Sifom)",2011,"","repository.uin-suska.ac.id","http://repository.uin-suska.ac.id/id/eprint/642","https://scholar.google.com/scholar?cites=16590926539742240414&as_sdt=2005&sciodt=0,5&hl=en",766,"2019-03-24","","","","",,,,,1,0.13,1,1,8
1,"BP Raharjo","Asosiasi Partisipasi Pemakai dengan Kepuasan Pemakai dalam Pengembangan Sistem Informasi (Studi pada Pengguna SIMAWeb FE UNDIP)",2011,"JINAH (Jurnal Ilmiah Akuntansi dan …","ejournal.undiksha.ac.id","http://ejournal.undiksha.ac.id/index.php/JJA/article/download/313/268","https://scholar.google.com/scholar?cites=5982105346151507347&as_sdt=2005&sciodt=0,5&hl=en",767,"2019-03-24","PDF","","","",,,,,1,0.13,1,1,8
1,"DK Hakim","Implementasi Online Analytical Processing (Olap) Pada Studi Kasus Sistem Informasi Manajemen Perijinan Menggunakan Alat Bantu Microsoft Business Intelligence …",2011,"Techno (Jurnal Fakultas Teknik, Universitas …","jurnalnasional.ump.ac.id","http://jurnalnasional.ump.ac.id/index.php/Techno/article/view/25","https://scholar.google.com/scholar?cites=5845936432122725496&as_sdt=2005&sciodt=0,5&hl=en",768,"2019-03-24","","","","",,,,,1,0.13,1,1,8
1,"H Destiana, N Indriyani","Perancangan Sistem Informasi Pengolahan Data Nilai Siswa Pada Lembaga Kursus English Course Jakarta Menggunakan Metode Waterfall",2011,"Paradigma-Jurnal Komputer dan …","ejournal.bsi.ac.id","http://ejournal.bsi.ac.id/ejurnal/index.php/paradigma/article/view/3440","https://scholar.google.com/scholar?cites=13694978689295383882&as_sdt=2005&sciodt=0,5&hl=en",769,"2019-03-24","","","","",,,,,1,0.13,1,2,8
5,"M Ahmad","Analisis Manajemen Mutu Terpadu (TQM) dalam Pelayanan Rumah Sakit",2011,"Diakses melalui https://www. google. com/url","academia.edu","http://www.academia.edu/download/46040710/ANALISIS-MANAJEMEN-MUTU-TERPADU-TQM-DALAM-PELAYANAN-RUMAH-SAKIT.pdf","https://scholar.google.com/scholar?cites=17056062339311274543&as_sdt=2005&sciodt=0,5&hl=en",770,"2019-03-24","PDF","","","",,,,,5,0.63,5,1,8
3,"W Wijayanto","Perancangan Aplikasi Pembagian Harta Waris Berdasarkan Hukum Islam untuk Membantu Tim Faraidh Masjid Baiturroyan Sleman Yogyakarta",2011,"Yogyakarta: AMIKOM Yogyakarta","repository.amikom.ac.id","http://repository.amikom.ac.id/files/Publikasi%20_07.12.2141.pdf","https://scholar.google.com/scholar?cites=13130846943178924551&as_sdt=2005&sciodt=0,5&hl=en",771,"2019-03-24","PDF","","","",,,,,3,0.38,3,1,8
1,"D Pitaloka","PENGARUH PERILAKU, KERUMITAN DAN DUKUNGAN ORGANISASI TERHADAP MINAT MENGUNAKAN SISTEM INFORMASI YANG TERINTREGASI: STUDI …",2011,"","etd.repository.ugm.ac.id","http://etd.repository.ugm.ac.id/index.php?mod=penelitian_detail&sub=PenelitianDetail&act=view&typ=html&buku_id=53625","https://scholar.google.com/scholar?cites=17089367341178498894&as_sdt=2005&sciodt=0,5&hl=en",772,"2019-03-24","","","","",,,,,1,0.13,1,1,8
1,"A Nugroho, S Hartati","… Dengan Kemampuan Menyimpan Data Berformat GML (Geography Markup Language) Yang Dapat Digunakan Untuk Mendasari Aplikasi-aplikasi Sistem Informasi …",2011,"Jurnal Informatika","ced.petra.ac.id","http://ced.petra.ac.id/index.php/inf/article/view/18257","https://scholar.google.com/scholar?cites=9773098560322617027&as_sdt=2005&sciodt=0,5&hl=en",773,"2019-03-24","","","","",,,,,1,0.13,1,2,8
1,"W Kartawan, H Susana","Sistem Informasi Monitoring Pekerjaan Berbasis Web Pada Bagian Pemeliharaan Dan Data Teknik Pertamina Ep Cirebon",2011,"JURNAL ICT","stmik-ikmi-cirebon.net","http://stmik-ikmi-cirebon.net/e-journal/index.php/JICT/article/view/34","https://scholar.google.com/scholar?cites=9338775691734437140&as_sdt=2005&sciodt=0,5&hl=en",774,"2019-03-24","","","","",,,,,1,0.13,1,2,8
1,"M Zunaidi, DE Waluyo, D Agustini","ANALISIS PENGARUH AKURASI, KETEPATAN WAKTU DAN RELEVANSI INFORMASI TERHADAP KEPUASAN PEMAKAI SISTEM INFORMASI ATEMIS ON WEB DI …",2011,"Semantik","publikasi.dinus.ac.id","http://publikasi.dinus.ac.id/index.php/semantik/article/view/57","https://scholar.google.com/scholar?cites=4269640603723078714&as_sdt=2005&sciodt=0,5&hl=en",775,"2019-03-24","","","","",,,,,1,0.13,0,3,8
1,"I Sanjaya","Penerapan Sistem Informasi Akuntansi Berbasis TI Menggunakan Software K-SYSTEM Pada Toko Sami Jaya",2011,"","repository.unika.ac.id","http://repository.unika.ac.id/11482/","https://scholar.google.com/scholar?cites=5420838927827570082&as_sdt=2005&sciodt=0,5&hl=en",776,"2019-03-24","","","","",,,,,1,0.13,1,1,8
17,"BE Purnama","Perancangan Awal Perangkat Lunak Ensiklopedia Wayang Digital Berbasis Multimedia",2011,"Speed-Sentra Penelitian Engineering dan Edukasi","ijns.org","http://ijns.org/journal/index.php/speed/article/view/821","https://scholar.google.com/scholar?cites=6333516843852191624&as_sdt=2005&sciodt=0,5&hl=en",777,"2019-03-24","","","","",,,,,17,2.13,17,1,8
1,"S Priyanto","ANALISA SISTEM INFORMASI PERPUSTAKAAN DENGAN MODEL TASK TECHNOLOGY FIT Studi kasus program SEMLIB di UPT Perpustakaan Undip",2011,"","eprints.undip.ac.id","http://eprints.undip.ac.id/49297/","https://scholar.google.com/scholar?cites=7627480364093366859&as_sdt=2005&sciodt=0,5&hl=en",778,"2019-03-24","","","","",,,,,1,0.13,1,1,8
1,"R Jayanti, WA Parashati","SISTEM INFORMASI CUSTOMER RELATIONSHIP MANAGEMENT (CRM) PADA SALON STEVIE N RIZ PALEMBANG",2011,"","eprints.mdp.ac.id","http://eprints.mdp.ac.id/115/","https://scholar.google.com/scholar?cites=2062540340317296064&as_sdt=2005&sciodt=0,5&hl=en",779,"2019-03-24","","","","",,,,,1,0.13,1,2,8
1,"HH Kusumo","Rancang Bangun Sistem Informasi Manajemen Pemesanan dan Persediaan Barang Berbasis Teknologi Java di PT. Endang (Agen Elpiji PT. Pertamina Rayon …",2011,"","eprints.ums.ac.id","http://eprints.ums.ac.id/12296/2/BabI.PDF","https://scholar.google.com/scholar?cites=3120434620607792674&as_sdt=2005&sciodt=0,5&hl=en",780,"2019-03-24","","","","",,,,,1,0.13,1,1,8
1,"B Ariawan, DRIR HIdayat","Evaluasi penerapan sistem informasi puskesmas elektronik (simpustronik) di dinas kesehatan kabupaten bondowoso menggunakan metode HOT (human …",2011,"","repository.ugm.ac.id","https://repository.ugm.ac.id/39002/","https://scholar.google.com/scholar?cites=14362615427953834531&as_sdt=2005&sciodt=0,5&hl=en",781,"2019-03-24","","","","",,,,,1,0.13,1,2,8
4,"SK Dana, PN Herlan, FAW Yanuar","Analisis Kajian Standarisasi Isi Situs Web Pemerintah Daerah Kabupaten/Kota",2011,"Telematika","","","https://scholar.google.com/scholar?cites=5681229504922604390&as_sdt=2005&sciodt=0,5&hl=en",782,"2019-03-24","CITATION","","","",,,,,4,0.50,1,3,8
0,"L Lisnawati","Pengaruh Kinerja Keuangan Terhadap Return Saham (Studi Pada Perusahaan Farmasi di Bursa Efek Indonesia)",2011,"sistem informasi","repo.unand.ac.id","http://repo.unand.ac.id/id/eprint/894","",783,"2019-03-24","","","","",,,,,0,0.00,0,1,8
1,"L Mustika","Sistem Informasi dan Panduan Arah Gedung SDIT Mutiara Insani Delanggu Berbasis 3D Blender",2011,"","eprints.ums.ac.id","http://eprints.ums.ac.id/id/eprint/14466","https://scholar.google.com/scholar?cites=4924387730145913118&as_sdt=2005&sciodt=0,5&hl=en",784,"2019-03-24","","","","",,,,,1,0.13,1,1,8
1,"R Primasari","Perancangan Sistem Informasi Pengolahan Data Pelanggan Pada Perusahaan Daerah AIR Minum (PDAM) Kota Pekanbaru",2011,"","repository.uin-suska.ac.id","http://repository.uin-suska.ac.id/611/","https://scholar.google.com/scholar?cites=11512563730043109349&as_sdt=2005&sciodt=0,5&hl=en",785,"2019-03-24","","","","",,,,,1,0.13,1,1,8
1,"R AMISENO","Analisis Penerimaan Sistem Informasi Rekam Medis menurut Aspek Kemudahan dan Aspek Manfaat di Seksi Rekam Medis dan Pelaporan Rumah Sakit Daerah …",2011,"","eprints.ums.ac.id","http://eprints.ums.ac.id/id/eprint/14829","https://scholar.google.com/scholar?cites=9207280274251872879&as_sdt=2005&sciodt=0,5&hl=en",786,"2019-03-24","","","","",,,,,1,0.13,1,1,8
2,"R Mursyid","Pengaruh partisipasi anggaran, komitmen organisasi, teknologi informasi terhadap kinerja manjerial: studi empiris pada perusahaan manufkatur di Kabupaten Bogor",2011,"","repository.uinjkt.ac.id","http://repository.uinjkt.ac.id/dspace/handle/123456789/3052","https://scholar.google.com/scholar?cites=12380113060469582061&as_sdt=2005&sciodt=0,5&hl=en",787,"2019-03-24","","","","",,,,,2,0.25,2,1,8
1,"AR HAKIM","Perancangan Sistem Informasi Pengukuran Konduktivitas Hidraulik Tidak Jenuh Tanah dengan Sensor Tensiometer dan Higrometer Digital",2011,"","repository.unej.ac.id","http://repository.unej.ac.id/handle/123456789/15918","https://scholar.google.com/scholar?cites=7014460939432230248&as_sdt=2005&sciodt=0,5&hl=en",788,"2019-03-24","","","","",,,,,1,0.13,1,1,8
3,"M Haris","Sistem penunjang keputusan kelayakan pembiayaan usaha kecil menengah (UKM) dengan menggunakan logika fazzy pada bank pembiayaan rakyat syariah: studi …",2011,"","repository.uinjkt.ac.id","http://repository.uinjkt.ac.id/dspace/handle/123456789/1399","https://scholar.google.com/scholar?cites=4266926635560928485&as_sdt=2005&sciodt=0,5&hl=en",789,"2019-03-24","","","","",,,,,3,0.38,3,1,8
1,"L Somantri","PEMANFAATAN CITRA QUICKBIRD DAN SISTEM INFORMASI GEOGRAFIS UNTUK ZONASI KERENTANAN KEBAKARAN PERMUKIMAN KASUS DI KOTA …",2011,"Jurnal Geografi Gea","ejournal.upi.edu","http://ejournal.upi.edu/index.php/gea/article/view/1656","https://scholar.google.com/scholar?cites=692233469077844005&as_sdt=2005&sciodt=0,5&hl=en",790,"2019-03-24","","","","",,,,,1,0.13,1,1,8
4,"PW Handayani, U Hariyaty","Analisis Fungsionalitas Open Source Software ERP untuk Pengembangan Modul Pembelajaran ERP",2011,"Jurnal Sistem Informasi","jsi.cs.ui.ac.id","http://jsi.cs.ui.ac.id/index.php/jsi/article/view/302","https://scholar.google.com/scholar?cites=17710859337373955244&as_sdt=2005&sciodt=0,5&hl=en",791,"2019-03-24","","","","",,,,,4,0.50,2,2,8
1,"D Sumartono","Evaluasi lahan untuk kawasan lindung dan budidaya dengan aplikasi sistem informasi geografis (SIG) di Kabupaten Karanganyar, Jawa Tengah",2011,"","eprints.ums.ac.id","http://eprints.ums.ac.id/14543/2/BAB_I.pdf","https://scholar.google.com/scholar?cites=11875720413906749616&as_sdt=2005&sciodt=0,5&hl=en",792,"2019-03-24","PDF","","","",,,,,1,0.13,1,1,8
1,"H Purnawan","PREFERENSI PETA PEMILIH PADA PEMILUKADA KOTA SURAKARTA TAHUN 2010 BERBASIS SISTEM INFORMASI GEOGRAFIS (SIG)",2011,"","eprints.uns.ac.id","https://eprints.uns.ac.id/5477/","https://scholar.google.com/scholar?cites=13729244381299180812&as_sdt=2005&sciodt=0,5&hl=en",793,"2019-03-24","","","","",,,,,1,0.13,1,1,8
2,"CN Alam, M Irfan","Pengembangan dan Pemanfaatan Sistem Informasi Berbasis Knowledge Management untuk Membentuk Sharing Culture pada Fakultas Sains dan Teknologi UIN …",2011,"JURNAL ISTEK","journal.uinsgd.ac.id","http://journal.uinsgd.ac.id/index.php/istek/article/view/263","https://scholar.google.com/scholar?cites=16025545068334690003&as_sdt=2005&sciodt=0,5&hl=en",794,"2019-03-24","","","","",,,,,2,0.25,1,2,8
1,"IM Salman","Sistem informasi manajemen dana pengelolaan donatur berbasis WEB pada yayasan Griya Yatim dan Dhu'afa",2011,"","repository.uinjkt.ac.id","http://repository.uinjkt.ac.id/dspace/handle/123456789/1308","https://scholar.google.com/scholar?cites=2703604524869914737&as_sdt=2005&sciodt=0,5&hl=en",795,"2019-03-24","","","","",,,,,1,0.13,1,1,8
1,"F Fitriyah","Penerapan sistem informasi manajemen pendidikan dalam meningkatkan pelayanan sekolah terhadap masyarakat pada website SMA Bakti Mulya 400",2011,"","repository.uinjkt.ac.id","http://repository.uinjkt.ac.id/dspace/handle/123456789/3845","https://scholar.google.com/scholar?cites=3238185922428371535&as_sdt=2005&sciodt=0,5&hl=en",796,"2019-03-24","","","","",,,,,1,0.13,1,1,8
3,"AAGB Ariana","Customer Segmentation Dengan Metode Self Organizing Map (Studi Kasus: UD. Fenny)",2011,"Lontar Komputer: Jurnal Ilmiah Teknologi Informasi","","","https://scholar.google.com/scholar?cites=15120434303662385990&as_sdt=2005&sciodt=0,5&hl=en",797,"2019-03-24","CITATION","","","",,,,,3,0.38,3,1,8
1,"ML Sutrisno","Aplikasi Sistem Informasi Geografi Untuk Penentuan Tingkat Kerentanan Longsor Lahan Di Kecamatan Imogiri Kabupaten Bantul",2011,"Yogyakarta: Universitan Negeri Yogyakarta","eprints.uny.ac.id","https://eprints.uny.ac.id/22626/1/Skripsi_Muh%20Lukman%20Sutrisno_07405241043.pdf","https://scholar.google.com/scholar?cites=184995843279574841&as_sdt=2005&sciodt=0,5&hl=en",798,"2019-03-24","PDF","","","",,,,,1,0.13,1,1,8
1,"A Agustina","Rancangan bangun sistem informasi spasial berbasis WEB pada lokasi masjid dan musholla; studi kasus: Kecamatan Serpong",2011,"","repository.uinjkt.ac.id","http://repository.uinjkt.ac.id/dspace/handle/123456789/314","https://scholar.google.com/scholar?cites=11395218122488263594&as_sdt=2005&sciodt=0,5&hl=en",799,"2019-03-24","","","","",,,,,1,0.13,1,1,8
3,"A Rahardjo, UL Yuhana, AM Shiddiqi","Rancang Bangun Aplikasi Pengaturan dan Pengendalian Suhu Ruang Server Berbasis Web Service dan SMS Gateway",2011,"Seminar Tugas Akhir Institut Teknologi …","","","https://scholar.google.com/scholar?cites=5623409845071078901&as_sdt=2005&sciodt=0,5&hl=en",800,"2019-03-24","CITATION","","","",,,,,3,0.38,1,3,8
1,"N Karniawati, R Rahmadani","ANALISIS KEBIJAKAN PENERAPAN E-GOVERNMENT MELALUI SISTEM INFORMASI MANAJEMEN KEPEGAWAIAN (SIMPEG)(SUATU STUDI PADA BIRO …",2011,"Majalah Ilmiah UNIKOM","repository.unikom.ac.id","https://repository.unikom.ac.id/30496/","https://scholar.google.com/scholar?cites=4097016028543064891&as_sdt=2005&sciodt=0,5&hl=en",801,"2019-03-24","","","","",,,,,1,0.13,1,2,8
1,"MN Tarigan, N Aprila","… DUKUNGAN MANAJEMEN, EFEKTIVITAS PENGGUNA DAN KEPERCAYAAN PENGGUNAAN TEKNOLOGI SISTEM INFORMASI TERHADAP KINERJA INDIVIDUAL …",2011,"","repository.unib.ac.id","http://repository.unib.ac.id/id/eprint/8095","https://scholar.google.com/scholar?cites=348499908803669050&as_sdt=2005&sciodt=0,5&hl=en",802,"2019-03-24","","","","",,,,,1,0.13,1,2,8
2,"M Febriyansyah","Rancang bangun sistem pakar memodifikasi sepeda motor Suzuki Satria 120R",2011,"","repository.uinjkt.ac.id","http://repository.uinjkt.ac.id/dspace/handle/123456789/21825","https://scholar.google.com/scholar?cites=17653293859768200364&as_sdt=2005&sciodt=0,5&hl=en",803,"2019-03-24","","","","",,,,,2,0.25,2,1,8
1,"C Sudrajat","Pengembangan sistem informasi pendaftaran siswa baru secara online berbasis web: studi kasus SMK Pelapor Nasional Ciputat Tangerang Selatan",2011,"","repository.uinjkt.ac.id","http://repository.uinjkt.ac.id/dspace/handle/123456789/5016","https://scholar.google.com/scholar?cites=528800959864782840&as_sdt=2005&sciodt=0,5&hl=en",804,"2019-03-24","","","","",,,,,1,0.13,1,1,8
21,"MP Nugraha, R Munir","Pengembangan Aplikasi QR Code Generator dan QR Code Reader dari Data Berbentuk Image",2011,"Informatics National Conference","informatika.stei.itb.ac.id","http://informatika.stei.itb.ac.id/~rinaldi.munir/TA/Makalah_TA%20Pasca%20Nugraha.pdf","https://scholar.google.com/scholar?cites=10915439171987120965&as_sdt=2005&sciodt=0,5&hl=en",805,"2019-03-24","PDF","","","",,,,,21,2.63,11,2,8
17,"S Hanuma, E Kiswara","Analisis Balance Scorecard Sebagai Alat Pengukur Kinerja Perusahaan (Studi Kasus pada PT Astra Honda Motor)",2011,"","eprints.undip.ac.id","http://eprints.undip.ac.id/26355","https://scholar.google.com/scholar?cites=845538590208952019&as_sdt=2005&sciodt=0,5&hl=en",806,"2019-03-24","","","","",,,,,17,2.13,9,2,8
1,"HW Sutomo","Pengaruh Teknologi dan Kepercayaan Atas Sistem Informasi Baru Terhadap Efektivitas Pelaporan Penggunaan Dana Bantuan Operasional Sekolah (Studi …",2011,"FE (Akuntansi)","thesis.umy.ac.id","http://thesis.umy.ac.id/datapublik/t8359.pdf","https://scholar.google.com/scholar?cites=5845448325287498124&as_sdt=2005&sciodt=0,5&hl=en",807,"2019-03-24","PDF","","","",,,,,1,0.13,1,1,8
