Cites,Authors,Title,Year,Source,Publisher,ArticleURL,CitesURL,GSRank,QueryDate,Type,DOI,ISSN,CitationURL,Volume,Issue,StartPage,EndPage,ECC,CitesPerYear,CitesPerAuthor,AuthorCount,Age
0,"IF Rozi, Y Pramitarin…","PENGEMBANGAN SISTEM DETEKSI DINI PENYAKIT PADA AYAM PULLET DENGAN FUZZY EXPERT SYSTEM DAN CERTAINTY FACTOR",2017,"Seminar Informatika …","jurnalti.polinema.ac.id","http://jurnalti.polinema.ac.id/index.php/SIAP2016/article/download/152/137","",658,"2019-03-27","PDF","","","",,,,,0,0.00,0,3,2
0,"ME Bimantari","SISTEM PAKAR DIAGNOSA PENYAKIT KAMBING DAN DOMBA MENGGUNAKAN METODE CERTAINTY FACTOR (STUDI KASUS UNIT PELAKSANA TEKNIS …",,"repository.unej.ac.id","","http://repository.unej.ac.id/handle/123456789/82862","",659,"2019-03-27","","","","",,,,,0,0.00,0,1,
0,"MF Fauziyah","Implementasi Web Responsif Penentuan Diagnosapenyakit Pada Ayam Berbasis Expert System",2017,"","eprints.umk.ac.id","http://eprints.umk.ac.id/7067/","",660,"2019-03-27","","","","",,,,,0,0.00,0,1,2
0,"D Arisandi, I Puspitasari…","Diagnosa Gangguan Perkembangan Anak Dengan Metode Fuzzy Expert System",2017,"Digital Zone: Jurnal …","journal.unilak.ac.id","http://journal.unilak.ac.id/index.php/dz/article/view/613","",661,"2019-03-27","","","","",,,,,0,0.00,0,3,2
0,"H Sanjaya, T Tingastuti, EL Santoso","Sistem Penentuan Penyakit Pada Ayam Menggunakan Metode Forward Chaining",2017,"CAHAYAtech","","","",662,"2019-03-27","CITATION","","","",,,,,0,0.00,0,3,2
0,"HR Ngemba, R Habibu, S Hendra","PERANCANGAN EXPERT SYSTEM CLINICAL PATHWAY ASUHAN KEPERAWATAN BRONCHOPNUEMONIA",2017,"SEMNASTEKNOMEDIA …","ojs.amikom.ac.id","http://ojs.amikom.ac.id/index.php/semnasteknomedia/article/view/1694","",663,"2019-03-27","","","","",,,,,0,0.00,0,3,2
0,"L Hutriana, Y Fitrian","SISTEM PENDUKUNG KEPUTUSAN PEMILIHAN HANDPHONE",2017,"PROCIDING KMSI","ojs.stmikpringsewu.ac.id","http://www.ojs.stmikpringsewu.ac.id/index.php/procidingkmsi/article/view/434","",664,"2019-03-27","","","","",,,,,0,0.00,0,2,2
0,"E Faizal","Metode Modified Weighted Minkowski Untuk Pengembangan Sistem Penalaran Berbasis Kasus",2017,"Jurnal Saintekom","stmikplk.ac.id","http://stmikplk.ac.id/jurnal/index.php/saintekom/article/view/27","",665,"2019-03-27","","","","",,,,,0,0.00,0,1,2
0,"EDS Mulyani, NS Uryani, FV Putri","Aplikasi Pakar Diagnosa Anak Berkebutuhan Khusus Dengan Metode Backward Chaining",2017,"Techno. Com","publikasi.dinus.ac.id","http://publikasi.dinus.ac.id/index.php/technoc/article/view/1406","",666,"2019-03-27","","","","",,,,,0,0.00,0,3,2
0,"I Apriliya, I Wahyuni","Sistem Diagnosis Penyakit pada Kambing Menggunakan Metode Forward Chaining",2017,"Jurnal Ilmiah Teknologi Informasi Asia","jurnal.stmikasia.ac.id","http://jurnal.stmikasia.ac.id/index.php/jitika/article/view/190","",667,"2019-03-27","","","","",,,,,0,0.00,0,2,2
0,"A Suryanto, B Irawan","Pengembangan Sistem Otomatisasi Pengendalian Nutrisi Pada Hidroponik Berbasis Android",2017,"eProceedings of Engineering","202.134.6.251","https://202.134.6.251/index.php/engineering/article/view/761","",668,"2019-03-27","","","","",,,,,0,0.00,0,2,2
0,"F Firdaus, SI Maiyanti","A Reasoning Technique for Taxonomy Expert System of Living Organisms",2017,"Annual Research Seminar (ARS)","seminar.ilkom.unsri.ac.id","http://www.seminar.ilkom.unsri.ac.id/index.php/ars/article/view/970","",669,"2019-03-27","","","","",,,,,0,0.00,0,2,2
0,"A Latubessy, A Jazuli","Perancangan Sistem Identifikasi Kecanduan Game Berdasarkan Jenis Perilaku Kecanduan Game Menggunakan Pendekatan Berbasis Object",2017,"Prosiding SNATIF","jurnal.umk.ac.id","https://jurnal.umk.ac.id/index.php/SNA/article/view/1484","",670,"2019-03-27","","","","",,,,,0,0.00,0,2,2
0,"RA Ramadhani, M Mandasari","Meilina Mandasari Sistem Pemilihan Makanan Pendamping Asi Menggunakan Metode Forward Chaining",2017,"Generation Journal","ojs.unpkediri.ac.id","http://ojs.unpkediri.ac.id/index.php/gj/article/view/768","",671,"2019-03-27","","","","",,,,,0,0.00,0,2,2
0,"RT Utomo, CG Yo","Expert System Selection Topics Thesis Title With Forward Chaining Method Web-Based",2017,"Tech-E","jurnal.ubd.ac.id","https://jurnal.ubd.ac.id/index.php/te/article/view/16","",672,"2019-03-27","","","","",,,,,0,0.00,0,2,2
0,"M Widyaningsih, R Gunadi","Dempster Shafer Untuk Sistem Diagnosa Gejala Penyakit Kulit Pada Kucing",2017,"Jurnal Saintekom","stmikplk.ac.id","http://stmikplk.ac.id/jurnal/index.php/saintekom/article/view/24","",673,"2019-03-27","","","","",,,,,0,0.00,0,2,2
0,"EL Asri, K Kasmi","ANALISA DAN PERANCANGAN SISTEM INFORMASI DIAGNOSA PENYAKIT PARU-PARU MENGGUNAKAN APLIKASI VB 6.0",2017,"PROCIDING KMSI","ojs.stmikpringsewu.ac.id","http://ojs.stmikpringsewu.ac.id/index.php/procidingkmsi/article/view/413","",674,"2019-03-27","","","","",,,,,0,0.00,0,2,2
0,"I Indrawati","SISTEM DIAGNOSA PENYAKIT KULIT PADA MANUSIA MENGGUNAKAN METODE FUZZY MULTI CRITERIA DECISION MAKING",2017,"Jurnal Sains dan Teknologi Reaksi","e-jurnal.pnl.ac.id","http://e-jurnal.pnl.ac.id/index.php/JSTR/article/view/719","",675,"2019-03-27","","","","",,,,,0,0.00,0,1,2
0,"L Puad, W Adriana","Pembuatan Aplikasi Sistem Informasi Kesehatan (SIFKES) untuk Meningkatkan Integrasi Data Puskesmas di Kota Jambi Berbasis Web Service",2017,"Indonesian Journal of Computer …","ijcs.stmikindonesia.ac.id","http://ijcs.stmikindonesia.ac.id/index.php/ijcs/article/view/40","",676,"2019-03-27","","","","",,,,,0,0.00,0,2,2
0,"TR Maulidia, T Rismawan, S Bahri","IMPLEMENTASI CASE BASED REASONING SISTEM DIAGNOSA PENYAKIT ANAK BERBASIS WEB",,"Coding Jurnal Komputer dan …","jurnal.untan.ac.id","http://jurnal.untan.ac.id/index.php/jcskommipa/article/view/22572","",677,"2019-03-27","","","","",,,,,0,0.00,0,3,
0,"F Indriani","Sistem Berbasis Pengetahuan Untuk Pencarian Alternatif Obat Yang Berkhasiat Sama",2017,"Kinetik: Game Technology, Information System …","kinetik.umm.ac.id","http://kinetik.umm.ac.id/index.php/kinetik/article/view/171","",678,"2019-03-27","","","","",,,,,0,0.00,0,1,2
0,"P Paryati, Y Yudiyanta","DETEKSI DAN TERAPI NERVOUS DISEASES MENGGUNAKAN EXPERT SISTEM DENGAN METODE FORWARD DAN BACKWARD CHAINING",2017,"SEMNASTEKNOMEDIA ONLINE","ojs.amikom.ac.id","http://ojs.amikom.ac.id/index.php/semnasteknomedia/article/view/1704","",679,"2019-03-27","","","","",,,,,0,0.00,0,2,2
0,"Y Fitrian, W Setriyeni","SISTEM PENDUKUNG KEPUTUSAN UNTUK MENDIAGNOSA PENYAKIT MENULAR PADA BALITA DENGAN MENGGUNAKAN PHP (PHP HYPERTEXT …",2017,"Jurnal TAM (Technology …","ojs.stmikpringsewu.ac.id","http://ojs.stmikpringsewu.ac.id/index.php/JurnalTam/article/view/11","",680,"2019-03-27","","","","",,,,,0,0.00,0,2,2
0,"S Hartanto","IMPLEMENTASI FUZZY RULE BASED SYSTEM UNTUK KLASIFIKASI BUAH MANGGA",2017,"TECHSI-Jurnal Teknik Informatika","ojs.unimal.ac.id","http://ojs.unimal.ac.id/index.php/techsi/article/view/217","",681,"2019-03-27","","","","",,,,,0,0.00,0,1,2
0,"Y Purlinda","SISTEM APLIKASI BERBASIS WEB UNTUK MENENTUKAN PENDERITA CACINGAN PADA ANAK USIA 5–10 TAHUN (Studi Kasus: Wilayah Kecamatan Pringsewu)",2017,"PROCIDING KMSI","ojs.stmikpringsewu.ac.id","http://ojs.stmikpringsewu.ac.id/index.php/procidingkmsi/article/view/256","",682,"2019-03-27","","","","",,,,,0,0.00,0,1,2
0,"F Setiawan, I Lestari, DH Qudsi","Sistem Pendukung Keputusan Diagnosa Penyakit Pada Anak Dengan Metode Simple Additive Weighting (Saw) Dan Technique Order Preference By Similarity To …",2017,"Jurnal Aksara Komputer Terapan","jurnal.pcr.ac.id","https://jurnal.pcr.ac.id/index.php/jakt/article/view/1346","",683,"2019-03-27","","","","",,,,,0,0.00,0,3,2
0,"R Kurniawan, I Muhimmah, HR Jannah","Sistem Monitoring Perkembangan Anak Berbasis Denver Development Screening Test (Ddst/Denver II)",,"Jurnal Fakultas Hukum UII","neliti.com","https://www.neliti.com/publications/129982/sistem-monitoring-perkembangan-anak-berbasis-denver-development-screening-test-d","",684,"2019-03-27","","","","",,,,,0,0.00,0,3,
0,"D Yusuf, A Hidayat, S Subono","PENGEMBANGAN SISTEM DIAGNOSA HAMA DAN PENYAKIT TANAMAN BERBASIS WEB SEBAGAI SARANA INFORMASI DAN UPAYA PENINGKATAN …",2017,"Seminar Nasional Sistem …","jurnalfti.unmer.ac.id","https://jurnalfti.unmer.ac.id/index.php/senasif/article/download/94/79","",685,"2019-03-27","PDF","","","",,,,,0,0.00,0,3,2
0,"A Amroni","PENERAPAN RULE BASE EXPERT SYSTEM UNTUK MENGETAHUI HASIL PERKAWINAN ANTAR GOLONGAN DARAH",2017,"Jurnal Ilmiah Media Sisfo","ejournal.stikom-db.ac.id","http://ejournal.stikom-db.ac.id/index.php/mediasisfo/article/view/236","",686,"2019-03-27","","","","",,,,,0,0.00,0,1,2
0,"Y Yoannita","Perancangan Sistem Diagnosis Autisme pada Anak dengan Menggunakan Naïve Bayes",2017,"Jurnal Teknik Informatika dan Sistem Informasi","journal.maranatha.edu","http://journal.maranatha.edu/index.php/jutisi/article/view/698","",687,"2019-03-27","","","","",,,,,0,0.00,0,1,2
0,"IGT Isa","Perancangan Sistem Parkir QR Code Menggunakan Mikrokontroler Arduino Berbasis Android",2017,"","eprints.ummi.ac.id","http://eprints.ummi.ac.id/57/","",688,"2019-03-27","","","","",,,,,0,0.00,0,1,2
0,"H Pramudia","Sistem Informasi Kerusakan Laptop Menggunakan Metode Naïve Bayes: Studi Kasus CV. Kharismamedia, Semarang",2017,"","repository.uksw.edu","http://repository.uksw.edu/handle/123456789/13753","",689,"2019-03-27","","","","",,,,,0,0.00,0,1,2
0,"P Maulidiawana","Sistem Penanganan Kerusakan City Car Menggunakan Metode Case Based Reasoning (CBR)",2017,"Prosiding SISFOTEK","seminar.iaii.or.id","http://seminar.iaii.or.id/index.php/SISFOTEK/article/view/41","",690,"2019-03-27","","","","",,,,,0,0.00,0,1,2
0,"I Akil","Implementasi Algoritma C4. 5 Pada Sistem Evaluasi Perijinan Pembukaan Program Studi",2017,"Paradigma-Jurnal Komputer dan Informatika","ejournal.bsi.ac.id","http://ejournal.bsi.ac.id/ejurnal/index.php/paradigma/article/view/1903","",691,"2019-03-27","","","","",,,,,0,0.00,0,1,2
0,"E Sufarnap, S Sudarto","Model Analisis Klasifikasi untuk Anemia dengan Fungsi Keanggotaan Fuzzy Inference System Sugeno",2017,"Jurnal SIFO Mikroskil","mikroskil.ac.id","https://mikroskil.ac.id/ejurnal/index.php/jsm/article/view/460","",692,"2019-03-27","","","","",,,,,0,0.00,0,2,2
0,"RR Panggali, F Marisa…","SISTEM PENDUKUNG KEPUTUSAN UNTUK MENENTUKAN JUDUL SKRIPSI JURUSAN TEKNIK INFORMATIKA MENGGUNAKAN METODE TOPSIS",2017,"JIMP-Jurnal Informatika …","ejurnal.unmerpas.ac.id","https://ejurnal.unmerpas.ac.id/index.php/informatika/article/viewFile/50/30","",693,"2019-03-27","PDF","","","",,,,,0,0.00,0,3,2
0,"AF Andikos","PEMBUKTIAN PENDEKATAN CERTANTY FACTOR PADA EXPERT SISTEM UNTUK MENENTUKAN JENIS GANGGUAN PERKEMBANGAN PADA ANAK",2017,"Jurnal Sakinah Dharmasraya","osf.io","https://osf.io/preprints/inarxiv/a6exw/","",694,"2019-03-27","","","","",,,,,0,0.00,0,1,2
0,"D Purnomo, RR Panggali, F Marisa","Sistem Pendukung Keputusan Untuk Menentukan Judul Skripsi Jurusan Teknik Informatika Menggunakan Metode Topsis",,"Jurnal Informatika Merdeka Pasuruan","neliti.com","https://www.neliti.com/publications/264543/sistem-pendukung-keputusan-untuk-menentukan-judul-skripsi-jurusan-teknik-informa","",695,"2019-03-27","","","","",,,,,0,0.00,0,3,
0,"L Meiliana, S Hansun","Sistem Deteksi Dini Penyakit Mulut dan Gigi dengan Metode Fuzzy Multi Criteria Decision Making",,"Jurnal Ilmu Pengetahuan dan Teknologi …","researchgate.net","https://www.researchgate.net/profile/Seng_Hansun/publication/315657057_Sistem_Deteksi_Dini_Penyakit_Mulut_dan_Gigi_dengan_Metode_Fuzzy_Multi_Criteria_Decision_Making/links/58d8d8d7a6fdcc1baeb8ff3b/Sistem-Deteksi-Dini-Penyakit-Mulut-dan-Gigi-dengan-Metode-Fuzzy-Multi-Criteria-Decision-Making.pdf","",696,"2019-03-27","PDF","","","",,,,,0,0.00,0,2,
0,"ZA Azzahra, E Purwanti, HB Hidayati","DESIGN OF EXPERT SYSTEM AS A SUPPORT TOOL FOR EARLY DIAGNOSIS OF PRIMARY HEADACHE",2017,"Malang Neurology Journal","mnj.ub.ac.id","http://mnj.ub.ac.id/index.php/mnj/article/view/112","",697,"2019-03-27","","","","",,,,,0,0.00,0,3,2
0,"CN Tan, CF Tan, MA Abdullah","A FAULT DIAGNOSIS EXPERT SYSTEM FOR WATER COOLED PACKED UNIT",2017,"Jurnal Teknologi","jurnalteknologi.utm.my","https://jurnalteknologi.utm.my/index.php/jurnalteknologi/article/view/10879","",698,"2019-03-27","","","","",,,,,0,0.00,0,3,2
0,"SMS Winarsih, R Palupi","PENYUSUNAN MODEL PERANGKAT LUNAK SEHATI (SEHAT SUAMI DAN ISTRI) UNTUK MEMBANTU PEMILIHAN ALAT KONTRASEPSI YANG COCOK BAGI …",2017,"Jurnal Ilmiah SINUS","p3m.sinus.ac.id","https://p3m.sinus.ac.id/jurnal/index.php/e-jurnal_SINUS/article/view/258","",699,"2019-03-27","","","","",,,,,0,0.00,0,2,2
0,"P WARIS, ASON ARIF","IMPLEMENTASI TREE PADA SISTEM",,"core.ac.uk","","https://core.ac.uk/download/pdf/95413340.pdf","",700,"2019-03-27","PDF","","","",,,,,0,0.00,0,2,
0,"YR Dewi","INTELLIGENT TUTORING SYSTEM UNTUK IDENTIFIKASI TINGKAT PEMAHAMAN MATERI FUNGSI SISWA SMP KELAS VIII",2017,"… PRODI PENDIDIKAN IPA-FAKULTAS MIPA UM","karya-ilmiah.um.ac.id","http://karya-ilmiah.um.ac.id/index.php/Pend-IPA/article/view/54498","",701,"2019-03-27","","","","",,,,,0,0.00,0,1,2
0,"IRAV PUTRI","SISTEM PENDUKUNG KEPUTUSAN PEMILIHAN PERUMAHAN PADA PT. PERMATA PROPERTY MENGGUNAKAN METODE SMARTER",2017,"","Universitas Potensi Utama","","",702,"2019-03-27","CITATION","","","",,,,,0,0.00,0,1,2
0,"D SANTOSO","SISTEM PENDUKUNG KEPUTUSAN PEMILIHAN SEPEDA MOTOR MATIC MENGGUNAKAN METODE SIMPLE ADDITIVE WEIGHTING (SAW)",2017,"","UNIVERSITAS MUHAMMADIYAH …","","",703,"2019-03-27","CITATION","","","",,,,,0,0.00,0,1,2
0,"E Ramadina","PENGELOLAAN EDUCATION MANAGEMENT INFORMATION SYSTEM (EMIS) DALAM PENGAMBILAN KEPUTUSAN (Studi Multisitus di MTsN Tulungagung dan …",2017,"Jurnal Sistem Informasi Indonesia","publications.aisindo.org","http://www.publications.aisindo.org/index.php/JSII/article/view/63","",704,"2019-03-27","","","","",,,,,0,0.00,0,1,2
0,"WN Cholifah, B Santoso","Sistem Pendukung Keputusan Pendeteksian Kerusakan Mesin Filling Sachet Wolf Vci 180 dengan Menggunakan Metode Forward Chaining Berbasis Web di PT …",2017,"Prosiding SNATIF","jurnal.umk.ac.id","https://jurnal.umk.ac.id/index.php/SNA/article/view/1503","",705,"2019-03-27","","","","",,,,,0,0.00,0,2,2
0,"MF Adiwisastra, NC Basjaruddin","Intelligent Tutoring System Untuk Mengukur Kemampuan Kognitif Dalam Fisika Dasar Berbasis Metode Bayesian Network",2017,"IJCIT (Indonesian Journal on …","academia.edu","http://www.academia.edu/download/57025687/2777-8993-1-PB.pdf","",706,"2019-03-27","PDF","","","",,,,,0,0.00,0,2,2
0,"A Anisa, T Tursina, HS Pratiwi","SISTEM PERAWATAN KUCING BERBASIS ATURAN",,"JUSTIN (Jurnal Sistem dan Teknologi …","jurnal.untan.ac.id","http://jurnal.untan.ac.id/index.php/justin/article/view/21412","",707,"2019-03-27","","","","",,,,,0,0.00,0,3,
0,"P Komputer, N Perkakasan, P dan Personel","BAB 1 PENGENALAN KEPADA PENGAUDITAN SISTEM MAKLUMAT Pengenalan Keperluan Kepada Kawalan dan Audit Komputer Kehilangan Data Ralat …",,"eprints.utm.my","","http://eprints.utm.my/id/eprint/30114/1/Ab.RazakChe2010_Kawalan%26PengauditanSistemMaklumat.pdf","",708,"2019-03-27","PDF","","","",,,,,0,0.00,0,3,
0,"YN Ifriza, CE Widodo, JE Suseno","Expert system irrigation management of agricultural reservoir system using analytical hierarchy process (AHP) and forward chaining method",2017,"Proceeding of ICMSE","journal.unnes.ac.id","https://journal.unnes.ac.id/sju/index.php/icmse/article/view/23720","",709,"2019-03-27","","","","",,,,,0,0.00,0,3,2
0,"R Sitepu","PERANCANGAN SISTEM OTOMATISASI PENGINGAT BATAS WAKTU PEMINJAMAN BUKU DI PERPUSTAKAAN KOTA YOGYAKARTA MELALUI LAYANAN SMS …",2017,"Jurnal Teknologi Informasi Respati","jti.respati.ac.id","http://jti.respati.ac.id/index.php/jurnaljti/article/view/42","",710,"2019-03-27","","","","",,,,,0,0.00,0,1,2
0,"NT Pradipta, F Fauziah…","PERANCANGAN SISTEM INFORMASI ANALISIS MEDIK MENGGUNAKAN LOGIKA FUZZY SUGENO BERBASIS DATA REKAM MEDIK PADA PENYAKIT …",2017,"Jurnal Ilmiah Informatika","ejournal.amiki.ac.id","http://ejournal.amiki.ac.id/index.php/JIMI/article/view/32","",711,"2019-03-27","","","","",,,,,0,0.00,0,3,2
0,"A Suryadi","SISTEM PENDUKUNG KEPUTUSAN PENETAPAN PELAYANAN KUNJUNGAN PASIEN RAWAT INAP DAN RAWAT JALAN PADA UNIT GAWAT DARURAT",2017,"Jurnal INFOKES Universitas Duta …","ejurnalinfokes.apikescm.ac.id","https://ejurnalinfokes.apikescm.ac.id/index.php/infokes/article/download/164/144","",712,"2019-03-27","PDF","","","",,,,,0,0.00,0,1,2
0,"S WIDIYANTO, B Surarso, OD Nurhayati","EXPERT SYSTEM UNTUK MENENTUKAN SKALA PRIORITAS PERKARA DI LABORATORIUM FORENSIK DENGAN MENGGUNAKAN METODE FORWARD DAN …",2017,"","eprints.undip.ac.id","http://eprints.undip.ac.id/56100/","",713,"2019-03-27","","","","",,,,,0,0.00,0,3,2
0,"M Mughniy, RC Wihandika, BH Prasetio","Sistem Rekomendasi Psikotes untuk Penjurusan Siswa SMA menggunakan Metode Modified K-Nearest Neighbor",,"… Teknologi Informasi dan Ilmu …","researchgate.net","https://www.researchgate.net/profile/Randy_Wihandika/publication/323409960_Sistem_Rekomendasi_Psikotes_untuk_Penjurusan_Siswa_SMA_menggunakan_Metode_Modified_K-Nearest_Neighbor/links/5a94a77b45851535bcdabc57/Sistem-Rekomendasi-Psikotes-untuk-Penjurusan-Siswa-SMA-menggunakan-Metode-Modified-K-Nearest-Neighbor.pdf","",714,"2019-03-27","PDF","","","",,,,,0,0.00,0,3,
0,"WB Trihanto, R Arifudin…","Information Retrieval System for Determining The Title of Journal Trends in Indonesian Language Using TF-IDF and Na? ve Bayes Classifier",2017,"Scientific Journal of …","journal.unnes.ac.id","https://journal.unnes.ac.id/nju/index.php/sji/article/view/11876","",715,"2019-03-27","","","","",,,,,0,0.00,0,3,2
0,"LM Tilova, S Ipnuwati","SISTEM PENDUKUNG KEPUTUSAN MENENTUKAN KUALITAS JAMBU BIJI DENGAN METODE SIMPLE ADDITIVE WEIGHTING (SAW) DI KECAMATAN …",2017,"PROCIDING KMSI","ojs.stmikpringsewu.ac.id","http://ojs.stmikpringsewu.ac.id/index.php/procidingkmsi/article/view/435","",716,"2019-03-27","","","","",,,,,0,0.00,0,2,2
0,"N Nofiana","Sistem Pendukung Keputusan Untuk Pemberian Ijin Usaha Penambangan Pada Dinas Pertambangan Dan Energi Kabupaten Pacitan",2017,"Speed-Sentra Penelitian Engineering dan Edukasi","speed.web.id","http://speed.web.id/ejournal/index.php/speed/article/view/180/175","",717,"2019-03-27","PDF","","","",,,,,0,0.00,0,1,2
0,"BAJ Putra","SISTEM PENDUKUNG KEPUTUSAN PENENTUAN GIZI BURUK BALITA DENGAN METODE FUZZY SUGENO PADA PUSKESMAS EROMOKO II WONOGIRI",2017,"","eprints.sinus.ac.id","https://eprints.sinus.ac.id/50/","",718,"2019-03-27","","","","",,,,,0,0.00,0,1,2
1,"SDPM Sari, H Ginardi, C Fatichah","Penentuan Harga dengan Menggunakan Sistem Inferensi Fuzzy Tsukamoto Pada Rancang Bangun Aplikasi “Finding-Tutor”",2017,"Jurnal Teknik ITS","ejurnal.its.ac.id","http://ejurnal.its.ac.id/index.php/teknik/article/view/24123","https://scholar.google.com/scholar?cites=11616214813469634406&as_sdt=2005&sciodt=0,5&hl=en",719,"2019-03-27","","","","",,,,,1,0.50,0,3,2
0,"WM BAIHAQI","PEMBANGKITAN ATURAN PADA FUZZY EXPERT SYSTEM BERDASARKAN ALGORITME RIPPER UNTUK MENDIAGNOSIS PENYAKIT JANTUNG KORONER",2017,"","etd.repository.ugm.ac.id","http://etd.repository.ugm.ac.id/index.php?mod=book_detail&sub=BookDetail&act=view&typ=htmlext&buku_id=112589&obyek_id=4&unitid=&jenis_id=","",720,"2019-03-27","","","","",,,,,0,0.00,0,1,2
0,"M Fuljana, J Prasetyo, K Muludi","Expert System of Chili Plant Disease Diagnosis using Forward Chaining Method on Android",2017,"INTERNATIONAL …","pdfs.semanticscholar.org","https://pdfs.semanticscholar.org/0955/e4d0300477784cc874a70045306040ad4b48.pdf","",721,"2019-03-27","PDF","","","",,,,,0,0.00,0,3,2
0,"AP Afianti","Sistem Informasi Perencanaan Jadwal di Asia Hardware Berdasarkan Material Requirement Planning",2017,"J-INTECH","jurnal.stiki.ac.id","http://jurnal.stiki.ac.id/J-INTECH/article/view/34","",722,"2019-03-27","","","","",,,,,0,0.00,0,1,2
0,"H Adiyatna","RANCANG BANGUN SISTEM PENDUKUNG MANAJEMEN KETAHANAN PANGAN BERAS TINGKAT KABUPATEN (Design of the rice food security management …",2017,"JURNAL PERTANIAN","ojs.unida.ac.id","http://ojs.unida.ac.id/index.php/jp/article/view/555","",723,"2019-03-27","","","","",,,,,0,0.00,0,1,2
0,"RW Putra","Sistem Informasi Kenaikan Pangkat Guru pada UPTD Dinas Pendidikan Kecamatan Singosari",2017,"J-INTECH","jurnal.stiki.ac.id","http://jurnal.stiki.ac.id/J-INTECH/article/view/5","",724,"2019-03-27","","","","",,,,,0,0.00,0,1,2
0,"A Irsyad, I Isnawaty, RA Saputra","IMPLEMENTASI SISTEM NAVIGASI DENGAN METODE PROPORTIONAL INTEGRAL DERIVATIVE (PID) PADA ROBOT WALL FOLLOWER",2017,"semanTIK","ojs.uho.ac.id","http://ojs.uho.ac.id/index.php/semantik/article/view/3135","",725,"2019-03-27","","","","",,,,,0,0.00,0,3,2
0,"TD Frandisman","Sistem Informasi Manajemen Data Barang guna Mempercepat Proses Perhitungan dalam Proses Produksi",2017,"J-INTECH","jurnal.stiki.ac.id","http://jurnal.stiki.ac.id/J-INTECH/article/download/29/17","",726,"2019-03-27","PDF","","","",,,,,0,0.00,0,1,2
0,"ED Susanti","Sistem Informasi Administrasi Keuangan Sekolah Berbasis Web di SMK YP 17 Selorejo-Blitar",2017,"J-INTECH","jurnal.stiki.ac.id","http://jurnal.stiki.ac.id/J-INTECH/article/view/28","",727,"2019-03-27","","","","",,,,,0,0.00,0,1,2
0,"A Widjaja, AB Susilo","EXPERT SYSTEM TO IDENTIFY DAMAGE CISCO AS5300 DEVICE WITH THE METHOD OF FORWARD CHAINING-BASED CLIENT-SERVER",,"jardcs.org","","http://jardcs.org/papers/v9/sp1066.pdf","",728,"2019-03-27","PDF","","","",,,,,0,0.00,0,2,
0,"E Minarni","APLIKASI SISTEM PENUNJANG KEPUTUSAN UNTUK MENENTUKAN SMP BERKUALITAS DENGAN PEMROGRAMAN VISUAL BASIC 6.0 (Studi Kasus …",2017,"PROCIDING KMSI","ojs.stmikpringsewu.ac.id","http://www.ojs.stmikpringsewu.ac.id/index.php/procidingkmsi/article/view/289","",729,"2019-03-27","","","","",,,,,0,0.00,0,1,2
0,"M Al-Ikhwan","SISTEM PENDUKUNG KEPUTUSAN MEMBERIKAN IZIN PERDAGANGAN DENGAN METODE SIMPLE ADDITIVE WEIGHTING (SAW) PADA KANTOR PENANAMAN …",2017,"Pelita Informatika: Informasi dan …","ejurnal.stmik-budidarma.ac.id","https://ejurnal.stmik-budidarma.ac.id/index.php/pelita/article/view/748","",730,"2019-03-27","","","","",,,,,0,0.00,0,1,2
0,"M Fikri Khaidir, H Supriyono",""" BEAFUZZY""-Sistem Fuzzy Logic Untuk Penyeleksian Pelamar Beasiswa",2017,"","eprints.ums.ac.id","http://eprints.ums.ac.id/id/eprint/50644","",731,"2019-03-27","","","","",,,,,0,0.00,0,2,2
0,"E Krisnanik, K Kraugusteeliana","PERANCANGAN MODEL BASIS DATA BERBASIS PAKAR GANGGUAN RAHIM DAN KESEHATAN JANIN PADA WANITA HAMIL",2017,"SEMNASTEKNOMEDIA ONLINE","ojs.amikom.ac.id","http://ojs.amikom.ac.id/index.php/semnasteknomedia/article/view/1777","",732,"2019-03-27","","","","",,,,,0,0.00,0,2,2
1,"S Setiawan","Pemanfaatan Sistem Inferensi Fuzzy Dalam Menentukan Perpanjangan Kontrak Kerja",2017,"Informatics for Educators and Professionals","ejournal-binainsani.ac.id","http://www.ejournal-binainsani.ac.id/index.php/ITBI/article/view/623","https://scholar.google.com/scholar?cites=17152108877497200731&as_sdt=2005&sciodt=0,5&hl=en",733,"2019-03-27","","","","",,,,,1,0.50,1,1,2
0,"S Moedjiono, J Mailissa, A Kusdaryono","INTERNATIONAL JOURNAL OF ENGINEERING SCIENCES & RESEARCH TECHNOLOGY RABIES DISEASE DIAGNOSIS EXPERT SYSTEM WITH WEB …",,"pdfs.semanticscholar.org","","https://pdfs.semanticscholar.org/1ac5/33808c608ec54c7e3da85de8496de6b5e5c9.pdf","",734,"2019-03-27","PDF","","","",,,,,0,0.00,0,3,
0,"RS Kharisma, A Setiyansah","Pembuatan Sistem Pendeteksi Dini Kebakaran Menggunakan Atmega8",2017,"Data Manajemen dan Teknologi …","ojs.amikom.ac.id","http://ojs.amikom.ac.id/index.php/dasi/article/view/1837","",735,"2019-03-27","","","","",,,,,0,0.00,0,2,2
0,"MU Suasana, IS Suasana…","SISTEM INFORMASI PANDUAN MANASIK HAJI DAN UMRAH BERBASIS ANDRIOD",2017,"… ILMIAH EKONOMI DAN …","jurnal.stekom.ac.id","http://jurnal.stekom.ac.id/index.php/ebisnis/article/viewFile/93/86","",736,"2019-03-27","PDF","","","",,,,,0,0.00,0,3,2
0,"A Subekti, EAE Ningtyas","Dentist Expert System Software in Dental Caries Detection",2017,"Advanced Science Letters","ingentaconnect.com","https://www.ingentaconnect.com/contentone/asp/asl/2017/00000023/00000004/art00159","",737,"2019-03-27","","","","",,,,,0,0.00,0,2,2
0,"AC Saputra","RANCANG BANGUN SISTEM CASE BASED REASONING UNTUK TINDAK KEJAHATAN SESUAI BAB 19, 20, 21 KUHP",2017,"Jurnal Teknologi Informasi: Jurnal Keilmuan dan …","e-journal.upr.ac.id","http://e-journal.upr.ac.id/index.php/TIK/article/view/584","",738,"2019-03-27","","","","",,,,,0,0.00,0,1,2
0,"R Rumini","Optimalisasi Sistem Pencarian Data Buku Untuk Pengambilan Keputusan di Perpustakaan",2017,"Data Manajemen dan Teknologi Informasi (DASI)","ojs.amikom.ac.id","http://ojs.amikom.ac.id/index.php/dasi/article/view/1919","",739,"2019-03-27","","","","",,,,,0,0.00,0,1,2
0,"DA Kurniawan, SW Sihwi","An expert system for diagnosing dysgraphia",2017,"2017 2nd International …","ieeexplore.ieee.org","https://ieeexplore.ieee.org/abstract/document/8285552/","",740,"2019-03-27","","","","",,,,,0,0.00,0,2,2
0,"A Kurnianto, H Supriyono","Sistem Pendukung Keputusan Berbasis Logika Kabur Untuk Penyeleksian Pelamar Beasiswa Dengan Metode Sugeno “Beaflogeno”",2017,"","eprints.ums.ac.id","http://eprints.ums.ac.id/id/eprint/49650","",741,"2019-03-27","","","","",,,,,0,0.00,0,2,2
0,"AH Anujuprana","PENGEMBANGAN STRATEGI UNTUK MENGELOLA RISIKO PADA INDUSTRI BIODIESEL DENGAN PENDEKATAN SISTEM INTELEJEN LOGIKA FUZZY",2017,"Jurnal Ilmiah Teknik Industri","journal.untar.ac.id","https://journal.untar.ac.id/index.php/industri/article/view/480","",742,"2019-03-27","","","","",,,,,0,0.00,0,1,2
0,"M Marfuah","Algoritma Sistem Pendukung Keputusan dalam Monitoring Penyelesaian Berkas Perkara Pidana Menggunakan Rule Based Expert Systems dan Teknologi Radio …",2017,"Jurnal SAINTEKOM","stmikplk.ac.id","http://stmikplk.ac.id/jurnal/index.php/saintekom/article/view/36","",743,"2019-03-27","","","","",,,,,0,0.00,0,1,2
