Cites,Authors,Title,Year,Source,Publisher,ArticleURL,CitesURL,GSRank,QueryDate,Type,DOI,ISSN,CitationURL,Volume,Issue,StartPage,EndPage,ECC,CitesPerYear,CitesPerAuthor,AuthorCount,Age
6,"D Djuhara, J Januariska","Pengaruh Sistem Informasi Akuntansi Persediaan Barang Terhadap Pengendalian Intern Persediaan Barang Pada CV. Tri Multi Manunggal Bandung",2014,"Jurnal Ekonomi, Bisnis & …","jurnal.stiepas.ac.id","http://jurnal.stiepas.ac.id/index.php/jebe/article/view/43","https://scholar.google.com/scholar?cites=16992428646286420029&as_sdt=2005&sciodt=0,5&hl=en",211,"2019-11-15","","","","",,,,,6,1.20,3,2,5
0,"L Oktari, A Ananda, SR Henim","Aplikasi Terjemah Kata dengan Gambar Berbasis Sistem Operasi Android Menggunakan Library Tesseract OCR",2014,"Jurnal Aksara Komputer Terapan","jurnal.pcr.ac.id","https://jurnal.pcr.ac.id/index.php/jakt/article/view/656","",212,"2019-11-15","","","","",,,,,0,0.00,0,3,5
4,"S Ipnuwati","Perancangan Sistem Informasi Penjualan Pada Toko Minak Singa",2014,"EXPLORE","jurnal.ubl.ac.id","http://jurnal.ubl.ac.id/index.php/explore/article/view/536","https://scholar.google.com/scholar?cites=7560402602814086221&as_sdt=2005&sciodt=0,5&hl=en",213,"2019-11-15","","","","",,,,,4,0.80,4,1,5
0,"MI Ramadhan","Pembuatan Game Deadline Mode Pengerjaan Tugas Berbasis Sistem Operasi Android Dengan Unity3d",2014,"","digilib.uns.ac.id","https://digilib.uns.ac.id/dokumen/detail/40504/Pembuatan-Game-Deadline-Mode-Pengerjaan-Tugas-Berbasis-Sistem-Operasi-Android-Dengan-Unity3d","",214,"2019-11-15","","","","",,,,,0,0.00,0,1,5
0,"I Nurmulya Malik","Pembuatan Aplikasi Pengolahan Citra Teks Inggris Dan Penerjemahannya ke Dalam Bahasa Indonesia Berbasis Sistem Operasi Android",2014,"","repository.unikom.ac.id","https://repository.unikom.ac.id/id/eprint/28446","",215,"2019-11-15","","","","",,,,,0,0.00,0,1,5
0,"F PUTRA ROCHIM","APLIKASI MOBILE PEMBELIAN TIKET KERETA API MENGGUNAKAN QR-CODE BERBASIS SISTEM OPERASI ANDROID (STUDI KASUS: PT KERETA API …",2014,"","eprints.upnyk.ac.id","http://eprints.upnyk.ac.id/5763/","",216,"2019-11-15","","","","",,,,,0,0.00,0,1,5
12,"MR Andikasani, M Awaluddin…","Aplikasi Persebaran Objek Wisata di Kota Semarang Berbasis Mobile GIS Memanfaatkan Smartphone Android",2014,"Jurnal Geodesi …","ejournal3.undip.ac.id","https://ejournal3.undip.ac.id/index.php/geodesi/article/view/5204","https://scholar.google.com/scholar?cites=17691291320714837638&as_sdt=2005&sciodt=0,5&hl=en",217,"2019-11-15","","","","",,,,,12,2.40,4,3,5
1,"H SOFFA","ANALISIS PERBANDINGAN KINERJA FREENAS DAN OPEN MEDIA VAULT (OMV) SEBAGAI SISTEM OPERASI JARINGAN NETWORK ATTACHED …",,"","","","https://scholar.google.com/scholar?cites=13579647928463713256&as_sdt=2005&sciodt=0,5&hl=en",218,"2019-11-15","CITATION","","","",,,,,1,0.00,1,1,
0,"NM Panjaitan","PENGEMBANGAN MEDIA PEMBELAJARAN E-LEARNING BERBASIS BLOG DALAM PEMBELAJARAN INSTALASI SISTEM OPERASI DASAR PADA KELAS X …",2014,"","digilib.unimed.ac.id","http://digilib.unimed.ac.id/id/eprint/19157","",219,"2019-11-15","","","","",,,,,0,0.00,0,1,5
1,"A Sugianto","Sistem Pemantauan Kualitas Udara",2014,"","repository.widyatama.ac.id","https://repository.widyatama.ac.id/xmlui/handle/123456789/4685","https://scholar.google.com/scholar?cites=1505387155153743440&as_sdt=2005&sciodt=0,5&hl=en",220,"2019-11-15","","","","",,,,,1,0.20,1,1,5
11,"D Martani","Dampak Implementasi IFRS Bagi Perusahaan",2014,"","staff.blog.ui.ac.id","https://staff.blog.ui.ac.id/martani/files/2012/06/Dampak-Implementasi-IFRS.doc","https://scholar.google.com/scholar?cites=3940160602192313395&as_sdt=2005&sciodt=0,5&hl=en",221,"2019-11-15","DOC","","","",,,,,11,2.20,11,1,5
0,"MA Safei","Pembuatan Game Deadline Mode Tanda Tangan Dosen Berbasis Sistem Operasi Android Dengan Unity3d",2014,"","digilib.uns.ac.id","https://digilib.uns.ac.id/dokumen/detail/40961/Pembuatan-Game-Deadline-Mode-Tanda-Tangan-Dosen-Berbasis-Sistem-Operasi-Android-Dengan-Unity3d","",222,"2019-11-15","","","","",,,,,0,0.00,0,1,5
0,"R Haryanto","APLIKASI SWITCHING DRIVER RELAY ULN 2003 PADA PENGENDALIAN BEBAN LISTRIK DENGAN SISTEM OPERASI ANDROID BERBASIS ATMEGA328",2014,"","eprints.polsri.ac.id","http://eprints.polsri.ac.id/169/","",223,"2019-11-15","","","","",,,,,0,0.00,0,1,5
5,"AN Saputra","Rancang Bangun Aplikasi Pembelajaran Hadis Untuk Perangkat Mobile Berbasis Android",2014,"","eprints.ums.ac.id","http://eprints.ums.ac.id/id/eprint/29372","https://scholar.google.com/scholar?cites=5733130612679313500&as_sdt=2005&sciodt=0,5&hl=en",224,"2019-11-15","","","","",,,,,5,1.00,5,1,5
1,"AS Barkah, A Purnomo","SISTEM INFORMASI PENJUALAN ONLINE PAKAIAN JADI DI CV. KLINIK REBEL AJIBARANG",2014,"Probisnis","ejournal.amikompurwokerto.ac.id","http://ejournal.amikompurwokerto.ac.id/index.php/probisnis/article/viewFile/336/310","https://scholar.google.com/scholar?cites=17195662310311769783&as_sdt=2005&sciodt=0,5&hl=en",225,"2019-11-15","PDF","","","",,,,,1,0.20,1,2,5
4,"MP Kereh, AAE Sinsuw…","Aplikasi E-Tourism Kuliner Kota Manado Dengan Platform Android",2014,"Jurnal Teknik Elektro dan …","ejournal.unsrat.ac.id","https://ejournal.unsrat.ac.id/index.php/elekdankom/article/view/6041","https://scholar.google.com/scholar?cites=7311769566252013463&as_sdt=2005&sciodt=0,5&hl=en",226,"2019-11-15","","","","",,,,,4,0.80,1,3,5
4,"RP Warouw, AAE Sinsuw…","Perancangan Aplikasi Voter Berbasis Android Studi Kasus Pemilihan Ketua Himpunan Mahasiswa Jurusan Teknik Elektro Universitas Sam Ratulangi Manado",2014,"Jurnal Teknik Elektro dan …","ejournal.unsrat.ac.id","https://ejournal.unsrat.ac.id/index.php/elekdankom/article/view/6048","https://scholar.google.com/scholar?cites=14149120690516177103&as_sdt=2005&sciodt=0,5&hl=en",227,"2019-11-15","","","","",,,,,4,0.80,1,3,5
0,"HMY Dinata","Analisa performa permainan hockey multiplayer pada beberapa versi sistem operasi android dan aplikasi pendukungnya= Performance analysis of hockey …",2014,"","repository.uph.edu","http://repository.uph.edu/889/","",228,"2019-11-15","","","","",,,,,0,0.00,0,1,5
10,"V Masinambow, MEI Najoan…","Pengendali Saklar Listrik Melalui Ponsel Pintar Android",2014,"Jurnal Teknik Elektro …","ejournal.unsrat.ac.id","https://ejournal.unsrat.ac.id/index.php/elekdankom/article/view/3772","https://scholar.google.com/scholar?cites=3172667277197424402&as_sdt=2005&sciodt=0,5&hl=en",229,"2019-11-15","","","","",,,,,10,2.00,3,3,5
0,"AE Fitiryanti","… DENGAN ADAPTIVE TEST MENGGUNAKAN ALGORITMA RUNUT BALIK UNTUK MENINGKATKAN PEMAHAMAN KONSEP PADA PELAJARAN SISTEM OPERASI",2014,"","repository.upi.edu","http://repository.upi.edu/15164/","",230,"2019-11-15","","","","",,,,,0,0.00,0,1,5
0,"INP Sari","… pembelajaran Student Teams Achievement Division (STAD) dan Think Pair Share (TPS) terhadap hasil belajar siswa mata pelajaran sistem operasi kelas X TKJ …",2014,"","repository.um.ac.id","http://repository.um.ac.id/45924/","",231,"2019-11-15","","","","",,,,,0,0.00,0,1,5
0,"C Yogatama, RR Isnanto, A Triwiyanto","… ALGORITMA HASH DALAM PENGACAKAN PERTEMUAN DAN PERTARUNGAN DINAMIS PADA PERANGKAT LUNAK PERMAINAN DENGAN SISTEM OPERASI …",2014,"TRANSIENT","ejournal3.undip.ac.id","https://ejournal3.undip.ac.id/index.php/transient/article/view/6347","",232,"2019-11-15","","","","",,,,,0,0.00,0,3,5
0,"NW WIJAYANTI","Analisis Sentimen pada Review Pengguna Sistem Operasi Windows Phone dengan Menggunakan Metode Support Vector Machine (SVM)",2014,"","etd.repository.ugm.ac.id","http://etd.repository.ugm.ac.id/index.php?act=view&buku_id=77287&mod=penelitian_detail&sub=PenelitianDetail&typ=html","",233,"2019-11-15","","","","",,,,,0,0.00,0,1,5
2,"CT Judianto, E Wurianto","ANALISIS POTENSI GANGGUAN INTERFERENSI MICROWAVE LINK TERHADAP OPERASI SATELIT LAPAN-A3 DI STASIUN BUMI RUMPIN (THE ANALYSIS OF …",2014,"Jurnal Teknologi Dirgantara","jurnal.lapan.go.id","http://jurnal.lapan.go.id/index.php/jurnal_tekgan/article/view/2081","https://scholar.google.com/scholar?cites=3731739957703124488&as_sdt=2005&sciodt=0,5&hl=en",234,"2019-11-15","","","","",,,,,2,0.40,1,2,5
0,"J Adler","Identifikasi Perambatan Gelombang pada Batuan Berpori dengan Bantuan Jaringan Syaraf Tiruan pada MatLab dan Sistem Operasi Linux",2014,"","elib.unikom.ac.id","https://elib.unikom.ac.id/files/disk1/663/jbptunikompp-gdl-johnadler-33106-1-identifi-4.pdf","",235,"2019-11-15","PDF","","","",,,,,0,0.00,0,1,5
0,"INURP SARI","… Student Teams Achievement Division (STAD) Dan Pembelajaran Think Pair Share (TPS) Terhadap Hasil Belajar Siswa Mata Pelajaran Sistem Operasi Kelas X TKJ …",2014,"… Jurusan Teknik Elektro-Fakultas Teknik UM","karya-ilmiah.um.ac.id","http://karya-ilmiah.um.ac.id/index.php/TE/article/view/30497","",236,"2019-11-15","","","","",,,,,0,0.00,0,1,5
6,"H Rimiyati, C Widodo","Pengaruh citra merek, kualitas produk, kepuasan konsumen terhadap loyalitas konsumen merek Samsung Galaxy Series (Studi pada mahasiswa Universitas …",2014,"Jurnal Manajemen Bisnis","journal.umy.ac.id","http://journal.umy.ac.id/index.php/mb/article/view/1113","https://scholar.google.com/scholar?cites=11387077816501107705&as_sdt=2005&sciodt=0,5&hl=en",237,"2019-11-15","","","","",,,,,6,1.20,3,2,5
0,"R Heryanto","SISTEM OPERASI SCADA AREA PENGATUR DISTRIBUSI JAKARTA RAYA DAN TANGERANG SERTA CARA MANUVER DAYA BEBAN SAAT TERJADI …",,"elektro.undip.ac.id","","http://www.elektro.undip.ac.id/el_kpta/wp-content/uploads/2012/05/21060110141043_MKP.pdf","",238,"2019-11-15","PDF","","","",,,,,0,0.00,0,1,
10,"ML Pandini, Z Arifin, DM Khairina","Design web service academic information system based multiplatform",2014,"2014 The 1st International …","ieeexplore.ieee.org","https://ieeexplore.ieee.org/abstract/document/7065760/","https://scholar.google.com/scholar?cites=11972911281560405207&as_sdt=2005&sciodt=0,5&hl=en",239,"2019-11-15","","","","",,,,,10,2.00,3,3,5
0,"A Pramana, J Oktavias","PENGEMBANGAN MODUL PEMBELAJARAN MATERI INSTALASI SISTEM OPERASI BERBASIS GRAPHICAL USER INTERFACE DAN COMMAND LINE …",2014,"SKRIPSI Jurusan Teknik Elektro …","karya-ilmiah.um.ac.id","http://karya-ilmiah.um.ac.id/index.php/TE/article/view/33465","",240,"2019-11-15","","","","",,,,,0,0.00,0,2,5
0,"DG Baringbing","… MEDIA PEMBELAJARAN BERBASIS WEBSITE (E-LEARNING) PADA KOMPETENSI DASAR MELAKUKAN INSTALASI SISTEM OPERASI DASAR PADA SISWA …",2014,"","digilib.unimed.ac.id","http://digilib.unimed.ac.id/id/eprint/19271","",241,"2019-11-15","","","","",,,,,0,0.00,0,1,5
11,"FN Claessen, H La Poutré","Towards a European smart energy system",2014,"EIT ICT Labs, Brussels","eitictlabs.eu","http://eitictlabs.eu/uploads/media/Towards_a_European_Smart_Energy_System_01.pdf","https://scholar.google.com/scholar?cites=610533252132944657&as_sdt=2005&sciodt=0,5&hl=en",242,"2019-11-15","PDF","","","",,,,,11,2.20,6,2,5
0,"IS Kusmaryanto, M Eng, PU Yanuar Linggar","Desain Dan Quality of Service (Qos) Layanan Voice Over Internet Protocol (Voip) Pada Sistem Operasi Android Menggunakan Jaringan High Speed Downlink Packet …",,"Jurnal Mahasiswa Teknik …","neliti.com","https://www.neliti.com/publications/119250/desain-dan-quality-of-service-qos-layanan-voice-over-internet-protocol-voip-pada","",243,"2019-11-15","","","","",,,,,0,0.00,0,3,
0,"Y Linggar PU, WA Priyono…","… DAN QUALITY OF SERVICE (QoS) LAYANAN VOICE OVER INTERNET PROTOCOL (VoIP) PADA SISTEM OPERASI ANDROID MENGGUNAKAN JARINGAN HIGH …",2014,"Jurnal Mahasiswa …","elektro.studentjournal.ub.ac.id","http://elektro.studentjournal.ub.ac.id/index.php/teub/article/view/271","",244,"2019-11-15","","","","",,,,,0,0.00,0,3,5
6,"E Pandara, S Karouw, M Najoan","Implementasi Proses Uji Sistem Informasi Admisi Pascasarjana Universitas Sam Ratulangi",2014,"Jurnal Teknik Informatika","ejournal.unsrat.ac.id","https://ejournal.unsrat.ac.id/index.php/informatika/article/view/6989","https://scholar.google.com/scholar?cites=9670780934886019233&as_sdt=2005&sciodt=0,5&hl=en",245,"2019-11-15","","","","",,,,,6,1.20,2,3,5
8,"SB Pudji","Aplikasi Konversi Suara Ke Teks Berbasis Android Menggunakan Google Speech Api",2014,"Bianglala Informatika","ejournal.bsi.ac.id","http://ejournal.bsi.ac.id/ejurnal/index.php/Bianglala/article/view/530","https://scholar.google.com/scholar?cites=11721906659267053993&as_sdt=2005&sciodt=0,5&hl=en",246,"2019-11-15","","","","",,,,,8,1.60,8,1,5
1,"EA Afriyansyah, RII Putri","Design research: Konsep nilai tempat pada operasi penjumlahan bilangan desimal di kelas V sekolah dasar",2014,"Jurnal Pendidikan Matematika","ejournal.unsri.ac.id","https://ejournal.unsri.ac.id/index.php/jpm/article/view/1857","https://scholar.google.com/scholar?cites=10780652097157567773&as_sdt=2005&sciodt=0,5&hl=en",247,"2019-11-15","","","","",,,,,1,0.20,1,2,5
0,"Y Yektiono","… BERBASIS MASALAH TERHADAP PENCAPAIAN KOMPETENSI MATA PELAJARAN INSTALASI SISTEM OPERASI DASAR DENGAN MENERAPKAN STRATEGI …",2014,"PENDIDIKAN VOKASI: TEORI DAN …","jurnalmahasiswa.unesa.ac.id","https://jurnalmahasiswa.unesa.ac.id/index.php/pendidikan-vokasi-teori-dan-prak/article/view/10871","",248,"2019-11-15","","","","",,,,,0,0.00,0,1,5
5,"YD Triyanti, O Marleen","Aplikasi Android Untuk Pencarian Lokasi Tempat Ibadah Di Wilayah Bekasi",2014,"Prosiding KOMMIT","ejournal.gunadarma.ac.id","http://www.ejournal.gunadarma.ac.id/index.php/kommit/article/viewFile/1062/925","https://scholar.google.com/scholar?cites=17958862965955134514&as_sdt=2005&sciodt=0,5&hl=en",249,"2019-11-15","PDF","","","",,,,,5,1.00,3,2,5
2,"C Kurniawan","Perancangan Jaringan Hotspot dengan Sistem Voucher Menggunakan Mikrotik pada Jaringan RT/RW Net",2014,"","eprints.ums.ac.id","http://eprints.ums.ac.id/id/eprint/32740","https://scholar.google.com/scholar?cites=8603928062792188216&as_sdt=2005&sciodt=0,5&hl=en",250,"2019-11-15","","","","",,,,,2,0.40,2,1,5
7,"A Ashari","Sistem Informasi Pembayaran Sumbangan Pembinaan Pendidikan (SPP) Pada Sekolah Menengah Atas Negeri 2 Pacitan",2014,"IJNS-Indonesian Journal on Networking and Security","ijns.org","http://ijns.org/journal/index.php/ijns/article/view/376","https://scholar.google.com/scholar?cites=1155661506054846030&as_sdt=2005&sciodt=0,5&hl=en",251,"2019-11-15","","","","",,,,,7,1.40,7,1,5
1,"S Bakhri","Pengembangan Plc Trainer Serbaguna untuk Simulator Sistem Keselamatan dan Keandalan Reaktor",2014,"Jurnal Pengembangan Energi Nuklir","jurnal.batan.go.id","http://jurnal.batan.go.id/index.php/jpen/article/view/2712","https://scholar.google.com/scholar?cites=14345363128956818175&as_sdt=2005&sciodt=0,5&hl=en",252,"2019-11-15","","","","",,,,,1,0.20,1,1,5
10,"SA Budiman, C Iswahyudi…","Implementasi Intrusion Detection System (Ids) Menggunakan Jejaring Sosial Sebagai Media Notifikasi",2014,"… Nasional Aplikasi Sains …","repository.akprind.ac.id","http://repository.akprind.ac.id/sites/files/A255-262_sahid_catur.pdf","https://scholar.google.com/scholar?cites=16332903153750748771&as_sdt=2005&sciodt=0,5&hl=en",253,"2019-11-15","PDF","","","",,,,,10,2.00,3,3,5
10,"D Wimpertiwi, AH Sasongko…","Konsep Business Process ReenginEering untuk Memperbaiki Kinerja Bisnis Menjadi Lebih Baik: Studi Kasus Perusahaan Susu Kedelai “XYZ”",2014,"Binus Business …","journal.binus.ac.id","https://journal.binus.ac.id/index.php/BBR/article/view/1189","https://scholar.google.com/scholar?cites=8134506445144848550&as_sdt=2005&sciodt=0,5&hl=en",254,"2019-11-15","","","","",,,,,10,2.00,3,3,5
0,"SRI HARTATI","APLIKASI SISTEM PENJAMINAN MUTU PROGRAM STUDI UNIVERSITAS MUHAMMADIYAH PURWOKERTO BERBASIS MOBILE THE APPLICATION OF MOBILE …",2014,"","repository.ump.ac.id","http://repository.ump.ac.id/4316/","",255,"2019-11-15","","","","",,,,,0,0.00,0,1,5
0,"IZ Muttaqin","… Minat dan Hasil Belajar antara Model Pembelajaran Project Based Learning dan Direct Instruction pada Matapelajaran Instalasi Sistem Operasi Jaringan Kelas XI …",2014,"SKRIPSI Jurusan Teknik Elektro-Fakultas Teknik …","karya-ilmiah.um.ac.id","http://karya-ilmiah.um.ac.id/index.php/TE/article/view/31943","",256,"2019-11-15","","","","",,,,,0,0.00,0,1,5
0,"F Al Hakim Binarso","SISTEM PENDUKUNG KEPUTUSAN PEMILIHAN GADGET SMARTPHONE MENGGUNAKAN METODE SIMPLE ADDITIVE WEIGHTING",,"core.ac.uk","","https://core.ac.uk/download/pdf/35379357.pdf","",257,"2019-11-15","PDF","","","",,,,,0,0.00,0,1,
6,"A Santoso, A Handojo","Pembuatan Aplikasi Mobile Broadcast Informasi Perkuliahan Berbasis Android",2014,"Jurnal Infra","publication.petra.ac.id","http://publication.petra.ac.id/index.php/teknik-informatika/article/view/1433","https://scholar.google.com/scholar?cites=10256177109795090675&as_sdt=2005&sciodt=0,5&hl=en",258,"2019-11-15","","","","",,,,,6,1.20,3,2,5
0,"JS Halim, BK Hartanto","Rancang Bangun Edugame untuk Pembelajaran Operasi Bilangan Bulat Berbasis Android",2014,"","eprints.mdp.ac.id","http://eprints.mdp.ac.id/999/","",259,"2019-11-15","","","","",,,,,0,0.00,0,2,5
9,"FJ Bhayangkara, I Riadi","Implementasi Proxy Server dan Load Balancing Menggunakan Metode Per Connection Classifier (PCC) Berbasis Mikrotik (Studi kasus: Shmily. net)",2014,"Jurnal Sarjana Teknik Informatika","neliti.com","https://www.neliti.com/publications/211183/implementasi-proxy-server-dan-load-balancing-menggunakan-metode-per-connection-c","https://scholar.google.com/scholar?cites=13383903942424705360&as_sdt=2005&sciodt=0,5&hl=en",260,"2019-11-15","","","","",,,,,9,1.80,5,2,5
5,"AREFF Coastera","Rancang Bangun Aplikasi Informasi Universitas Bengkulu Sebagai Panduan Pengenalan Kampus Menggunakan Metode Markerless Augmented Reality Berbasis …",2014,"Jurnal Teknik Informatika","journal.uinjkt.ac.id","http://journal.uinjkt.ac.id/index.php/ti/article/view/1944","https://scholar.google.com/scholar?cites=2911599393188557310&as_sdt=2005&sciodt=0,5&hl=en",261,"2019-11-15","","","","",,,,,5,1.00,5,1,5
3,"H Sulistyanto","Pengembangan Aplikasi Sistem Informasi Wisata Solo Raya pada Perangkat Mobile",2014,"","publikasiilmiah.ums.ac.id","https://publikasiilmiah.ums.ac.id/xmlui/handle/11617/5472","https://scholar.google.com/scholar?cites=197645302675988620&as_sdt=2005&sciodt=0,5&hl=en",262,"2019-11-15","","","","",,,,,3,0.60,3,1,5
3,"K Wibowo","Dimmer Light Berbasis WEB Menggunakan Mini PC Raspberry pi",2014,"Skripsi, Fakultas Ilmu Komputer, Jurusan Teknik …","eprints.dinus.ac.id","http://eprints.dinus.ac.id/16670/1/jurnal_15683.pdf","https://scholar.google.com/scholar?cites=14611162169996995942&as_sdt=2005&sciodt=0,5&hl=en",263,"2019-11-15","PDF","","","",,,,,3,0.60,3,1,5
2,"AT Putri, BS Santoso, MH Rabbani, L Wulandari","Aplikasi Sistem Pakar Pendeteksi Kerusakan Pada Smartphone",2014,"","academia.edu","http://www.academia.edu/download/35773021/APLIKASI_SISTEM_PAKAR_PENDETEKSI_KERUSAKAN_PADA_SMARTPHONE1.pdf","https://scholar.google.com/scholar?cites=13540279900815253074&as_sdt=2005&sciodt=0,5&hl=en",264,"2019-11-15","PDF","","","",,,,,2,0.40,1,4,5
1,"A Herizal","ANALISIS SISTEM PEMELIHARAAN MESINHELIXDALAMEFISIENSI BIAYA OPERASIONAL DI PT. INDO DUCTING PRIMATAMA",2014,"","repository.widyatama.ac.id","https://repository.widyatama.ac.id/xmlui/handle/123456789/4706","https://scholar.google.com/scholar?cites=4640744465251401368&as_sdt=2005&sciodt=0,5&hl=en",265,"2019-11-15","","","","",,,,,1,0.20,1,1,5
5,"T Witono, R Susanto","Aplikasi Pemesanan Tiket Bioskop Berbasis Mobile",2014,"Jurnal Teknik Informatika dan Sistem Informasi","neliti.com","https://www.neliti.com/publications/219744/aplikasi-pemesanan-tiket-bioskop-berbasis-mobile","https://scholar.google.com/scholar?cites=12569721444063895219&as_sdt=2005&sciodt=0,5&hl=en",266,"2019-11-15","","","","",,,,,5,1.00,3,2,5
7,"A Suwondo","APLIKASI SISTEM INFORMASI PERPUSTAKAAN DI SMK TAKHASSUS KALIBEBER WONOSOBO",2014,"Jurnal Penelitian dan Pengabdian Kepada Masyarakat …","ojs.unsiq.ac.id","https://ojs.unsiq.ac.id/index.php/ppkm/article/view/231","https://scholar.google.com/scholar?cites=7432053131168062784&as_sdt=2005&sciodt=0,5&hl=en",267,"2019-11-15","","","","",,,,,7,1.40,7,1,5
116,"AK Marvasti, Y Fu, S DorMohammadi…","Optimal operation of active distribution grids: A system of systems framework",2014,"… on Smart Grid","ieeexplore.ieee.org","https://ieeexplore.ieee.org/abstract/document/6780985/","https://scholar.google.com/scholar?cites=6631873662130856848&as_sdt=2005&sciodt=0,5&hl=en",268,"2019-11-15","","","","",,,,,116,23.20,29,4,5
5,"D Sudarma","Rancang Bangun Kendali Lampu on/off Dengan smartphone android via bluetooth",2014,"Jurnal Teknik Elektro Universitas Tanjungpura","jurnal.untan.ac.id","http://jurnal.untan.ac.id/index.php/jteuntan/article/view/5447","https://scholar.google.com/scholar?cites=16581050237166580038&as_sdt=2005&sciodt=0,5&hl=en",269,"2019-11-15","","","","",,,,,5,1.00,5,1,5
1,"D Susianto","Rancang Bangung Sistem Informasi Pemasangan Iklan Online Berbasis Web Pada Lampung Post",2014,"Jurnal Cendikia","jurnal.dcc.ac.id","https://jurnal.dcc.ac.id/index.php/JC/article/view/71","https://scholar.google.com/scholar?cites=8520888690068854554&as_sdt=2005&sciodt=0,5&hl=en",270,"2019-11-15","","","","",,,,,1,0.20,1,1,5
4,"AD Kartikasari","Pembuatan Aplikasi Informasi Tagihan Listrik Berbasis Android",2014,"Skripsi, Fakultas Ilmu Komputer","eprints.dinus.ac.id","http://eprints.dinus.ac.id/13343/1/jurnal_13931.pdf","https://scholar.google.com/scholar?cites=14000378863738191222&as_sdt=2005&sciodt=0,5&hl=en",271,"2019-11-15","PDF","","","",,,,,4,0.80,4,1,5
7,"F Setyani, RR Isnanto…","Pengenalan Bahasa Inggris untuk Anak Melalui Permainan Edukasi"" The Zoo"" Berbasis Kinect",2014,"Jurnal Teknologi dan …","jtsiskom.undip.ac.id","http://jtsiskom.undip.ac.id/index.php/jtsiskom/article/view/4769","https://scholar.google.com/scholar?cites=13432334903568642448&as_sdt=2005&sciodt=0,5&hl=en",272,"2019-11-15","","","","",,,,,7,1.40,2,3,5
11,"Y Yuniati, H Fitriawan…","Analisa Perancangan Server VoIP (Voice Internet Protocol) dengan Opensource Asterisk dan VPN (Virtual Private Network) Sebagai Pengaman Jaringan Antar Client",2014,"Jurnal Sains dan …","ejournal.uin-suska.ac.id","http://ejournal.uin-suska.ac.id/index.php/sitekin/article/view/781","https://scholar.google.com/scholar?cites=13183669945025541693&as_sdt=2005&sciodt=0,5&hl=en",273,"2019-11-15","","","","",,,,,11,2.20,4,3,5
7,"T Suhesti","Web Server dan Jenisnya",2014,"Tangerang: Penerbit Ilmuti","","","https://scholar.google.com/scholar?cites=3177690303542571565&as_sdt=2005&sciodt=0,5&hl=en",274,"2019-11-15","CITATION","","","",,,,,7,1.40,7,1,5
9,"AD Hartanto, WMP Dhuhita, A Tinangon","Perancangan Game Multiplatform Menggunakan Scirra Construct 2 dan HTML 5",2014,"","publikasiilmiah.ums.ac.id","https://publikasiilmiah.ums.ac.id/xmlui/handle/11617/5459","https://scholar.google.com/scholar?cites=16596564335093522495&as_sdt=2005&sciodt=0,5&hl=en",275,"2019-11-15","","","","",,,,,9,1.80,3,3,5
4,"KYR Palilingan, AAE Sinsuw…","Registrasi Calon Siswa Baru Berbasis Mobile Android di Sekolah Menengah Atas Negeri 9 Manado",2014,"Jurnal Teknik Elektro …","ejournal.unsrat.ac.id","https://ejournal.unsrat.ac.id/index.php/elekdankom/article/view/5313","https://scholar.google.com/scholar?cites=17213440016640320075&as_sdt=2005&sciodt=0,5&hl=en",276,"2019-11-15","","","","",,,,,4,0.80,1,3,5
1,"AR Kartika, A Yusuf, AD Rohman…","Sistem Rekam Medik Berbasis Cloud Computing dan Identifikasi Frekuensi Radio",2014,"SEMNASTEKNOMEDIA …","ojs.amikom.ac.id","http://ojs.amikom.ac.id/index.php/semnasteknomedia/article/view/277","https://scholar.google.com/scholar?cites=9638628474324889711&as_sdt=2005&sciodt=0,5&hl=en",277,"2019-11-15","","","","",,,,,1,0.20,0,4,5
0,"ADWI PRAYOGO","IMPLEMENTASI RESTFULL WEB SERVICE PADA SISTEM INFORMASI RAWAT JALAN PASIEN BERBASIS SMARTPHONE",2014,"","etd.repository.ugm.ac.id","http://etd.repository.ugm.ac.id/index.php?mod=penelitian_detail&sub=PenelitianDetail&act=view&typ=html&buku_id=70015","",278,"2019-11-15","","","","",,,,,0,0.00,0,1,5
1,"MF Muhyidin","Rancang Bangun Robot Beroda Dengan Kendali Berbasis Sistem Operasi Android Untuk Monitoring Sumber Radiasi",2014,"","Teknofisika Nuklir, STTN-BATAN …","","https://scholar.google.com/scholar?cites=1941504957219748797&as_sdt=2005&sciodt=0,5&hl=en",279,"2019-11-15","CITATION","","","",,,,,1,0.20,1,1,5
1,"IBK Pribadi","Pengembangan Game Interaktif pada Materi Pecahan dengan Menggunakan Sistem Operasi Android",2014,"","Skripsi S1 Pendidikan. UMM","","https://scholar.google.com/scholar?cites=11586339429083476085&as_sdt=2005&sciodt=0,5&hl=en",280,"2019-11-15","CITATION","","","",,,,,1,0.20,1,1,5
0,"S Susliansyah","RANCANG BANGUN SISTEM INFORMASI PERPUSTAKAAN MENGGUNAKAN METODE RATIONAL UNIFIED PROCESS",2014,"Seminar Nasional Ilmu Pengetahuan …","konferensi.nusamandiri.ac.id","http://konferensi.nusamandiri.ac.id/prosiding/index.php/sniptek/article/view/388","",281,"2019-11-15","","","","",,,,,0,0.00,0,1,5
0,"RU Putri","APLIKASI PENERAPAN DIGITAL FORENSICS PADA SISTEM FILE",,"KATA PENGANTAR","teknomatika.stmikayani.ac.id","http://teknomatika.stmikayani.ac.id/wp-content/uploads/2013/07/Teknomatika-Volume-6-No-2.pdf#page=77","",282,"2019-11-15","PDF","","","",,,,,0,0.00,0,1,
6,"S Triyanto, A Fadlil","Sistem Pakar Untuk Mendiagnosa Penyakit Kelinci Berbasis Web",2014,"Jurnal Sarjana Teknik Informatika","neliti.com","https://www.neliti.com/publications/211577/sistem-pakar-untuk-mendiagnosa-penyakit-kelinci-berbasis-web","https://scholar.google.com/scholar?cites=16799816945760677334&as_sdt=2005&sciodt=0,5&hl=en",283,"2019-11-15","","","","",,,,,6,1.20,3,2,5
8,"F Akmal, S Winiarti","Sistem Pakar Untuk Mendiagnosa Penyakit Lambung dengan Implementasi Metode CBR (Case-Based Reasoning) Berbasis Web",2014,"Jurnal Sarjana Teknik Informatika","neliti.com","https://www.neliti.com/publications/211023/sistem-pakar-untuk-mendiagnosa-penyakit-lambung-dengan-implementasi-metode-cbr-c","https://scholar.google.com/scholar?cites=1745316935665273763&as_sdt=2005&sciodt=0,5&hl=en",284,"2019-11-15","","","","",,,,,8,1.60,4,2,5
