Cites,Authors,Title,Year,Source,Publisher,ArticleURL,CitesURL,GSRank,QueryDate,Type,DOI,ISSN,CitationURL,Volume,Issue,StartPage,EndPage,ECC,CitesPerYear,CitesPerAuthor,AuthorCount,Age
2,"BS Hantono, GD Putra","Analisis Unjuk Kerja Aplikasi Digital Signage Xibo pada Single Board Computer Raspberry Pi",2014,"SEMNASTEKNOMEDIA ONLINE","ojs.amikom.ac.id","https://www.ojs.amikom.ac.id/index.php/semnasteknomedia/article/view/327","https://scholar.google.com/scholar?cites=1989792220937104583&as_sdt=2005&sciodt=0,5&hl=en",448,"2019-11-15","","","","",,,,,2,0.40,1,2,5
0,"AH Network","SISTEM KOMUNIKASI ALTERNATIF PADA DAERAH BENCANA MENGGUNAKAN INFRASTRUKTUR MOBILE AD-HOC NETWORK (MANET)",,"academia.edu","","http://www.academia.edu/download/34889220/DAPUS01.pdf","",449,"2019-11-15","PDF","","","",,,,,0,0.00,0,1,
0,"FA Rahman, S Suhartono…","Pengembangan Sistem Informasi Manajemen Rumah Makan (Simrahman) Studi Kasus Rumah Makan Memory Garden Purwokerto",2014,"Journal of Informatics and …","ejournal3.undip.ac.id","https://ejournal3.undip.ac.id/index.php/joint/article/view/6327","",450,"2019-11-15","","","","",,,,,0,0.00,0,3,5
0,"AM Nuriansyah, I Arwani, S Kom, HA ST","PERANCANGAN DAN ANALISIS DATA SISTEM INFORMASI INVENTARIS PTIIK DENGAN MENGGUNAKAN QR CODE",,"academia.edu","","http://www.academia.edu/download/44182190/DR00086201412_FIN.pdf","",451,"2019-11-15","PDF","","","",,,,,0,0.00,0,4,
0,"IDABG MANUABA","PENGEMBANGAN STRATEGI KONTROL UNTUK MEREDAM OSILASI PADA SISTEM TENAGA LISTRIK BERBASIS BACTERIA FORAGING-PARTICLE SWARM …",2014,"","repository.its.ac.id","http://repository.its.ac.id/id/eprint/744","",452,"2019-11-15","","","","",,,,,0,0.00,0,1,5
3,"A Hutomo","Pengembangan Aplikasi Android Kamus Command Line (FYComm) sebagai Media Bantu Belajar Siswa SMK Negeri 1 Bantul Kompetensi Keahlian Teknik Komputer …",2014,"Jurnal Elektronik Pendidikan Teknik Informatika","eprints.uny.ac.id","https://eprints.uny.ac.id/11294/1/ABSTRAK%20INDONESIA.pdf","https://scholar.google.com/scholar?cites=4097294033529500447&as_sdt=2005&sciodt=0,5&hl=en",453,"2019-11-15","","","","",,,,,3,0.60,3,1,5
0,"VA Nugraha, A Noertjahyana, I Gunawan","Implementasi Sistem Active Directory Untuk Kemudahan Administrasi Laboratorium–Laboratorium Program Studi Teknik Informatika Universitas Kristen Petra",2014,"Jurnal Infra","publication.petra.ac.id","http://publication.petra.ac.id/index.php/teknik-informatika/article/view/1806","",454,"2019-11-15","","","","",,,,,0,0.00,0,3,5
0,"FR Wulansari","PSI: Rancang Bangun Sistem Informasi Administrasi Gudang Pada PT. Sinar Mas Teladan Surabaya",2014,"","repository.dinamika.ac.id","http://repository.dinamika.ac.id/id/eprint/781/","",455,"2019-11-15","","","","",,,,,0,0.00,0,1,5
3,"ME Putra, E Nugroho, HA Nugroho","Perancangan Aplikasi Pemesanan Tiket Mobil Berbasis Android Pada Agen Travel",2014,"SEMNASTEKNOMEDIA …","ojs.amikom.ac.id","https://www.ojs.amikom.ac.id/index.php/semnasteknomedia/article/view/323","https://scholar.google.com/scholar?cites=14855593320016733322&as_sdt=2005&sciodt=0,5&hl=en",456,"2019-11-15","","","","",,,,,3,0.60,1,3,5
0,"S MAULINA","PENERAPAN SISTEM INFORMASI PERUSAHAAN BERBASIS WEB (STUDI KASUS PADA UD. YUASA FOOD BERKAH MAKMUR WONOSOBO)",2014,"","etd.repository.ugm.ac.id","http://etd.repository.ugm.ac.id/index.php?mod=penelitian_detail&sub=PenelitianDetail&act=view&typ=html&buku_id=71663","",457,"2019-11-15","","","","",,,,,0,0.00,0,1,5
2,"S Prayoga","Implementasi Pengaturan dan Prioritas Bandwidth dengan Hierarchical Token Bucket berbasiskan GUI pada Linux Server Clearos",2014,"KOMPUTIKA-Jurnal Sistem Komputer UNIKOM","repository.unikom.ac.id","https://repository.unikom.ac.id/id/eprint/30326","https://scholar.google.com/scholar?cites=4732574022030263938&as_sdt=2005&sciodt=0,5&hl=en",458,"2019-11-15","","","","",,,,,2,0.40,2,1,5
1,"A Justitia, B Nuqoba","PARENTAL CONTROL SYSTEM PADA BOARDING SCHOOL BERBASIS ANDROID (STUDI KASUS: SMA LUQMAN AL HAKIM, SURABAYA)",2014,"Informatika Mulawarman: Jurnal Ilmiah …","fmipa.unmul.ac.id","https://fmipa.unmul.ac.id/files/docs/9.%2049-55%20PARENTAL%20CONTROL%20SYSTEM%20PADA.pdf","https://scholar.google.com/scholar?cites=926556918452399928&as_sdt=2005&sciodt=0,5&hl=en",459,"2019-11-15","PDF","","","",,,,,1,0.20,1,2,5
4,"IME Virnawan, IGC Putra","Efisiensi Penyaluran Kredit Pada Lembaga Perkreditan Desa (LPD) Di Kecamatan Marga-Tabanan",2014,"Jurnal Ilmiah Akuntansi Dan Bisnis","ojs.unud.ac.id","https://ojs.unud.ac.id/index.php/jiab/article/view/16537","https://scholar.google.com/scholar?cites=14512386507023420388&as_sdt=2005&sciodt=0,5&hl=en",460,"2019-11-15","","","","",,,,,4,0.80,2,2,5
0,"R Robianto","Sistem Kontrol Rolling Door Berbasis Android Didukung Kamera CCTV dan Buzzer",2014,"Komputer Teknologi Informasi","lppm.upiyptk.ac.id","http://lppm.upiyptk.ac.id/komtekinfo/index.php/KOMTEKINFO/article/view/133","",461,"2019-11-15","","","","",,,,,0,0.00,0,1,5
0,"AC Nugroho","PENGGUNAAN NEAR FIELD COMMUNICATION (NFC) UNTUK PERANCANGAN SISTEM PARKIR SWALAYAN PADA PLATFORM ANDROID",2014,"","eprints.umm.ac.id","http://eprints.umm.ac.id/25344/","",462,"2019-11-15","","","","",,,,,0,0.00,0,1,5
0,"R Putera","SISTEM INFORMASI DOKUMEN SKRIPSI BERBASIS WEB TEKNIK INFORMATIKA UNIVERSITAS MUHAMMADIYAH GRESIK",2014,"","eprints.umg.ac.id","http://eprints.umg.ac.id/1529/","",463,"2019-11-15","","","","",,,,,0,0.00,0,1,5
7,"N Rahmawati, R Saputra…","Sistem Informasi Geografis Pemetaan dan Analisis Lahan Pertanian di Kabupaten Pekalongan",2014,"Journal of Informatics and …","ejournal3.undip.ac.id","https://ejournal3.undip.ac.id/index.php/joint/article/view/6275","https://scholar.google.com/scholar?cites=16381014491500253959&as_sdt=2005&sciodt=0,5&hl=en",464,"2019-11-15","","","","",,,,,7,1.40,2,3,5
0,"Y Arkiansyah","Sistem Repository Berita Dan Gambar Pada Harian Umum Lampung Post",2014,"Jurnal Informatika","neliti.com","https://www.neliti.com/publications/103319/sistem-repository-berita-dan-gambar-pada-harian-umum-lampung-post","",465,"2019-11-15","","","","",,,,,0,0.00,0,1,5
0,"S Indarto","SISTEM PEMBAYARAN KULIAH MELALUI BANK BNI MENGGUNAKAN SISTEM KEAMANAN DATA KRIPTOGRAFI CAESAR",2014,"","eprints.sinus.ac.id","https://eprints.sinus.ac.id/278/","",466,"2019-11-15","","","","",,,,,0,0.00,0,1,5
0,"AR Pratama","Whatsapp Forensics: Eksplorasi Sistem Berkas Dan Basis Data Pada Aplikasi Android Dan Ios",2014,"Jurnal Fakultas Hukum UII","neliti.com","https://www.neliti.com/publications/129880/whatsapp-forensics-eksplorasi-sistem-berkas-dan-basis-data-pada-aplikasi-android","",467,"2019-11-15","","","","",,,,,0,0.00,0,1,5
0,"IH HULUKATI","MODEL SERVER CLUSTER SEBAGAI REDUNDANT SYSTEM DI UNIVERSITAS NEGERI GORONTALO",2014,"","Universitas Negeri Gorontalo","","",468,"2019-11-15","CITATION","","","",,,,,0,0.00,0,1,5
0,"M Hulzanah","SISTEM INFORMASI AKADEMIK SEKOLAH MENENGAH PERTAMA (SMP) NEGERI 15 PALEMBANG BERBASIS WEB",2014,"","eprints.polsri.ac.id","http://eprints.polsri.ac.id/1077/","",469,"2019-11-15","","","","",,,,,0,0.00,0,1,5
0,"G PUSPA GEODA, A Suprayogi, H Hani'ah…","PEMBUATAN APLIKASI SISTEM INFORMASI GEOGRAFIS KAMPUS UNIVERSITAS DIPONEGORO BERBASIS ANDROID",2014,"","eprints.undip.ac.id","http://eprints.undip.ac.id/45098/","",470,"2019-11-15","","","","",,,,,0,0.00,0,4,5
5,"H Ardiyanto, PS Sasongko…","Sistem Pendukung Keputusan Pemilihan Perumahan Menggunakan Metode AHP Berbasis WEB (Studi Kasus CV. Wisma Anungkriya Demak)",2014,"Journal of Informatics and …","ejournal3.undip.ac.id","https://ejournal3.undip.ac.id/index.php/joint/article/view/6293","https://scholar.google.com/scholar?cites=14675197286863316755&as_sdt=2005&sciodt=0,5&hl=en",471,"2019-11-15","","","","",,,,,5,1.00,2,3,5
0,"MS Ramadhan, M Amin","APLIKASI SISTEM KONTROL KONEKTIVITAS JARINGAN DENGAN MENGGUNAKAN TEKNOLOGI GLOBAL SYSTEMS FOR MOBILE",2014,"JURTEKSI ROYAL Vol 3 No 1","is.its.ac.id","http://is.its.ac.id/pubs/oajis/index.php/home/detail/1293/APLIKASI-SISTEM-KONTROL-KONEKTIVITAS-JARINGAN-DENGAN-MENGGUNAKAN-TEKNOLOGI-GLOBAL-SYSTEMS-FOR-MOBILE","",472,"2019-11-15","","","","",,,,,0,0.00,0,2,5
4,"ND Satika, STTI TANJUNGPINANG","Sistem Informasi Pengiriman Barang Berbasis Web Dengan Metode Transshipment",2014,"Skripsi, Sekolah Tinggi …","academia.edu","http://www.academia.edu/download/48010257/jbptsttippp--nurdwisati-349-1-tikalen-p.pdf","https://scholar.google.com/scholar?cites=506195668344598030&as_sdt=2005&sciodt=0,5&hl=en",473,"2019-11-15","PDF","","","",,,,,4,0.80,2,2,5
0,"R Gustriansyah, H Sunardi…","PEMBANGUNAN M-BEKAM BERBASIS SISTEM PAKAR",2014,"Jurnal Informatika …","ejournal.uigm.ac.id","http://ejournal.uigm.ac.id/index.php/IG/article/view/74","",474,"2019-11-15","","","","",,,,,0,0.00,0,3,5
0,"W Prasetyawan","PERANCANGAN SISTEM PENJUALAN BERBASIS WEB PADA CV. KICAU BURUNG KABUPATEN KUDUS",,"core.ac.uk","","https://core.ac.uk/download/pdf/35379372.pdf","",475,"2019-11-15","PDF","","","",,,,,0,0.00,0,1,
0,"A Afriyudi, M Akbar, S Suryayusra","Pengembangan Sistem Informasi Eksekutif berbasis Android pada Jaringan Virtual Private Network (VPN)",2014,"","eprints.binadarma.ac.id","http://eprints.binadarma.ac.id/2169/","",476,"2019-11-15","","","","",,,,,0,0.00,0,3,5
5,"R Septianita","Pengembangan Media Belajar Buku Saku Fisika dengan Teknologi Augmented Reality Berbasis Android pada Materi Fluida Statis untuk Siswa kelas X SMA IPA",2014,"SKRIPSI Jurusan Fisika-Fakultas MIPA UM","karya-ilmiah.um.ac.id","http://karya-ilmiah.um.ac.id/index.php/fisika/article/view/32673","https://scholar.google.com/scholar?cites=2780526289168421514&as_sdt=2005&sciodt=0,5&hl=en",477,"2019-11-15","","","","",,,,,5,1.00,5,1,5
3,"R Efendi, M Fitri, D Andreswari","Rancang Bangun Aplikasi Kamus Bahasa Indonesia-Minang, Minang-Indonesia Berbasis Android",2014,"TEKNOSIA","repository.unib.ac.id","http://repository.unib.ac.id/6884/1/TEknosi%20Maret%202014.PDF","https://scholar.google.com/scholar?cites=3412430885370277484&as_sdt=2005&sciodt=0,5&hl=en",478,"2019-11-15","PDF","","","",,,,,3,0.60,1,3,5
0,"L Ratmelia","MEMBANGUN APLIKASI ANDROID UNTUK SISTEM AKADEMIK (STUDI KASUS: FAKULTAS SAINS DAN TEKNOLOGI UIN SUSKA RIAU)",2014,"","repository.uin-suska.ac.id","http://repository.uin-suska.ac.id/3672/","",479,"2019-11-15","","","","",,,,,0,0.00,0,1,5
0,"N Prabowo","PEMBANGUNAN APLIKASI PEMBELAJARAN MENGGUNAKAN MEDIA MOBILE-LEARNING BERBASIS ANDROID DI PROGRAM STUDI SISTEM INFORMASI …",2014,"","repository.widyatama.ac.id","https://repository.widyatama.ac.id/xmlui/handle/123456789/5911","",480,"2019-11-15","","","","",,,,,0,0.00,0,1,5
5,"L Candra, AA Alkodri","Aplikasi Pemesanan Makanan Pada Bangka Original Cafe Berbasis Client Server Dengan Platform Android",2014,"Jurnal Sisfokom (Sistem Informasi dan …","jurnal.atmaluhur.ac.id","http://jurnal.atmaluhur.ac.id/index.php/sisfokom/article/view/205","https://scholar.google.com/scholar?cites=591615818722627061&as_sdt=2005&sciodt=0,5&hl=en",481,"2019-11-15","","","","",,,,,5,1.00,3,2,5
0,"H Bangun","APLIKASI SISTEM PAKAR IDENTIFIKASI GAYA BERPIKIR BERBASIS ANDROID",2014,"","repository.uin-suska.ac.id","http://repository.uin-suska.ac.id/3636/","",482,"2019-11-15","","","","",,,,,0,0.00,0,1,5
0,"T Raharjo","APLIKASI PENDUKUNG KEPUTUSAN PENENTUAN JURUSAN DI SMA NEGERI 1 NOGOSARI DENGAN METODE FUZZY INFERENCE SYSTEM (FIS)",2014,"","eprints.sinus.ac.id","https://eprints.sinus.ac.id/280/","",483,"2019-11-15","","","","",,,,,0,0.00,0,1,5
0,"B Gustiandi, A Indradjad","SISTEM PENGOLAHAN DATA SATELIT SUOMI NPP UNTUK PRODUKSI CITRA TRUE COLOR",2014,"SESINDO 2014","is.its.ac.id","http://is.its.ac.id/pubs/oajis/index.php/home/detail/1384/SISTEM-PENGOLAHAN-DATA-SATELIT-SUOMI-NPP-UNTUK-PRODUKSI-CITRA-TRUE-COLOR","",484,"2019-11-15","","","","",,,,,0,0.00,0,2,5
0,"A Anang","SISTEM INFORMASI TRYOUT ONLINE SEKOLAH MENENGAH PERTAMA BERBASIS WEB",2014,"","eprints.akakom.ac.id","http://eprints.akakom.ac.id/4357/8/103110116_BAB%20I.pdf","",485,"2019-11-15","","","","",,,,,0,0.00,0,1,5
0,"S Surahmat, YN Kunang…","ANALISIS KEAMANAN SISTEM WPA RADIUS",2014,"Jurnal Mahasiswa …","eprints.binadarma.ac.id","http://eprints.binadarma.ac.id/2019/1/10142020N_Journal.pdf","",486,"2019-11-15","PDF","","","",,,,,0,0.00,0,3,5
0,"S Slamet","Intrusion Preventing System pada Jaringan Wireless STIKOM Surabaya Menggunakan SNORT dan IPTables",2014,"Jurnal Ilmiah SCROLL","repository.dinamika.ac.id","http://repository.dinamika.ac.id/id/eprint/1029/","",487,"2019-11-15","","","","",,,,,0,0.00,0,1,5
1,"MD Arini","SISTEM BERORIENTASI OBJEK PEMBELIAN MATERIAL PADA PT. HI-TECH INK INDONESIA CIKARANG",2014,"Seminar Nasional Ilmu Pengetahuan dan …","konferensi.nusamandiri.ac.id","http://konferensi.nusamandiri.ac.id/prosiding/index.php/sniptek/article/view/383","https://scholar.google.com/scholar?cites=14751001563504724957&as_sdt=2005&sciodt=0,5&hl=en",488,"2019-11-15","","","","",,,,,1,0.20,1,1,5
0,"S Khusnul Azifah, I Waspada","SISTEM PEMANTAU AKTIVITAS PENGGUNA PADA JARINGAN CLIENT-SERVER",,"Proceeding Seminar Nasional Ilmu …","eprints.undip.ac.id","http://eprints.undip.ac.id/48789/","",489,"2019-11-15","","","","",,,,,0,0.00,0,2,
1,"DA Prameswari","Aplikasi Location Based Service SPBU di Wilayah Bandung Tengah berbasis Android",2014,"","repository.widyatama.ac.id","https://repository.widyatama.ac.id/xmlui/handle/123456789/3520","https://scholar.google.com/scholar?cites=12835651570424023468&as_sdt=2005&sciodt=0,5&hl=en",490,"2019-11-15","","","","",,,,,1,0.20,1,1,5
0,"H Hendrawan","ANALISA SISTEM INFORMASI AKADEMIK STIKOM DINAMIKA BANGSA DENGAN ASPEK HUMAN COMPUTER INTERACTION",2014,"Jurnal Ilmiah Media Sisfo","ejournal.stikom-db.ac.id","http://ejournal.stikom-db.ac.id/index.php/mediasisfo/article/view/15","",491,"2019-11-15","","","","",,,,,0,0.00,0,1,5
2,"I Saleh, H Wintolo, D Nugraheny","Analisa Perbandingan Waktu dan Kecepatan Transfer pada Multi Protocol Label Switching (Mpls) dengan Virtual Private Network (Vpn) untuk Perpindahan Dokumen …",2014,"Compiler","ejournals.stta.ac.id","http://ejournals.stta.ac.id/index.php/compiler/article/view/70","https://scholar.google.com/scholar?cites=3811183586510106502&as_sdt=2005&sciodt=0,5&hl=en",492,"2019-11-15","","","","",,,,,2,0.40,1,3,5
0,"GD Prasetyo","Sistem Aplikasi Pengaturan Layanan Percetakan Dokumen Di Perpustakaan Dengan Menggunakan Bahasa Pemograman Java",2014,"","eprints.ums.ac.id","http://eprints.ums.ac.id/id/eprint/32514","",493,"2019-11-15","","","","",,,,,0,0.00,0,1,5
0,"NI Prasetya, S Djanali, M Husni","VERIFIKASI SIGNATURE PADA KOLABORASI SISTEM DETEKSI INTRUSI JARINGAN TERSEBAR DENGAN HONEYPOT",2014,"JUTI: Jurnal Ilmiah Teknologi …","juti.if.its.ac.id","http://juti.if.its.ac.id/index.php/juti/article/view/324","",494,"2019-11-15","","","","",,,,,0,0.00,0,3,5
8,"R SYAFRIDA","Regulasi Diri dan Intensitas Penggunaan Smartphone Terhadap Keterampilan Sosial",2014,"Jurnal Pendidikan Usia Dini","journal.unj.ac.id","http://journal.unj.ac.id/unj/index.php/jpud/article/download/3602/2631","https://scholar.google.com/scholar?cites=15889032427401176535&as_sdt=2005&sciodt=0,5&hl=en",495,"2019-11-15","PDF","","","",,,,,8,1.60,8,1,5
0,"R Ilman","TA: Analisis Penerapan Sistem High Availability Dataguard Oracle 11G Pada PT. Terminal Petikemas Surabaya",2014,"","repository.dinamika.ac.id","http://repository.dinamika.ac.id/id/eprint/1555/","",496,"2019-11-15","","","","",,,,,0,0.00,0,1,5
2,"UH Suharto, J Triyono…","Aplikasi Pencarian Lokasi Agen TIKI (Titipan Kilat) Di Yogyakarta Untuk Android",2014,"Yogyakarta: Institut Sains …","repository.akprind.ac.id","http://repository.akprind.ac.id/sites/files/2014-Untoro%20HS-Joko%20T-Edhy%20S-Makalah%20Jurnal%20SCRIPT-Hal%20147-155-Aplikasi%20Pencarian%20Lokasi%20Agen%20Tiki%20(Titipan%20Kilat)%20di%20Yogyakarta%20untuk%20Android.pdf","https://scholar.google.com/scholar?cites=4491198042290145016&as_sdt=2005&sciodt=0,5&hl=en",497,"2019-11-15","PDF","","","",,,,,2,0.40,1,3,5
3,"NMD Arisandi, PN Crisnapati…","Pengembangan Aplikasi augmented reality story book Legenda Kebo Iwa",2014,"Kumpulan Artikel …","ejournal.undiksha.ac.id","https://ejournal.undiksha.ac.id/index.php/KP/article/view/19733","https://scholar.google.com/scholar?cites=14301844693463042948&as_sdt=2005&sciodt=0,5&hl=en",498,"2019-11-15","","","","",,,,,3,0.60,1,3,5
0,"AAW Darma","SISTEM INFORMASI PENJADWALAN TUTORIAL PADA UNIVERSITAS TERBUKA PEKANBARU",2014,"","repository.uin-suska.ac.id","http://repository.uin-suska.ac.id/3529/","",499,"2019-11-15","","","","",,,,,0,0.00,0,1,5
0,"MW Hidayat","Implementasi Sistem Single Sign On Authentication Terintegrasi Dengan Account Mail Zimbra",2014,"","digilib.uns.ac.id","https://digilib.uns.ac.id/dokumen/download/40727/MTMyNjkw/Implementasi-Sistem-Single-Sign-On-Authentication-Terintegrasi-Dengan-Account-Mail-Zimbra-IMAGE0006.pdf","",500,"2019-11-15","","","","",,,,,0,0.00,0,1,5
0,"DA Putra","Sistem Informasi Pemesanan Menu Makanan Berbasis Web Mobile Di Waroeng Spesial Sambal Yogyakarta",2014,"","digilib.uns.ac.id","https://digilib.uns.ac.id/dokumen/detail/41239/Sistem-Informasi-Pemesanan-Menu-Makanan-Berbasis-Web-Mobile-Di-Waroeng-Spesial-Sambal-Yogyakarta","",501,"2019-11-15","","","","",,,,,0,0.00,0,1,5
4,"O Okfalisa, A Gunawan","SIstem Pendukung Keputusan Untuk Menentukan Produk Asuransi Jiwa Bagi Nasabah Menggunakan Metode Smarter",2014,"Jurnal Sains dan Teknologi …","ejournal.uin-suska.ac.id","http://ejournal.uin-suska.ac.id/index.php/sitekin/article/view/776","https://scholar.google.com/scholar?cites=199693441133003757&as_sdt=2005&sciodt=0,5&hl=en",502,"2019-11-15","","","","",,,,,4,0.80,2,2,5
10,"S Kurczyk, M Pawelczyk","Active noise control using a fuzzy inference system without secondary path modelling",2014,"Archives of Acoustics","degruyter.com","https://www.degruyter.com/downloadpdf/j/aoa.2014.39.issue-2/aoa-2014-0028/aoa-2014-0028.xml","https://scholar.google.com/scholar?cites=9241292448645775081&as_sdt=2005&sciodt=0,5&hl=en",503,"2019-11-15","PDF","","","",,,,,10,2.00,5,2,5
0,"E Winarno","LKP: Rancang Bangun Sistem Informasi Perpustakaan Pada PT. Garudafood Putra Putri Jaya Gresik",2014,"","repository.dinamika.ac.id","http://repository.dinamika.ac.id/id/eprint/1323/","",504,"2019-11-15","","","","",,,,,0,0.00,0,1,5
0,"K Rachmanto","Perancangan Decision Support System (Dss) Berbasis Program Aplikasi Menggunakan Microsoft Visual Basic 6.0",2014,"","eprints.ums.ac.id","http://eprints.ums.ac.id/id/eprint/28880","",505,"2019-11-15","","","","",,,,,0,0.00,0,1,5
5,"PA Sumirat","Aplikasi alat musik gamelan Jawa pada perangkat android",2014,"","publikasiilmiah.ums.ac.id","https://publikasiilmiah.ums.ac.id/xmlui/handle/11617/4864","https://scholar.google.com/scholar?cites=10864051013006293662&as_sdt=2005&sciodt=0,5&hl=en",506,"2019-11-15","","","","",,,,,5,1.00,5,1,5
0,"TM Zaini, L Destasari","Sistem Informasi Hasil Perikanan Berbasis Jaringan Pada Dinas Kelautan Dan Perikanan Provinsi Lampung",2014,"Jurnal Informatika","jurnal.darmajaya.ac.id","http://jurnal.darmajaya.ac.id/index.php/JurnalInformatika/article/view/162","",507,"2019-11-15","","","","",,,,,0,0.00,0,2,5
0,"D Dimastuti, B Sunarko…","DESAIN ONE-CARD SYSTEM BERORIENTASI OPERASI PROSES PELAYANAN AKADEMIK (Studi Kasus di Fakultas Ekonomi dan Bisnis, Universitas Jenderal …",2014,"JBIMA (Jurnal Bisnis dan …","journal.peradaban.ac.id","http://journal.peradaban.ac.id/index.php/jbm/article/view/36","",508,"2019-11-15","","","","",,,,,0,0.00,0,3,5
0,"LES Subiyanto","SISTEM INFORMASI GEOGRAFIS BERBASIS WEB UNTUK PEMETAAN PENYAKIT PADA DINAS KESEHATAN DI KOTA SEMARANG",,"mahasiswa.dinus.ac.id","","http://mahasiswa.dinus.ac.id/docs/skripsi/jurnal/14693.pdf","",509,"2019-11-15","PDF","","","",,,,,0,0.00,0,1,
5,"S Priyanto, P Pribadi, A Hamdi","GAME EDUKASI “MATCHING THREE” UNTUK ANAK USIA DINI",2014,"Telematika","ejournal.amikompurwokerto.ac.id","http://ejournal.amikompurwokerto.ac.id/index.php/telematika/article/download/248/223","https://scholar.google.com/scholar?cites=1363345974619385292&as_sdt=2005&sciodt=0,5&hl=en",510,"2019-11-15","PDF","","","",,,,,5,1.00,2,3,5
1,"D Junaidi","SISTEM INFORMASI BANK DARAH PADA UNIT DONOR DARAH (UDD) PMI KOTA DUMAI BERBASIS ANDROID",2014,"","repository.uin-suska.ac.id","http://repository.uin-suska.ac.id/id/eprint/3557","https://scholar.google.com/scholar?cites=10341237313880081049&as_sdt=2005&sciodt=0,5&hl=en",511,"2019-11-15","","","","",,,,,1,0.20,1,1,5
0,"CA Amor, D Meilani, H Kamil","Sistem Informasi Logistik Aktiva Tetap Berbasis Web dengan Akses Mobile pada PT. Bank Rakyat Indonesia (Persero) Tbk. Kantor Cabang Padang Panjang",2014,"Seminar Nasional Sistem Komputer …","repo.unand.ac.id","http://repo.unand.ac.id/id/eprint/21820","",512,"2019-11-15","","","","",,,,,0,0.00,0,3,5
1,"H Hendrayanto","PEMBANGUNAN SISTEM DISTRIBUSI VOUCHER PULSA TRI MENGGUNAKAN METODE DISTRIBUTION REQUIREMENT PLANNING DI PT DWI DAYA USAHA …",2014,"","repository.widyatama.ac.id","https://repository.widyatama.ac.id/xmlui/handle/123456789/4694","https://scholar.google.com/scholar?cites=12390015227223527387&as_sdt=2005&sciodt=0,5&hl=en",513,"2019-11-15","","","","",,,,,1,0.20,1,1,5
0,"AA Citra","SISTEM INFORMASI LOGISTIK AKTIVA TETAP BERBASIS WEB DENGAN FITUR MOBILE PADA PT. BANK RAKYAT INDONESIA (PERSERO) Tbk. KANTOR …",2014,"","scholar.unand.ac.id","http://scholar.unand.ac.id/8918/","",514,"2019-11-15","","","","",,,,,0,0.00,0,1,5
0,"BU Wulandari","Sistem Rekomendasi Pemilihan Tempat Kost Menggunakan Database Fuzzy Model Tahani Berbasis Web",2014,"","digilib.uns.ac.id","https://digilib.uns.ac.id/dokumen/detail/40822/Sistem-Rekomendasi-Pemilihan-Tempat-Kost-Menggunakan-Database-Fuzzy-Model-Tahani-Berbasis-Web","",515,"2019-11-15","","","","",,,,,0,0.00,0,1,5
0,"D Sapitri, D Prayama, T Erlina","PENGEMBANGAN DAN OPTIMALISASI OPENBIBLIO SEBAGAI SISTEM OTOMASI PERPUSTAKAAN PADA SMA NEGERI 4 PADANG",2014,"… OPENBIBLIO SEBAGAI SISTEM …","repo.unand.ac.id","http://repo.unand.ac.id/1060/1/jurnal%2520delfi.pdf","",516,"2019-11-15","PDF","","","",,,,,0,0.00,0,3,5
0,"R Uliani","Pengembangan Sistem Informasi Penilaian Berbasis Kurikulum 2013",2014,"Edu Komputika Journal","journal.unnes.ac.id","http://journal.unnes.ac.id/sju/index.php/edukom/article/view/4119","",517,"2019-11-15","","","","",,,,,0,0.00,0,1,5
5,"JP Sari, E Ernawati, A Erlansari","Rancang Bangun Aplikasi Layanan Berbasis Lokasi Dengan Penerapan Augmented Reality Menggunakan Metode Markerless Berbasis Android (Studi Kasus …",2014,"Rekursif: Jurnal Informatika","ejournal.unib.ac.id","https://ejournal.unib.ac.id/index.php/rekursif/article/view/309","https://scholar.google.com/scholar?cites=9926008203139628603&as_sdt=2005&sciodt=0,5&hl=en",518,"2019-11-15","","","","",,,,,5,1.00,2,3,5
0,"R Hiba, R Pusitasari","CATUAN NO BREAK SYSTEM PERANGKAT TELEKOMUNIKASI DI PT. TELKOM INDONESIA, Tbk DIVISI REGIONAL II AREA NETWORK TANGERANG",2014,"Journal ICT","academia.edu","https://www.academia.edu/download/36434503/49-Jurnal-No-9.pdf","",519,"2019-11-15","PDF","","","",,,,,0,0.00,0,2,5
1,"M Rizkiyani","Penerapan Forecasting Methods untuk Meningkatkan Strategi dalam Sistem Penjualan Ponsel pada Sarang Cell Semarang",2014,"Semarang: Seminar Nasional","eprints.dinus.ac.id","http://eprints.dinus.ac.id/13341/1/jurnal_13927.pdf","https://scholar.google.com/scholar?cites=13362825804140711351&as_sdt=2005&sciodt=0,5&hl=en",520,"2019-11-15","PDF","","","",,,,,1,0.20,1,1,5
3,"NN Farah, A Suprayogi, M Awaluddin","Aplikasi Pgrouting Untuk Penentuan Jalur Optimum Pada Pembuatan Rute Pemadam Kebakaran (Studi Kasus: Kota Semarang)",2014,"Jurnal Geodesi Undip","ejournal3.undip.ac.id","https://ejournal3.undip.ac.id/index.php/geodesi/article/view/4722","https://scholar.google.com/scholar?cites=2873951433163424634&as_sdt=2005&sciodt=0,5&hl=en",521,"2019-11-15","","","","",,,,,3,0.60,1,3,5
0,"I Siddiq","ANALISIS DAN PERANCANGAN SISTEM INFORMASI LAPORAN PENJUALAN DAN INVENTORY PADA APOTEK RUMAH SAKIT MULYASARI …",,"karyailmiah.yai.ac.id","","http://karyailmiah.yai.ac.id/files/pdf/20140220163839.pdf","",522,"2019-11-15","PDF","","","",,,,,0,0.00,0,1,
0,"Y Prayudi","Analisis Bukti Digital Global Positioning System (GPS) Pada Smartphone Android",,"researchgate.net","","https://www.researchgate.net/profile/Sukriadi_Shafar5/publication/264497148_Analisis_Bukti_Digital_Global_Positioning_System_GPS_Pada_Smartphone_Android/links/5c93025b92851cf0ae8bdd53/Analisis-Bukti-Digital-Global-Positioning-System-GPS-Pada-Smartphone-Android.pdf","",523,"2019-11-15","PDF","","","",,,,,0,0.00,0,1,
3,"V Alvianita","Sistem Tes Kepribadian Dengan Skala Likert Untuk Menentukkan Calon Karyawan Di Perusahaan",2014,"","eprints.ums.ac.id","http://eprints.ums.ac.id/id/eprint/28091","https://scholar.google.com/scholar?cites=17764004741885446130&as_sdt=2005&sciodt=0,5&hl=en",524,"2019-11-15","","","","",,,,,3,0.60,3,1,5
0,"M ZAMRONI","APLIKASI SISTEM PENDUKUNG KEPUTUSAN DENGAN METODE PROMETHEE UNTUK PEMILIHAN JURUSAN DI MAN LAMONGAN BERBASIS ANDROID",2014,"","eprints.umg.ac.id","http://eprints.umg.ac.id/1556/","",525,"2019-11-15","","","","",,,,,0,0.00,0,1,5
1,"GRD Irianto, NA Setiyanto, M Kom","RANCANG BANGUN APLIKASI SISTEM PAKAR UNTUK MENGETAHUI KARAKTERISTIK KEPRIBADIAN PADA ANAK DENGAN MENGGUNAKAN METODE …",2014,"","core.ac.uk","https://core.ac.uk/download/pdf/35378781.pdf","https://scholar.google.com/scholar?cites=1956848815270433543&as_sdt=2005&sciodt=0,5&hl=en",526,"2019-11-15","PDF","","","",,,,,1,0.20,0,3,5
0,"S Subianto","SISTEM INFORMASI PENGELOLAAN PARKIR (Studi Kasus Pusat Perbelanjaan Modern)",2014,"INFOKAM","amikjtc.com","http://amikjtc.com/jurnal/index.php/jurnal/article/view/58","",527,"2019-11-15","","","","",,,,,0,0.00,0,1,5
