Cites,Authors,Title,Year,Source,Publisher,ArticleURL,CitesURL,GSRank,QueryDate,Type,DOI,ISSN,CitationURL,Volume,Issue,StartPage,EndPage,ECC,CitesPerYear,CitesPerAuthor,AuthorCount,Age
3,"F Arsi, KV Febrianti","Pengembangan Media Pembelajaran Fisika Berbasis Web untuk SMA Kelas X pada Pokok Bahasan Listrik Dinamis",2014,"PROSIDING: Seminar Nasional Fisika dan …","jurnal.fkip.uns.ac.id","http://www.jurnal.fkip.uns.ac.id/index.php/prosfis1/article/view/5891","https://scholar.google.com/scholar?cites=5161193897891630568&as_sdt=2005&sciodt=0,5&hl=en",687,"2019-11-15","","","","",,,,,3,0.60,2,2,5
0,"R Arafiah","PERANCANGAN SISTEM INFORMASI BERBASIS WEB PADA JURUSAN MATEMATIKA FMIPA",2014,"PARAMETER: Jurnal Pendidikan Universitas Negeri …","journal.unj.ac.id","http://journal.unj.ac.id/unj/index.php/parameter/article/view/1091","",688,"2019-11-15","","","","",,,,,0,0.00,0,1,5
2,"E Priyatmanto","Aplikasi Pembelajaran Kaidah Bahasa Jawa Berbasis Android Mobile",2014,"","eprints.ums.ac.id","http://eprints.ums.ac.id/id/eprint/28095","https://scholar.google.com/scholar?cites=7949260490172329447&as_sdt=2005&sciodt=0,5&hl=en",689,"2019-11-15","","","","",,,,,2,0.40,2,1,5
1,"IP Libramawan","PENGARUH PENERAPAN WHISTLEBLOWING SYSTEM TERHADAP PENCEGAHAN KECURANGAN (Studi Survey pada PT Coca-Cola Amatil Indonesia SO …",2014,"","repository.widyatama.ac.id","https://repository.widyatama.ac.id/xmlui/handle/123456789/3653","https://scholar.google.com/scholar?cites=2542950561477077872&as_sdt=2005&sciodt=0,5&hl=en",690,"2019-11-15","","","","",,,,,1,0.20,1,1,5
0,"S Haryanto","Analisa Penerapan Sistem pada Hospitality Industry",2014,"ComTech: Computer, Mathematics and Engineering …","journal.binus.ac.id","https://journal.binus.ac.id/index.php/comtech/article/view/2217","",691,"2019-11-15","","","","",,,,,0,0.00,0,1,5
1,"H Hafsah, HC Rustamadji, AS Sriyono","Aplikasi Pencarian Android Package (APK) Berbasis Web Dan Mobile Web Dengan API",2014,"Telematika","jurnal.upnyk.ac.id","http://jurnal.upnyk.ac.id/index.php/telematika/article/download/298/260","https://scholar.google.com/scholar?cites=3033777594582585559&as_sdt=2005&sciodt=0,5&hl=en",692,"2019-11-15","PDF","","","",,,,,1,0.20,0,3,5
1,"L Erawan, S Suharnawi","RANCANGAN SILABUS MATA KULIAH WEB BERFILOSOFI WEB STANDARDS CURRICULUM W3C (STUDI KASUS KURIKULUM PRODI SISTEM INFORMASI …",2014,"Techno. Com","publikasi.dinus.ac.id","http://publikasi.dinus.ac.id/index.php/technoc/article/view/538","https://scholar.google.com/scholar?cites=15087224633425369877&as_sdt=2005&sciodt=0,5&hl=en",693,"2019-11-15","","","","",,,,,1,0.20,1,2,5
2,"INHR Putra","Aplikasi Presensi Siswa Menggunakan Kode QR (QR Code) Berbasis Android Di SMK Shifa Kalipare Malang",2014,"Bimasakti","neliti.com","https://www.neliti.com/publications/184279/aplikasi-presensi-siswa-menggunakan-kode-qr-qr-code-berbasis-android-di-smk-shif","https://scholar.google.com/scholar?cites=3270412053895141458&as_sdt=2005&sciodt=0,5&hl=en",694,"2019-11-15","","","","",,,,,2,0.40,2,1,5
5,"LD Jayanti","Implementasi Metode Weighted Product Pada Sistem Pendukung Keputusan Pemberian Kredit Pada BPR BKK KARANGANYAR Kab. Pekalongan",2014,"Jurnal Teknik Informatika Universitas Dian …","eprints.dinus.ac.id","http://eprints.dinus.ac.id/13395/1/jurnal_14011.pdf","https://scholar.google.com/scholar?cites=16087166451266623686&as_sdt=2005&sciodt=0,5&hl=en",695,"2019-11-15","PDF","","","",,,,,5,1.00,5,1,5
0,"D Astuti","SISTEM INFORMASI PENYEDIAAN JASA KEAMANAN PADA PT. TANSATRISNA MAJU BERSAMA PALEMBANG",2014,"","eprints.polsri.ac.id","http://eprints.polsri.ac.id/1042/","",696,"2019-11-15","","","","",,,,,0,0.00,0,1,5
2,"ABC Permana, KI Satoto…","Perancangan Aplikasi Pengenal Alat Musik Tradisional Gandara Menggunakan Multipoint Mouse SDK",2014,"Jurnal Teknologi dan …","jtsiskom.undip.ac.id","http://jtsiskom.undip.ac.id/index.php/jtsiskom/article/view/12594","https://scholar.google.com/scholar?cites=4365318981273978357&as_sdt=2005&sciodt=0,5&hl=en",697,"2019-11-15","","","","",,,,,2,0.40,1,3,5
1,"SA Pranata","Sistem informasi kompetisi penuh liga sepak bola berbasis website",2014,"","digilib.uns.ac.id","https://digilib.uns.ac.id/dokumen/download/44540/MTU4MDM1/Sistem-informasi-kompetisi-penuh-liga-sepak-bola-berbasis-website-AWAL.pdf","https://scholar.google.com/scholar?cites=2549574628098266020&as_sdt=2005&sciodt=0,5&hl=en",698,"2019-11-15","PDF","","","",,,,,1,0.20,1,1,5
1,"A Suwandhi, J Erpin","Analisa Sistem Pengaman Data Jaringan Berbasis VPN",,"STMIK IBBI","dosen.publikasistmikibbi.lppm.org","http://dosen.publikasistmikibbi.lppm.org/permalink/000125.pdf","https://scholar.google.com/scholar?cites=8687129189765811614&as_sdt=2005&sciodt=0,5&hl=en",699,"2019-11-15","PDF","","","",,,,,1,0.00,1,2,
1,"FGN Larosa","Pemanfaatan Virtual Box dalam Praktikum Routing Menggunakan Metoda Static Routing",2014,"Majalah Ilmiah Methoda","ojs.lppmmethodistmedan.net","http://ojs.lppmmethodistmedan.net/index.php/METHODA/article/view/79","https://scholar.google.com/scholar?cites=15223488428931934606&as_sdt=2005&sciodt=0,5&hl=en",700,"2019-11-15","","","","",,,,,1,0.20,1,1,5
0,"T Ramdhany, AK Puspitasasi","PEMBANGUNAN APLIKASI SISTEM INFORMASI PENCATATAN HUTANG DAGANG Studi Kasus: PT. DAYA ANUGRAH MANDIRI",2014,"Jurnal Komputer Bisnis","jurnal.lpkia.ac.id","http://jurnal.lpkia.ac.id/index.php/jkb/article/view/54","",701,"2019-11-15","","","","",,,,,0,0.00,0,2,5
0,"SP TSP, C Visual","KNSI2014-381 STUDI DAN IMPLEMENTASI ALGORITMA TERINSPIRASI SISTEM IMUN: CLONAL SELECTION ALGORITHM",,"researchgate.net","","https://www.researchgate.net/profile/Ayi_Purbasari/publication/260618073_Studi_Dan_Implementasi_Algoritma_Terinspirasi_Sistem_Imun_Clonal_Selection_Algorithm/links/0f317531d980388da2000000.pdf","",702,"2019-11-15","PDF","","","",,,,,0,0.00,0,2,
3,"DW Nugraha","Sistem Pakar Untuk Mendiagnosa Kerusakan Perangkat Televisi Menggunakan Metode Backward Chaining",2014,"Informatika: Jurnal Teknologi Komputer dan Informatika","neliti.com","https://www.neliti.com/publications/67632/sistem-pakar-untuk-mendiagnosa-kerusakan-perangkat-televisi-menggunakan-metode-b","https://scholar.google.com/scholar?cites=8395479576244898360&as_sdt=2005&sciodt=0,5&hl=en",703,"2019-11-15","","","","",,,,,3,0.60,3,1,5
0,"EGI GUSMAN","SISTEM INFORMASI PENJUALAN PADA CUBICLE'S DJ STORE",,"elib.unikom.ac.id","","https://elib.unikom.ac.id/files/disk1/690/jbptunikompp-gdl-egigusmann-34454-10-unikom_1-r.pdf","",704,"2019-11-15","PDF","","","",,,,,0,0.00,0,1,
1,"MT Pratama","Evolusi Bahasa Pemrograman (Evolution Of Programming Language)",2014,"Jurnal Computech & Bisnis","jurnal.stmik-mi.ac.id","http://www.jurnal.stmik-mi.ac.id/index.php/jcb/article/view/112","https://scholar.google.com/scholar?cites=6139478355958368828&as_sdt=2005&sciodt=0,5&hl=en",705,"2019-11-15","","","","",,,,,1,0.20,1,1,5
1,"RF RIZQI","Pembuatan Aplikasi Lembar Kerja Siswa Elektronik (Elks) Berbasis Android",2014,"","eprints.ums.ac.id","http://eprints.ums.ac.id/id/eprint/30664","https://scholar.google.com/scholar?cites=6020214142706979270&as_sdt=2005&sciodt=0,5&hl=en",706,"2019-11-15","","","","",,,,,1,0.20,1,1,5
1,"HA DIDIK","RANCANG BANGUN APLIKASI BERBASIS ANDROID PENCARIAN LOKASI UNIVERSITAS DI KOTA SEMARANG LOCATION-BASED SERVICE",2014,"Skripsi, Fakultas Ilmu Komputer","eprints.dinus.ac.id","http://eprints.dinus.ac.id/13457","https://scholar.google.com/scholar?cites=4261457323978490225&as_sdt=2005&sciodt=0,5&hl=en",707,"2019-11-15","","","","",,,,,1,0.20,1,1,5
1,"S Kosasi","Perancangan Aplikasi Point of Sale dengan Arsitektur Client/Server Berbasis Linux dan Windows",2014,"Creative Information Technology Journal","citec.amikom.ac.id","https://citec.amikom.ac.id/main/index.php/citec/article/view/15","https://scholar.google.com/scholar?cites=17862424119814180935&as_sdt=2005&sciodt=0,5&hl=en",708,"2019-11-15","","","","",,,,,1,0.20,1,1,5
0,"A Mulyana","Rancang Bangun Sistem Kontrol Menghidupkan Komputer Server Berbasis Mikrokontroler",2014,"","repository.ut.ac.id","http://repository.ut.ac.id/id/eprint/5884","",709,"2019-11-15","","","","",,,,,0,0.00,0,1,5
4,"H Mulyana, M Maimunah","Aplikasi Mobile Kamus Istilah Komputer Berbasis Android",2014,"PIKSEL (Penelitian Ilmu …","jurnal.unismabekasi.ac.id","http://jurnal.unismabekasi.ac.id/index.php/piksel/article/view/228","https://scholar.google.com/scholar?cites=8315183678313839396&as_sdt=2005&sciodt=0,5&hl=en",710,"2019-11-15","","","","",,,,,4,0.80,2,2,5
0,"YI Yulianto, WW Winarno, D Adhipta","INTEGRASI SISTEM INFORMASI LABORATORIUM KE DALAM SISTEM INFORMASI RUMAH SAKIT MENGGUNAKAN ENTERPRISE APPLICATION INTEGRATION …",2014,"SEMNASTEKNOMEDIA …","ojs.amikom.ac.id","http://ojs.amikom.ac.id/index.php/semnasteknomedia/article/view/302","",711,"2019-11-15","","","","",,,,,0,0.00,0,3,5
0,"A Roziani","Analisis dan Perancangan Sistem Informasi Akuntansi pada TOKO ERSTIN Yogyakarta",2014,"","repository.amikom.ac.id","http://repository.amikom.ac.id/files/Publikasi_06.12.1527.pdf","",712,"2019-11-15","PDF","","","",,,,,0,0.00,0,1,5
3,"H Nugroho, MR Utama","Simulasi Management Bandwidth dan Load Balancing Server Menggunakan Clear OS Pada Virtual Box",2014,"Journal ICT","ejournal.akademitelkom.ac.id","http://ejournal.akademitelkom.ac.id/index.php/ictjurnal/article/view/76","https://scholar.google.com/scholar?cites=7759773131296275059&as_sdt=2005&sciodt=0,5&hl=en",713,"2019-11-15","","","","",,,,,3,0.60,2,2,5
0,"R Effendi, F Farady, A Vatresia","SISTEM TATA KELOLA DATABASE SEKOLAH DASAR DAN MENENGAH PROPINSI BENGKULU",,"repository.unib.ac.id","","http://repository.unib.ac.id/6826/","",714,"2019-11-15","","","","",,,,,0,0.00,0,3,
0,"NUR SAPITRI","SISTEM ONLINE PEMBUATAN SERTIFIKAT HAK MILIK TANAH PADA BADAN PERTANAHAN NASIONAL KOTA PALEMBANG",2014,"","eprints.polsri.ac.id","http://eprints.polsri.ac.id/1095/","",715,"2019-11-15","","","","",,,,,0,0.00,0,1,5
1,"RM Nugraha","Implementasi Firewall IPTables Untuk Mencegah Serangan Terhadap Webserver",2014,"","eprints.umm.ac.id","http://eprints.umm.ac.id/25368/","https://scholar.google.com/scholar?cites=5673171697081125005&as_sdt=2005&sciodt=0,5&hl=en",716,"2019-11-15","","","","",,,,,1,0.20,1,1,5
1,"S Saleh, H Basri","Perancangan Sistem Informasi Promosi Dan Transaksi Buku Berorientasi Objek Pada PT. Fajar Agung Indocemerlang",2014,"Jurnal Informatika","jurnal.darmajaya.ac.id","http://jurnal.darmajaya.ac.id/index.php/JurnalInformatika/article/view/119","https://scholar.google.com/scholar?cites=9041350126300113596&as_sdt=2005&sciodt=0,5&hl=en",717,"2019-11-15","","","","",,,,,1,0.20,1,2,5
0,"E Angraeni, LS Ramdhani…","Perancangan Sistem Informasi Simpan Pinjam Pada Koperasi Swadharma Sukabumi",2014,"Konferensi Nasional Ilmu …","seminar.bsi.ac.id","http://seminar.bsi.ac.id/knist/index.php/UnivBSI/article/view/176","",718,"2019-11-15","","","","",,,,,0,0.00,0,3,5
1,"DS Sharon, R Supardi","MEMBANGUN JARINGAN WIRELESS LOCAL AREA NETWORK (WLAN) PADA CV. BIQ BENGKULU",2014,"JURNAL MEDIA INFOTAMA","jurnal.unived.ac.id","https://jurnal.unived.ac.id/index.php/jmi/article/view/230","https://scholar.google.com/scholar?cites=5675385596043971587&as_sdt=2005&sciodt=0,5&hl=en",719,"2019-11-15","","","","",,,,,1,0.20,1,2,5
3,"VRS Purnomo, B Murtianta…","Sistem Pengendali Peralatan Elektronik Serta Pemantauan Suhu Ruangan Berbasis Mikrokontroler Dengan Media Komunikasi Jala-Jala",2014,"Techné: Jurnal Ilmiah …","ojs.jurnaltechne.org","http://ojs.jurnaltechne.org/index.php/techne/article/view/97","https://scholar.google.com/scholar?cites=17926018642668908149&as_sdt=2005&sciodt=0,5&hl=en",720,"2019-11-15","","","","",,,,,3,0.60,1,3,5
0,"NMR Mamulak","Sistem Informasi Geografis Sebaran Tutupan Lahan Pemukiman Penduduk Di Kota dan Kabupaten Kupang",2014,"SNIT 2014","seminar.bsi.ac.id","http://seminar.bsi.ac.id/snit/index.php/snit-2014/article/view/271","",721,"2019-11-15","","","","",,,,,0,0.00,0,1,5
0,"A Afrianti, PS Sasongko…","Sistem Informasi Rencana Operasional Kegiatan APBD Berbasis Web Di Dinas Kesehatan Provinsi Jawa Tengah",2014,"Journal of Informatics and …","ejournal3.undip.ac.id","https://ejournal3.undip.ac.id/index.php/joint/article/view/6325","",722,"2019-11-15","","","","",,,,,0,0.00,0,3,5
0,"MF Hidayat","SISTEM INFORMASI PENJUALAN RUMAH PADA CV JAKABARING PERMAI PALEMBANG",2014,"","eprints.polsri.ac.id","http://eprints.polsri.ac.id/1013/2/BAB%20I.pdf","",723,"2019-11-15","","","","",,,,,0,0.00,0,1,5
0,"J Hart, P Davis","Guideline for reporting of OPERA contributions",2014,"","","","",724,"2019-11-15","CITATION","","","",,,,,0,0.00,0,2,5
0,"A Andri, M Nasir","Perancangan Dan Implementasi Sistem Akademik Berbasis Web Service Pada Akbid Budi Mulia Palembang",2014,"","eprints.binadarma.ac.id","http://eprints.binadarma.ac.id/2327/","",725,"2019-11-15","","","","",,,,,0,0.00,0,2,5
3,"W Rahman, F Alfaizi","Mengenal Berbagai Macam Software",2014,"Diperoleh pada","kambing.ui.ac.id","http://kambing.ui.ac.id/onnopurbo/ebook/ebook-SU2013/SuryaUniv-Mengenal-berbagai-macam%20software.pdf","https://scholar.google.com/scholar?cites=15852987918228933286&as_sdt=2005&sciodt=0,5&hl=en",726,"2019-11-15","PDF","","","",,,,,3,0.60,2,2,5
0,"ATRI HARYANTO","SISTEM KOMPUTER",,"smkn4tpi.sch.id","","http://smkn4tpi.sch.id/web/media_library/files/cd6a07cc8d263200badf17672cae361b.pdf","",727,"2019-11-15","PDF","","","",,,,,0,0.00,0,1,
2,"A Chowanda, BH Prabowo, G Iglesias…","TAP FOR BATTLE: Perancangan Casual Game pada Smartphone Android",2014,"ComTech: Computer …","journal.binus.ac.id","https://journal.binus.ac.id/index.php/comtech/article/view/2187","https://scholar.google.com/scholar?cites=14188355817067672392&as_sdt=2005&sciodt=0,5&hl=en",728,"2019-11-15","","","","",,,,,2,0.40,1,4,5
1,"Z RUSWANTO","Rancang Bangun Aplikasi Try Out Ujian Nasional Sekolah Menengah Atas Berbasis Android",2014,"","eprints.ums.ac.id","http://eprints.ums.ac.id/id/eprint/39909","https://scholar.google.com/scholar?cites=14192335500683609193&as_sdt=2005&sciodt=0,5&hl=en",729,"2019-11-15","","","","",,,,,1,0.20,1,1,5
1,"AS Aji","Sistem Informasi Arsip Aktif Pada Badan Arsip Dan Perpustakaan Provinsi Jawa Tengah",2014,"Sistem Informasi Universitas Dian Nuswantoro …","core.ac.uk","https://core.ac.uk/download/pdf/35379420.pdf","https://scholar.google.com/scholar?cites=9321178121129194636&as_sdt=2005&sciodt=0,5&hl=en",730,"2019-11-15","PDF","","","",,,,,1,0.20,1,1,5
3,"INK Wardana, IG Harsemadi","Identifikasi Biometrik Intonasi Suara untuk Sistem Keamanan Berbasis Mikrokomputer",2014,"Jurnal Sistem dan Informatika (JSI …","jsi.stikom-bali.ac.id","http://www.jsi.stikom-bali.ac.id/index.php/jsi/article/view/35","https://scholar.google.com/scholar?cites=2377630867349874965&as_sdt=2005&sciodt=0,5&hl=en",731,"2019-11-15","","","","",,,,,3,0.60,2,2,5
1,"DP Sari, R Efendi, A Ruyani","METODE FORWARD CHAINING PADA SISTEM PAKAR UNTUK DIAGNOSA CACAT LAHIR AKIBAT FAKTOR TERATOGEN BERBASIS ANDROID",2014,"","repository.unib.ac.id","http://repository.unib.ac.id/9203/","https://scholar.google.com/scholar?cites=2366521204597598235&as_sdt=2005&sciodt=0,5&hl=en",732,"2019-11-15","","","","",,,,,1,0.20,0,3,5
1,"A Mokhtar, S Muhammad","PENERAPAN TEKNOLOGI PENGOPERASIAN, PERAWATAN DAN PELATIHAN MIKRO HIDRO DI DESA KARANG SUKO KECAMATAN PAGELARAN …",2014,"Jurnal Dedikasi","ejournal.umm.ac.id","http://ejournal.umm.ac.id/index.php/dedikasi/article/download/1752/1891","https://scholar.google.com/scholar?cites=6533485320272716072&as_sdt=2005&sciodt=0,5&hl=en",733,"2019-11-15","PDF","","","",,,,,1,0.20,1,2,5
0,"BC Putra, G Gata","RANCANG BANGUN SISTEM INFORMASI PENDAFTARAN CPNS BERBASIS WEB PADA KOMISI YUDISIAL",2014,"SESINDO 2014","is.its.ac.id","http://is.its.ac.id/pubs/oajis/index.php/home/detail/1392/RANCANG-BANGUN-SISTEM-INFORMASI-PENDAFTARAN-CPNS-BERBASIS-WEB-PADA-KOMISI-YUDISIAL","",734,"2019-11-15","","","","",,,,,0,0.00,0,2,5
1,"S Nyimas, U Usman Ependi","Aplikasi Latihan Tes IQ Menggunakan Android",2014,"MATRIK","eprints.binadarma.ac.id","http://eprints.binadarma.ac.id/2699/","https://scholar.google.com/scholar?cites=1826955665223366448&as_sdt=2005&sciodt=0,5&hl=en",735,"2019-11-15","","","","",,,,,1,0.20,1,2,5
2,"D Wicaksono, RR Isnanto…","Perancangan perangkat lunak untuk analisis tingkat fokus pada citra mikroskop digital menggunakan proses ekstraksi ciri",2014,"Jurnal Teknologi dan …","jtsiskom.undip.ac.id","http://jtsiskom.undip.ac.id/index.php/jtsiskom/article/view/4755","https://scholar.google.com/scholar?cites=2498383729156591543&as_sdt=2005&sciodt=0,5&hl=en",736,"2019-11-15","","","","",,,,,2,0.40,1,3,5
0,"A Prastiwi","SISTEM PENANGANAN SENGKETA DAN KONFLIK PERTANAHAN PADA KANTOR PERTANAHAN KOTA PALEMBANG SECARA ONLINE",2014,"","eprints.polsri.ac.id","http://eprints.polsri.ac.id/1084/","",737,"2019-11-15","","","","",,,,,0,0.00,0,1,5
1,"J Marwiyanto, S Sumaryono","Model Integrasi Data Sistem Informasi Pelayanan Publik Berbasis Service Oriented Architecture (SOA) Untuk Optimalisasi Pendapatan Asli Daerah di Pemerintah …",2014,"SEMNASTEKNOMEDIA ONLINE","ojs.amikom.ac.id","http://ojs.amikom.ac.id/index.php/semnasteknomedia/article/view/413","https://scholar.google.com/scholar?cites=15189146664033462671&as_sdt=2005&sciodt=0,5&hl=en",738,"2019-11-15","","","","",,,,,1,0.20,1,2,5
2,"R Pradata, M Rif'an, E Maulana","Pengaturan Sistem Keamanan dan Pemantauan Lokasi Mobil Dengan Fasilitas SMS",2014,"Jurnal Mahasiswa …","elektro.studentjournal.ub.ac.id","http://elektro.studentjournal.ub.ac.id/index.php/teub/article/view/141","https://scholar.google.com/scholar?cites=9780004022316497709&as_sdt=2005&sciodt=0,5&hl=en",739,"2019-11-15","","","","",,,,,2,0.40,1,3,5
1,"R Chandra, KR Prilianti, PL Tirma","Implementasi Case Based Reasoning padaFitur Rekomendasi Nakamnakam. com Berbasis Android di Kota Malang",2014,"Volume 2 No. 2/Juli2014","","","https://scholar.google.com/scholar?cites=14590692116813730193&as_sdt=2005&sciodt=0,5&hl=en",740,"2019-11-15","CITATION","","","",,,,,1,0.20,0,3,5
0,"H Mendrofa","SISTEM INFORMASI JAMINAN KESEHATAN DAERAH BERBASIS ONLINE PADA DINAS KESEHATAN KOTA PEKANBARU",2014,"","repository.uin-suska.ac.id","http://repository.uin-suska.ac.id/id/eprint/3630","",741,"2019-11-15","","","","",,,,,0,0.00,0,1,5
1,"IS Pratama, G Alam, T Tinaliah","Penerapan Algoritma Centroid-Based Summarization untuk Sistem Peringkasan Dokumen Berbahasa Indonesia",,"eprints.mdp.ac.id","","http://eprints.mdp.ac.id/1248/","https://scholar.google.com/scholar?cites=10052855563926451051&as_sdt=2005&sciodt=0,5&hl=en",742,"2019-11-15","","","","",,,,,1,0.00,0,3,
2,"MM Lukiarti, AT Ferdinand, S SUGIONO","Analisis faktor-faktor yang Mempengaruhi Loyalitas Pelanggan Microsoft (Studi Kasus Di Kabupaten Rembang)",2014,"","eprints.undip.ac.id","http://eprints.undip.ac.id/48540/","https://scholar.google.com/scholar?cites=1264583479393295230&as_sdt=2005&sciodt=0,5&hl=en",743,"2019-11-15","","","","",,,,,2,0.40,1,3,5
0,"Y PUTRI","SISTEM INFORMASI IKATAN ALUMNI JURUSAN MANAJEMEN INFORMATIKA BERBASIS WEB PADA POLITEKNIK NEGERI SRIWIJAYA",2014,"","eprints.polsri.ac.id","http://eprints.polsri.ac.id/1090/","",744,"2019-11-15","","","","",,,,,0,0.00,0,1,5
0,"RF Amanda","Evaluasi Kinerja Sistem Informasi Inventori (Studi Kasus: PT. Titian Sinar Mustakim)",2014,"","repository.uin-suska.ac.id","http://repository.uin-suska.ac.id/3798/","",745,"2019-11-15","","","","",,,,,0,0.00,0,1,5
0,"R Ariesta Priliani","SISTEM PENGAMAN KENDARAAN BERMOTOR MENGGUNAKAN RADIO FREQUENCY IDENTIFICATION (RFID) DAN SMS GATEWAY",2014,"","eprints.polsri.ac.id","http://eprints.polsri.ac.id/1471/","",746,"2019-11-15","","","","",,,,,0,0.00,0,1,5
1,"WA Yulianto, J Jusak, IDGR Mardiana","IMPLEMENTASI DAN ANALISIS UNJUK KERJA JARINGAN OPENSWAN DAN OPENVPN PADA PT RELIANCE",2014,"Journal JCONES","","","https://scholar.google.com/scholar?cites=8498543147716753883&as_sdt=2005&sciodt=0,5&hl=en",747,"2019-11-15","CITATION","","","",,,,,1,0.20,0,3,5
0,"YB RAHASIA, NB EKAPUTRA","ANALISIS APLIKASI KRIPTOGRAFI UNTUK SISTEM KEAMANAN PENYIMPANAN DATA ATAU INFORMASI HASIL-HASIL PENELITIAN",,"core.ac.uk","","https://core.ac.uk/download/pdf/35379306.pdf","",748,"2019-11-15","PDF","","","",,,,,0,0.00,0,2,
0,"DK Ayuningtias","APLIKASI PEMANTAUAN KONDISI BANGUNAN DAERAH IRIGASI BERBASIS GEOGRAPHIC INFORMATION SYSTEM (GIS)(STUDI KASUS JARINGAN IRIGASI …",2014,"","repository.widyatama.ac.id","https://repository.widyatama.ac.id/xmlui/handle/123456789/3712","",749,"2019-11-15","","","","",,,,,0,0.00,0,1,5
4,"A Setiawan, A Mulyani…","Perhitungan Komponen Elektronika Dasar Berbasis Android",2014,"Jurnal Techno Nusa …","ejournal.nusamandiri.ac.id","http://ejournal.nusamandiri.ac.id/index.php/techno/article/view/508","https://scholar.google.com/scholar?cites=17079106186482106234&as_sdt=2005&sciodt=0,5&hl=en",750,"2019-11-15","","","","",,,,,4,0.80,1,3,5
1,"AK Dupa, S Rostianingsih, LW Santoso","Perancangan dan Pembuatan Sistem Informasi Administrasi pada Katering Happuch",2014,"Jurnal Infra","publication.petra.ac.id","http://publication.petra.ac.id/index.php/teknik-informatika/article/view/1484","https://scholar.google.com/scholar?cites=2296868597341118376&as_sdt=2005&sciodt=0,5&hl=en",751,"2019-11-15","","","","",,,,,1,0.20,0,3,5
0,"E Meilani, H Sumarty, M Mardiani, D Oktaviany","Sistem Informasi Administrasi dan Pembelajaran Siswa Berbasis Desktop dan Website pada Family Course",2014,"","eprints.mdp.ac.id","http://eprints.mdp.ac.id/1045/","",752,"2019-11-15","","","","",,,,,0,0.00,0,4,5
1,"PT Hartantyo, UDNS Komputer","RANCANGBANGUN PENCARIAN LOKASI RUMAH SAKIT DAN PUSKESMAS DI WILAYAH TEGAL BERBASIS ANDROID",2014,"Skripsi, Semarang: Fakultas …","eprints.dinus.ac.id","http://eprints.dinus.ac.id/13461/1/jurnal_14115.pdf","https://scholar.google.com/scholar?cites=15259091184899767312&as_sdt=2005&sciodt=0,5&hl=en",753,"2019-11-15","PDF","","","",,,,,1,0.20,1,2,5
2,"MW Sari","ANALISIS KEAMANAN JARINGAN WI-FI MENGGUNAKAN METODE SIGNAL SCANNING DI FAKULTAS TEKNIK UNIVERSITAS PGRI YOGYAKARTA",2014,"Universitas PGRI Yogyakarta","repository.upy.ac.id","http://repository.upy.ac.id/id/eprint/431","https://scholar.google.com/scholar?cites=16743682388032538056&as_sdt=2005&sciodt=0,5&hl=en",754,"2019-11-15","","","","",,,,,2,0.40,2,1,5
0,"DW Anggoro","SISTEM MONITORING EVALUASI PAJAK BUMI BANGUNAN PERDESAAN DAN PERKOTAAN PADA DINAS PENDAPATAN PENGELOLAAN KEUANGAN DAN …",2014,"","eprints.sinus.ac.id","https://eprints.sinus.ac.id/284/","",755,"2019-11-15","","","","",,,,,0,0.00,0,1,5
0,"G ANUGRAH","SISTEM INFORMASI PENGGAJIAN DI UNIVERSITAS KEBANGSAAN",,"elib.unikom.ac.id","","https://elib.unikom.ac.id/files/disk1/713/jbptunikompp-gdl-gilanganug-35613-11-unikom_g-l.pdf","",756,"2019-11-15","PDF","","","",,,,,0,0.00,0,1,
2,"NF Rahmawati, HA Wibawa…","Sistem Pendukung Keputusan Pemilihan Penerima Beasiswadengan Metode Simple Additive Weighting (Studi Kasus Di SMA N 1 Karanganyar Kebumen)",2014,"Journal of Informatics and …","ejournal3.undip.ac.id","https://ejournal3.undip.ac.id/index.php/joint/article/view/6294","https://scholar.google.com/scholar?cites=15891905589254603379&as_sdt=2005&sciodt=0,5&hl=en",757,"2019-11-15","","","","",,,,,2,0.40,1,3,5
0,"P Khasanah","SISTEM PENERIMAAN KAS AL-JAWI GROUP",2014,"","eprints.akakom.ac.id","http://eprints.akakom.ac.id/8013/7/113210003_BAB%20I.pdf","",758,"2019-11-15","","","","",,,,,0,0.00,0,1,5
0,"PMK AJI, A YOGYAKARTA","SISTEM INFORMASI INVENTORI BAHAN BAKU PEMBUATAN ROTI",,"repository.amikom.ac.id","","http://repository.amikom.ac.id/files/Publikasi_10.12.5318.pdf","",759,"2019-11-15","PDF","","","",,,,,0,0.00,0,2,
6,"D Mulia, HH Handayani","Studi Fotogrametri Jarak Dekat dalam Pemodelan 3D dan Analisis Volume Objek",2014,"Geoid","iptek.its.ac.id","http://iptek.its.ac.id/index.php/geoid/article/view/687","https://scholar.google.com/scholar?cites=13465895651373134360&as_sdt=2005&sciodt=0,5&hl=en",760,"2019-11-15","","","","",,,,,6,1.20,3,2,5
0,"M Muzahid","PENGARUH PENERAPAN SISTEM INFORMASI AKUNTANSI TERHADAP KEBERHASILAN PERUSAHAAN JASA PERBANKAN DI KOTA BANDA ACEH",,"jurnal.pnl.ac.id","","http://jurnal.pnl.ac.id/wp-content/plugins/Flutter/files_flutter/1394855533JurnalManekbis_Ambon.pdf","",761,"2019-11-15","PDF","","","",,,,,0,0.00,0,1,
0,"ED Wuryanto","Rancangan Pengembangan Sistem Informasi Keuangan Internal Badan Kepegawaian Daerah Propinsi Jawa Tengah",2014,"HIMSYATECH","ojs.stmik-himsya.ac.id","http://ojs.stmik-himsya.ac.id/index.php/JHT/article/view/62","",762,"2019-11-15","","","","",,,,,0,0.00,0,1,5
1,"IPSP Wardhana, IGM Darmawiguna…","PENGEMBANGAN APLIKASI INSTRUMEN GAMELAN GONG KEBYAR BERBASIS ANDROID",2014,"Kumpulan Artikel …","ejournal.undiksha.ac.id","https://ejournal.undiksha.ac.id/index.php/KP/article/viewFile/19712/11688","https://scholar.google.com/scholar?cites=6727409808670245957&as_sdt=2005&sciodt=0,5&hl=en",763,"2019-11-15","PDF","","","",,,,,1,0.20,0,3,5
0,"E Suhendri","RANCANGAN SISTEM INFORMASI PERPUSTAKAAN MENGGUNAKAN MICROSOFT VISUAL BASIC 6.0 PADA SMP NEGERI 36 PALEMBANG",2014,"","eprints.polsri.ac.id","http://eprints.polsri.ac.id/752/","",764,"2019-11-15","","","","",,,,,0,0.00,0,1,5
0,"RS Persiana","Sistem Informasi Data Warga Binaan Rutan Klas Iib Kabupaten Blora",2014,"","eprints.ums.ac.id","http://eprints.ums.ac.id/id/eprint/39918","",765,"2019-11-15","","","","",,,,,0,0.00,0,1,5
0,"Z Barreto","SISTEM PERSEDIAAN BARANG TOKO ELEKTRONIK TOKO WARA",2014,"","eprints.akakom.ac.id","http://eprints.akakom.ac.id/8015/7/NIM_113210008%20BAB%20I.pdf","",766,"2019-11-15","","","","",,,,,0,0.00,0,1,5
0,"V Orintya","SISTEM INFORMASI DATA PEMBAYARAN GAS MELALUI SMS (SHORT MESSAGE SERVICE) GATEWAY PADA PD. PETRO PRABU",2014,"","eprints.polsri.ac.id","http://eprints.polsri.ac.id/1020/","",767,"2019-11-15","","","","",,,,,0,0.00,0,1,5
